Product Type,Recently Updated Record,Last Modified Date,Event ID,Status,Recalling Firm,Address1,Address2,City,State/Province,Postal Code,Country,Voluntary/Mandated,Initial Firm Notification of Consignee or Public,Distribution Pattern,Recall Number,Classification,Product Description,Product Quantity,Reason for Recall,Recall Initiation Date,Center Classification Date,Termination Date,Report Date,Code Info,More Code Info
"Veterinary","No","","70582","Terminated","Purina Animal Nutrition LLC","1700 Industries Rd","","Richmond","IN","	47374-1375","United States","Voluntary: Firm Initiated","Two or more of the following: Email, Fax, Letter, Press Release, Telephone, Visit","Domestic: Duke University   Durham, NC  27708  Contact:  Francis Sun  Tel  919-684-2341      Foreign: None","V-313-2016","Class I","Mod LabDiet 5058 w/150 ppm Fenbendazole  Plastic sealed bag in a box; 1 - 480 kg package","1 - 480 kg package","A manufacturing error resulting in Ivermectin used in place of Fenbendazole in custom research diet for mice resulted in mice mortality.","02/23/2015","02/25/2016","05/18/2016","03/02/2016","Product Code:  57T7; Manufactured 01/26/2015"
"Veterinary","No","","72147","Terminated","Frontier Cooperative Co","2175 14th Ave","","Columbus","NE","	68601","United States","Voluntary: Firm Initiated","Visit","NE","V-310-2016","Class I","Product is a custom feed, ""Moravec"" goat pellets (16.5 lbs rumensin per ton) packaged into 50 lb. bags.  Manufactured by Frontier Cooperative Columbus, NE","40 - 50 lb. bags","Product contained elevated levels of monensin which resulted in animal death.","09/02/2015","02/22/2016","04/13/2016","03/02/2016","237.15.1 manufactured on or about 8/27/2015"
"Veterinary","No","","72164","Terminated","Kassik Milling Co Inc","309 Main St","PO Box 128","Milligan","NE","	68406-3949","United States","Voluntary: Firm Initiated","Telephone","NE","V-311-2016","Class I","Bulk Prestart 550 non-medicated nursery swine feed manufactured with Start 300 Vitamin Pac.  The responsible firm is Kassik Milling, Milligan, NE.","38250.5 pounds","Product is superpotent for Vitamin A.","08/25/2015","02/23/2016","03/09/2016","03/02/2016","lots:  15040912,15041403, 15042102, 15050107, 15040922, 15042222, 15043014, 15043013, 15041017, and 15042215"
"Veterinary","No","","72164","Terminated","Kassik Milling Co Inc","309 Main St","PO Box 128","Milligan","NE","	68406-3949","United States","Voluntary: Firm Initiated","Telephone","NE","V-312-2016","Class I","Bulk Start 300 non-medicated nursery swine feed manufactured with Start 300 Vitamin Pac.  The responsible firm is Kassik Milling, Milligan, NE.","80071.2 pounds","Product is superpotent for Vitamin A.","08/25/2015","02/23/2016","03/09/2016","03/02/2016","lots:  15040913, 15041404, 15042101, 15050108, 15042016, 15042223, 15043015, 15041627, and 15043007"
"Devices","No","","72387","Terminated","Cook Inc.","750 N Daniels Way","","Bloomington","IN","	47404-9120","United States","Voluntary: Firm Initiated","Letter","Worldwide Distribution - US (nationwide including Puerto Rico and US Virgin Islands), Algeria, Antigua, Armenia, Austria, Australia, Bahamas, Belgium, Bangladesh, Bulgaria, Bahrain, Brazil, Brunei Darussalam, Canada, Canary Islands, Chile, China, Colombia, Costa Rica, Cyprus, Czech Republic, Denmark, Dominican Republic, Egypt, El Salvador, Finland, France, French Polynesia, Georgia, Germany, Ghana, Great Britain, Greece Guadeloupe, Hong Kong, Hungary, Iceland, India, Indonesia, Iraq, Ireland, Israel, Italy, Japan, Jersey,  Jordan, Kuwait, Kazakhstan, Republic of Korea, Kuwait, Lebanon, Lithuania, Luxemburg, Latvia, Libya, Macau, Malaysia, Malta, Martinique, Mexico, Mongolia, Morocco, Netherlands, Netherlands Antilles, New Caledonia, New Zealand, Nicaragua, Norway, Oman, Pakistan, Panama, Paraguay, Peru, Philippines, Poland, Portugal, Qatar, Reunion, Romania, Russian Federation, Saudi Arabia, Serbia, Singapore, Slovakia, Slovenia, South Africa, Sri Lanka, Sweden, Switzerland, Spain, Taiwan, Thailand, Turkey, Ukraine, United Arab Emirates, United Kingdom, Uruguay, Venezuela, and Vietnam.","Z-0798-2016","Class I","Shuttle Select Slip-Cath Catheter. Angiographic catheter.     For use in angiographic procedures as a conduit for the delivery of contrast media and can help physicians diagnose occlusion or stenosis. The catheters are designed for percutaneous introduction into the vascular system over  an appropriately sized wire guide.","9519","Reports of catheter tip splits and or separation. Loss of device function, medical intervention to retrieve separated segment, or complications resulting from separated tip occluding blood flow to end organs may result. Recall expanded 10/07/2015 to include additional catheters.","10/07/2015","02/24/2016","09/02/2017","03/02/2016","All lot numbers of the following  Product numbers:   SCBR4.5-35-135-P-NS-ANG-SHTL,  SCBR4.5-35-135-P-NS-ANG-SHTL-JP,  SCBR4.5-35-150-P-NS-0-SHTL,  SCBR4.5-35-150-P-NS-ANG-SHTL,  SCBR4.5-35-75-P-NS-ANGSHTL"
"Food","No","","72772","Terminated","Roundys Supermarkets, Inc.","1111 E Delafield Rd","PO Box 473","Oconomowoc","WI","	53066-8673","United States","Voluntary: Firm Initiated","E-Mail","IL and WI only","F-0633-2016","Class I","Simply Roundy's Natural Authentic Italian Butternut Squash Ravioli, Net Wt. 9 oz (255g).  Packaged in a paper tray inside a plastic bag and wrapped around with paper band.   Made in Italy.  UPC 11150-50750","1542 cases","Roundy's is recalling Simply Roundy's Natural Authentic Italian Sweet Butternut Squash Ravioli because the product may contain undeclared cashew and almond.  This product was manufactured and recalled by Bertagni 1882 SpA of Arcugnano, Italy due to undeclared cashews and almonds.","11/18/2015","02/25/2016","04/11/2016","03/02/2016","Lot Numbers:  506B, 508C, 511D, 512C, 513B, 516B, 520A, 522B, 522F, 523B, 523C, 529C, 530F, 531F, 535C, and 536A"
"Devices","No","","73056","Terminated","Cook Inc.","750 N Daniels Way","","Bloomington","IN","	47404-9120","United States","Voluntary: Firm Initiated","Letter","Worldwide Distribution - US Nationwide including DC and PR including the countries of Australia, Germany, China, Chile, Dominican Republic, Panama, Israel, Brazil, Canada","Z-0799-2016","Class I","Single Lumen Central Venous Catheter Sets and Trays    The subject sets and trays are comprised of a single-lumen uncoated or heparin-coated catheter. Product catalog numbers with heparin coating are designated by the suffix BH.","1341","A manufacturing process may lead to catheter tip fracture and or separation.  Potential adverse events may include loss of device function, medical intervention to retrieve a separated segment, or complications resulting from a separated tip occluding blood flow to end organs. These catheters are used in venous or arterial pressure monitoring, blood sampling, and administration of drugs and fluids.","01/06/2016","02/24/2016","08/23/2017","03/02/2016","RPN/Catalog number:  C-PMS-250-PED  C-PMS-251J-PED  C-PMS-300-CHILDRENS-032285  C-PMS-301J-PED  C-PMS-301J-PED-BH  C-PMS-301-PED  C-PMSY-250  C-PMSY-251  C-PMSY-251J  C-PMSY-300  C-PMSY-300J  C-PMSY-300J-UT-A  C-PMSY-300-PED  C-PMSY-301J  C-PMSY-301J-BH  C-PMSY-301J-PED  C-PMSY-301J-PED-OTP  C-PMSY-400-HURLEY-022388  C-PUM-300J  C-PUM-301  C-PUM-301J  C-PUMY-301J    Lots:  NS6168054  NS6178118  NS6063352  NS5855441  5824486  5898058  5967405  6079119  NS5932737  NS6028554  NS6042799  NS5922707  NS5932811  NS6145002  5987014  NS6178099  NS6028540  NS5830758  NS5866960  NS5918174  NS5974263  NS6042577  NS6047450  NS6090278  NS6105922  NS6124990  NS5881337  NS5892116  NS6031991  5782006  5855241  NS5881336  NS5892113  NS5945282  6062729  NS5970950  NS6108255  NS6153173  5793198  5925744  6010406  6148800  NS5796483  NS5928602  NS6047451  NS5970942  NS5954223  5945120  NS5954224  5973354"
"Devices","No","","73056","Terminated","Cook Inc.","750 N Daniels Way","","Bloomington","IN","	47404-9120","United States","Voluntary: Firm Initiated","Letter","Worldwide Distribution - US Nationwide including DC and PR including the countries of Australia, Germany, China, Chile, Dominican Republic, Panama, Israel, Brazil, Canada","Z-0800-2016","Class I","Single Lumen Pressure Monitoring Sets and Trays    The subject sets and trays are comprised of a single-lumen uncoated or heparin-coated catheter. Product catalog numbers with heparin coating are designated by the suffix BH.","2280","A manufacturing process may lead to catheter tip fracture and or separation.  Potential adverse events may include loss of device function, medical intervention to retrieve a separated segment, or complications resulting from a separated tip occluding blood flow to end organs. These catheters are used in venous or arterial pressure monitoring, blood sampling, and administration of drugs and fluids.","01/06/2016","02/24/2016","08/23/2017","03/02/2016","RPN/Catalog number:  C-PMS-250  C-PMS-2502-15-3.5  C-PMS-2502-15-5.0  C-PMS-250-MONTES-A-092084  C-PMS-251  C-PMS-251J  C-PMS-300  C-PMS-300-CHILDRENS-A-032988  C-PMS-300J  C-PMS-301  C-PMS-301J  C-PMS-301J-PKG  C-PMS-400J    Lots:  6028502  6034979  6083984  6194848  NS6014456  NS6014457  6148788  6254047  5906417  6160213  NS6064797  NS6014483  NS6175149  NS6184593  NS6187516  NS6014458  5889463  5898283  5922849  5941909  5964565  5976506  6021072  6028497  6143834  6160238  NS5933957  5828147  5941919  NS5932835  NS5932836  NS6050233  NS6072523  NS6108227  NS6130497  5803601  6034985  6075213  NS5833882  NS5892109  NS5892110  NS5919920  NS6021136  NS6054843  NS6072524  NS6075557  NS6082375  NS6108228  NS6148658  6067668"
"Devices","No","","73056","Terminated","Cook Inc.","750 N Daniels Way","","Bloomington","IN","	47404-9120","United States","Voluntary: Firm Initiated","Letter","Worldwide Distribution - US Nationwide including DC and PR including the countries of Australia, Germany, China, Chile, Dominican Republic, Panama, Israel, Brazil, Canada","Z-0801-2016","Class I","Femoral Artery Pressure Monitoring Catheter Sets and Trays    The subject sets and trays are comprised of a single-lumen uncoated or heparin-coated catheter. Product catalog numbers with heparin coating are designated by the suffix BH.","1515","A manufacturing process may lead to catheter tip fracture and or separation.  Potential adverse events may include loss of device function, medical intervention to retrieve a separated segment, or complications resulting from a separated tip occluding blood flow to end organs. These catheters are used in venous or arterial pressure monitoring, blood sampling, and administration of drugs and fluids.","01/06/2016","02/24/2016","08/23/2017","03/02/2016","RPN/Catalog number:  C-NPMS-501J-15  C-NPMSY-501J-15  C-PMS-300-FA  C-PMS-300J-FA  C-PMS-301-FA  C-PMS-301J-FA  C-PMS-400-FA  C-PMS-401-FA  C-PMS-401J-FA  C-PMSY-300-FA  C-PMSY-300J-FA  C-PMSY-400J-FA  C-PMSY-401-FA    Lots:  6054830  6054831  6072436  6078670  6081720  6083977  NS6054841  NS6054842  NS6075552  NS6082372  NS6082373  NS5833881  NS5881267  NS5881268  NS5892106  NS5892107  NS5892108  NS5914766  NS5922706  NS5928596  NS5932820  NS5932821  NS5967447  NS5967448  NS5967449  NS6014474  NS6014475  NS6014484  NS6014485  NS6042778  NS6042795  NS6042796  NS6050046  NS6063330  NS6063354  NS6075555  NS6100599  NS6100600  NS6108225  NS6124985  NS5888542  NS5928597  NS6028553  NS6042797  NS6090273  NS6090274  NS6100601  NS6130149  5800570  5860387  5891906  5980254  6003160  6062725  6143835  NS5830771  NS5866956  NS5866957  NS5881269  NS6014460  NS6042798  NS6050047  NS6075534  NS6075556  5895598  6129058  6148613  NS5932822  NS5932837  NS5994907  NS6130498  6067782  6139280  NS6042805  NS6130500  6049951  6137353  6139281  6034986  6049957  6067784  NS5833887  NS5866959  NS5881272  NS5881334  NS5881335  NS5919925  NS6047449  NS6054847  NS6054848  NS6072526  NS6072555  NS6082379  NS6090277  NS6105921  NS6124989  NS6130501  NS6148639  NS5866961  NS5866962  NS5892115  NS5922709  NS5932844  NS5974256  NS6031988  NS6031990  NS6042578  NS6050052  NS6050053  NS6031992  NS6031993  NS6130504  NS6137424  NS6054849"
"Devices","No","","73056","Terminated","Cook Inc.","750 N Daniels Way","","Bloomington","IN","	47404-9120","United States","Voluntary: Firm Initiated","Letter","Worldwide Distribution - US Nationwide including DC and PR including the countries of Australia, Germany, China, Chile, Dominican Republic, Panama, Israel, Brazil, Canada","Z-0802-2016","Class I","Radial Artery Pressure Monitoring Catheter Sets and Trays    The subject sets and trays are comprised of a single-lumen uncoated or heparin-coated catheter. Product catalog numbers with heparin coating are designated by the suffix BH.","12691","A manufacturing process may lead to catheter tip fracture and or separation.  Potential adverse events may include loss of device function, medical intervention to retrieve a separated segment, or complications resulting from a separated tip occluding blood flow to end organs. These catheters are used in venous or arterial pressure monitoring, blood sampling, and administration of drugs and fluids.","01/06/2016","02/24/2016","08/23/2017","03/02/2016","RPN/Catalog number:  C-PMS-250-RA  C-PMS-251-RA  C-PMS-300-RA  C-PMS-300-RA-CHOP  C-PMS-301J-RA  C-PMS-301-RA  C-PMS-400-RA  C-PMSY-250-RA  C-PMSY-300-RA  C-PMSY-301-RA    Lots:  6049998  6160195  6160212  NS5898558  NS6063328  NS6178204  NS6178206  5895605  6191185  5793196  5800313  5800443  5800569  5806981  5810905  5810917  5824484  5824546  5824547  5824548  5866984  5866985  5866986  5870319  5881447  5881519  5889496  5891905  5911486  5922847  5922848  5925742  5928632  5939446  5939447  5939448  5976502  6025016  6025094  6033768  6034981  6034983  6050000  6062738  6062742  6067675  6067676  6075206  6075207  6083936  6083954  6083985  6083986  6129056  6148790  6160236  6165591  6174974  6175289  6191362  6269150  NS6063331  NS6108226  NS6170739  NS6170767  5905252  6003109  NS6072553  5793197  5800571  5800572  5824485  5824551  5845063  5864072  5866988  5873125  5881151  5881152  5884641  5884642  5889464  5892063  5892064  5922850  5939431  5942091  5951549  5953768  5954322  5967404  5974281  5994817  5996926  6003161  6003162  6017048  6025095  6025145  6034984  6042699  6050002  6075210  6075211  6075212  6081723  6083988  6100756  6124809  6125111  6148791  6153122  6160239  6160240  6168131  6171368  6187477  6250532  6059759  NS6047396  NS6047397  NS6047398  NS6047399  NS6047440  NS6047442  6124812  5793192  5824526  5884647  5892068  5942090  5967410  6003167  6059765  6134128  6153124  6168137  6254068  5793193  5866995  5892069  5942092  6003168  6025099  6067664  6168138"
"Food","No","","73124","Terminated","Mahina Mele Farm","87-2642 Mamalahoa Hwy","","Captain Cook","HI","	96704-8703","United States","Voluntary: Firm Initiated","Press Release","US","F-0628-2016","Class I","Izzie Macs! Macadamia Nuts - Salted.  Certified Organic Macadamia Nuts, 100% Big Island Grown  A raw food.  Sold in 6 oz. plastic bag and 16 oz. plastic bag.    UPC - 6 oz.: 689076792677;  UPC 16 oz.: 689076792974.    Mahina Mele Farm  87-2642 Mamalahoa Hwy.  Captain Cook, HI 96704","All lots - approximately 5676 total pounds of nuts and nut butters","IEH sampling found samples of raw macadamia nuts to be positive for Salmonella.","01/21/2016","02/25/2016","04/19/2016","03/02/2016","All Lots currently in commerce"
"Food","No","","73124","Terminated","Mahina Mele Farm","87-2642 Mamalahoa Hwy","","Captain Cook","HI","	96704-8703","United States","Voluntary: Firm Initiated","Press Release","US","F-0629-2016","Class I","Izzie Macs! Macadamia Nuts - Unsalted.  Certified Organic Macadamia Nuts, 100% Big Island Grown  A raw food.  Sold in 6 oz. plastic bag and 16 oz. plastic bag.    UPC - 6 oz.: 689076793575;  UPC 16 oz.: 689076792776.    Mahina Mele Farm  87-2642 Mamalahoa Hwy.  Captain Cook, HI 96704","All lots - approximately 5676 total pounds of nuts and nut butters","IEH sampling found samples of raw macadamia nuts to be positive for Salmonella.","01/21/2016","02/25/2016","04/19/2016","03/02/2016","All lots currently is commerce"
"Food","No","","73124","Terminated","Mahina Mele Farm","87-2642 Mamalahoa Hwy","","Captain Cook","HI","	96704-8703","United States","Voluntary: Firm Initiated","Press Release","US","F-0630-2016","Class I","Bulk Macadamia Nuts - (salted, unsalted; whole and pieces)  Certified Organic Macadamia Nuts, 100% Big Island Grown  A raw food.  Sold in 5 lb. bag.    NO UPC number.    Mahina Mele Farm  87-2642 Mamalahoa Hwy.  Captain Cook, HI 96704","All lots - approximately 5676 total pounds of nuts and nut butters","IEH sampling found samples of raw macadamia nuts to be positive for Salmonella.","01/21/2016","02/25/2016","04/19/2016","03/02/2016","All lots currently in commerce"
"Food","No","","73124","Terminated","Mahina Mele Farm","87-2642 Mamalahoa Hwy","","Captain Cook","HI","	96704-8703","United States","Voluntary: Firm Initiated","Press Release","US","F-0631-2016","Class I","Baby Bruddah's Mac Nut Buttah;  Certified Organic by International Certification Services Inc.. From the Big Island,   A raw food.  Sold in 12 oz. plastic tub.    UPC number:  753182242019    Mahina Mele Farm  87-2642 Mamalahoa Hwy.  Captain Cook, HI 96704","All lots - approximately 5676 total pounds of nuts and nut butters","IEH sampling found samples of raw macadamia nuts to be positive for Salmonella.","01/21/2016","02/25/2016","04/19/2016","03/02/2016","All lots currently in commerce"
"Food","No","","73124","Terminated","Mahina Mele Farm","87-2642 Mamalahoa Hwy","","Captain Cook","HI","	96704-8703","United States","Voluntary: Firm Initiated","Press Release","US","F-0632-2016","Class I","Baby Bruddah's Chocolate Mac Nut Buttah;  Certified Organic by International Certification Services Inc. From the Big Island,   A raw food.  Sold in 12 oz. plastic tub.    UPC number:  75318224204    Mahina Mele Farm  87-2642 Mamalahoa Hwy.  Captain Cook, HI 96704","All lots - approximately 5676 total pounds of nuts and nut butters","IEH sampling found samples of raw macadamia nuts to be positive for Salmonella.","01/21/2016","02/25/2016","04/19/2016","03/02/2016","All lots currently in commerce"
"Devices","No","","73137","Terminated","Maquet Cardiovascular Us Sales, Llc","45 Barbour Pond Drive","","Wayne","NJ","	07470","United States","Voluntary: Firm Initiated","Letter","US Nationwide in the states of CA, NY, and OR","Z-0804-2016","Class I","Flow-i Anesthesia System    Product Usage:  The indication for the Flow-i Anesthesia System is administering inhalation anesthesia while controlling the entire ventilation of patients with no ability to breath, as well as in supporting patients with a limited ability to breath. The system is intended for use on neonatal to adult patient populations. The system is intended for use in hospital environments, except MRI environment by healthcare professionals trained in inhalation anesthesia administration.  ","7 units within US","Electrical issues in the control, monitoring or panel sub-systems, caused by the printed circuit boards (PCBs) that control the sub-systems. The problems manifested as multiple re-starts of the sub-systems and, in a few instances, disabling of the system has occurred. Replacement PCBs are now available to correct the issues.    Only the Model C20 is affected in the US.","12/10/2015","02/22/2016","07/06/2016","03/02/2016","Model numbers: C20, C30 and C40 (Only Model # C20 for US)    Part numbers:  66 77 200 (US Only), 66 77 300 and 66 77 400    Serial numbers (2743, 2852, 2854, 2855, 2856, 2858"
"Food","No","","73158","Terminated","House Of Flavors, Inc.","110 N William St","","Ludington","MI","	49431-1674","United States","Voluntary: Firm Initiated","Press Release","Domestic: IL, IN, KY, MI, OH, WI    Foreign: None","F-0623-2016","Class I","Purple Cow Limited Edition Cookie Butter Ice Cream, 8 oz. cups, packed in paper cartons","17,352    8 oz. containers","House of Flavors, Inc. is voluntarily recalling a small batch of 8 oz. cups of Purple Cow Limited Edition Cookie Butter Ice Cream, sold at Meijer stores, that contain Purple Cow Butter Pecan Ice Cream with a Purple Cow Butter Pecan lid.","01/27/2016","02/23/2016","04/28/2016","03/02/2016","UPC Code 13733 61945 and marked Best By November 21, 2016"
"Devices","No","","73241","Ongoing","Draeger Medical, Inc.","3135 Quarry Rd","","Telford","PA","	18969-1042","United States","Voluntary: Firm Initiated","Letter","US Nationwide Distribution including Puerto Rico.","Z-0827-2016","Class I","Evita Infinity V500 Ventilator; Babylog Infinity VN500 Ventilator.  Ventilation.","2553","The battery capacity of the optional PS500 power supply unit for the Infinity (ACS) Workstation Critical and Neonatal Care was rapidly and unexpectedly reduced, despite using the most recent power supply firmware version 1.50 released in November 2015 (recall Z-0436-2016). The batteries were prematurely discharged, even though an adequate battery charge status was displayed on the device.","02/04/2016","02/25/2016","","03/02/2016","Catalog #s 8416400 and 8417400"
"Food","No","","73245","Terminated","Fresh Express Incorporated","900 E Blanco Rd","","Salinas","CA","	93901-4419","United States","Voluntary: Firm Initiated","Two or more of the following: Email, Fax, Letter, Press Release, Telephone, Visit","CT, FL, MA and MD.","F-0634-2016","Class I","Fresh Express, Club Size, Chopped Romaine Lettuce, 32 oz., in clear flexible plastic bags, containing condiments in a separate clear flexible plastic bag.","322 Cases x 8 bags of 32 oz. each = 2576 32 oz. bags.","Undeclared Allergens: milk, eggs, wheat and fish.","02/06/2016","02/25/2016","10/12/2016","03/02/2016","Use By Feb 19, G034A06A"
"Devices","No","","69974","Ongoing","The Anspach Effort, Inc.","4500 Riverside Dr","","Palm Beach Gardens","FL","	33410-4235","United States","Voluntary: Firm Initiated","Letter","CO, FL, LA, ID, CA, KS, IL, TX, VA, MI, NC, WA, AR, NY, NC, AZ, and Hawaii     Canada, Hong Kong, Chile, Israel, Poland, Turkey, Itly, Malaysia, Ireland, Korea, Germany, Spain, Norway, Sweeden, England, Fiji, Switzerland, Belgium, Austria, Netherlands, France, Japan, China, India, Thailand, Russia, Zaire, Taiwan, and Australia.","Z-1017-2016","Class II","Synthes Small Electric Drive (SED)","302 (23 in the USA and 279 OUS)","May operate solely in reverse mode, not operate in reverse mode when intended, not function or an unintentionally start.","11/14/2014","02/25/2016","","03/02/2016","All lots from production launch"
"Devices","No","","72515","Terminated","Regulatory Insight, Inc","33 Golden Eagle Ln","","Littleton","CO","	80127-5745","United States","Voluntary: Firm Initiated","Letter","US Distribution to the states of :TN, CA, WA, OR, PA, WI, FL, MN, VT, NY, NV, MA, CO, IN, MI, MS and OH.","Z-0753-2016","Class II","GE Precision MPi is an all-digital multipurpose tilt-C x-ray system, intended for a multitude of diagnostic procedures, including radiology, fluoroscopy, interventional procedures, vascular and non-vascular procedures, and specialized applications including angiographic studies.","43","It was discovered that the Remote Touch Panel (RTP) of the GE Precision MPi X-ray system may not always boot up as intended and needs to be updated to properly accomplish its intended purpose.","07/01/2008","02/24/2016","07/11/2017","03/02/2016","NRT no.: 02980000"
"Food","No","","72536","Terminated","CSFPDX, LLC","500 S Biak Ave","","Garibaldi","OR","	97118-1306","United States","Voluntary: Firm Initiated","Press Release","Their own retail store and 3 restaurants in Oregon","F-0624-2016","Class II","Labeled ""CSFISHERY COMMUNITY SUPPORTED FISHERY Wild Albacore Tuna, 64 oz.., Ingredients:  Oregon Albacore Tuna, Sea Salt""    Label is black ink on an off white label.    No UPC","142 cans","This voluntary recall was initiated after the manufacturing firm notified the recalling firm that products were possibly under- processed. Under-processed seafood could lead to contamination with Clostridium botulinum.","10/28/2015","02/23/2016","02/25/2016","03/02/2016","OCK 16AAPR2017"
"Devices","No","","72720","Terminated","Philips Electronics North  America Corporation","3000 Minuteman Rd","","Andover","MA","	01810-1032","United States","Voluntary: Firm Initiated","Letter","Worldwide Distribution-US (nationwide) and the countries of  Algeria Australia Austria Belgium Bulgaria Canada Denmark Estonia Finland France Germany Hong Kong Hungary Iceland India Indonesia Iraq Ireland Israel Italy Japan Kenya Korea Kuwait Luxembourg Malaysia Mongolia Morocco Netherlands New Zealand Nigeria Norway Poland Qatar Romania Russian Federation Saudi Arabia Singapore Slovenia South Africa Spain Sweden Switzerland Taiwan Turkey United Arab Emirates and United Kingdom.","Z-0856-2016","Class II","Philips Healthcare IntelliVue Info Center iX, A.0 866023  ","5671 units","Reconstructed ECG leads viewed or printed at the Information Center iX may misrepresent the ECG waveform in specific leads.","11/25/2015","02/23/2016","09/06/2017","03/02/2016","Software A.0.X"
