"Devices","No","","76400","Terminated","Boston Scientific Corporation","47215 Lakeview Blvd","","Fremont","CA","	94538-6530","United States","Voluntary: Firm initiated","Letter","US and Australia, Austria, Bahrain, Bangladesh, Belgium, Brazil, Bulgaria, Canada, Chile, China, Costa Rica, Croatia, Cyprus, Denmark, Dominican Rep., Ecuador, Egypt, Finland, France, Germany, Great Britain, Greece, Hong Kong, Hungary, Indonesia, Iraq, Ireland, Israel, Italy, Jordan, Lebanon, Lithuania, Malaysia, Mexico, Netherlands, New Zealand, Norway, Palestine, Panama, Philippines, Poland, Portugal, Puerto Rico, Russian Fed. ,Saudi Arabia, Singapore, Slovenia, South Africa, South Korea, Spain, Sweden, Switzerland, Taiwan, Thailand, Trinidad, Tobago, Turkey, United Arab Emir.,  Venezuela, Virgin Islands, W.Bank/Gaza Strip","Z-1401-2017","Class II","AngioJet¿ Ultra 5000 A Console:Foot Switch  Material number (U PN) 105650    Cardiovascular: The Console is a multiple-use device that controls the Thrombectomy Set. It drives the pump, regulates fluid inflow and outflow, provides the operator with Ultra System set-up prompts, total infused saline volume, and Ultra System malfunction warnings.  ","3402 units; 2626 in US; 786 units OUS","Boston Scientific has received field reports regarding the AngioJet Ultra 5000 A Console foot switch sticking during use resulting in an undesired continued operation of the device.","01/31/2017","03/03/2017","04/22/2019","03/15/2017","Serial number ranges:U2000 - U4530            U5001 - U5233;           U6001 - U6197;            U6300 - U6374 ;           U6376 - U6432;           U8001 - U8276;           U8500 - U8719;            U8800 - U8829;   U8831 - U8869."
"Food","No","","76415","Terminated","Legendary Baking","400 W 48th Ave","","Denver","CO","	80216-1806","United States","Voluntary: Firm initiated","Telephone","DISTRIBUTION CENTERS: OR, OH, CO, KY, AZ, WI, GA, KS.    RETAIL STORES: AL, GA, SC, MI, OH, WV, IL, IN, KY, KS, MO, NE, CO, NM, UT, WY, AZ, AK, ID, OR and WA.","F-1566-2017","Class II","Private Selection, Salted Caramel Chocolate Almond Pie, NET WT 34 OZ ( 2 LB 2 OZ) 963g, UPC 1111054021.  Container: In a labeled pie dome and base.   Pies are distributed frozen.  Some stores sell refrigerated and some sell frozen.","652 cases","Salted Carmel Chocolate Almond Pie was mislabeled. The wrong ingredient label was used which did not listed two allergens,  eggs and almonds.","02/06/2017","03/03/2017","03/24/2017","03/15/2017","lot CH 17025"
"Devices","No","","76445","Terminated","Remel Inc","12076 Santa Fe Trail Dr","","Lenexa","KS","	66215-3519","United States","Voluntary: Firm initiated","Letter","USA ( nationwide ) Distribution including Puerto Rico and to the states of : AK, AL, AR, AZ, CA, CO, CT, DC, FL, GA, HI, IA, IL, IN, KS, KY, LA, MA, MD, ME, MI, MN, MO, NC, ND, NE, NH, NJ, NY, OH, OK, OR, PA, RI, SD, TN, TX, VA, VT, WA, WI, WV and WY.","Z-1400-2017","Class II","Remel, Haemophilus Test Medium (Agar) in A) 100 mm REF R01503, and B) 150 mm plates REF R04033,","RO4033 - 163,     R01503 - 50.","Test organisms exhibit poor growth when grown using the test agar. The poor growth can give users incorrect AST zones when performing susceptibility tests.","02/09/2017","03/03/2017","05/01/2019","03/15/2017","A) Lot: 978596, 2017-01-30; B) Lot: 978948, 2017/01/30"
"Devices","No","","76456","Terminated","Encore Medical, Lp","9800 Metric Blvd","","Austin","TX","	78758-5445","United States","Voluntary: Firm initiated","Letter","US, South Korea, Australia, Canada, United Kingdom/Ireland, Germany","Z-1412-2017","Class II","Turon Impaction Fixture","297 units","During the Turon assembly, the impaction forces caused the polymer, black acetal copolymer from the Impaction Fixture to wear off on the lateral surface of the Humeral Stem titanium plasma spray coating.","02/09/2017","03/08/2017","10/20/2017","03/15/2017","101521L01, 115670L18, 128092L10, 136172L07, 136172L08, 141511L22, 37369L10A, 37369L10B, 37837L23A, 37837L23B, 37837L23C, 37837L23D, 51103L05E, 51103L05F, 52748L02A, 52748L02B, 52748L02C, 52748L02D, 52748L02E, 52748L02F, 52748L02G, 52748L02H, 57074L05A, 89910L10"
"Devices","No","","76456","Terminated","Encore Medical, Lp","9800 Metric Blvd","","Austin","TX","	78758-5445","United States","Voluntary: Firm initiated","Letter","US, South Korea, Australia, Canada, United Kingdom/Ireland, Germany","Z-1413-2017","Class II","RSP Impaction Fixture","626 units","During the Turon assembly, the impaction forces caused the polymer, black acetal copolymer from the Impaction Fixture to wear off on the lateral surface of the Humeral Stem titanium plasma spray coating.","02/09/2017","03/08/2017","10/20/2017","03/15/2017","109931L01, 109931L02, 115670L15, 115670L16, 128092L08, 128092L09, 137917L16, 167829L06, 52258L01, 52258L01A, 67428L01, 76386L01, 76386L02, 81722L01, 81722L02"
"Devices","No","","76459","Terminated","Siemens Medical Solutions USA, Inc","40 Liberty Blvd","","Malvern","PA","	19355-1418","United States","Voluntary: Firm initiated","Letter","Nationwide Distribution","Z-1432-2017","Class II","PRIMUS HI and Mevatron M2/Primus Mid-Energy, Accelerator, Linear, Medical  The intended use of the SIEMENS branded PRIMUS family of linear accelerator systems is to deliver x-ray radiation for therapeutic treatment of cancer","35 systems","Siemens became aware of a defective weld seam at overhead suspensions. Due to this defect it is possible for the weld seam to break and to cause the overhead suspension to fall down. This can lead to a severe injury to a patient or any other person.","01/25/2017","03/09/2017","10/06/2017","03/15/2017","Device Model Number 4504200 and 1940035  Serial numbers: 3009  2958  2863  2972  2646  3079  2516  2962  3055  1452  2702  2125  3066  2689  2228  2564  2507  1904  3075  2375  3013  3068  2596  3025  3049  2965  2045  3084  2855  2906  2292  2384  2067  2818  3089"
"Devices","No","","76459","Terminated","Siemens Medical Solutions USA, Inc","40 Liberty Blvd","","Malvern","PA","	19355-1418","United States","Voluntary: Firm initiated","Letter","Nationwide Distribution","Z-1433-2017","Class II","MEVATRON M 6700 (MX) Accelerator, Linear, Medical  The intended use of the SIEMENS branded PRIMUS family of linear accelerator systems is to deliver x-ray radiation for therapeutic treatment of cancer","35 systems","Siemens became aware of a defective weld seam at overhead suspensions. Due to this defect it is possible for the weld seam to break and to cause the overhead suspension to fall down. This can lead to a severe injury to a patient or any other person.","01/25/2017","03/09/2017","10/06/2017","03/15/2017","Device Model Number 5693908  Serial numbers: 3009  2958  2863  2972  2646  3079  2516  2962  3055  1452  2702  2125  3066  2689  2228  2564  2507  1904  3075  2375  3013  3068  2596  3025  3049  2965  2045  3084  2855  2906  2292  2384  2067  2818  3089"
"Devices","No","","76459","Terminated","Siemens Medical Solutions USA, Inc","40 Liberty Blvd","","Malvern","PA","	19355-1418","United States","Voluntary: Firm initiated","Letter","Nationwide Distribution","Z-1434-2017","Class II","MEVATRON M 6730/6740 (MEX) Accelerator, Linear, Medical  The intended use of the SIEMENS branded PRIMUS family of linear accelerator systems is to deliver x-ray radiation for therapeutic treatment of cancer","35 systems","Siemens became aware of a defective weld seam at overhead suspensions. Due to this defect it is possible for the weld seam to break and to cause the overhead suspension to fall down. This can lead to a severe injury to a patient or any other person.","01/25/2017","03/09/2017","10/06/2017","03/15/2017","Device Model Number 8319758  Serial numbers: 3009  2958  2863  2972  2646  3079  2516  2962  3055  1452  2702  2125  3066  2689  2228  2564  2507  1904  3075  2375  3013  3068  2596  3025  3049  2965  2045  3084  2855  2906  2292  2384  2067  2818  3089"
"Devices","No","","76459","Terminated","Siemens Medical Solutions USA, Inc","40 Liberty Blvd","","Malvern","PA","	19355-1418","United States","Voluntary: Firm initiated","Letter","Nationwide Distribution","Z-1435-2017","Class II","MEVATRON M 7400/7440(MEX) Accelerator, Linear, Medical  The intended use of the SIEMENS branded PRIMUS family of linear accelerator systems is to deliver x-ray radiation for therapeutic treatment of cancer","35 systems","Siemens became aware of a defective weld seam at overhead suspensions. Due to this defect it is possible for the weld seam to break and to cause the overhead suspension to fall down. This can lead to a severe injury to a patient or any other person.","01/25/2017","03/09/2017","10/06/2017","03/15/2017","Device Model Number 8319758  Serial numbers: 3009  2958  2863  2972  2646  3079  2516  2962  3055  1452  2702  2125  3066  2689  2228  2564  2507  1904  3075  2375  3013  3068  2596  3025  3049  2965  2045  3084  2855  2906  2292  2384  2067  2818  3089"
"Devices","No","","76459","Terminated","Siemens Medical Solutions USA, Inc","40 Liberty Blvd","","Malvern","PA","	19355-1418","United States","Voluntary: Firm initiated","Letter","Nationwide Distribution","Z-1436-2017","Class II","MEVATRON MD-2, MEVATRON MDX-2 and MEVATRON ME, accelerator, Linear, Medical  The intended use of the SIEMENS branded PRIMUS family of linear accelerator systems is to deliver x-ray radiation for therapeutic treatment of cancer","35 systems","Siemens became aware of a defective weld seam at overhead suspensions. Due to this defect it is possible for the weld seam to break and to cause the overhead suspension to fall down. This can lead to a severe injury to a patient or any other person.","01/25/2017","03/09/2017","10/06/2017","03/15/2017","Device Model Number 9401654, 9401746, 8490005  Serial numbers: 3009  2958  2863  2972  2646  3079  2516  2962  3055  1452  2702  2125  3066  2689  2228  2564  2507  1904  3075  2375  3013  3068  2596  3025  3049  2965  2045  3084  2855  2906  2292  2384  2067  2818  3089"
"Devices","No","","76459","Terminated","Siemens Medical Solutions USA, Inc","40 Liberty Blvd","","Malvern","PA","	19355-1418","United States","Voluntary: Firm initiated","Letter","Nationwide Distribution","Z-1437-2017","Class II","MEVATRON KD-2, accelerator, Linear, Medical  The intended use of the SIEMENS branded PRIMUS family of linear accelerator systems is to deliver x-ray radiation for therapeutic treatment of cancer","35 systems","Siemens became aware of a defective weld seam at overhead suspensions. Due to this defect it is possible for the weld seam to break and to cause the overhead suspension to fall down. This can lead to a severe injury to a patient or any other person.","01/25/2017","03/09/2017","10/06/2017","03/15/2017","Device Model Number 8515520  Serial numbers: 3009  2958  2863  2972  2646  3079  2516  2962  3055  1452  2702  2125  3066  2689  2228  2564  2507  1904  3075  2375  3013  3068  2596  3025  3049  2965  2045  3084  2855  2906  2292  2384  2067  2818  3089"
"Food","No","","76462","Terminated","McCormick & Co Inc. Spice Mill Plant","10901 Gilroy Rd","","Hunt Valley","MD","	21031-1307","United States","Voluntary: Firm initiated","Two or more of the following: Email, Fax, Letter, Press Release, Telephone, Visit","Nationwide distribution to:  PA, KS, AR, GA, IN, ME, MO, WI, IN, FL, VA, OH, NY, TN, MI, KY, DE","F-1576-2017","Class II","McCormick & Co., Inc., Stubbs Barbecue. 18oz  Best By Date of January 17, 2020.","583 cases","McCormick & Co., Inc.,  has decided to initiated a voluntary recall of there Stubbs Sticky Sweet BBQ Sauce 18oz Bottle.  Best By Date of January 17, 2020. Because of a glass bottle defect.  The glass defect involves various thickness and defects that may result in chipped or missing glass.","02/13/2017","03/06/2017","08/04/2017","03/15/2017","January 17, 2020"
"Drugs","No","","76463","Terminated","Mylan Institutional, Inc. (d.b.a. UDL Laboratories)","1718 Northrock Ct","","Rockford","IL","	61103-1201","United States","Voluntary: Firm initiated","Letter","Nationwide","D-0493-2017","Class II","Mirtazapine Tablets, USP, 45 mg.  Rx only, 100 Tablets (10 X 10).  Manufactured by:  Mylan Pharmaceuticals Inc, Morgantown, WV ---NDC 51079-088-20","58 UD100 Unit Dose Blister Cards of 10 (10 cards of 10 tablets each)","Presence of Foreign Tablets/Capsules; possibility of Glipizide 10 mg tablets commingled","01/27/2017","03/08/2017","03/15/2019","03/15/2017","Batch #3083289; Exp. Date 12/2018"
"Drugs","No","","76467","Terminated","LEO PHARMA INC","7 Giralda Farms","","Madison","NJ","	07940-1051","United States","Voluntary: Firm initiated","Letter","U.S. Nationwide","D-0510-2017","Class II","Calcipotriene Cream 0.0005%, packaged in a) 60g tube, (NDC 66993-877-61), b) 120g tube (NDC 66993-877-78), Rx Only,  Manufactured by: LEO Pharma Inc., Dublin, Ireland, Manufactured for: Prasco Laboratories, Mason, OH, 45040","272,062 tubes","Incorrect/Undeclared excipients: inadvertent omission of a drug excipient from the the Authorized Generic label and also a warning regarding contact dermatitis from the brand product labeling not being incorporated into the Authorized Generic labeling.","01/19/2017","03/03/2017","01/24/2018","03/15/2017","Lot #: a) EK8760, Exp 2/17; EL1115, Exp 3/17; EL2358, Exp 4/17;  EL6143, Exp 7/17; EM0837, Exp 10/17; EM2088, 12/17; A20899, Exp 5/18; A24492, Exp 6/18; b) EK8764, Exp 2/17; EL6145, Exp 7/17; EM2091, Exp 2/17; A25206, Exp 6/18."
"Devices","No","","76481","Terminated","Abbott Laboratories","4551 Great America Pkwy","","Santa Clara","CA","	95054-1208","United States","Voluntary: Firm initiated","Letter","US and Afghanistan, Brazil, Egypt, Tanzania, Hungary, Iraq, Kenya, Netherlands, Russia, Romania Vietnam, , United Kingdom, Saudi Arabia, Philippines, Lebanon, Mexico, Japan, Jordan, India, Indonesia, Turkey, UAE, Gaza & Jericho, Germany, Bulgaria, Chile, Argentina, Luxembourg.","Z-1438-2017","Class II","CELL-DYN Ruby System:  List Number: 08H6701;      Hematology: The CELL-DYN Ruby System is a multi-parameter automated hematology analyzer designed for in-vitro diagnostic use in clinical laboratories","116","The Pump Relay Printed Circuit Board Assembly (PCBA) used in the CELL-DYN Ruby instrument may prematurely fail and lead to instrument stoppage","02/13/2017","03/09/2017","03/06/2018","03/15/2017","Affected serial numbers:   70002BG  70026BG  70050BG  70076BG  70105BG  70141BG  70003BG  70028BG  70051BG  70077BG  70106BG  70142BG  70004BG  70029BG  70052BG  70079BG  70107BG  70144BG  70005BG  70030BG  70054BG  70082BG  70113BG  70146BG  70006BG  70031BG  70056BG  70084BG  70114BG  70147BG  70007BG  70032BG  70058BG  70086BG  70119BG  70149BG  70008BG  70033BG  70059BG  70087BG  70120BG  70164BG  70009BG  70034BG  70061BG  70088BG  70124BG  70165BG  70010BG  70035BG  70063BG  70089BG  70125BG  70166BG  70011BG  70036BG  70064BG  70090BG  70127BG  70167BG  70012BG  70037BG  70065BG  70091BG  70129BG  70170BG  70013BG  70038BG  70067BG  70092BG  70130BG  70171BG  70014BG  70039BG  70068BG  70093BG  70131BG  70178BG  70016BG  70040BG  70069BG  70094BG  70132BG  70181BG  70018BG  70042BG  70070BG  70095BG  70133BG  70183BG  70019BG  70043BG  70071BG  70096BG  70134BG  70189BG  70020BG  70044BG  70072BG  70099BG  70136BG  70021BG  70045BG  70073BG  70100BG  70137BG  70024BG  70046BG  70074BG  70103BG  70138BG  70025BG  70047BG  70075BG  70104BG  70140BG.    UPDATE: 2-28-17 - five additional serial numbers added:  55899BG,   55900BG,   55901BG,   55902BG   55904BG."
"Food","No","","76489","Terminated","Index Fresh","18184 Slover Ave","","Bloomington","CA","	92316-2367","United States","Voluntary: Firm initiated","Telephone","US: CA, UT, WA","F-1581-2017","Class II","Hass Avocado 32 1 Index Fresh- USA  Hass Avocado 36 1 Index Fresh- USA  Hass Avocado 40 1 Index Fresh- USA  Hass Avocado 48 1 Index Fresh- USA  Hass Avocado 60 1 Index Fresh- USA  Hass Avocado 70 1 Index Fresh- USA  ","6 cases","Index Fresh is recalling avocados because they may be contaminated with Listeria monocytogenes.","02/14/2017","03/07/2017","06/02/2017","03/15/2017","Lot#170213"
"Food","No","","76489","Terminated","Index Fresh","18184 Slover Ave","","Bloomington","CA","	92316-2367","United States","Voluntary: Firm initiated","Telephone","US: CA, UT, WA","F-1582-2017","Class II","Hass Avocado HA LTP S 40 1 Index Fresh- USA  Hass Avocado HA LTP S 70 1 Index Fresh- USA  Hass Avocado HA LTP S 70 1 Index Fresh- USA  ","116 cases","Index Fresh is recalling avocados because they may be contaminated with Listeria monocytogenes.","02/14/2017","03/07/2017","06/02/2017","03/15/2017","Lot#170210"
"Food","No","","76489","Terminated","Index Fresh","18184 Slover Ave","","Bloomington","CA","	92316-2367","United States","Voluntary: Firm initiated","Telephone","US: CA, UT, WA","F-1583-2017","Class II","Hass Avocado HA LB Signature Farms 15/4 60 1- USA  Hass Avocado HA LTP S 60 1 Index Fresh- USA  Hass Avocado HA RPCFB 10/4 70 1 Index Fresh- USA  Hass Avocado HA LTP 32 2 So Good- USA  ","176 cases","Index Fresh is recalling avocados because they may be contaminated with Listeria monocytogenes.","02/14/2017","03/07/2017","06/02/2017","03/15/2017","Lot#170213, 1702/10"
"Devices","No","","76498","Terminated","Becton Dickinson & Co.","7 Loveton Cir","BD Diagnostic Systems","Sparks","MD","	21152-9212","United States","Voluntary: Firm initiated","Letter","15 US customers, 18 Ex-US sites, and 0 distributors.  Approximately 115 customers totally  and 0 distributors","Z-1414-2017","Class II","EpiCenter Plus Microbiology Data Management System software version 6.20A, when used in conjunction with the MALDI BioTyper System .    Product Usage:  The EpiCenter system is a clinical data management system designed for use with certain BD instrument systems. The EpiCenter system provides advanced capabilities in data management, including extended demographic data, comprehensive reporting features including a powerful database query tool, bi-directional Laboratory Information System (LIS) communications and long-term data storage. Additionally, the EpiCenter system provides an Expert System that can manipulate and/or act upon AST results.  ","Qty Distr. to Field - 115","The information in the EpiCenter interface translation tables was not updated to match the Bruker MALDI BioTyper database identifications for some organisms. This could lead to a possible mis-identification of an organism.","08/25/2014","03/08/2017","03/08/2017","03/15/2017","Lot Numbers  Version 6.20A    Cat. Number  442953"
"Drugs","No","","76515","Terminated","Sandoz Inc","100 College Rd W","","Princeton","NJ","	08540-6604","United States","Voluntary: Firm initiated","Letter","Nationwide","D-0515-2017","Class II","Pioglitazone and Glimepiride Tablets, USP, 30 mg/4 mg, 30 count bottles, Rx only, Manufactured by Lek Pharmaceuticals d.d., Verovskova Ulica 57, Ljubljana, - SI-1526, Slovenia ---  NDC 0781-5635-31","","Failed Dissolution Specifications","02/10/2017","03/09/2017","10/24/2017","03/15/2017","Lot FY3669 with expiry 11/2017"
"Food","No","","76535","Terminated","Nu Skin Enterprises Inc.","75 W Center St","","Provo","UT","	84601-4432","United States","Voluntary: Firm initiated","E-Mail","Nationwide, Canadian and other foreign consignees. No VA/govt/military consignees.","F-1578-2017","Class II","Pharmanex BioGinkgo. Mental Sharpness. 60 Tablets","40,158","Nu Skin announces a voluntary field action for Pharmanex BioGinkgo due to undeclared allergen; wheat.","02/13/2017","03/08/2017","08/22/2017","03/15/2017","Batches: DL14951-07, DL31551-07, DL21161-07"
"Food","No","","76535","Terminated","Nu Skin Enterprises Inc.","75 W Center St","","Provo","UT","	84601-4432","United States","Voluntary: Firm initiated","E-Mail","Nationwide, Canadian and other foreign consignees. No VA/govt/military consignees.","F-1579-2017","Class II","Pharmanex Cortitrol. Cortisol Management. 60 Capsules","56,332","Nu Skin announces a voluntary field action for Pharmanex Cortitrol due to undeclared allergen; soy.","02/13/2017","03/08/2017","08/22/2017","03/15/2017","Batches: DL06951-08, DL14251-08, DL34351-08, DL06061-08, DL27161-08"
"Food","No","","76535","Terminated","Nu Skin Enterprises Inc.","75 W Center St","","Provo","UT","	84601-4432","United States","Voluntary: Firm initiated","E-Mail","Nationwide, Canadian and other foreign consignees. No VA/govt/military consignees.","F-1580-2017","Class II","Pharmanex Cholestin. Cholesterol Health. 60 Softgels.","7,327","Nu Skin announces a voluntary field action for Pharmanex Cholestin due to undeclared allergen; soy.","02/13/2017","03/08/2017","08/22/2017","03/15/2017","Batch: CS10351"
"Devices","No","","76541","Terminated","Merge Healthcare, Inc.","900 Walnut Ridge Dr","","Hartland","WI","	53029-8347","United States","Voluntary: Firm initiated","E-Mail","US Distribution was made to medical facilities in CA, MT, PA, and TX.   There was no foreign/military/government distribution.","Z-1426-2017","Class II","DR Systems Unity PACS software, now known as Merge Unity PACS","9 sites potentially have the affected version","Reports were missing demographic header information when they were faxed to referring physicians.","04/08/2016","03/09/2017","03/17/2017","03/15/2017","Version 11.0"
"Drugs","No","","76542","Terminated","Endo Pharmaceuticals, Inc.","1400 Atwater Drive","","Malvern","PA","	19355","United States","Voluntary: Firm initiated","Letter","Nationwide within the United States","D-0512-2017","Class II","Edex (alprostadil for injection) 10mcg, packaged in a 2 pack carton, Rx only, Manufactured in Germany for: Actient Pharmaceuticals, LLC, Lake Forest, Illinois 60045; NDC 52244-010-02.","5,086 cartridges","Lack of Assurance of Sterility: Defective container resulting in the lack of sterility assurance.  ok thanks","02/22/2017","03/03/2017","06/12/2018","03/15/2017","Lot #: 207386, Exp. May 2019"
"Food","No","","76546","Terminated","Hormel Foods Corporation","1 Hormel Pl","","Austin","MN","	55912-3673","United States","Voluntary: Firm initiated","Letter","US: AL, CA, CO, CT, FL, GA, ID, IL, IN, IA, KS, KY, MD, MI, MN, MO, MT, NE, NV, NH, NJ, NM, NY, NC, OH, OK, OR, PA, SC, TX, VA, WA, WV, WY, WI.    OUS: Canada","F-1568-2017","Class II","Great Shake Fortified Nutrition, Soy Formula, Chocolate Artificially Flavored, Packaged in 4 fl oz. (118 mL), and 6 fl oz. (177 mL).  Store Frozen.","25,774 cases for all products","Hormel Foods is recalling Great Shake and Great Shake Plus, fortified Nutrition drinks, due to presence of undeclared milk.","02/22/2017","03/08/2017","08/23/2018","03/15/2017","USE BY dates are FEB 17 17 to MAY 16 18"
"Food","No","","76546","Terminated","Hormel Foods Corporation","1 Hormel Pl","","Austin","MN","	55912-3673","United States","Voluntary: Firm initiated","Letter","US: AL, CA, CO, CT, FL, GA, ID, IL, IN, IA, KS, KY, MD, MI, MN, MO, MT, NE, NV, NH, NJ, NM, NY, NC, OH, OK, OR, PA, SC, TX, VA, WA, WV, WY, WI.    OUS: Canada","F-1569-2017","Class II","Great Shake Fortified Nutrition, Soy Formula, Strawberry Artificially Flavored, Packaged in 4 fl oz. (118 mL), and 6 fl oz. (177 mL).  Store Frozen.","25,774 cases for all products","Hormel Foods is recalling Great Shake and Great Shake Plus, fortified Nutrition drinks, due to presence of undeclared milk.","02/22/2017","03/08/2017","08/23/2018","03/15/2017","USE BY dates are FEB 17 17 to MAY 16 18"
"Food","No","","76546","Terminated","Hormel Foods Corporation","1 Hormel Pl","","Austin","MN","	55912-3673","United States","Voluntary: Firm initiated","Letter","US: AL, CA, CO, CT, FL, GA, ID, IL, IN, IA, KS, KY, MD, MI, MN, MO, MT, NE, NV, NH, NJ, NM, NY, NC, OH, OK, OR, PA, SC, TX, VA, WA, WV, WY, WI.    OUS: Canada","F-1570-2017","Class II","Great Shake Fortified Nutrition, Soy Formula, Vanilla Artificially Flavored, Packaged in 4 fl oz. (118 mL), and 6 fl oz. (177 mL).  Store Frozen.","25,774 cases for all products","Hormel Foods is recalling Great Shake and Great Shake Plus, fortified Nutrition drinks, due to presence of undeclared milk.","02/22/2017","03/08/2017","08/23/2018","03/15/2017","USE BY dates are FEB 17 17 to MAY 16 18"
"Food","No","","76546","Terminated","Hormel Foods Corporation","1 Hormel Pl","","Austin","MN","	55912-3673","United States","Voluntary: Firm initiated","Letter","US: AL, CA, CO, CT, FL, GA, ID, IL, IN, IA, KS, KY, MD, MI, MN, MO, MT, NE, NV, NH, NJ, NM, NY, NC, OH, OK, OR, PA, SC, TX, VA, WA, WV, WY, WI.    OUS: Canada","F-1571-2017","Class II","Great Shake Plus Fortified Nutrition, Soy Formula, Vanilla Artificially Flavored, Packaged in 4 fl oz. (118 mL).  Store Frozen.","25,774 cases for all products","Hormel Foods is recalling Great Shake and Great Shake Plus, fortified Nutrition drinks, due to presence of undeclared milk.","02/22/2017","03/08/2017","08/23/2018","03/15/2017","USE BY dates are FEB 17 17 to MAY 16 18"
"Food","No","","76546","Terminated","Hormel Foods Corporation","1 Hormel Pl","","Austin","MN","	55912-3673","United States","Voluntary: Firm initiated","Letter","US: AL, CA, CO, CT, FL, GA, ID, IL, IN, IA, KS, KY, MD, MI, MN, MO, MT, NE, NV, NH, NJ, NM, NY, NC, OH, OK, OR, PA, SC, TX, VA, WA, WV, WY, WI.    OUS: Canada","F-1572-2017","Class II","Great Shake Plus Fortified Nutrition, Soy Formula, Chocolate Artificially Flavored, Packaged in 4 fl oz. (118 mL).  Store Frozen.","25,774 cases for all products","Hormel Foods is recalling Great Shake and Great Shake Plus, fortified Nutrition drinks, due to presence of undeclared milk.","02/22/2017","03/08/2017","08/23/2018","03/15/2017","USE BY dates are FEB 17 17 to MAY 16 18"
