"Food","No","","76546","Terminated","Hormel Foods Corporation","1 Hormel Pl","","Austin","MN","	55912-3673","United States","Voluntary: Firm initiated","Letter","US: AL, CA, CO, CT, FL, GA, ID, IL, IN, IA, KS, KY, MD, MI, MN, MO, MT, NE, NV, NH, NJ, NM, NY, NC, OH, OK, OR, PA, SC, TX, VA, WA, WV, WY, WI.    OUS: Canada","F-1573-2017","Class II","Great Shake Plus Fortified Nutrition, Soy Formula, Strawberry Artificially Flavored, Packaged in 4 fl oz. (118 mL).  Store Frozen.","25,774 cases for all products","Hormel Foods is recalling Great Shake and Great Shake Plus, fortified Nutrition drinks, due to presence of undeclared milk.","02/22/2017","03/08/2017","08/23/2018","03/15/2017","USE BY dates are FEB 17 17 to MAY 16 18"
"Biologics","No","","76553","Terminated","American National Red Cross (the)","Carolinas Region","2425 Park Rd","Charlotte","NC","	28203-5926","United States","Voluntary: Firm initiated","Telephone","North Carolina; Georgia","B-0395-2017","Class II","Apheresis Red Blood Cells, Leukocytes Reduced","3","Apheresis products, collected from unsuitable donors due to a donor screening deviation, were distributed.","12/16/2016","03/06/2017","03/06/2017","03/15/2017","W201216077984; W201216111594 (double collection)"
"Biologics","No","","76554","Terminated","American National Red Cross The","100 Red Cross Cir","","Pomona","CA","	91768-2580","United States","Voluntary: Firm initiated","Telephone","California","B-0396-2017","Class II","Pooled Cryoprecipitated AHF","1 unit","Blood products, in which donor suitability was not adequately determined, were distributed.","01/12/2017","03/06/2017","03/06/2017","03/15/2017","W200616947834"
"Biologics","No","","76555","Terminated","Central Texas Regional Blood & Tissue Center","4300 N Lamar Blvd","","Austin","TX","	78756-3421","United States","Voluntary: Firm initiated","Telephone","Texas","B-0400-2017","Class II","Platelets Pheresis, Leukocytes Reduced","1","Apheresis product for which white blood cell count testing was not performed, was distributed.","12/30/2016","03/06/2017","03/06/2017","03/15/2017","W221616620394"
"Biologics","No","","76556","Terminated","American National Red Cross (the)","Carolinas Region","2425 Park Rd","Charlotte","NC","	28203-5926","United States","Voluntary: Firm initiated","Telephone","North Carolina; New York; Massachusetts; Georgia","B-0401-2017","Class II","Red Blood Cells, Leukocytes Reduced, Irradiated","1 unit","Blood products, collected from unsuitable donors were distributed.","12/16/2016","03/06/2017","03/06/2017","03/15/2017","W200416498120"
"Biologics","No","","76556","Terminated","American National Red Cross (the)","Carolinas Region","2425 Park Rd","Charlotte","NC","	28203-5926","United States","Voluntary: Firm initiated","Telephone","North Carolina; New York; Massachusetts; Georgia","B-0402-2017","Class II","Apheresis Platelets, Leukocytes Reduced, Irradiated","1 unit","Blood products, collected from unsuitable donors were distributed.","12/16/2016","03/06/2017","03/06/2017","03/15/2017","W200416818339"
"Biologics","No","","76556","Terminated","American National Red Cross (the)","Carolinas Region","2425 Park Rd","Charlotte","NC","	28203-5926","United States","Voluntary: Firm initiated","Telephone","North Carolina; New York; Massachusetts; Georgia","B-0403-2017","Class II","Apheresis Red Blood Cells, Leukocytes Reduced","2 units","Blood products, collected from unsuitable donors were distributed.","12/16/2016","03/06/2017","03/06/2017","03/15/2017","W201216111594 (double collection)"
"Biologics","No","","76556","Terminated","American National Red Cross (the)","Carolinas Region","2425 Park Rd","Charlotte","NC","	28203-5926","United States","Voluntary: Firm initiated","Telephone","North Carolina; New York; Massachusetts; Georgia","B-0404-2017","Class II","Red Blood Cells, Leukocytes Reduced","3 units","Blood products, collected from unsuitable donors were distributed.","12/16/2016","03/06/2017","03/06/2017","03/15/2017","W201216077955; W201216111039; W201216121133"
"Biologics","No","","76557","Terminated","BloodSource, Inc.","10536 Peter a McCuen Blvd","","Mather","CA","	95655-4128","United States","Voluntary: Firm initiated","Telephone","California","B-0406-2017","Class II","Red Blood Cells, Leukocytes Reduced","1 unit","Blood product, in which donor deferral and/or donor incorrectly deleted from deferral list, was distributed.","01/23/2017","03/06/2017","03/06/2017","03/15/2017","W035817029029"
"Biologics","No","","76558","Terminated","Central California Blood Center","4343 W Herndon Ave","","Fresno","CA","	93722-3794","United States","Voluntary: Firm initiated","Other","Florida; California","B-0398-2017","Class II","Blood and Blood Products for Reprocessing","1 unit","Blood products collected from a donor who travelled to a malarial endemic area within a year of donation, were distributed.","01/11/2017","03/06/2017","03/06/2017","03/15/2017","W115916026503"
"Biologics","No","","76558","Terminated","Central California Blood Center","4343 W Herndon Ave","","Fresno","CA","	93722-3794","United States","Voluntary: Firm initiated","Other","Florida; California","B-0399-2017","Class II","Red Blood Cells, Leukocytes Reduced","1 unit","Blood products collected from a donor who travelled to a malarial endemic area within a year of donation, were distributed.","01/11/2017","03/06/2017","03/06/2017","03/15/2017","W115916026503"
"Devices","No","","76560","Terminated","MicroAire Surgical Instruments, LLC","3590 Grand Forks Blvd","","Charlottesville","VA","	22911-9006","United States","Voluntary: Firm initiated","Letter","United States.","Z-1407-2017","Class II","MicroAire K-Wires","Total 362","Mislabeling on three lots of K-Wires. The incorrect product description "" dual trocar"" instead of ""single trocar"" was on the product label on the following parts:  1600-9355NS (lot 61005), 1600-9625NS (lot 60297), and 1604-162NS (lot 62856).","02/21/2017","03/03/2017","07/14/2017","03/15/2017","Part Number, Lot Number, Quantity Distributed to Field  1600-9355NS, 61005,   56; 1600-9625NS, 60297,  209;  1604-162NS, 62856,  97."
"Food","No","","76566","Terminated","Trader Joes Company","800 S Shamrock Ave","","Monrovia","CA","	91016-6346","United States","Voluntary: Firm initiated","E-Mail","US: CA, OR, AZ, WA, NV, NM, CO, UT, ID, TX, MA, NH, CT, VT, NY, NJ, KY, PA, DE, VA, MD, DC, TN, MI, OH, IN, IL, MO, MN, WI, NE, KS, IA, GA, AL, NC, SC, LA, FL.","F-1584-2017","Class II","Trader Joes Imported English Authentic Lemon Curd, 10.5oz (300g), 24 jars/case","409,512 units","Trader Joe's Co. is recalling the Lemon Curd because it contains undeclared milk in the sub-ingredient of butter.","02/24/2017","03/08/2017","06/05/2017","03/15/2017","all codes"
"Devices","No","","76590","Terminated","Merge Healthcare, Inc.","900 Walnut Ridge Dr","","Hartland","WI","	53029-8347","United States","Voluntary: Firm initiated","Two or more of the following: Email, Fax, Letter, Press Release, Telephone, Visit","Distribution was made to medical facilities nationwide.  There was no foreign/military/government distribution.","Z-1403-2017","Class II","Merge Cardio software. The firm name on the label is Merge Healthcare, Hartland, WI.","110 sites potentially have the affected versions","When taking measurements from images on the Cardio workstation or from the US cart, numbers are not crossing to the report in the correct unit of measure.","04/04/2016","03/03/2017","","03/15/2017","Versions 9.0, 9.0.1, 9.0.2, 9.0.3, 9.0.4, 9.0.5, 9.0.6, 9.0.7, 9.0.8, 9.0.9, and 10.0."
"Devices","No","","76594","Ongoing","Merge Healthcare, Inc.","900 Walnut Ridge Dr","","Hartland","WI","	53029-8347","United States","Voluntary: Firm initiated","Two or more of the following: Email, Fax, Letter, Press Release, Telephone, Visit","USA (nationwide ) Distribution was made to medical facilities. Internationally to Canada. There was no government or military distribution.","Z-1431-2017","Class II","Merge PACS software.  The firm name on the label is Merge Healthcare.","248 sites potentially have the affected versions","Studies that have QC, PDE, or HL7 ADT updates applied may fail to propagate via telmed protocol to the destination server and may fail to import on the destination server.","04/04/2016","03/09/2017","","03/15/2017","Versions 6.6.1, 6.6.1.1, 6.6.2, 6.6.2.1, 6.6.2.2, 7.0, and 7.0.1"
"Food","No","","76618","Terminated","Versa Marketing","4623 N 1st St","","Fresno","CA","	93726-0904","United States","Voluntary: Firm initiated","Telephone","Aldi stores nationwide","F-1585-2017","Class II","Fusia Asian Aspirations Szechuan Stir Fry;  A delicious blend of premium vegetables with a savory sauce packed in a plastic bag:  Sauce packet included.  NET WT 21 oz. (1 lb 5 oz) 595 g  ","4089 cases of multi-pack product (6 pacakges of Szechuan per case)","Product was tested and found positive for Listeria monocytogenes.","02/27/2017","03/09/2017","03/16/2017","03/15/2017","Lot 3720 60,894 lbs. Best by date 6-14-18 VM3496 3720"
"Drugs","No","","76631","Ongoing","Mckesson Packaging Services","7101 Weddington Rd NW","","Concord","NC","	28027-3412","United States","Voluntary: Firm initiated","Letter","Nationwide in the USA","D-0513-2017","Class II","Aspirin Chewable Tablets, 81 mg, (NSAID*), packaged in UD 750 Tablets (25 x 30) tablets in blisters per carton, Dist. By: McKesson Packaging Services, a business unit of McKesson Corporation, 7101 Weddington Rd., Concord, NC 28027, NDC 63739-434-01.","6,717 cartons","Presence of Foreign Substance: foreign material found in the bulk inventory.","02/23/2017","03/07/2017","","03/15/2017","Lot numbers: 0113784, 0113786, 0113834, 0113887, Exp. 07/18"
"Devices","No","","76153","Terminated","US Endoscopy Group Inc","5976 Heisley Rd","","Mentor","OH","	44060-1873","United States","Voluntary: Firm initiated","Letter","US Distribution to the states of : AL, CA, CO, IL, KS, MA, MT, NC , NE , NY, OH, PA, TN, TX  and WA.    Product was also shipped to the following countries: Australia, Belgium, Canada, Czech Republic, Ireland, Kuwait, Norway, Poland & Sweden.","Z-1416-2017","Class III","Roth Net Polyp Retrieval","2,131 units","The firm was notified that the expiration date on the outer carton is different than the expiration date on the inner package.  The expiration date is shorter than the actual expiration.","12/13/2016","03/08/2017","06/13/2017","03/15/2017","Model # 0071151; Lot #s: 1613898, Exp. Date October 5, 2019; Lot # 1616337, Exp. Date October 7, 2019; Lot # 1616733, Exp. Date October 7, 2019; Lot # 1616734, Exp. Date October 20, 2019 & Lot # 1616735, Exp. Date October 28, 2019."
"Biologics","No","","76388","Terminated","Inland Northwest Blood Center","210 W Cataldo Ave","","Spokane","WA","	99201-2217","United States","Voluntary: Firm initiated","Telephone","Louisiana; California","B-0414-2017","Class III","Apheresis Red Blood Cells, Leukocytes Reduced","2 units","Blood products, inappropriately released from quarantine, were distributed.","01/06/2017","03/07/2017","03/07/2017","03/15/2017","W0425160652272 (double collection)"
"Devices","No","","76408","Terminated","Integra LifeSciences Corp.","311 Enterprise Dr","","Plainsboro","NJ","	08536-3344","United States","Voluntary: Firm initiated","Letter","Nationwide","Z-1410-2017","Class III","The UNI-CP System; Model Number: 330230SND.      ","39 units","The firm received one complaint from one non-US sales representative (France) that the label on the UNI-CP plate was incorrect.","01/25/2017","03/04/2017","11/08/2017","03/15/2017","Lot # FEDT"
"Biologics","No","","76417","Terminated","Mercy Health Youngstown","1044 Belmont Ave","","Youngstown","OH","	44504-1006","United States","Voluntary: Firm initiated","Other","Ohio","B-0415-2017","Class III","Red Blood Cells, Leukocytes Reduced, Irradiated","2 units","Misbranded red blood cells were distributed.","01/24/2017","03/07/2017","03/07/2017","03/15/2017","W204216484880; W204216435721;"
"Drugs","No","","76421","Terminated","Actavis Inc","400 Interpace Pkwy","","Parsippany","NJ","	07054-1120","United States","Voluntary: Firm initiated","Letter","Nationwide","D-0514-2017","Class III","Levofloxacin Ophthalmic Solution, 0.5%, Sterile,  packaged in 5mL bottles, Rx Only, Manufactured by  Hi-Tech Pharmacal Co., Inc., Amityville, NY 11707, NDC 50383-283-05","14280 bottles","Failed Impurities/ Degradation Specifications: OOS for related compound (levofloxacin n-oxide) at the 18  month stability time point.","02/07/2017","03/09/2017","01/09/2018","03/15/2017","Lot # 348748, Exp 11/30/2017; 350578, Exp 3/31/2018; 633467, Exp 3/31/2017"
"Drugs","No","","76513","Terminated","Teva Pharmaceuticals USA","1090 Horsham Rd","","North Wales","PA","	19454-1505","United States","Voluntary: Firm initiated","Letter","Nationwide in the United States and Puerto Rico","D-0511-2017","Class III","Risedronate Sodium Delayed-release Tablets, 35 mg, Once-a-Week, 1 tablet per blister (NDC 0093-5509-19), packaged in 4 blisters per carton (NDC 0093-5509-44), Rx only, TEVA PHARMACEUTICALS USA, INC., North Wales, PA  19454.","25,916 cartons","Failed Dissolution Specifications: low out of specification dissolution results found during stability testing.","02/17/2017","03/03/2017","02/05/2018","03/15/2017","Lot # 34025762A, Exp 06/17"
"Biologics","No","","76524","Terminated","Community Blood Center","2900 College Dr","","Kettering","OH","	45420-2972","United States","Voluntary: Firm initiated","Telephone","Pennsylvania; Oregon; Alabama; New Jersey","B-0416-2017","Class III","Bone","6 allografts","Bone allografts were inappropriately distributed.","01/23/2017","03/07/2017","03/07/2017","03/15/2017","161991026; 161991038; 161991044; 161991048; 162866031; 162866043;"
"Biologics","No","","76554","Terminated","American National Red Cross The","100 Red Cross Cir","","Pomona","CA","	91768-2580","United States","Voluntary: Firm initiated","Telephone","California","B-0397-2017","Class III","Blood and Blood Products for Reprocessing","1 unit","Blood products, in which donor suitability was not adequately determined, were distributed.","01/12/2017","03/06/2017","03/06/2017","03/15/2017","W200616265349"
