Product Type,Recently Updated Record,Last Modified Date,Event ID,Status,Recalling Firm,Address1,Address2,City,State/Province,Postal Code,Country,Voluntary/Mandated,Initial Firm Notification of Consignee or Public,Distribution Pattern,Recall Number,Classification,Product Description,Product Quantity,Reason for Recall,Recall Initiation Date,Center Classification Date,Termination Date,Report Date,Code Info
"Devices","No","","76252","Terminated","Physio-Control, Inc.","11811 Willows Rd NE","","Redmond","WA","	98052-2003","United States","Voluntary: Firm initiated","Two or more of the following: Email, Fax, Letter, Press Release, Telephone, Visit","Worldwide Distribution - US (nationwide) and in the following countries: Bahrain, Belize, Cambodia, Chile, China, C¿te d'Ivoire, Ecuador, Germany, Honduras, Hong Kong, India, Indonesia, Jamaica, Myanmar, Netherlands, Niger, Philippines, Saudi Arabia, Senegal, Singapore, Sri Lanka, Thailand, Tunisia, Ukraine, and Zambia.","Z-1257-2017","Class I","The LIFEPAK 1000 defibrillator is intended for use by personnel who are authorized by a physician/medical director and are trained in CPR and the use of the LIFEPAK 1000 defibrillator.","total 133,330 units (50,046 units in the US)","The firm has received complaints that the LIFEPAK 1000 Defibrillator is unexpectedly powering off during device usage.","01/13/2017","03/03/2017","08/22/2019","03/15/2017","Affected Product Part Numbers: 320371500XX.  There are 133,330 affected serial numbers."
"Food","No","","76341","Terminated","NSE Products, Inc.","75 W Center St","","Provo","UT","	84601-4432","United States","Voluntary: Firm initiated","Press Release","Nationwide and Canada. No other foreign or VA/govt/military consignees.","F-1532-2017","Class I","Pharmanex ageLOC TR90 Protein Boost. Protein Powder. Net wt. 1.59 lbs (720g). 30 Servings. Natural Vanilla Flavor. Lactose, Gluten, & Soy Free. Plant Protein/Vegetarian.","21,460 units","Nu Skin announces a voluntary field action for Pharmanex ageLOC TR90 Protein Boost due to an undeclared milk allergen.","01/26/2017","03/03/2017","07/05/2017","03/15/2017","Lot Numbers: AZ30751, AZ32051, AZ00661, AZ27161, and AZ34161"
"Food","No","","76586","Terminated","Dairy Maid Dairy, LLC","259 E 7th St","","Frederick","MD","	21701-5227","United States","Voluntary: Firm initiated","Telephone","Geographic areas of distribution: Maryland and Connecticut    The firm sold product to 14 of direct account customers. All direct account customers were distributors, schools, prisons, and similar institutions.","F-1567-2017","Class I","Grove Fresh Pasteurized Apple Juice from concentrate, 4-ounce cartons, 100 % Pure.","","The firm received several customer complaints regarding foreign material in the product.  The firm tested seven of the returned product units and found that they were positive for undeclared milk.  The product has been recalled due to undeclared milk.    ","02/16/2017","03/03/2017","06/02/2017","03/15/2017","Mar 08 PLT-24008"
"Devices","No","","76158","Terminated","Mako Surgical Corporation","2555 Davie Rd Ste 110","","Davie","FL","	33317-7424","United States","Voluntary: Firm initiated","Letter","US nationwide distribution.","Z-1411-2017","Class II","MAKO RIO THA Application User Guides, for total hip arthroplasty, orthopedic surgery.","777","Five (5) AFMEA Risk Control Measures are missing from the MAKO RIO THA Application User Guides","12/22/2016","03/07/2017","08/06/2019","03/15/2017","Part Item #: 204863 - THA 1.0 Application User Guide  Part Item #: 207116 - THA 2.0 Application User Guide  Part Item #: 208692 - THA 2.1 Application User Guide  Part Item #: 209711 - MAKOplasty THA Application User Guide  Part Item #: 210555 - MAKIplast THA 3.1 Application User Guide  Part Item#: 212026 - THA Application User Guide  2.1-2.1.1  THA 3.0, THA 3.1, 3.1.1 and  3.1.1.1    Part Item # 204863 THA 1.0 Application User Guide  Part Item # 207116 THA 2.0 Application User Guide  Part Item # 208692 THA 2.1 Application User Guide  Part Item # 209711 MAKOplasty THA Application User Guide  Part Item # 210555 MAKIplast THA 3.1  Application User Guide  Part Item # 212026 THA Application User Guide"
"Devices","No","","76212","Terminated","Siemens Healthcare Diagnostics, Inc","333 Coney St","","East Walpole","MA","	02032-1516","United States","Voluntary: Firm initiated","Letter","US Nationwide distribution including Puerto Rico","Z-1418-2017","Class II","ADVIA Centaur Progesterone; Catalog Number: 10310305 10315522 10333111    Product Usage:  The PROG method is an in vitro diagnostic test for the quantitative measurement of progesterone in human serum and plasma on the Dimension Vista¿System. Progesterone measurements are used in the diagnosis and treatment of disorders of the ovaries or placenta.    ","76,107","DHEA-S causes falsely elevated progesterone results.","01/04/2017","03/09/2017","07/18/2019","03/15/2017","SMN: 10310305: 75422274  83380274  89389274  99473274  8713275  19796275  30565275  38674275  46515276  55704276  66971276  78934276  80930277;   SMN: 10315522: 74355274  80476274  87497274  20274  7772275  14822275  25943275  35303275  43229276  46525276  55505276  67430276  80448276  81415277;   SMN: 10333111: 84848274  89946274  14006275  33598275  49907276  66978276"
"Devices","No","","76212","Terminated","Siemens Healthcare Diagnostics, Inc","333 Coney St","","East Walpole","MA","	02032-1516","United States","Voluntary: Firm initiated","Letter","US Nationwide distribution including Puerto Rico","Z-1419-2017","Class II","Dimension Vista LOCI Progesterone; Catalog Number: K6464; Siemens Material Number: 10461743    Product Usage:  For in vitro diagnostic use in the quantitative determination of progesterone in serum and using the ADVIA Centaur¿, ADVIA Centaur XP, ADVIA Centaur XPT and ADVIA Centaur CP systems  ","1148","DHEA-S causes falsely elevated progesterone results.","01/04/2017","03/09/2017","07/18/2019","03/15/2017","16193BB  16200BA  16214BA  16235BB  16250BA  16270BA  16291BA  16319AA"
"Devices","No","","76212","Terminated","Siemens Healthcare Diagnostics, Inc","333 Coney St","","East Walpole","MA","	02032-1516","United States","Voluntary: Firm initiated","Letter","US Nationwide distribution including Puerto Rico","Z-1420-2017","Class II","IMMULITE/ IMMULITE 1000 Progesterone; Catalog Number: LKPW1; Siemens Material Number: 10381128    Product Usage:  For in vitro diagnostic use with the IMMULITE¿2000 Systems Analyzers- for the quantitative measurement of progesterone in serum, as an aid in the diagnosis and treatment of disorders of the ovaries or placenta.  ","9076","DHEA-S causes falsely elevated progesterone results.","01/04/2017","03/09/2017","07/18/2019","03/15/2017","LKPW1 kit lot 0245  LKPW1 kit lot 0246  LKPW1 kit lot 0247  LKPW1 kit lot 0248  LKPW1 kit lot 0249"
"Devices","No","","76212","Terminated","Siemens Healthcare Diagnostics, Inc","333 Coney St","","East Walpole","MA","	02032-1516","United States","Voluntary: Firm initiated","Letter","US Nationwide distribution including Puerto Rico","Z-1421-2017","Class II","IMMULITE 2000 Progesterone; Catalog Number: L2KPW2   L2KPW6; Siemens Material Number: 10381181, 10381170    Product Usage:  For in vitro diagnostic use with the IMMULITE¿ and IMMULITE 1000 Analyzers - for the quantitative measurement of progesterone in serum as an aid in the diagnosis and treatment of disorders of the ovaries or placenta.  ","11963","DHEA-S causes falsely elevated progesterone results.","01/04/2017","03/09/2017","07/18/2019","03/15/2017","SMN: 10381181: L2KPW2 kit lot 453  L2KPW2 kit lot 454  L2KPW2 kit lot 455  L2KPW2 kit lot 456  L2KPW2 kit lot 457  L2KPW2 kit lot 458  L2KPW2 kit lot 459  L2KPW2 kit lot 460  L2KPW2 kit lot 462  L2KPW2 kit lot 463  L2KPW2 kit lot 464  L2KPW2 kit lot 465  L2KPW2 kit lot 467  L2KPW2 kit lot 468  L2KPW2 kit lot 470  L2KPW2 kit lot 471  L2KPW2 kit lot 472  L2KPW2 kit lot 474;  SMN: 10381170: L2KPW6 kit lot 453  L2KPW6 kit lot 454  L2KPW6 kit lot 455  L2KPW6 kit lot 456  L2KPW6 kit lot 457  L2KPW6 kit lot 458  L2KPW6 kit lot 459  L2KPW6 kit lot 460  L2KPW6 kit lot 461  L2KPW6 kit lot 463  L2KPW6 kit lot 464  L2KPW6 kit lot 465  L2KPW6 kit lot 466  L2KPW6 kit lot 467  L2KPW6 kit lot 469  L2KPW6 kit lot 470  L2KPW6 kit lot 471  L2KPW6 kit lot 472  L2KPW6 kit lot 474"
"Devices","No","","76228","Terminated","Siemens Medical Solutions USA Inc.","810 Innovation Dr","","Knoxville","TN","	37932-2562","United States","Voluntary: Firm initiated","Letter","Worldwide distribution - US Nationwide in the states of CA, CT, FL, GA, IL, KY, MA, MI, ND, NJ, OH, OK, OR, PA, TN, WA, WI, WY and the countries of  Switzerland, Great Britain, Italy","Z-1422-2017","Class II","Biograph 6 TruePoint, Material Number 10097289    The Biograph Mobile PET/CTs are intended to be utilized by appropriately trained health care professionals to:  ¿ Image and measure the distribution of injected positron emitting radiopharmaceuticals in humans for the purpose of determining various metabolic (molecular) and physiologic functions within the human body; and  ¿ Produce cross-sectional images of the body by computer reconstruction of XRay transmission data from either the same axial plan taken at different angles or spiral planes taken at different angles.","18 units","The mobile-specific instructions was not shipped to a limited population of Biograph Mobile systems.","02/20/2017","03/09/2017","09/17/2017","03/15/2017","1010, 1024, 1038, 44976, 45509, 45530, 45573, 45583, 45601, 45604, 45619, 45621, 45627, 45639, 45640, 45646, 45655, 45658"
"Devices","No","","76228","Terminated","Siemens Medical Solutions USA Inc.","810 Innovation Dr","","Knoxville","TN","	37932-2562","United States","Voluntary: Firm initiated","Letter","Worldwide distribution - US Nationwide in the states of CA, CT, FL, GA, IL, KY, MA, MI, ND, NJ, OH, OK, OR, PA, TN, WA, WI, WY and the countries of  Switzerland, Great Britain, Italy","Z-1423-2017","Class II","Biograph 6 TruePoint, Material Number 10097290    The Biograph Mobile PET/CTs are intended to be utilized by appropriately trained health care professionals to:  ¿ Image and measure the distribution of injected positron emitting radiopharmaceuticals in humans for the purpose of determining various metabolic (molecular) and physiologic functions within the human body; and  ¿ Produce cross-sectional images of the body by computer reconstruction of XRay transmission data from either the same axial plan taken at different angles or spiral planes taken at different angles.","6 units","The mobile-specific instructions was not shipped to a limited population of Biograph Mobile systems.","02/20/2017","03/09/2017","09/17/2017","03/15/2017","1010, 1015, 1034, 1044, 45503, 45537"
"Devices","No","","76228","Terminated","Siemens Medical Solutions USA Inc.","810 Innovation Dr","","Knoxville","TN","	37932-2562","United States","Voluntary: Firm initiated","Letter","Worldwide distribution - US Nationwide in the states of CA, CT, FL, GA, IL, KY, MA, MI, ND, NJ, OH, OK, OR, PA, TN, WA, WI, WY and the countries of  Switzerland, Great Britain, Italy","Z-1424-2017","Class II","Biograph 16 TruePoint - 3R, Material Number 10249555    The Biograph Mobile PET/CTs are intended to be utilized by appropriately trained health care professionals to:  ¿ Image and measure the distribution of injected positron emitting radiopharmaceuticals in humans for the purpose of determining various metabolic (molecular) and physiologic functions within the human body; and  ¿ Produce cross-sectional images of the body by computer reconstruction of XRay transmission data from either the same axial plan taken at different angles or spiral planes taken at different angles.","9 units","The mobile-specific instructions was not shipped to a limited population of Biograph Mobile systems.","02/20/2017","03/09/2017","09/17/2017","03/15/2017","72444, 72470, 72476, 72480, 72487, 72494, 72515, 72526, 72545"
"Devices","No","","76228","Terminated","Siemens Medical Solutions USA Inc.","810 Innovation Dr","","Knoxville","TN","	37932-2562","United States","Voluntary: Firm initiated","Letter","Worldwide distribution - US Nationwide in the states of CA, CT, FL, GA, IL, KY, MA, MI, ND, NJ, OH, OK, OR, PA, TN, WA, WI, WY and the countries of  Switzerland, Great Britain, Italy","Z-1425-2017","Class II","Biograph 16 TruePoint TrueV - 4R, Material Number 10249556    The Biograph Mobile PET/CTs are intended to be utilized by appropriately trained health care professionals to:  ¿ Image and measure the distribution of injected positron emitting radiopharmaceuticals in humans for the purpose of determining various metabolic (molecular) and physiologic functions within the human body; and  ¿ Produce cross-sectional images of the body by computer reconstruction of XRay transmission data from either the same axial plan taken at different angles or spiral planes taken at different angles.","4 units","The mobile-specific instructions was not shipped to a limited population of Biograph Mobile systems.","02/20/2017","03/09/2017","09/17/2017","03/15/2017","72484, 72490, 72516, 72536"
"Food","No","","76266","Terminated","Robert Rothschild Farm LLC","3143 E US Highway 36","","Urbana","OH","	43078-9735","United States","Voluntary: Firm initiated","Two or more of the following: Email, Fax, Letter, Press Release, Telephone, Visit","This product was distributed nationwide.    Product was distributed in Canada.","F-1574-2017","Class II","Gift Sets with Pretzel Twists","126,419 Units","The product is not labeled with an ingredient statement and therefore, does not declare the allergens, soy and wheat.","01/11/2017","03/06/2017","01/31/2018","03/15/2017","98016 - Use by date 9/21/16 through 9/06/17"
"Food","No","","76266","Terminated","Robert Rothschild Farm LLC","3143 E US Highway 36","","Urbana","OH","	43078-9735","United States","Voluntary: Firm initiated","Two or more of the following: Email, Fax, Letter, Press Release, Telephone, Visit","This product was distributed nationwide.    Product was distributed in Canada.","F-1575-2017","Class II","Gift Sets with Chocolate Pretzel Dippers","28,288 units","The product is not labeled with an ingredient statement and therefore, does not declare the allergens, soy and wheat.","01/11/2017","03/06/2017","01/31/2018","03/15/2017","88035 - Use by dates 1/21/16 thorugh 3/14/17"
"Devices","No","","76279","Ongoing","The See Clear Company","4995 Buford Hwy Ste 102","","Peachtree Corners","GA","	30071-2721","United States","Voluntary: Firm initiated","Letter","Worldwide Distribution: US (nationwide) including states of: AZ, CA, DE, FL, GA, HI, LA, NJ, NY, NV, ON, PA and WA; and  country of: Canada.","Z-1404-2017","Class II","Color contact lenses labeled under the following brands: Diamond, Fierce, Ambition, Circle Collection, Lunatic, Fright, Desire and See Clear.","119,829 units","Sterility and Misbranding: Lenses may not be sterile and may be labeled with erroneous lot numbers and expiry dates.","01/06/2017","03/03/2017","","03/15/2017","All lots of lenses sold between 10/31/2013 to 10/31/2016"
"Devices","No","","76299","Terminated","Parker Medical","5085 Weeping Willow Cir","","Highlands Ranch","CO","	80130-4485","United States","Voluntary: Firm initiated","Telephone","Nationwide Distribution to CO, FL, IN, SC and TX. One VA consignee.","Z-1399-2017","Class II","Parker Left Double Lumen Endobronchial Tube with Parker Flex-Tip (Parker Endo-Bronch with Flex Tip). Model Numbers: H-PFTDL-28-1, H-PFTDL-32-1, H-PFTDL-35-1, H-PFTDL-37-1, H-PFTDL-39-1,  H-PFTDL-41-1.  The product is an endotracheal tube with a double lumen for single lung isolation allowing for ventilation of one lung during a surgical procedure. Endotracheal tubes are used for intubating patients and used in conjunction with a ventilator to provide oxygen and anesthetic agents to the patient during surgeries","1,060 units","The product was not functioning as intended.  The ventilation to the patient was not disrupted, but the single lung isolation and ventilation did not function as intended.","12/16/2016","03/03/2017","04/17/2017","03/15/2017","Lot Numbers: 1605DL0814A, 1605DL0814B, 1601LD2001C, 1605DL0814C, 1601DL2001D, 1605DL0814D,  1601DL2001E, 1605DL0814E, 1605DL0814F"
"Devices","No","","76318","Terminated","Metrex Research, LLC.","28210 Wick Rd","","Romulus","MI","	48174-2639","United States","Voluntary: Firm initiated","Letter","Nationwide Distribution to PA, FL, IL, MN, TX, AL, NY","Z-1402-2017","Class II","CaviWipes1 Extra Large, Part No. 13-5150  The brand name of the device is CaviWipes1 Extra Large, a surface disinfectant. The device has been assigned the product code LRJ (General Purpose Disinfectant) by the FDA and is classified as a Class I Medical Device. CaviWipes1 Extra Large is intended to be used to disinfect surfaces.","960 cases","Metrex is recalling the CaviWipes Extra Large because they may have been contaminated during the packaging process.","01/20/2017","03/03/2017","09/01/2017","03/15/2017","Lot No. 16-2340PA"
"Devices","No","","76327","Terminated","Covidien LLC","60 Middletown Ave","","North Haven","CT","	06473-3908","United States","Voluntary: Firm initiated","Letter","Nationwide","Z-1408-2017","Class II","Premier Guard Sterile Drape For Use with Blair-Port Wand (02-0029) and Blair-Port Wand X (01-0046)  Item Number: 01-0020    Used in conjunction RF Surgical Gauze detection systems to protect scanning device from contamination during various surgical procedures","1,111,600 units","Sterility compromised due to breach in sterile barrier","01/23/2017","03/04/2017","08/07/2019","03/15/2017","Lot Numbers: 1112351 to 1609891"
"Devices","No","","76327","Terminated","Covidien LLC","60 Middletown Ave","","North Haven","CT","	06473-3908","United States","Voluntary: Firm initiated","Letter","Nationwide","Z-1409-2017","Class II","Premier Guard Drape, Sterile.  For Use with Verisphere (01-0035) and ArQ.Sphere (01-0044)    Item Number: 01-0037  Used in conjunction RF Surgical Gauze detection systems to protect scanning device from contamination during various surgical procedures","42,750 units","Sterility compromised due to breach in sterile barrier","01/23/2017","03/04/2017","08/07/2019","03/15/2017","Lot Numbers: 1410577-4 to 1605778"
"Devices","No","","76351","Terminated","ErgoSafe Products, LLC (DBA) Prism Medical","10888 Metro Ct","","Maryland Heights","MO","	63043-2413","United States","Voluntary: Firm initiated","Letter","Product was distributed to MT and NV; one VA consignee.","Z-1405-2017","Class II","A-series lift - A625 Manual w/Load Cell & Wi-Fi, Omni  Part No. 324124. Prism Medical.","21","During internal cycle test at max load (625 lbs.) 2 units had straps break prematurely.","01/30/2017","03/03/2017","12/04/2017","03/15/2017","A6MC000110  A6M0001010  A6M0001011  A6M0001012  A6M0001013  A6M0001014  A6M0001015  A6M0001016  A6M0001017  A6M0001018  A6M0001019  A6M0001020  A6M0001021  A6M0001025  A6M0001026  A6M0001029  A6M0001022  A6M0001023  A6M0001024  A6M0001027  A6M0001028"
"Devices","No","","76351","Terminated","ErgoSafe Products, LLC (DBA) Prism Medical","10888 Metro Ct","","Maryland Heights","MO","	63043-2413","United States","Voluntary: Firm initiated","Letter","Product was distributed to MT and NV; one VA consignee.","Z-1406-2017","Class II","A-series lift - A625 Manual Part No. 324117. Prism Medical.","76","During internal cycle test at max load (625 lbs.) 2 units had straps break prematurely.","01/30/2017","03/03/2017","12/04/2017","03/15/2017","A6MC000016  A6MC000019  A6MC000020  A6MC000021  A6MC000022  A6MC000023  A6MC000024  A6MC000025  A6MC000026  A6MC000027  A6MC000028  A6MC000029  A6MC000030  A6MC000031  A6MC000009  A6MC000002  A6MC000004  A6MC000001  A6MC000003  A6MC000005  A6MC000006  A6MC000007  A6MC000008  A6MC000010  A6MC000011  A6MC000012  A6MC000013  A6MC000014  A6MC000015  A6MC000017  A6MC000018  A6MC000096  A6MC000087  A6MC000088  A6MC000090  A6MC000091  A6MC000092  A6MC000093  A6MC000094  A6MC000048  A6MC000068  A6MC000070  A6MC000072  A6MC000073  A6MC000074  A6MC000075  A6MC000078  A6MC000079  A6MC000081  A6MC000082  A6MC000083  A6MC000085  A6MC000086  A6MC000042  A6MC000043  A6MC000045  A6MC000046  A6MC000047  A6MC000049  A6MC000050  A6MC000051  A6MC000052  A6MC000053  A6MC000054  A6MC000055  A6MC000056  A6MC000057  A6MC000058  A6MC000059  A6MC000060  A6MC000061  A6MC000062  A6MC000063  A6MC000064  A6MC000066  A6MC000071"
"Drugs","No","","76357","Terminated","Mylan Pharmaceuticals Inc.","781 Chestnut Ridge Rd","","Morgantown","WV","	26505-2730","United States","Voluntary: Firm initiated","E-Mail","Nationwide","D-0492-2017","Class II","Mirtazapine Tablets, USP 45 mg, a) 30 count, b) 100 count and c) 500 count bottles, Rx only, Mylan Pharmaceuticals Inc., Morgantown, WV","37,445 bottles","Presence of Foreign Tablets/Capsules; possibility of Glipizide 10 mg tablet in bottle","01/19/2017","03/08/2017","07/12/2017","03/15/2017","a) 3078937 and 3078938 (NDC 0378-3545-93), exp August 2019  b) 3078937 (NDC 0378-3545-01), exp August 2019  c) 3078936 (0378-3545-05), exp August 2019"
"Devices","No","","76367","Completed","Villa Sistemi Medicali S.P.A.","Via delle Azalee 3","","Buccinasco","","	","Italy","Voluntary: Firm initiated","Letter","US Nationwide distribution in the states of AL, AZ, CA, CO, CT, DC, FL, IA, IL, IN, LA, MA, MD, MI, MN, MO, MS, NJ, NY, PA,   Puerto Rico, TN, TX, UT, and W.I","Z-1427-2017","Class II","Juno DRF; Model: 709020    Product Usage:  General, multi-function x-ray systems capable of routine radiographs and general fluoroscopy procedures","65 devices in total","Patient fell from the table because the footrest of the device detached from the table top while the patient was positioned on the table and table was moving from vertical position.","12/27/2016","03/09/2017","","03/15/2017","Serial Numbers: 10110770  11030805  11070845  11070848  11070849  11090864  11110900  12020978  12020982  12030999  12041003  12061014  12061018  12061020  12081040  12091074  12101104  12121186  12121187  13031215  13101263  14021301  14031313  14041321  14051332  14071353  14081359  14091368  14091371  14121400  14121403  15021426  15031440  15041444  15091473  15091478  15101484  15101487  15121505  16011512  16021514  16021517  16021518  16041533  16121595"
"Devices","No","","76367","Completed","Villa Sistemi Medicali S.P.A.","Via delle Azalee 3","","Buccinasco","","	","Italy","Voluntary: Firm initiated","Letter","US Nationwide distribution in the states of AL, AZ, CA, CO, CT, DC, FL, IA, IL, IN, LA, MA, MD, MI, MN, MO, MS, NJ, NY, PA,   Puerto Rico, TN, TX, UT, and W.I","Z-1428-2017","Class II","Apollo; Models: 9784000131  9784000231  9784020131  9784020231  9784100231  9784120131  9784120231  9784130131    Product Usage:  General, multi-function x-ray systems capable of routine radiographs and general fluoroscopy procedures.  ","65 devices in total","Patient fell from the table because the footrest of the device detached from the table top while the patient was positioned on the table and table was moving from vertical position.","12/27/2016","03/09/2017","","03/15/2017","Serial Numbers: 06100127  06110138  07010149  07020158  07020163  07020165  07030171  07040206  09010566  09090605  10100752  11100873  15041446"
"Devices","No","","76367","Completed","Villa Sistemi Medicali S.P.A.","Via delle Azalee 3","","Buccinasco","","	","Italy","Voluntary: Firm initiated","Letter","US Nationwide distribution in the states of AL, AZ, CA, CO, CT, DC, FL, IA, IL, IN, LA, MA, MD, MI, MN, MO, MS, NJ, NY, PA,   Puerto Rico, TN, TX, UT, and W.I","Z-1429-2017","Class II","Apollo DRF; Model: 9784220831    Product Usage:  General, multi-function x-ray systems capable of routine radiographs and general fluoroscopy procedures","65 devices in total","Patient fell from the table because the footrest of the device detached from the table top while the patient was positioned on the table and table was moving from vertical position.","12/27/2016","03/09/2017","","03/15/2017","08090531  09090591  10040680  15051450  11020798"
"Devices","No","","76367","Completed","Villa Sistemi Medicali S.P.A.","Via delle Azalee 3","","Buccinasco","","	","Italy","Voluntary: Firm initiated","Letter","US Nationwide distribution in the states of AL, AZ, CA, CO, CT, DC, FL, IA, IL, IN, LA, MA, MD, MI, MN, MO, MS, NJ, NY, PA,   Puerto Rico, TN, TX, UT, and W.I","Z-1430-2017","Class II","Apollo EZ; Model: 9784152036    Product Usage:  General, multi-function x-ray systems capable of routine radiographs and general fluoroscopy procedures","65 devices in total","Patient fell from the table because the footrest of the device detached from the table top while the patient was positioned on the table and table was moving from vertical position.","12/27/2016","03/09/2017","","03/15/2017","Serial Number: 13101261"
