Product Type,Recently Updated Record,Last Modified Date,Event ID,Status,Recalling Firm,Address1,Address2,City,State/Province,Postal Code,Country,Voluntary/Mandated,Initial Firm Notification of Consignee or Public,Distribution Pattern,Recall Number,Classification,Product Description,Product Quantity,Reason for Recall,Recall Initiation Date,Center Classification Date,Termination Date,Report Date,Code Info,More Code Info,More Code Info,More Code Info
"Food","No","","79551","Ongoing","Davis Chocolate a division of Deco Chem, Inc.","3502 N Home St","","Mishawaka","IN","	46545-4318","United States","Voluntary: Firm initiated","Telephone","Domestic only: Wisconsin, sole customer","F-1108-2018","Class I","Davis Chocolate Peanut Morsels /Organic Peanut Chips","2840 lbs of lot GMPBMO-25 and 1960 lbs of lot GMPBMO-26","Davis Chocolate Inc., voluntarily removed organic peanut butter chips from a wholesale account due to a customer's laboratory analysis of the product indicating the presence of Listeria monocytogenes.","03/14/2018","04/17/2018","","04/25/2018","Production Information: Davis Chocolate Peanut Morsels lot GMPBMO-25/FTORK-DCPC-13 was produced starting February 8, 2018 and finishing on February 14, 2018. Lot GMPBMO-26/FTORK-DCPC-14 had production dates of February 15-23, 2018."
"Food","No","","79563","Terminated","River Valley Sprouts","9211 Day Valley Dr","","Houston","MN","	55943-8242","United States","Voluntary: Firm initiated","Telephone","MN and WI","F-1015-2018","Class I","River Valley Alfalfa Sprouts in 4 ounce Clam shell, UPC 87906-00027, 5 ounce plastic cup, UPC  87906-00006, and 2 lb. bag","1,867 lbs. total","Alfalfa Sprouts have the potential to be contaminated with Salmonella.","03/16/2018","04/13/2018","05/07/2018","04/25/2018","Sell by Dates  March 15-March 25."
"Food","No","","79563","Terminated","River Valley Sprouts","9211 Day Valley Dr","","Houston","MN","	55943-8242","United States","Voluntary: Firm initiated","Telephone","MN and WI","F-1016-2018","Class I","River Valley Garlic/Alfalfa Sprouts in 5 ounce Cup, UPC 87906-00016, 4 ounce clam shell, UPC  87906-00026","1,867 lbs. total","Alfalfa Sprouts have the potential to be contaminated with Salmonella.","03/16/2018","04/13/2018","05/07/2018","04/25/2018","Sell by Dates  March 15-March 25."
"Food","No","","79563","Terminated","River Valley Sprouts","9211 Day Valley Dr","","Houston","MN","	55943-8242","United States","Voluntary: Firm initiated","Telephone","MN and WI","F-1017-2018","Class I","River Valley Variety Sprouts in 5 ounce Cup, UPC 87906-00018","1,867 lbs. total","Alfalfa Sprouts have the potential to be contaminated with Salmonella.","03/16/2018","04/13/2018","05/07/2018","04/25/2018","Sell by Dates  March 15-March 25."
"Food","No","","79632","Terminated","Kwik Trip, Inc.","1626 Oak St","","La Crosse","WI","	54603-2308","United States","Voluntary: Firm initiated","Two or more of the following: Email, Fax, Letter, Press Release, Telephone, Visit","IA, MN, WI","F-1110-2018","Class I","Kitchen's Cravings Egg Salad Sandwich on Oat Multigrain Bread.  Net Wt. 5.5 oz. (156g),  Black bottom clear top plastic clamshell container, UPC 39779-00079   Keep Refrigerated.","4,957 units","Kwik Trip is recalling Kitchen's Cravings Premium Egg Salad Sandwich on Oat Multigrain Bread because it may contain undeclared fish and shellfish.","03/23/2018","04/19/2018","08/07/2018","04/25/2018","Sell By dates:  3/25/18, 3/26/18, 3/27/18, 3/28/18, 3/29/18"
"Food","No","","79672","Terminated","Nutrizone LLC","9000 Southwest Fwy Ste 410","","Houston","TX","	77074-1522","United States","Voluntary: Firm initiated","Press Release","Nationwide (FL, CA,OK,GA,SC,PA,LA,WA,MS,MO,KY,AZ,CO,TX, NY,IL)","F-1379-2018","Class I","Cali Green Malay Kratom all packages, all quantities","1500 units","Dietary supplements have the potential to be contaminated with Salmonella.","03/30/2018","05/07/2018","10/11/2018","04/25/2018","All lots"
"Food","No","","79672","Terminated","Nutrizone LLC","9000 Southwest Fwy Ste 410","","Houston","TX","	77074-1522","United States","Voluntary: Firm initiated","Press Release","Nationwide (FL, CA,OK,GA,SC,PA,LA,WA,MS,MO,KY,AZ,CO,TX, NY,IL)","F-1380-2018","Class I","Cali Maeng Da Kratom all packages, all quantities","3000 units","Dietary supplements have the potential to be contaminated with Salmonella.","03/30/2018","05/07/2018","10/11/2018","04/25/2018","All lots"
"Food","No","","79672","Terminated","Nutrizone LLC","9000 Southwest Fwy Ste 410","","Houston","TX","	77074-1522","United States","Voluntary: Firm initiated","Press Release","Nationwide (FL, CA,OK,GA,SC,PA,LA,WA,MS,MO,KY,AZ,CO,TX, NY,IL)","F-1381-2018","Class I","Cali Thai Kratom all packages, all quantities","1500 units","Dietary supplements have the potential to be contaminated with Salmonella.","03/30/2018","05/07/2018","10/11/2018","04/25/2018","All lots"
"Food","No","","79672","Terminated","Nutrizone LLC","9000 Southwest Fwy Ste 410","","Houston","TX","	77074-1522","United States","Voluntary: Firm initiated","Press Release","Nationwide (FL, CA,OK,GA,SC,PA,LA,WA,MS,MO,KY,AZ,CO,TX, NY,IL)","F-1382-2018","Class I","Nirvanio Bali Kratom all packages, all quantities","Unknown","Dietary supplements have the potential to be contaminated with Salmonella.","03/30/2018","05/07/2018","10/11/2018","04/25/2018","All lots"
"Food","No","","79672","Terminated","Nutrizone LLC","9000 Southwest Fwy Ste 410","","Houston","TX","	77074-1522","United States","Voluntary: Firm initiated","Press Release","Nationwide (FL, CA,OK,GA,SC,PA,LA,WA,MS,MO,KY,AZ,CO,TX, NY,IL)","F-1383-2018","Class I","Nirvanio Green Malay Kratom all packages, all quantities","Approximately 3341 units","Dietary supplements have the potential to be contaminated with Salmonella.","03/30/2018","05/07/2018","10/11/2018","04/25/2018","All lots"
"Food","No","","79672","Terminated","Nutrizone LLC","9000 Southwest Fwy Ste 410","","Houston","TX","	77074-1522","United States","Voluntary: Firm initiated","Press Release","Nationwide (FL, CA,OK,GA,SC,PA,LA,WA,MS,MO,KY,AZ,CO,TX, NY,IL)","F-1384-2018","Class I","Nirvanio Maeng Da Kratom all packages, all quantities","Approximately 5517 units","Dietary supplements have the potential to be contaminated with Salmonella.","03/30/2018","05/07/2018","10/11/2018","04/25/2018","All lots"
"Food","No","","79672","Terminated","Nutrizone LLC","9000 Southwest Fwy Ste 410","","Houston","TX","	77074-1522","United States","Voluntary: Firm initiated","Press Release","Nationwide (FL, CA,OK,GA,SC,PA,LA,WA,MS,MO,KY,AZ,CO,TX, NY,IL)","F-1385-2018","Class I","Nirvanio Special Reserve Kratom all packages, all quantities","4624 units","Dietary supplements have the potential to be contaminated with Salmonella.","03/30/2018","05/07/2018","10/11/2018","04/25/2018","All lots"
"Food","No","","79672","Terminated","Nutrizone LLC","9000 Southwest Fwy Ste 410","","Houston","TX","	77074-1522","United States","Voluntary: Firm initiated","Press Release","Nationwide (FL, CA,OK,GA,SC,PA,LA,WA,MS,MO,KY,AZ,CO,TX, NY,IL)","F-1386-2018","Class I","Pain Out Green Malay Kratom all packages, all quantities","1340 units","Dietary supplements have the potential to be contaminated with Salmonella.","03/30/2018","05/07/2018","10/11/2018","04/25/2018","All lots"
"Food","No","","79672","Terminated","Nutrizone LLC","9000 Southwest Fwy Ste 410","","Houston","TX","	77074-1522","United States","Voluntary: Firm initiated","Press Release","Nationwide (FL, CA,OK,GA,SC,PA,LA,WA,MS,MO,KY,AZ,CO,TX, NY,IL)","F-1387-2018","Class I","Pain Out Maeng Da Kratom all packages, all quantities","2487 units","Dietary supplements have the potential to be contaminated with Salmonella.","03/30/2018","05/07/2018","10/11/2018","04/25/2018","All lots"
"Food","No","","79672","Terminated","Nutrizone LLC","9000 Southwest Fwy Ste 410","","Houston","TX","	77074-1522","United States","Voluntary: Firm initiated","Press Release","Nationwide (FL, CA,OK,GA,SC,PA,LA,WA,MS,MO,KY,AZ,CO,TX, NY,IL)","F-1388-2018","Class I","Pain Out Thai Kratom all packages, all quantities","851 units","Dietary supplements have the potential to be contaminated with Salmonella.","03/30/2018","05/07/2018","10/11/2018","04/25/2018","All lots"
"Food","No","","79716","Terminated","Club 13 Enterprises Warehouse","1715 Lakeside Ave Ste 4","","Saint Augustine","FL","	32084-4123","United States","Voluntary: Firm initiated","Two or more of the following: Email, Fax, Letter, Press Release, Telephone, Visit","U.S. consignees only.","F-1119-2018","Class I","Club 13 Kratom Maeng Da Red powder;  Pouches of 15, 30, 90, 150, 454 grams, and Club 13 Kratom Maeng Da Red powder in bulk bags.","10,237 units and 48 kg of bulk bags","Samples of Maeng Da red powder were tested and resulted positive for Salmonella.","03/31/2018","04/20/2018","03/25/2019","04/25/2018","Lot # MRMD012618"
"Food","No","","79716","Terminated","Club 13 Enterprises Warehouse","1715 Lakeside Ave Ste 4","","Saint Augustine","FL","	32084-4123","United States","Voluntary: Firm initiated","Two or more of the following: Email, Fax, Letter, Press Release, Telephone, Visit","U.S. consignees only.","F-1120-2018","Class I","Club 13 Kratom Maeng Da Red capsules;  5, 25, 50, 100, 120 capsule bottles, and Club 13 Kratom Maeng Da Red capsules in bulk bags.","7,683 units and 128 kg of capsules in bulk bags","Samples of Maeng Da red powder were tested and resulted positive for Salmonella.","03/31/2018","04/20/2018","03/25/2019","04/25/2018","Lots # MRMD013018, MRMD013118, MRMD020118, MRMD020518, MRMD022318, MRMD022718, MRMD030118, MRMD030218, and MRMD030618."
"Food","No","","79716","Terminated","Club 13 Enterprises Warehouse","1715 Lakeside Ave Ste 4","","Saint Augustine","FL","	32084-4123","United States","Voluntary: Firm initiated","Two or more of the following: Email, Fax, Letter, Press Release, Telephone, Visit","U.S. consignees only.","F-1121-2018","Class I","Club 13 Kratom Maeng Da Red XS capsules;  5, 20, 25, 40, 50 capsule bottles","873 units","Samples of Maeng Da red powder were tested and resulted positive for Salmonella.","03/31/2018","04/20/2018","03/25/2019","04/25/2018","Lots # KRXS020718, KRXS030618, KRXS102417, KRXS110617, and KRXS120117."
"Food","No","","79730","Terminated","Aspire Food Group USA Inc.","2028 E Ben White Blvd Ste 320","","Austin","TX","	78741-6996","United States","Voluntary: Firm initiated","Two or more of the following: Email, Fax, Letter, Press Release, Telephone, Visit","United States and Germany","F-1111-2018","Class I","EXO Cricket Protein Bar Blueberry Vanilla; Net Wt 2.1 Oz. packaged in a film wrapper, 12 units per case; UPC: 861703000069","40,512 units","Products contain undeclared sulfites","03/16/2018","04/19/2018","09/13/2018","04/25/2018","26DEC2018 and 06Apr2018"
"Food","No","","79730","Terminated","Aspire Food Group USA Inc.","2028 E Ben White Blvd Ste 320","","Austin","TX","	78741-6996","United States","Voluntary: Firm initiated","Two or more of the following: Email, Fax, Letter, Press Release, Telephone, Visit","United States and Germany","F-1112-2018","Class I","EXO Cricket Protein Bar Peanut Butter and Jelly; Net Wt 2.1 Oz. packaged in a film wrapper, 12 units per case; UPC: 861703000014","27,128 units","Products contain undeclared sulfites","03/16/2018","04/19/2018","09/13/2018","04/25/2018","27DEC2018 and 09Apr2018"
"Food","No","","79730","Terminated","Aspire Food Group USA Inc.","2028 E Ben White Blvd Ste 320","","Austin","TX","	78741-6996","United States","Voluntary: Firm initiated","Two or more of the following: Email, Fax, Letter, Press Release, Telephone, Visit","United States and Germany","F-1113-2018","Class I","EXO Cricket Protein Bar Apple Cinnamon; Net Wt. 2.1 Oz. packaged in a film wrapper, 12 units per case; UPC: 861703000014","20,000 units","Products contain undeclared sulfites","03/16/2018","04/19/2018","09/13/2018","04/25/2018","08Apr2018"
"Food","No","","79733","Terminated","Global Commodities Corp.","23759 Eichler St Ste G","","Hayward","CA","	94545-2783","United States","Voluntary: Firm initiated","Two or more of the following: Email, Fax, Letter, Press Release, Telephone, Visit","Northern CA only","F-1117-2018","Class I","Buenas Grated coconut - frozen;  Kinayod na Niyog  Noix de Coco Rape;  UPC: 4806514650443  Keep Frozen  Net Wt. 16 oz., (4545 g) plastic bag    Product of the Philippines    Ingredients: Grated coconut Meat (95%) Water and preservative: Sodium Benzoate.","59 cases (40 x 16 oz. bags per case)","Salmonella found in one lot of grated coconut though sampling and testing by the California Department of Public Health","04/04/2018","04/20/2018","05/11/2018","04/25/2018","LOT NUMBER: 10BAAGA"
"Food","No","","79808","Terminated","Seacrest Foods International, Inc.","86 Bennett St","","Lynn","MA","	01905-3011","United States","Voluntary: Firm initiated","E-Mail","MA, NH, ME, CT","F-1116-2018","Class I","Formagere de la Brie brand, l' Explorateur, soft ripened cheese made from pasteurized milk, product comes in a 250g (8.8 oz), clear plastic package marked with lot # on the bottom, with UPC: 3 390010 004080.","29 cases","The cheese has the potential to be contaminated with Listeria monocytogenes.","04/05/2018","04/20/2018","06/20/2018","04/25/2018","Lot# H010 or H011"
"Devices","No","","76620","Terminated","Carefusion 2200 Inc","75 N Fairway Dr","","Vernon Hills","IL","	60061-1845","United States","Voluntary: Firm initiated","Letter","Nationwide, Australia, Brazil, Canada, China, Japan, Kuwait, Malaysia, Mexico, Netherlands, New Zealand, Philippines, Singapore, South Africa, Taiwan, Thailand, United Arab Emirates, Vietnam","Z-1421-2018","Class II","Manometer, 550 ml three-Way Stopcock; STERILE;","4,240 units","The integrity of the sterile packaging is potentially compromised.","02/23/2017","04/18/2018","07/09/2019","04/25/2018","Product Code: 4330  Lot Code:  0000837810; 0000840335; 0000842213; 0000848531; 0000851181; 0000853962"
"Devices","No","","76620","Terminated","Carefusion 2200 Inc","75 N Fairway Dr","","Vernon Hills","IL","	60061-1845","United States","Voluntary: Firm initiated","Letter","Nationwide, Australia, Brazil, Canada, China, Japan, Kuwait, Malaysia, Mexico, Netherlands, New Zealand, Philippines, Singapore, South Africa, Taiwan, Thailand, United Arab Emirates, Vietnam","Z-1422-2018","Class II","JAMSHIDI NEEDLE BIOPSY [15G X 100MM DISP, 16G X 100MM DISP, 17G X 100MM, 16G X 70MM DISP]; STERILE;","790 units","The integrity of the sterile packaging is potentially compromised.","02/23/2017","04/18/2018","07/09/2019","04/25/2018","Product Code: SN1015X / LOT 0000840334 ; Product Code: SN1016X / LOT 0000848028 ; Product Code: SN1017X / LOT 0000848018 ; Product Code SN7016X / LOT 0000848017"
"Devices","No","","76620","Terminated","Carefusion 2200 Inc","75 N Fairway Dr","","Vernon Hills","IL","	60061-1845","United States","Voluntary: Firm initiated","Letter","Nationwide, Australia, Brazil, Canada, China, Japan, Kuwait, Malaysia, Mexico, Netherlands, New Zealand, Philippines, Singapore, South Africa, Taiwan, Thailand, United Arab Emirates, Vietnam","Z-1423-2018","Class II","ILLINOIS (TJ) NEEDLE ASPIRATION [15GA, 18GA]; STERILE;","a.) 13,010 units b.) 2116 units","The integrity of the sterile packaging is potentially compromised.","02/23/2017","04/18/2018","07/09/2019","04/25/2018","Product Code: a.) TIN3015/ LOT 0000836578, 0000841213, 0000841215, 0000842719, 0000842721, 0000845423, 0000848061, 0000849715, 0000850938, 0000852076, 0000854859; Product Code: b.) TIN3018/ LOT 0000836574, 0000841212, 0000852078"
"Devices","No","","76620","Terminated","Carefusion 2200 Inc","75 N Fairway Dr","","Vernon Hills","IL","	60061-1845","United States","Voluntary: Firm initiated","Letter","Nationwide, Australia, Brazil, Canada, China, Japan, Kuwait, Malaysia, Mexico, Netherlands, New Zealand, Philippines, Singapore, South Africa, Taiwan, Thailand, United Arab Emirates, Vietnam","Z-1424-2018","Class II","JAMSHIDI (TJ) NEEDLE BONE MARROW [a.) 13G x 3.5, b.) 8G x 4, c.) 11G x 4, d.) 8G x 6, e.) 11G x 6]; STERILE;","","The integrity of the sterile packaging is potentially compromised.","02/23/2017","04/18/2018","07/09/2019","04/25/2018","Product Code: a.) TJC3513 / LOT 0000848831, 0000851431, 0000854856; Product Code: b.) TJC4008 / LOT 0000841227, 0000846706, 0000848560, 0000849684, 0000853455; c.) TJC4011 / LOT 0000840667, 0000841228, 0000845874, 0000849717, 0000850937, 0000852121; d.) TJC6008 / LOT 0000841216, 0000848569, 0000851432, 0000852122, 0000853458; e.) TJC6011 / LOT 0000841124, 0000848571, 0000853975"
"Devices","No","","76620","Terminated","Carefusion 2200 Inc","75 N Fairway Dr","","Vernon Hills","IL","	60061-1845","United States","Voluntary: Firm initiated","Letter","Nationwide, Australia, Brazil, Canada, China, Japan, Kuwait, Malaysia, Mexico, Netherlands, New Zealand, Philippines, Singapore, South Africa, Taiwan, Thailand, United Arab Emirates, Vietnam","Z-1425-2018","Class II","JAMSHIDI (TJ) NEEDLE BM ASP MAC [a.) 13G x 3.5, b.) 8G x 4, c.) 11G x 3.5, d.) 8G x 6, e.) 11G x 6]; STERILE;","14,200 units","The integrity of the sterile packaging is potentially compromised.","02/23/2017","04/18/2018","07/09/2019","04/25/2018","Product Code: a.) TJM3513 / LOT 0000836582, 0000838949, 0000843968, 0000849685, 0000852933; b.) TJM4008 / LOT 0000841349, 0000841348, 0000843961, 0000849132, 0000852123, 0000853877; c.) TJM4011 / LOT 0000836575, 0000838950, 0000840195, 0000843075, 0000843076, 0000846708, 0000852932, 0000853878, 0000854861, 0000854983; d.) TJM6008 / LOT 0000842725, 0000853971; e.) TJM6011 / LOT 0000843077, 0000849713, 0000854659"
"Devices","No","","76620","Terminated","Carefusion 2200 Inc","75 N Fairway Dr","","Vernon Hills","IL","	60061-1845","United States","Voluntary: Firm initiated","Letter","Nationwide, Australia, Brazil, Canada, China, Japan, Kuwait, Malaysia, Mexico, Netherlands, New Zealand, Philippines, Singapore, South Africa, Taiwan, Thailand, United Arab Emirates, Vietnam","Z-1426-2018","Class II","Thoracentesis/ Paracentesis Kit 10/CS; STERILE;","1200 units","The integrity of the sterile packaging is potentially compromised.","02/23/2017","04/18/2018","07/09/2019","04/25/2018","Product Code: TPK1001 / LOT 0000837811, 0000842215, 0000840336, 0000851185"
"Food","No","","79212","Terminated","Divinity Product Distribution LLC","1119 Nw Valley Ridge Dr","","Grain Valley","MO","	64029-9094","United States","Voluntary: Firm initiated","Telephone","Product distributed to the following US states and countries: AK, AL, AR, Austria, AZ, CA, Canada, CO, CT, DC, DE, FL, GA, ID, IL, IN, KS, KY, LA, MA, MD, ME, MI, MN, MO, MS, NC, ND, NH, NJ, NM, NV, NY, OH, OK, OR, PA, RI, SC, TN, TX, United Kingdom, UT, VA, WA, WI, and WV","F-1020-2018","Class II","Kratom capsules labeled in the following ways: 1) Divinity Kratom 10 Capsule Dietary Supplement, Divinity Product LLC, Blue Springs, MO 64015; 2) Divinity Bali Kratom, 10PK Capsules; 3) Divinity Bali Kratom, 20PK Capsules; 4) Divinity Bali Kratom, 40PK Capsules;","","The firm's dietary supplement products contain kratom (Mitragyna speciosa), a new dietary ingredient for which there is inadequate information to provide reasonable assurance that such ingredient does not present a significant or unreasonable risk of illness or injury;","02/09/2018","04/13/2018","09/14/2018","04/25/2018","All lot codes with expiration dates after 1/31/2018"
"Food","No","","79212","Terminated","Divinity Product Distribution LLC","1119 Nw Valley Ridge Dr","","Grain Valley","MO","	64029-9094","United States","Voluntary: Firm initiated","Telephone","Product distributed to the following US states and countries: AK, AL, AR, Austria, AZ, CA, Canada, CO, CT, DC, DE, FL, GA, ID, IL, IN, KS, KY, LA, MA, MD, ME, MI, MN, MO, MS, NC, ND, NH, NJ, NM, NV, NY, OH, OK, OR, PA, RI, SC, TN, TX, United Kingdom, UT, VA, WA, WI, and WV","F-1021-2018","Class II","Kratom powder labeled in the following ways 1) Enhance Your Life, Kratom Essence Maeng Da Mitragyna speciosa, 150 gras;  2) Bali Kratom, 15 g Powdered; 3) Bali Kratom, 30 g Powdered; 4) Bali Kratom, 60 g Powdered; 5) Bali Kratom, 120 g Powdered; 6) Botany Bay, 1 oz","","The firm's dietary supplement products contain kratom (Mitragyna speciosa), a new dietary ingredient for which there is inadequate information to provide reasonable assurance that such ingredient does not present a significant or unreasonable risk of illness or injury;","02/09/2018","04/13/2018","09/14/2018","04/25/2018","All lot codes with expiration dates after 1/31/2018"
"Devices","No","","79373","Ongoing","Tornier, Inc","10801 Nesbitt Ave S","","Bloomington","MN","	55437-3109","United States","Voluntary: Firm initiated","E-Mail","US Nationwide Distribution.","Z-1374-2018","Class II","Fornier Phantom Fiber(TM) Sutures:  Item Number	Description  SMB000425	4.5 MM PHANTOM FT BIOCOMPOSITE SUTURE ANCHOR WITH NEEDLES  SMB000525	5.5 MM PHANTOM FT BIOCOMPOSITE SUTURE ANCHOR WITH NEEDLES  SMP000425	4.5 MM PHANTOM FT PEEK SUTURE ANCHOR WITH NEEDLES  SMP000525	5.5 MM PHANTOM FT PEEK SUTURE ANCHOR WITH NEEDLES  SMSB0110	1PK PHANTOM FIBER SZ 2 WHITE  SMSB0110N   	lPK BIOFIBER SUTURE SZ 2 WHT NEEDLED  SMSB0112	10 PK PHANTOM FIBER SZ 2 WHITE  SMSB0112N  	10 PK PHANTOM FIBER SUTURE SZ 2WHT NEEDLED  SMSB0120	1PK PHANTOM FIBER SZ 2 VIOLET  SMSB0120N	lPK BIOFIBER SUTURE SZ 2 VLT NEEDLED  SMSB0122	10 PK PHANTOM FIBER SZ 2 VIOLET  SMSB0122N	10 PK BIOFIBER SUTURE SZ 2 VLT NEEDLED  SMSB0130	1PK PHANTOM FIBER SZ 2 WHITE/VIOLET  SMSB0132	10 PK PHANTOM FIBER SZ 2 WHITE/VIOLET    Indications for use for the Phantom Fiber are: Phantom Fiber suture is indicated for use in general soft tissue approximation and/or ligation, but not for use in cardiovascular or neurological tissues, microsurgery or ophthalmic surgery.  ","32253 units","Data has shown that degradation of a raw material used in Phantom Fiber may occur more quickly than expected if improperly stored.  This may impact the shelf-life of the product which could cause the suture to lose strength more quickly than expected.","02/08/2018","04/13/2018","","04/25/2018","All lots"
"Devices","No","","79378","Ongoing","Preservation Solutions, Inc.","1099 Proctor Dr","","Elkhorn","WI","	53121-2027","United States","Voluntary: Firm initiated","Letter","Worldwide Distribution -- USA and Europe.","Z-1387-2018","Class II","Cold Storage Solution, 2L, labeled as Waters IGL Cold Storage Solution, Catalog No. CSS/2000/US; and, Belzer UW Cold Storage Solution, Catalog No. BUW_002.     Intended for the hypothermic flushing and storage of specific organs in preparation for storage, transportation, and transplantation into a recipient.","31,104 units","Bags of solution may have a small leak at the base of the injection port where the port is welded into the body of the bag..","02/26/2018","04/16/2018","","04/25/2018","UDI 00810805000163, and UDI 00810805000071."
"Biologics","No","","79430","Terminated","OneBlood, Inc.","10100 Dr Martin Luther King Jr St N","","St Petersburg","FL","	33716-3806","United States","Voluntary: Firm initiated","FAX","Florida","B-0497-2018","Class II","Apheresis Platelets, Leukocytes Reduced","2 units","Platelet products, labeled as leukoreduced but were not tested to verify white blood cell count, were distributed.","02/14/2018","04/17/2018","04/17/2018","04/25/2018","W036817524828 (Double collection)"
"Devices","No","","79451","Ongoing","Philips Electronics North  America Corporation","3000 Minuteman Rd","","Andover","MA","	01810-1032","United States","Voluntary: Firm initiated","Letter","Worldwide Distribution - US Nationwide; International - Albania, Algeria, Andorra, Argentina, Australia, Austria, Bahamas, Bahrain, Bangladesh, Barbados, Belarus, Belgium, Bolivia,   Bosnia and Herzegovina, Botswana, Brazil, Bulgaria, Burkina Faso, Chile,  China, Colombia, Congo (Democratic Republic of the), Costa Rica,   C퓍e D'Ivoire, Croatia, Cyprus, Czech Republic, Denmark, Dominican Republic,  Ecuador, Egypt, El Salvador, Ethiopia, Finland, France, Gabon, Georgia, Germany, Ghana, Greece, Guadeloupe, Guatemala, Hong Kong, Hungary,  Iceland, India, Indonesia, Iran, Iraq, Ireland, Israel, Italy, Japan, Jersey, Jordan,  Kazakhstan, Kenya, Republic of Korea - South Korea, Kuwait, Kyrgyzstan,   Latvia, Lebanon, Lesotho, Libya, Libyan Arab Jamahiriya, Lithuania, Luxembourg, Macedonia, Malaysia, Malta, Mauritius, Mexico, Monaco, Mongolia,  Montenegro, Morocco, Myanmar, Nepal, Netherlands, New Caledonia,   New Zealand, Nicaragua, Nigeria, Norway, Oman, Pakistan, Palestine, State of  Panama, Papua New Guinea, Peru, Philippines, Poland, Portugal, Qatar,   Romania, Russian Federation, Rwanda, Saudi Arabia, Serbia, Singapore,  Slovakia, Slovenia, South Africa, Spain, Sri Lanka, Sudan, Sweden, Switzerland,  Syrian Arab Republic, Taiwan, Tanzania, Thailand, Tunisia, Turkey, Turkmenistan, Ukraine, United Arab Emirates, United Kingdom, Venezuela,  Viet Nam, Yemen & Zimbabwe.","Z-1430-2018","Class II","Multiva systems, 1) Multiva 1.5T 8 R5 Model 781072, 2) Multiva 1.5T 16 R5 Model 781073, 3) Multiva 1.5T 8ch R5 based Model 781074, 4) Multiva 1.5T Model 781076, & 5) Multiva 1.5T 16ch R5 based Model 781078     Product Usage:  Indicated for use as a diagnostic device. It can produce cross-sectional images, spectroscopic images and/or spectra in any orientation of the internal structure of the head, body,or extremities.  ","8,205 units in total","Potential risk for helium gas inside the MR examination room during a magnet quench","03/16/2018","04/18/2018","","04/25/2018","None"
