Product Type,Recently Updated Record,Last Modified Date,Event ID,Status,Recalling Firm,Address1,Address2,City,State/Province,Postal Code,Country,Voluntary/Mandated,Initial Firm Notification of Consignee or Public,Distribution Pattern,Recall Number,Classification,Product Description,Product Quantity,Reason for Recall,Recall Initiation Date,Center Classification Date,Termination Date,Report Date,Code Info
"Food","No","05/13/2019","81938","Terminated","McCormick & Company, Inc. - Flavor Manufacturing Center","11102 McCormick Rd Bldg 20","","Hunt Valley","MD","	21031-1404","United States","Voluntary: Firm initiated","Two or more of the following: Email, Fax, Letter, Press Release, Telephone, Visit","Product distributed to the following states: AL, AR, AZ, CA, CO, FL, GA, ID, IL, IN, IA, KS, KY, MI, MN, MO, MT, NE, NV, NM, NC, OH, OK, OR, TN, TX, UT, WI","F-1345-2019","Class I","El Guapo Chile Habanero Habanero Chili Pepper 0.5oz","47,044 pouches","Mojave Foods Corporation (subsidiary of McCormick) is initiating a voluntary recall of El Guapo Chile Habanero and Chili Pasilla-Ancho pouches due to unlabeled peanut allergen.","01/11/2019","05/13/2019","06/27/2019","05/15/2019","UPC# 044989012968; Best By Apr/05/19; Best By; Jun/21/19; Best By Jun/22/19; Best By Oct/29/19; Best By Dec/07/19; Best By Feb/05/20; Best By Feb/06/20; Best By; Jun/12/20"
"Food","No","05/13/2019","81938","Terminated","McCormick & Company, Inc. - Flavor Manufacturing Center","11102 McCormick Rd Bldg 20","","Hunt Valley","MD","	21031-1404","United States","Voluntary: Firm initiated","Two or more of the following: Email, Fax, Letter, Press Release, Telephone, Visit","Product distributed to the following states: AL, AR, AZ, CA, CO, FL, GA, ID, IL, IN, IA, KS, KY, MI, MN, MO, MT, NE, NV, NM, NC, OH, OK, OR, TN, TX, UT, WI","F-1346-2019","Class I","El Guapo Pasilla-Ancho Chile Pods 2oz, 7.5oz, 11oz","2 oz, 22,848 pouches ; 7.5oz, 13,896 pouches ; 11oz, 2,064 pouches","Mojave Foods Corporation (subsidiary of McCormick) is initiating a voluntary recall of El Guapo Chile Habanero and Chile Pasilla-Ancho pouches due to unlabeled peanut allergen.","01/11/2019","05/13/2019","06/27/2019","05/15/2019","2oz: UPC# 044989010391; Best By Jun/20/20    7.5oz: UPC# 044989211088; Best By Jun/13/20; Best By Jun/14/20    11oz: UPC# 044989211149; Best By Jun/12/20"
"Food","No","","82516","Terminated","Elite Spice Inc.","7151 Montevideo Rd","","Jessup","MD","	20794-9308","United States","Voluntary: Firm initiated","Telephone","One customer domestically","F-1330-2019","Class I","Basil Olive Oil Flavored Tortilla Seasoning Package Type: Box with liner, Units Per Case: 1, Weight Per Package:  50 pounds   ","10 Cases, equals 500 pounds","Elite Spice, Inc. has initiated a recall of Basil Olive Oil Flavored Tortilla Seasoning, Lot Number:1-310242, Units Per Case: 1, Weight Per Package:  50 pounds because Elite Spice produced a batch of seasoning containing an undeclared milk allergen .","03/01/2019","05/06/2019","08/15/2019","05/15/2019","Product Code: 37805A9  Lot Number: 1-310242"
"Devices","No","","82540","Ongoing","Alpha Omega Engineering","PO Box 810, Haavoda Street","","Nazerat Illit","","	","Israel","Voluntary: Firm initiated","E-Mail","US nationwide distribution: AL, AZ, CA, CO, GA, IL, LA, MD, MA, MI, MN, OH, PA, RI, TX, and VA","Z-1216-2019","Class I","Neuro Omega System, incorporating HaGuide software.    For neurological and neurosurgical use.     To monitor, record and display bioelectric signals, and stimulate nerves and brain tissue.  ","29","If cables are improperly connected, current may reach high charge density, causing tissue harm.","09/04/2018","05/06/2019","","05/15/2019","Serial numbers: 113, 115, 116, 118, 123, 121, 125, 129, 130, 137, 138, 141, 140, 146, 149, 147, 156/04, 159/04, 163/04, 161/04, 167, 175/06, 176/06, 177/06, 180/06, 182/06, 185/06, 188/06, and 189."
"Food","No","","82623","Ongoing","Caito Foods LLC.","3120 N Post Rd","","Indianapolis","IN","	46226-6514","United States","Voluntary: Firm initiated","Press Release","see below.","F-1338-2019","Class I","Fresh cut watermelon, fresh cut honeydew melon, fresh cut cantaloupe and fresh cut mixed fruit containing one of these melons. See attachment.","See attachment","Potential to be contaminated with Salmonella Carrau","04/12/2019","05/09/2019","","05/15/2019","Best by or Use by 4/7/19 to 4/19/19"
"Drugs","No","05/13/2019","82669","Terminated","Alvogen, Inc","10 Bloomfield Ave Bldg B Ste 2","","Pine Brook","NJ","	07058-9743","United States","Voluntary: Firm initiated","Press Release","Nationwide in the USA","D-1277-2019","Class I","FENTANYL Transdermal System, 12 mcg/h, five (12 mcg/h) systems per carton, Rx only, Distributed by: Alvogen, Inc., Pine Brook, NJ  07058; Manufactured by: 3M Drug Delivery Systems, St. Paul, MN  55107, NDC 47781-423-47.","119,608 cartons","Product Mix-Up: Customer complaint that their carton labeled as Fentanyl Transdermal Systems, 12 mcg/h contained five patches labeled and containing 50 mcg/h.","04/19/2019","05/13/2019","08/14/2019","05/15/2019","Lot#: 180060, Exp 05/2020; 180073, Exp 06/2020."
"Drugs","No","05/22/2019","82680","Ongoing","Par Pharmaceutical, Inc.","1 Ram Ridge Rd","","Chestnut Ridge","NY","	10977-6714","United States","Voluntary: Firm initiated","Letter","nationwide","D-1293-2019","Class I","Mycophenolate Mofetil for Injection, USP  500 mg, 4 Single Dose Vials, Rx Only, Distributed by: Par Pharmaceutical Chestnut Ridge, NY 10977  NDC 342023-172-044","4506 packs","Presence of Particulate Matter; glass fragment observed in one vial of reconstituted product","04/30/2019","05/22/2019","","05/15/2019","AD812, exp 9/2020"
"Veterinary","No","05/10/2019","80749","Ongoing","Norbrook Laboratories, Ltd.","105 Armagh Road","","Newry","","	","United Kingdom","Voluntary: Firm initiated","E-Mail","MO, TX, KS, Puerto Rico","V-0139-2019","Class II","Hexasol Injection (oxytetracycline & flunixin meglumine), 300mg oxytetracycline and 20mg flunixin per mL, 250 mL (NDC: 55529-016-04), 500 mL (NDC: 55529-016-05),  Norbrook Laboratories Limited, Newry, BT35 6PU, Co. Down, Northern Ireland","39,025 vials","Crystallization: crystals observed suspended in the injectable solution.","08/09/2018","05/10/2019","","05/15/2019","[Expiry], Batch#: [April 2019] 7152-90A, 7152-91A, 7153 90A, 7173 98A, 7173 98B, 7175 90A; [February 2020] 8073-90A"
"Veterinary","No","05/16/2019","80962","Ongoing","King Bio Inc.","3 Westside Dr","","Asheville","NC","	28806-2846","United States","Voluntary: Firm initiated","Press Release","Nationwide.","V-0142-2019","Class II","King Bio Allergies Product Number 30-6043 UPC 357955604341","515 bottles","Possible microbial contamination.","08/27/2018","05/16/2019","","05/15/2019","Lot: 032116D Exp. 01/20, 082216C Exp. 08/19; 111017A Exp. 11/19"
"Veterinary","No","05/16/2019","80962","Ongoing","King Bio Inc.","3 Westside Dr","","Asheville","NC","	28806-2846","United States","Voluntary: Firm initiated","Press Release","Nationwide.","V-0143-2019","Class II","Dr. King's Natural Pet Pharmaceuticals Homeopathic All Natural Cat Tomlyn Anxiety & Stress 4 fl. oz. (118 mL) NDC# 57955-4304-4 UPC 357955430445 King Bio, Inc. FDA Reg. #1053442 3 Westside Dr. Asheville, NC 28806 USA","29567 bottles","Possible microbial contamination.","08/27/2018","05/16/2019","","05/15/2019","Lots: 112317B Exp. 11/19; 011817C Exp. 01/20; 012616C Exp. 01/19; 030816H Exp. 03/19; 072916B Exp. 07/19; 081715C Exp. 08/18; 101816A Exp. 10/19"
"Veterinary","No","05/16/2019","80962","Ongoing","King Bio Inc.","3 Westside Dr","","Asheville","NC","	28806-2846","United States","Voluntary: Firm initiated","Press Release","Nationwide.","V-0144-2019","Class II","Dr. King's Natural Pet Pharmaceuticals Homeopathic All Natural Cat Tomlyn Urinary Tract Irritations 4 fl. oz. (118 mL) NDC# 57955-4302-4 UPC 357955430247 King Bio, Inc. FDA Reg. #1053442 3 Westside Dr. Asheville, NC 28806 USA","53010 bottles","Possible microbial contamination.","08/27/2018","05/16/2019","","05/15/2019","Lots: 010118BF Exp. 01/20; 090717B Exp. 09/19; 111617A Exp. 11/19; 102215J Exp. 10/18; 101016C Exp. 10/19; 090816C Exp. 09/19; 082015B Exp. 08/18; 072216E Exp. 07/19; 030816F Exp. 03/19; 010517D Exp. 01/20"
"Veterinary","No","05/16/2019","80962","Ongoing","King Bio Inc.","3 Westside Dr","","Asheville","NC","	28806-2846","United States","Voluntary: Firm initiated","Press Release","Nationwide.","V-0145-2019","Class II","Dr. King's Natural Pet Pharmaceuticals Homeopathic All Natural Dog Tomlyn Skin & Itch 4 fl. oz. (118 mL) NDC# 57955-4402-4 UPC 357955440246 King Bio, Inc. FDA Reg. #1053442 3 Westside Dr. Asheville, NC 28806 USA","26996 bottles","Possible microbial contamination.","08/27/2018","05/16/2019","","05/15/2019","Lots: 011916B Exp. 01/19; 031717C Exp. 03/20; 033016L Exp. 03/19; 051116B Exp. 05/19; 062016C Exp. 06/19; 071116M Exp. 07/19; 081016D Exp. 08/19; 081315H Exp. 08/18; 101016D Exp. 10/19; 020118E Exp. 02/20"
"Veterinary","No","05/16/2019","80962","Ongoing","King Bio Inc.","3 Westside Dr","","Asheville","NC","	28806-2846","United States","Voluntary: Firm initiated","Press Release","Nationwide.","V-0146-2019","Class II","Dr. King's Natural Pet Pharmaceuticals Homeopathic All Natural Dog Tomlyn Allergies 4 fl. oz. (118 mL) NDC# 57955-4409-4 UPC 357955440147 King Bio, Inc. FDA Reg. #1053442 3 Westside Dr. Asheville, NC 28806 USA","14246 bottles","Possible microbial contamination.","08/27/2018","05/16/2019","","05/15/2019","Lots: 033016M Exp. 03/19; 052516B Exp. 05/19; 071116K Exp. 07/19; 081715A Exp. 09/19; 090816G Exp. 09/19; 101016B Exp. 10/19; 041518B Exp. 04/20"
"Veterinary","No","05/16/2019","80962","Ongoing","King Bio Inc.","3 Westside Dr","","Asheville","NC","	28806-2846","United States","Voluntary: Firm initiated","Press Release","Nationwide.","V-0147-2019","Class II","Dr. King's Natural Pet Pharmaceuticals Homeopathic All Natural Cat Tomlyn Skin & Itch 4 fl. oz. (118 mL) NDC# 57955-4301-4 UPC 357955430148 King Bio, Inc. FDA Reg. #1053442 3 Westside Dr. Asheville, NC 28806 USA","26977 bottles","Possible microbial contamination.","08/27/2018","05/16/2019","","05/15/2019","Lots: 030816G Exp. 03/19; 052516A Exp. 05/19; 062816J Exp. 06/19; 091416B Exp. 06/19; 123016C Exp. 12/19; 121417H Exp. 12/19"
"Veterinary","No","05/16/2019","80962","Ongoing","King Bio Inc.","3 Westside Dr","","Asheville","NC","	28806-2846","United States","Voluntary: Firm initiated","Press Release","Nationwide.","V-0148-2019","Class II","Natural Veterinary Pharmaceuticals Better Breath, Teeth & Gums Advanced High Potency Homeopathic Medicine 4 fl oz (120 mL) NDC 57955-6171-4 UPC 357955616948 King Bio, Inc. FDA Reg. #1053442 3 Westside Drive Asheville, NC 28806 USA","344 bottles","Possible microbial contamination.","08/27/2018","05/16/2019","","05/15/2019","Lot: 121417G Exp. 12/19; 030916X Exp. 03/19; 090116B Exp. 09/19"
"Veterinary","No","05/16/2019","80962","Ongoing","King Bio Inc.","3 Westside Dr","","Asheville","NC","	28806-2846","United States","Voluntary: Firm initiated","Press Release","Nationwide.","V-0149-2019","Class II","Natural Veterinary Pharmaceuticals Appetite Control Advanced High Potency Homeopathic Medicine 4 fl oz (120 mL) NDC 57955-6156-4 UPC 357955615644 King Bio, Inc. FDA Reg. #1053442 3 Westside Drive Asheville, NC 28806 USA","41 bottles","Possible microbial contamination.","08/27/2018","05/16/2019","","05/15/2019","Lots: 120616D Exp. 12/19; 111516Q Exp. 11/19"
"Veterinary","No","05/16/2019","80962","Ongoing","King Bio Inc.","3 Westside Dr","","Asheville","NC","	28806-2846","United States","Voluntary: Firm initiated","Press Release","Nationwide.","V-0150-2019","Class II","Dr. King's Natural Pet Pharmaceuticals All Natural Dog Homeopathic Allergies 4 fl oz (118 mL) NDC# 57955-4409-4 UPC 357955440147 King Bio, Inc. FDA Reg. # 1053442 3 Westside Dr. Asheville, NC 28806 USA","2186 bottles","Possible microbial contamination.","08/27/2018","05/16/2019","","05/15/2019","Lot: 120217S Exp. 12/19"
"Veterinary","No","05/16/2019","80962","Ongoing","King Bio Inc.","3 Westside Dr","","Asheville","NC","	28806-2846","United States","Voluntary: Firm initiated","Press Release","Nationwide.","V-0151-2019","Class II","Natural Veterinary Pharmaceuticals Foul Gas & Stool Relief Advanced High Potency Homeopathic Medicine 4 fl oz (120 mL) NDC# 57955-6603-4 UPC 357955660347 King Bio, Inc. FDA Reg. #1053442 3 Westside Drive Asheville, NC 28806 USA","20 bottles","Possible microbial contamination.","08/27/2018","05/16/2019","","05/15/2019","Lot: 112116A Exp. 11/19"
"Veterinary","No","05/16/2019","80962","Ongoing","King Bio Inc.","3 Westside Dr","","Asheville","NC","	28806-2846","United States","Voluntary: Firm initiated","Press Release","Nationwide.","V-0152-2019","Class II","Natural Veterinary Pharmaceuticals Digestion Reliever Advanced High Potency Homeopathic Medicine 4 fl oz (120 mL) NDC# 57955-6158-4 UPC 357955615842 King Bio, Inc. FDA Reg. #1053442 3 Westside Drive Asheville, NC 28806 USA","100 bottles","Possible microbial contamination.","08/27/2018","05/16/2019","","05/15/2019","Lots: 111516F Exp. 11/19; 081015P Exp. 08/18"
"Veterinary","No","05/16/2019","80962","Ongoing","King Bio Inc.","3 Westside Dr","","Asheville","NC","	28806-2846","United States","Voluntary: Firm initiated","Press Release","Nationwide.","V-0153-2019","Class II","Natural Veterinary Pharmaceuticals Urinary Incontinence High Potency Homeopathic Medicine 4 fl oz (120 mL) NDC# 57955-6045-4 UPC 357955604549 King Bio, Inc. FDA Reg. #1053442 3 Westside Drive Asheville, NC 28806 USA","144 bottles","Possible microbial contamination.","08/27/2018","05/16/2019","","05/15/2019","Lots: 102116B Exp. 10/19; 041416D Exp. 04/19; 010118T Exp. 01/20"
"Veterinary","No","05/16/2019","80962","Ongoing","King Bio Inc.","3 Westside Dr","","Asheville","NC","	28806-2846","United States","Voluntary: Firm initiated","Press Release","Nationwide.","V-0154-2019","Class II","Natural Veterinary Pharmaceuticals Trauma & Wounds High Potency Homeopathic Medicine 4 fl oz (120 mL) NDC# 57955-6118-4 UPC 357955611844 King Bio, Inc. FDA Reg. #1053442 3 Westside Drive Asheville, NC 28806 USA","97 bottles","Possible microbial contamination.","08/27/2018","05/16/2019","","05/15/2019","Lots: 081815P Exp. 08/18; 060716C Exp. 06/19"
"Veterinary","No","05/16/2019","80962","Ongoing","King Bio Inc.","3 Westside Dr","","Asheville","NC","	28806-2846","United States","Voluntary: Firm initiated","Press Release","Nationwide.","V-0155-2019","Class II","Natural Veterinary Pharmaceuticals Multi-Stress Control High Potency Homeopathic Medicine 4 fl oz (120 mL) NDC# 57955-6850-4 UPC 357955685043 King Bio, Inc. FDA Reg. #1053442 3 Westside Drive Asheville, NC 28806 USA","344 bottles","Possible microbial contamination.","08/27/2018","05/16/2019","","05/15/2019","Lots: 081315P Exp. 08/18; 011217A Exp. 01/20"
"Veterinary","No","05/16/2019","80962","Ongoing","King Bio Inc.","3 Westside Dr","","Asheville","NC","	28806-2846","United States","Voluntary: Firm initiated","Press Release","Nationwide.","V-0156-2019","Class II","Natural Veterinary Pharmaceuticals Odor Freee High Potency Homeopathic Medicine 4 fl oz (120 mL) NDC# 57955-6130-4 UPC 357955613046 King Bio, Inc. FDA Reg. #1053442 3 Westside Drive Asheville, NC 28806 USA","43 bottles","Possible microbial contamination.","08/27/2018","05/16/2019","","05/15/2019","Lots: 081315G Exp. 08/18; 062615F Exp. 06/18"
"Veterinary","No","05/16/2019","80962","Ongoing","King Bio Inc.","3 Westside Dr","","Asheville","NC","	28806-2846","United States","Voluntary: Firm initiated","Press Release","Nationwide.","V-0157-2019","Class II","Natural Veterinary Pharmaceuticals Urinary Tract Irritations High Potency Homeopathic Medicine 4 fl oz (120 mL) NDC# 57955-6052-4 UPC 357955605249 King Bio, Inc. FDA Reg. #1053442 3 Westside Drive Asheville, NC 28806 USA","399 bottles","Possible microbial contamination.","08/27/2018","05/16/2019","","05/15/2019","Lots: 081315E Exp. 08/18; 041416C Exp. 04/19; 081016A Exp. 08/19; 081015M Exp. 08/18"
"Veterinary","No","05/16/2019","80962","Ongoing","King Bio Inc.","3 Westside Dr","","Asheville","NC","	28806-2846","United States","Voluntary: Firm initiated","Press Release","Nationwide.","V-0158-2019","Class II","Natural Veterinary Pharmaceuticals Doggie Drool High Potency Homeopathic Medicine 4 fl oz (120 mL) NDC# 57955-6602-4 UPC 357955660248 King Bio, Inc. FDA Reg. #1053442 3 Westside Drive Asheville, NC 28806 USA","2 bottles","Possible microbial contamination.","08/27/2018","05/16/2019","","05/15/2019","Lot: 081015R Exp. 08/18"
"Veterinary","No","05/16/2019","80962","Ongoing","King Bio Inc.","3 Westside Dr","","Asheville","NC","	28806-2846","United States","Voluntary: Firm initiated","Press Release","Nationwide.","V-0159-2019","Class II","Natural Veterinary Pharmaceuticals Skin Irritations & Itch Relief High Potency Homeopathic Medicine 4 fl oz (120 mL) NDC# 57955-6168-4 UPC 357955616849 King Bio, Inc. FDA Reg. #1053442 3 Westside Drive Asheville, NC 28806 USA","525 bottles","Possible microbial contamination.","08/27/2018","05/16/2019","","05/15/2019","Lots: 072516K Exp. 07/19; 011617A Exp. 01/20; 010818D Exp. 01/20"
"Veterinary","No","05/16/2019","80962","Ongoing","King Bio Inc.","3 Westside Dr","","Asheville","NC","	28806-2846","United States","Voluntary: Firm initiated","Press Release","Nationwide.","V-0160-2019","Class II","Natural Veterinary Pharmaceuticals Stop Bark High Potency Homeopathic Medicine 4 fl oz (120 mL) NDC# 57955-6604-4 UPC 357955660446 King Bio, Inc. FDA Reg. #1053442 3 Westside Drive Asheville, NC 28806 USA","50 bottles","Possible microbial contamination.","08/27/2018","05/16/2019","","05/15/2019","Lot: 052516D Exp. 05/19"
"Veterinary","No","05/16/2019","80962","Ongoing","King Bio Inc.","3 Westside Dr","","Asheville","NC","	28806-2846","United States","Voluntary: Firm initiated","Press Release","Nationwide.","V-0161-2019","Class II","Natural Veterinary Pharmaceuticals Muscle, Joint & Arthritis Relief High Potency Homeopathic Medicine 4 fl oz (120 mL) NDC# 57955-6162-4 UPC 357955616245 King Bio, Inc. FDA Reg. #1053442 3 Westside Drive Asheville, NC 28806 USA; b) Natural Pet Pharmaceuticals Muscle, Joint & Arthritis Homeopathic Dog 4 fl. oz. (118 mL) NDC# 57955-4404-4 UPC357955440444","14367 bottles","Possible microbial contamination.","08/27/2018","05/16/2019","","05/15/2019","Lots: a) 041416G Exp. 01/20; 081315J Exp. 08/18; 090816E Exp. 09/19; 051116A Exp. 05/19 ;071116N Exp. 07/19; b) 010418A Exp. 01/20; 011617E Exp. 01/20; 081216A Exp. 08/16; 082015C Exp. 08/18; 062816H Exp. 06/19"
"Veterinary","No","05/16/2019","80962","Ongoing","King Bio Inc.","3 Westside Dr","","Asheville","NC","	28806-2846","United States","Voluntary: Firm initiated","Press Release","Nationwide.","V-0162-2019","Class II","Natural Pet Pharmaceuticals Teeth & Gums Homeopathic Dog 4 fl oz (118 mL) NDC# 57955-4406-4 UPC357955440642","4388 bottles","Possible microbial contamination.","08/27/2018","05/16/2019","","05/15/2019","Lots: 083116A Exp. 08/19; 041316A Exp. 04/19; 102215K Exp. 10/18; 052516AC Exp. 09/19"
"Veterinary","No","05/16/2019","80962","Ongoing","King Bio Inc.","3 Westside Dr","","Asheville","NC","	28806-2846","United States","Voluntary: Firm initiated","Press Release","Nationwide.","V-0163-2019","Class II","Dr. King's Natural Pet Pharmaceuticals Yeast Control Homeopathic Dog 4 fl oz (118 mL) NDC# 57955-4408-4 UPC357955440840","2779 bottles","Possible microbial contamination.","08/27/2018","05/16/2019","","05/15/2019","Lots: 110317F Exp. 11/19; 030916L Exp. 03/19; 020317D Exp. 02/20"
"Veterinary","No","05/16/2019","80962","Ongoing","King Bio Inc.","3 Westside Dr","","Asheville","NC","	28806-2846","United States","Voluntary: Firm initiated","Press Release","Nationwide.","V-0164-2019","Class II","Dr. King's Natural Pet Pharmaceuticals Digestive Upsets Homeopathic Dog 4 fl oz (118 mL) NDC# 57955-4403-4 UPC357955440345 King Bio, Inc. FDA Reg. #1053442 3 Westside Dr. Asheville, NC 28806 USA","2055 bottles","Possible microbial contamination.","08/27/2018","05/16/2019","","05/15/2019","Lots: 011918D Exp. 01/20; 020317C Exp. 02/20; 040616AA Exp. 04/19; 071116L Exp. 07/19"
"Veterinary","No","05/16/2019","80962","Ongoing","King Bio Inc.","3 Westside Dr","","Asheville","NC","	28806-2846","United States","Voluntary: Firm initiated","Press Release","Nationwide.","V-0165-2019","Class II","Natural Pet Pharmaceuticals Anxiety & Stress Homeopathic Dog 4 fl oz (118 mL) NDC# 57955-4407-4 UPC357955440741 King Bio, Inc. FDA Reg. #1053442 3 Westside Dr. Asheville, NC 28806 USA","10394 bottles","Possible microbial contamination.","08/27/2018","05/16/2019","","05/15/2019","Lots: 100716A Exp. 10/19; 092617D Exp. 09/19; 081715B Exp. 08/18; 072916C Exp. 07/19; 051716Q Exp. 05/19"
"Veterinary","No","05/16/2019","80962","Ongoing","King Bio Inc.","3 Westside Dr","","Asheville","NC","	28806-2846","United States","Voluntary: Firm initiated","Press Release","Nationwide.","V-0166-2019","Class II","Natural Pet Pharmaceuticals Appetite & Weight Homeopathic Dog 4 fl oz (118 mL) NDC# 57955-4405-4 UPC357955440543 King Bio, Inc. FDA Reg. #1053442 3 Westside Dr. Asheville, NC 28806 USA","853 bottles","Possible microbial contamination.","08/27/2018","05/16/2019","","05/15/2019","Lots: 071116J Exp. 07/19; 042717B Exp. 04/20; 033016N Exp. 03/19"
"Veterinary","No","05/16/2019","80962","Ongoing","King Bio Inc.","3 Westside Dr","","Asheville","NC","	28806-2846","United States","Voluntary: Firm initiated","Press Release","Nationwide.","V-0167-2019","Class II","Natural Pet Pharmaceuticals Teeth & Gums Homeopathic Cat 4 fl oz (118 mL) NDC# 57955-4303-4 UPC357955430346 King Bio, Inc. FDA Reg. #1053442 3 Westside Dr. Asheville, NC 28806 USA","7006 bottles","Possible microbial contamination.","08/27/2018","05/16/2019","","05/15/2019","Lots: 012716A Exp. 01/19; 072716A Exp. 07/19; 060116D Exp. 06/19; 021717D Exp. 02/20"
"Veterinary","No","05/16/2019","80962","Ongoing","King Bio Inc.","3 Westside Dr","","Asheville","NC","	28806-2846","United States","Voluntary: Firm initiated","Press Release","Nationwide.","V-0168-2019","Class II","Dr. King's Natural Pet Pharmaceuticals Oral Health All Natural Dog Homeopathic 4 fl oz (118 mL) NDC# 57955-4420-4 UPC357955442042 King Bio, Inc. FDA Reg. #1053442 3 Westside Dr. Asheville, NC 28806 USA","1958 bottles","Possible microbial contamination.","08/27/2018","05/16/2019","","05/15/2019","Lot: 102717D Exp. 10/19"
"Veterinary","No","05/16/2019","80962","Ongoing","King Bio Inc.","3 Westside Dr","","Asheville","NC","	28806-2846","United States","Voluntary: Firm initiated","Press Release","Nationwide.","V-0169-2019","Class II","Dr. King's Natural Pet Pharmaceuticals Oral Health All Natural Cat Homeopathic 4 fl oz (118 mL) NDC# 57955-4310-4 UPC357955431046 King Bio, Inc. FDA Reg. #1053442 3 Westside Dr. Asheville, NC 28806 USA","1015 bottles","Possible microbial contamination.","08/27/2018","05/16/2019","","05/15/2019","Lot: 022318E Exp. 02/20"
"Devices","No","","81656","Ongoing","Medtronic Inc.","18000 Devonshire St","","Northridge","CA","	91325-1219","United States","Voluntary: Firm initiated","Letter","Distribution was only made OUS.  Countries involved are:  Austria, United Arab Emirate, Australia, Belgium, Switzerland, Chile, Colombia, Czech Republic, Germany, Denmark, Spain, Finland, France, United Kingdom, Hungary, Ireland, Israel, Iceland, Italy, Republic of Korea, Luxembourg, Netherlands, Norway, Poland, Qatar, Romania, Russian Federation, Saudi Arabia, Sweden, Singapore, Slovenia, Slovakia, Turkey, and South Africa.","Z-1282-2019","Class II","Guardian Connect App CSS7200 used on the iPhone, iPad, and iPod Touch devices.","Approximately 9,328 registered users","The application may be closed by the operating system without alerting the user the app is no longer running or communicating with the transmitter resulting in the user not receiving alerts that could be associated with hypoglycemic or hyperglycemic events.","07/04/2018","05/03/2019","","05/15/2019","UDI - (01)00643169693142(10)"
"Devices","No","","81861","Ongoing","Abbott Laboratories, Inc","1921 Hurd Dr","","Irving","TX","	75038-4313","United States","Voluntary: Firm initiated","Letter","Worldwide Distribution - US Nationwide in the states of AR, CA, CT, FL, IA, IN, LA, MA, MD, MS, NJ, NY, PA, SC, TX, VT, WA, and WV.  There was government distribution and no military distribution.  Foreign distribution was made to Australia, China, Hong Kong, and New Zealand.","Z-1296-2019","Class II","Abbott ARCHITECT cSystems ICT Module, REF 09D28-03.    Product Usage:  The ARCHITECT cSystems ICT (Integrated Chip Technology) is used for the quantitation of sodium, potassium, and chloride in human serum, plasma, or urine.  ","99 modules/kits","There is a potential to generate falsely elevated serum or plasma chloride results when using the product.","08/28/2018","05/08/2019","","05/15/2019","Lot No. 180326, Exp. 12/26/2018;    UDI (01)00380740019327(17)181226(10)180326(21)180326301  through (01)00380740019327(17)181226(10)180326(21)180326399"
