Product Type,Recently Updated Record,Last Modified Date,Event ID,Status,Recalling Firm,Address1,Address2,City,State/Province,Postal Code,Country,Voluntary/Mandated,Initial Firm Notification of Consignee or Public,Distribution Pattern,Recall Number,Classification,Product Description,Product Quantity,Reason for Recall,Recall Initiation Date,Center Classification Date,Termination Date,Report Date,Code Info
"Veterinary","No","","78865","Ongoing","Pet Apothecary Llc","8850 N Port Washington Rd","","Milwaukee","WI","	53217-1676","United States","Voluntary: Firm initiated","Telephone","IL","V-0099-2018","Class I","Phenobarbital Capsule, 6 MG. The Pet Apothecary, 407 W. Silver Spring Dr., Milwaukee, WI 53217.  NDC: 38779-0852-05","60 capsules","Animal drug is superpotent.","10/20/2017","06/28/2018","","06/06/2018","Lot: 224590"
"Devices","No","","80003","Ongoing","Maquet Datascope Corp - Cardiac Assist Division","1300 Macarthur Blvd","","Mahwah","NJ","	07430-2052","United States","Voluntary: Firm initiated","Other","The devices were distributed to the following US states: AK, AL, AR, AZ, CA, CO, CT, DC, DE, FL, GA, HI, IA, ID, IL, IN, KS, KY, LA, MA, MD, ME, MI, MN, MO, MS, NC, ND, NE, NH, NJ, NM, NV, NY, OH, OK, OR, PA, SC, SD, TN, TX, UT, VA, VT, WA, WI, WV, WY, and Guam.    The devices were distributed to the following foreign countries: Argentina, Australia, Austria, Azerbaijan, Bahrain, Belgium, Brazil, Brunei, Bulgaria, Canada, Chile, China, Czech Republic, Denmark, Dominican Republic, Ecuador, Egypt, El Salvador, Finland, France, Germany, Ghana, Guatemala, Hong Kong, Hungary, Iceland, India, Indonesia, Iran, Iraq, Ireland, Israel, Italy, Japan, Jordan, Kuwait, Lebanon, Libya, Lithuania, Macedonia, Malaysia, Mexico, Morocco, Myanmar, Netherlands, Nigeria, Norway, Oman, Pakistan, Palestine, Philippines, Poland, Portugal, Russia, Saudi Arabia, Serbia, Singapore, Slovakia, Slovenia, South Africa, Spain, Sri Lanka, Sweden, Switzerland, Syrica, Taiwan, Thailand, Turkey, UAE, UK, Vietnam, Yemen.","Z-1928-2018","Class I","CARDIOSAVE Hybrid Intra-Aortic Balloon Pump (IABP), Part Number 0998-00-0800-XX & 0998-UC-0800-XX (excluding 0998-00-0800-83, 0998-UC-0800-83 & 0998-00-0800-75) and cart 0997-00-1179  ","4300","Ingress of fluids into the device can affect various electronic circuit boards which would prevent initiation or continuation of therapy.","05/03/2018","05/31/2018","","06/06/2018","All Serial Numbers distributed from 03/06/2012 to  04/26/2018"
"Devices","No","","80056","Ongoing","Heartware","14400 NW 60th Ave","","Miami Lakes","FL","	33014-2807","United States","Voluntary: Firm initiated","Letter","Worldwide Distribution including US Nationwide, Argentina, Australia, Austria, Belarus, Belgium, Brazil, Canada, Chile, Croatia, Cyprus, Czech Republic, Denmark, Egypt, Estonia, Finland, France, Germany, Greece, Hong Kong, Hungary, India, Israel, Italy, Japan, Kazakhstan, Korea, , Kuwait, Latvia, Lebanon, Lithuania, Luxembourg, Malaysia, Netherlands, New Zealand, Norway, Poland, Romania, Saudi Arabia, Serbia, Singapore, Slovakia, South Africa, Spain, Sweden, Switzerland, Taiwan, Turkey, Ukraine, United Arab Emirates, and Vietnam.","Z-1903-2018","Class I","Heartware Medtronic  HVAD System for cardiac use.  Including the following parts:  (a) Controller / Controller Kits, Product numbers: 1400, 1401, 1403, 1407, 1420  (b) DC Adapter, Product numbers: 1435, 1440  (c) AC Adapter, Product numbers:  1425, 1430  (d) Battery Pack, Product number:  1650DE      Indication for Use for OUS HVAD System: The HVAD System is intended for use in patients at risk of death from refractory end-stage heart failure. The HVAD System is designed for in-hospital and out-of-hospital settings, including transportation via fixed wing aircraft or helicopter.  ","175878 devices","Possible transient electrical connection interruption between an HVAD System power source (Battery, AC Adapter, or DC Adapter) and the Controller, while the power source is connected, that may cause unintended switching to the secondary power source and/or unexpected audible tones (beeping). The interruption typically lasts 1-2 seconds, due to oxidation between power source connector and socket.","05/02/2018","05/31/2018","","06/06/2018","ALL SERIAL NUMBERS    UPN/GTIN:  (a) 1400 and 1401:  distributed prior to GTN requirement        1403: 00888707000116, 00888707000475        1407: '00888707000291, '00888707000727, '00888707000710,    00888707000734, '00888707000741, '00888707000765, '00888707000758, '00888707000789, '00888707000772, '00888707000499, '00888707000796, '00888707000802, '00888707000819, '00888707000482, '00888707004534, '0888707001670, '00888707001656, '00888707001663, '00888707001670, '00888707001687, '00888707001694, '00888707001700, '00888707001717, '00888707001724, '00888707001731, '00888707001748, '00888707001755, '00888707001762, '00888707002813, '00888707002820, '00888707002837, '00888707002844, '00888707002851, '00888707001472        1420: '00888707000420, '00888707000437, '00888707002660    (b) 1435:  '00888707000109       1440:  '00888707000260, '00888707001885, '00888707001496,   '00888707002745    (c) 1425:  '00888707000093       1430: '00888707000307, '00888707000826, '00888707000833,   '00888707000840, '00888707000857, '00888707000871, '00888707000864,   '00888707000888, '00888707000901, '00888707000505, '00888707000895,   '00888707000918, '00888707001489, '00888707001779, '00888707001786,   '00888707001793, '00888707001809, '00888707001816, '00888707001823,   '00888707001830, '00888707001847, '00888707001854, '00888707001861,   '00888707001878, '00888707002738, '00888707002769, '00888707002776,   '00888707002783, '00888707002790, '00888707002806, '00888707004817    (d) 1650DE:  00888707000369, 00888707001373, '00888707001588,  '00888707001366, '00888707002684 '00888707002646, '00888707002653,   '00888707000376"
"Food","No","09/18/2018","80070","Terminated","Caudill Sprouting LLC","1531 W Main St","Suite A","Louisville","KY","	40203-1329","United States","Voluntary: Firm initiated","Letter","The seeds were distributed to 6 consignees (five domestic facilities in FL, IL, & MN and one in Mexico)","F-1572-2018","Class I","Alfalfa Seeds  ","","The firm's seeds have been linked in a multistate outbreak of Salmonella Montevideo and Salmonella Cubana infections.","05/10/2018","06/14/2018","09/06/2019","06/06/2018","Master Lot# AT-0286098"
"Drugs","No","","80128","Ongoing","Shoreside Enterprises Inc.","6345 Newtown Cir Apt A3 Ste A-3","","Tampa","FL","	33615-3629","United States","Voluntary: Firm initiated","Press Release","Nationwide.","D-0879-2018","Class I","POSEIDON Xtreme PLATINUM 4500,1000mg, packaged in single packs sold in 24-count boxes, Distributed by: Poseidon Distribution Atlanta, GA, UPC 638632428857","Unknown","Marketed Without An Approved NDA/ANDA: FDA analysis found products to contain undeclared sildenafil and tadalafil. The presence of sildenafil and tadalafil makes these products an unapproved drug for which safety and efficacy have not been established and, therefore, subject to recall.","05/17/2018","06/18/2018","","06/06/2018","Lot #: 201117BL, Exp. 01/2020"
"Drugs","No","","80128","Ongoing","Shoreside Enterprises Inc.","6345 Newtown Cir Apt A3 Ste A-3","","Tampa","FL","	33615-3629","United States","Voluntary: Firm initiated","Press Release","Nationwide.","D-0880-2018","Class I","7K capsules packaged in single packs sold in 24-count boxes, Distributed by SX Power Co. San Diego, CA 92108, UPC 601577513148","Unknown","Marketed Without An Approved NDA/ANDA: FDA analysis found products to contain undeclared sildenafil and tadalafil. The presence of sildenafil and tadalafil makes these products an unapproved drug for which safety and efficacy have not been established and, therefore, subject to recall.","05/17/2018","06/18/2018","","06/06/2018","Lot #: RO, Exp. 12/31/2021"
"Food","No","","80134","Terminated","Ziyad Brothers Importing, Inc.","5400 W 35th St","","Cicero","IL","	60804-4431","United States","Voluntary: Firm initiated","Letter","Domestic: AL, AR, AZ, CA, CT, DE, FL, GA, IA, IL, IN, KS, KY, LA, MA, MD, ME, MI, MN, MO, NC, NE, NJ, NM, NY, OH, OK, PA, RI, SC, SD, TN, TX, UT, VA, WA,WI    Foreign: Virgin Islands","F-1495-2018","Class I","Ziyad Brand Tahini, 8oz, 16oz, ¿ gal, 32oz. , packed in glass jars","655 units, 8827 units, 5304 units, 456 units","Ziyad Brothers Importing is voluntarily recalling its Ziyad Brand Tahini, 8 oz. 16 oz., 1/2 gallon and 32 oz. sizes due to potential contamination with Salmonella.","05/17/2018","05/25/2018","10/16/2018","06/06/2018","Ziyad Brand Tahini, 8oz, 16oz, ¿ gal, 32oz. , packed in glass jars,    Product Code Product Description & Size Lot #  A0071 Ziyad Tahini 6 x 1/2 gal Glass Jar 35417  A0072 Ziyad Tahini 12 x 32 oz Glass Jar 00318  A0073 Ziyad Tahini 12 x 16 oz Glass Jar 35317    35417    35517    35617  A0076 Ziyad Tahini 12 x 8 oz Glass Jar 34817    01218  S0073 Ziyad Tahini 6 x 16 oz. Glass Jars 34917"
"Devices","No","","78460","Ongoing","NordicNeuroLab AS","Mollendalsveien 65c","","Bergen","","	","Norway","Voluntary: Firm initiated","E-Mail","Worldwide Distribution - USA (nationwide) and to the countries of :  SA, Russia, South Korea, UK, Japan, Australia, Sweden, Norway, Greece","Z-2042-2018","Class II","nordicTumorEx 1.0      nordicTumorEx is an image processing software package to be used by trained professionals including but not limited to physicians and medical technicians. The software runs on a standard  off-the-shelf  PC workstation and can be used to perform image viewing, processing and analysis of medical images. Data and images are acquired through DICOM compliant imaging devices and modalities. nordicTumorEx software enables processing and visualization of dynamic MR imaging datasets of the brain, showing properties of changes in contrast overtime. It generates various parametric images calculated from the image intensity variations and provides tools to extract and visualize such parametric properties within specified volumes of interest. Structural datasets providing anatomical information can be sued to evaluate the extent of a specified sub-volume, such as a tumor. Comparison of imaging studies performed at different study dates may also be performed to support the diagnostic process.","16 licenses","An error was discovered in the interpretation of certain DICOM header tags that may lead to incorrect orientation labeling, and thus and indirect left-right, up-down or anterior-posterior flipping of images.","12/15/2014","05/31/2018","","06/06/2018","Version 1.0.4"
"Devices","No","","78463","Ongoing","NordicNeuroLab AS","Mollendalsveien 65c","","Bergen","","	","Norway","Voluntary: Firm initiated","E-Mail","Worldwide Distribution -- USA, Australia, Denmark, China, France, Japan, Malaysia, Netherlands, USA, Poland, Sweden, Spain, Russia, India, Norway, Singapore, South Korea, United Kingdom, and Slovenia.","Z-2044-2018","Class II","nordicICE 2.3.14    Image processing software package used by trained professionals,  including physicians and medical technicians.","97 licenses","An error was discovered in the interpretation of certain DICOM header tags that may lead to incorrect orientation labeling, and thus and indirect left-right, up-down or anterior-posterior flipping of images.","09/12/2014","05/31/2018","","06/06/2018","Version 2.3.14"
"Devices","No","","79413","Terminated","Siemens Healthcare Diagnostics, Inc.","500 Gbc Dr Ms 514","PO BOX 6101","Newark","DE","	19702-2466","United States","Voluntary: Firm initiated","Letter","US Nationwide Distribution","Z-1946-2018","Class II","Syva¿ EMIT¿ 2000 Theophylline    Product Usage:  The Syva¿ Emit¿ 2000 Theophylline Assay is a homogeneous enzyme immunoassay intended for use in the quantitative analysis of theophylline in human serum or plasma.  ","","Lot J1 of the Syva¿ EMIT¿ 2000 Theophylline Assay,  when run on a Beckman AU Clinical Chemistry System, may exhibit increased imprecision for commercially available controls and for patient samples.","11/27/2017","05/25/2018","04/19/2019","06/06/2018","Catalog # 4P019UL /SMN#10445324  kit lot J1 (UDI# 00842768001024J120190414)"
"Biologics","No","","79639","Terminated","Haemonetics Corporation","400 Wood Rd","","Braintree","MA","	02184-2412","United States","Voluntary: Firm initiated","Letter","US","B-0579-2018","Class II","Acrodose PLus and PL Systems, Product Code: 73282, 73283, 73286","61,299 units","Specific lots of Haemonetics Acrodose PLus and PL Systems, associated with low pH readings in the CLX HP bag, and in some instances accompanied by a yellow discoloration of the storage bag, were distributed.","03/28/2018","05/31/2018","03/11/2019","06/06/2018","Affected Lots  1754045  1754067  1754068  1754070  1754084  1754085  1854001    1754048  1754054  1754069  1754071  1754072  1754074  1754075  1754086  1754087  1754090  1754089"
"Food","No","","79714","Terminated","Ohio Hickory Harvest Brand Products Inc.","90 Logan Pkwy","","Akron","OH","	44319-1177","United States","Voluntary: Firm initiated","Telephone","Product was only distributed in the following states:  AL, AR, AZ, CA, CO, CT, FL, GA, IA, IL, IN, KS, KY, LA, MD, MI, MO, NC, ND, NE, NV, NY, OH, OK, OR, PA, SC, TN, TX, UT, VA, WA and WY.","F-1496-2018","Class II","Heinens Organic Nut Mix Net Wt. 9 oz (255g) Distributed By Heinens, Warrensville Hts., OH 44128  UPC 0-36232-01871-1","40 Cases with 6 tubs per case","The firm received positive test results for Listeria monocytogenes in a product that was housed in the same storage bin.","04/10/2018","05/30/2018","07/16/2018","06/06/2018","Lot # 031919"
"Food","No","","79714","Terminated","Ohio Hickory Harvest Brand Products Inc.","90 Logan Pkwy","","Akron","OH","	44319-1177","United States","Voluntary: Firm initiated","Telephone","Product was only distributed in the following states:  AL, AR, AZ, CA, CO, CT, FL, GA, IA, IL, IN, KS, KY, LA, MD, MI, MO, NC, ND, NE, NV, NY, OH, OK, OR, PA, SC, TN, TX, UT, VA, WA and WY.","F-1497-2018","Class II","Hickory Harvest Island Fruit Mix NET WT 9 oz (255g) Distributed by: Hickory Harvest Foods, Akron, OH 44319 UPC 0-36232-06052-9","200 Cases with 9 bags per case","The firm received positive test results for Listeria monocytogenes in a product that was housed in the same storage bin.","04/10/2018","05/30/2018","07/16/2018","06/06/2018","Lot # 032019"
"Food","No","","79714","Terminated","Ohio Hickory Harvest Brand Products Inc.","90 Logan Pkwy","","Akron","OH","	44319-1177","United States","Voluntary: Firm initiated","Telephone","Product was only distributed in the following states:  AL, AR, AZ, CA, CO, CT, FL, GA, IA, IL, IN, KS, KY, LA, MD, MI, MO, NC, ND, NE, NV, NY, OH, OK, OR, PA, SC, TN, TX, UT, VA, WA and WY.","F-1498-2018","Class II","Liberty Snacks Natural PISTACHIOS Net Wt. 1 oz (#g) DISTRIBUTED BY Liberty Candy & Nuts Inc. 347.945.0540  libertysnacks@gmail.com UPC 8-04879-17158-4","208 Cases with 72 packages per case","The firm received positive test results for Listeria monocytogenes in a product that was housed in the same storage bin.","04/10/2018","05/30/2018","07/16/2018","06/06/2018","Lot # 032019"
"Food","No","","79714","Terminated","Ohio Hickory Harvest Brand Products Inc.","90 Logan Pkwy","","Akron","OH","	44319-1177","United States","Voluntary: Firm initiated","Telephone","Product was only distributed in the following states:  AL, AR, AZ, CA, CO, CT, FL, GA, IA, IL, IN, KS, KY, LA, MD, MI, MO, NC, ND, NE, NV, NY, OH, OK, OR, PA, SC, TN, TX, UT, VA, WA and WY.","F-1499-2018","Class II","Liberty Snacks Honey Roasted CASHEWS Net Wt. 1.2 oz (#g) DISTRIBUTED BY Liberty Candy & Nuts Inc. 347.945.0540 libertysnacks@gmail.com UPC 8-04879-17154-4","156 Cases with 72 packages per case","The firm received positive test results for Listeria monocytogenes in a product that was housed in the same storage bin.","04/10/2018","05/30/2018","07/16/2018","06/06/2018","Lot # 032119"
"Food","No","","79714","Terminated","Ohio Hickory Harvest Brand Products Inc.","90 Logan Pkwy","","Akron","OH","	44319-1177","United States","Voluntary: Firm initiated","Telephone","Product was only distributed in the following states:  AL, AR, AZ, CA, CO, CT, FL, GA, IA, IL, IN, KS, KY, LA, MD, MI, MO, NC, ND, NE, NV, NY, OH, OK, OR, PA, SC, TN, TX, UT, VA, WA and WY.","F-1500-2018","Class II","Liberty Snacks Raw ALMONDS Net Wt. 1.3 oz (#g) DISTRIBUTED BY Liberty Candy & Nuts Inc. 347.945.0540 libertysnacks@gmail.com UPC 8-04879-17157-7","208 Cases with 72 packages per case","The firm received positive test results for Listeria monocytogenes in a product that was housed in the same storage bin.","04/10/2018","05/30/2018","07/16/2018","06/06/2018","Lot # 031919"
"Food","No","","79714","Terminated","Ohio Hickory Harvest Brand Products Inc.","90 Logan Pkwy","","Akron","OH","	44319-1177","United States","Voluntary: Firm initiated","Telephone","Product was only distributed in the following states:  AL, AR, AZ, CA, CO, CT, FL, GA, IA, IL, IN, KS, KY, LA, MD, MI, MO, NC, ND, NE, NV, NY, OH, OK, OR, PA, SC, TN, TX, UT, VA, WA and WY.","F-1501-2018","Class II","Liberty Snacks NUTS ALMOND RAISIN Mix Net Wt. 1.6 oz (#g) DISTRIBUTED BY Liberty Candy & Nuts Inc. 347.945.0540 libertysnacks@gmail.com UPC 8-04879-17158-7","52 Cases with 72 packages per case","The firm received positive test results for Listeria monocytogenes in a product that was housed in the same storage bin.","04/10/2018","05/30/2018","07/16/2018","06/06/2018","Lot # 032019"
"Biologics","No","","79757","Terminated","Terumo BCT, Inc.","10811 W Collins Ave","","Lakewood","CO","	80215-4440","United States","Voluntary: Firm initiated","Letter","US and OUS (Albania, Algeria, Argentina, Australia, Austria, Azerbaijan, Bahrain, Bangladesh, Belgium, Bolivia, Bosnia-Herz, Brazil, Brunei Daruss,  Bulgaria, Canada, Chile, China, Colombia, Costa Rica,Cote d'Ivoire, Croatia, Czech Republic, Denmark, Dominican Rep., Dutch Antilles, Ecuador, Egypt, El Salvador, Estonia, Ethiopia, Finland, France, French Guayana, Georgia,  Germany, Greece, Guadeloupe, Guatemala, Hong Kong, Hungary, Iceland,  India, Indonesia, Iran, Iraq, Ireland, Israel, Italy, Jamaica, Japan, Jordan,  Kazakhstan, Kenya, Kuwait, Lebanon, Libya, Lithuania, Luxembourg,  Malaysia, Malta, Martinique, Mayotte, Mexico, Moldova, Mongolia, Morocco  Myanmar, Nepal, Netherlands, New Zealand, Norway, Oman, Pakistan, Palestine, Panama, Paraguay, Peru, Poland, Portugal, Qatar, Reunion  Romania, Russian Fed., Saudi Arabia, Serbia, Singapore, Slovenia, Slovakia, South Africa, South Korea, Spain, Sri Lanka, Sudan, Sweden, Switzerland  Syria, Taiwan, Thailand, Tunisia, Turkey, Ukraine, United Kingdom, Uruguay   Utd.Arab Emir., Vatican City, Vietnam)","B-0568-2018","Class II","Spectra Optia Apheresis System,  61000, 61001, 61002","4,978 devices","Spectra Optia Apheresis Systems, containing a software defect or glitch that is associated with a potential safety risk, were distributed.","03/30/2018","05/31/2018","03/20/2019","06/06/2018","Optia (61000, 61001, 61002); All serial numbers"
"Devices","No","","79762","Ongoing","Gyrus Acmi, Incorporated","136 Turnpike Rd","","Southborough","MA","	01772-2118","United States","Voluntary: Firm initiated","Letter","Worldwide Distribution - USA (nationwide) Distribution to the states of :   AK, AL, AR, AZ, CA, CO, CT, DE, FL, GA, HI, IA, ID, IL, IN, KS, KY, LA, MA, MD, ME, MI, MN, MO, MS, MT, NC, ND, NE, NH, NJ, NM, NV, NY, OH, OK, OR, PA, RI, SC, TN, TX, UT, VA, WA, WI, WV, and WY., and to the countries of :  Japan, Canada, Mexico, Australia, and EU.","Z-1952-2018","Class II","Gyrus ACMI Reusable Active Cord for Bovie/ValleyLab Generators, Catalog No C650-129A (00821925008700)    The cord consists of a single conductor stranded wire terminated with plugs that connect to a generator on one end and a plug that connects to a Gyrus ACMI working element on the other end. They are provided non-sterile and are reusable. The cord is designed to be used with Gyrus ACMI GOCUS 640, Bovie, and other general purpose monopolar electrosurgical generators and appropriate electrodes and endoscopes.","6447","There is a potential for the cord to spark and cause a fire.","04/17/2018","05/29/2018","","06/06/2018","All lots manufactured before December 7, 2017    UDI (00821925008700)"
"Devices","No","","79822","Ongoing","Torax Medical, Inc.","4188 Lexington Ave N","","Shoreview","MN","	55126-6106","United States","Voluntary: Firm initiated","Letter","Worldwide Distribution: US (nationwide) in states of: AL, AR, AZ, CA, CO, CT, DC, DE, FL, GA, IA, ID, IL, IN, KS, KY, LA, MA, MD, ME, MI, MN, MO, MS, NC, ND, NE, NH, NJ, NM, NV, NY, OH, OK, OR, PA, RI, SC, SD, TN, TX, UT, VA, WA, WI, WV, WY; and in countries of: Austria, France, Germany, Italy, Scotland, Spain, Switzerland, United Kingdom.","Z-2037-2018","Class II","LINX Reflux Management System, Implant Suture, 12-17 Bead, 0.7T, Product Code LS-xx, sterile, Rx only.  Labeled as:    a. Product Code LS-12;    b. Product Code LS-13;   c. Product Code LS-14;    d. Product Code LS-15;    e. Product Code LS-16;    f. Product Code LS-17;       Laparoscopic, fundic-sparing anti-reflux procedure indicated for patients diagnosed with Gastroesophageal Reflux Disease (GERD) as defined by abnormal pH testing, and who are seeking an alternative to continuous acid suppression therapy (i.e. proton pump inhibitors or equivalent) in the management of their GERD.","9,131 devices in total","Possible out of specification condition which may allow a bead component to separate from an adjacent wire link. This condition may result in a discontinuous or open LINX device.","04/20/2018","05/31/2018","","06/06/2018","a. Product Code LS-12, Part No. 2170-6, GTIN 00855106005011;    b. Product Code LS-13, Part No. 2170-7, GTIN 00855106005028;   c. Product Code LS-14, Part No. 2170-8, GTIN 00855106005035;    d. Product Code LS-15, Part No. 2170-9, GTIN 00855106005042;    e. Product Code LS-16, Part No. 2170-10, GTIN 00855106005059;    f. Product Code LS-17, Part No. 2170-11, GTIN 00855106005066;      Lot No. 6100 through 14055, 15286, 15287, 15314, 15315, 15317, and 16557"
"Devices","No","","79822","Ongoing","Torax Medical, Inc.","4188 Lexington Ave N","","Shoreview","MN","	55126-6106","United States","Voluntary: Firm initiated","Letter","Worldwide Distribution: US (nationwide) in states of: AL, AR, AZ, CA, CO, CT, DC, DE, FL, GA, IA, ID, IL, IN, KS, KY, LA, MA, MD, ME, MI, MN, MO, MS, NC, ND, NE, NH, NJ, NM, NV, NY, OH, OK, OR, PA, RI, SC, SD, TN, TX, UT, VA, WA, WI, WV, WY; and in countries of: Austria, France, Germany, Italy, Scotland, Spain, Switzerland, United Kingdom.","Z-2038-2018","Class II","LINX Reflux Management System, Implant Clasp, 12-17 Bead, 0.7T, Product Code LXC-xx, sterile, Rx only.  Labeled as:    a. Product Code LXC-12;    b. Product Code LXC-13;   c. Product Code LXC-14;    d. Product Code LXC-15;    e. Product Code LXC-16;    f. Product Code LXC-17;       Laparoscopic, fundic-sparing anti-reflux procedure indicated for patients diagnosed with Gastroesophageal Reflux Disease (GERD) as defined by abnormal pH testing, and who are seeking an alternative to continuous acid suppression therapy (i.e. proton pump inhibitors or equivalent) in the management of their GERD.","9,131 devices in total","Possible out of specification condition which may allow a bead component to separate from an adjacent wire link. This condition may result in a discontinuous or open LINX device.","04/20/2018","05/31/2018","","06/06/2018","a. Product Code LXC-12, Part No. 3718-12, GTIN 00855106005134;    b. Product Code LXC-13, Part No. 3718-13, GTIN 00855106005141;   c. Product Code LXC-14, Part No. 3718-14, GTIN 00855106005158;    d. Product Code LXC-15, Part No. 3718-15, GTIN 00855106005165;    e. Product Code LXC-16, Part No. 3718-16, GTIN 00855106005172;    f. Product Code LXC-17, Part No. 3718-17, GTIN 00855106005189;      Lot No. 6100 through 14055, 15286, 15287, 15314, 15315, 15317, and 16557"
"Devices","No","","79822","Ongoing","Torax Medical, Inc.","4188 Lexington Ave N","","Shoreview","MN","	55126-6106","United States","Voluntary: Firm initiated","Letter","Worldwide Distribution: US (nationwide) in states of: AL, AR, AZ, CA, CO, CT, DC, DE, FL, GA, IA, ID, IL, IN, KS, KY, LA, MA, MD, ME, MI, MN, MO, MS, NC, ND, NE, NH, NJ, NM, NV, NY, OH, OK, OR, PA, RI, SC, SD, TN, TX, UT, VA, WA, WI, WV, WY; and in countries of: Austria, France, Germany, Italy, Scotland, Spain, Switzerland, United Kingdom.","Z-2039-2018","Class II","LINX Reflux Management System, Implant Clasp, 13-17 Bead, 1.5T, Product Code LXMC-xx, sterile, Rx only.  Labeled as:    a. Product Code LXMC-13;    b. Product Code LXMC-14;   c. Product Code LXMC-15;    d. Product Code LXMC-16;    e. Product Code LXMC-17;         Laparoscopic, fundic-sparing anti-reflux procedure indicated for patients diagnosed with Gastroesophageal Reflux Disease (GERD) as defined by abnormal pH testing, and who are seeking an alternative to continuous acid suppression therapy (i.e. proton pump inhibitors or equivalent) in the management of their GERD.","9,131 devices in total","Possible out of specification condition which may allow a bead component to separate from an adjacent wire link. This condition may result in a discontinuous or open LINX device.","04/20/2018","05/31/2018","","06/06/2018","a. Product Code LXMC-13, Part No. 4550-13, GTIN 00855106005332;   b. Product Code LXMC-14, Part No. 4550-14, GTIN 00855106005349;    c. Product Code LXMC-15, Part No. 4550-15, GTIN 00855106005356;    d. Product Code LXMC-16, Part No. 4550-16, GTIN 00855106005363;    e. Product Code LXMC-17, Part No. 4550-17, GTIN 00855106005370;      Lot No. 6100 through 14055, 15286, 15287, 15314, 15315, 15317, and 16557"
