Product Type,Recently Updated Record,Last Modified Date,Event ID,Status,Recalling Firm,Address1,Address2,City,State/Province,Postal Code,Country,Voluntary/Mandated,Initial Firm Notification of Consignee or Public,Distribution Pattern,Recall Number,Classification,Product Description,Product Quantity,Reason for Recall,Recall Initiation Date,Center Classification Date,Termination Date,Report Date,Code Info,More Code Info,More Code Info
"Drugs","No","","68048","Terminated","Hospira Inc.","275 N Field Dr","","Lake Forest","IL","	60045-2579","United States","Voluntary: Firm Initiated","Press Release","Nationwide.","D-1358-2014","Class I","Marcaine (bupivacaine HCl) injection, USP, 0.25%, Preservative-Free, 10 mL (25 mg) Single-dose Vial, Rx only, Hospira, Inc., Lake Forest, IL  60045 USP, NDC 0409-1559-10.","85,680 vials","Presence of Particulate Matter: Confirmed customer complaint of discolored solution with visible metal particles embedded in the glass vial and visible in the solution.","04/21/2014","06/05/2014","03/16/2017","06/11/2014","Lot #: 34-440-DD, Exp 10/15"
"Food","No","","68178","Terminated","E & M Corporation, Dba Noh Foods International Of Hawaii","2043 S Beretania St","","Honolulu","HI","	96826-1344","United States","Voluntary: Firm Initiated","Press Release","US distribution - HI, CA, FL, VA, ID, UT, NV, IL OR, WI, WA.  Also Australia, French Polynesia.  Mail order sales to FL, CA, MI, NM, WA, NY, NJ, TN, OR, MN, IA, ID and Canada.","F-1986-2014","Class I","Hawaiian Coconut Pudding, Haupia Luau Dessert;  Packaged in Net Wt. 2  oz. (57 g); Net wt. 4 oz. (114 g) and Net wt. 48 oz. (3 lb) 1.36 kg.  Ingredients: Sugar, coconut ""powder, corn starch, locust bean gum, carrageenan, maltodextrin.  2 oz UPC 073562000504;  4 oz UPC 073562000559;  3 lb UPC 073562000511,    NOH Foods of Hawaii, Honolulu, HI","25458 - 3lb cases, 13,337- 2 oz cases, 4103 4 oz cases","Consumer complaint initiated testing of the product by University of Nebraska who found >5000 ppm of milk allergen.","05/01/2014","05/30/2014","03/04/2015","06/11/2014","All codes  2 oz UPC 073562000504;  4 oz UPC 073562000559;  3 lb UPC 073562000511,"
"Food","No","","68238","Terminated","Lily Bloom's Kitchen","6215 University Ave NE","","Fridley","MN","	55432-4944","United States","Voluntary: Firm Initiated","Telephone","Minnesota","F1990-2014","Class I","Lily Bloom's Kitchen Chocolate Coconut Poparoons","1,000 individual pieces","Lily Bloom's Kitchen Poparoon flavors that contain milk which was not listed on the label include lemon, key lime, strawberry, blueberry and chocolate dipped in a white chocolate coating.","05/01/2014","06/02/2014","08/28/2014","06/11/2014","Poparoons do not contain a lot number or code"
"Food","No","","68239","Terminated","STE FROMAGERE DU LIVRADOIS","N/A","","Fournols","","	","France","Voluntary: Firm Initiated","Press Release","CA, IL, MI, OH, NJ, & WI","F-2005-2014","Class I","Raclette du Haut Livradois   Ste Fromagere du Livradois 63980 Fournols  13lbs or cut and wrapped (weight may vary)  wrap in a wax paper in a case or wrapped in plastic wrap if cut; refrigerated","168 cases (1 per case)","Ste Fromagere du Livradois of Fournols, France is recalling Haut Livradois brand Raclette and Montboissie cheeses lot#350 because they have the potential to be contaminated with Salmonella, an organism which can cause serious and sometimes fatal infections in young children, frail or elderly people, and others with weakened immune systems.","05/07/2014","06/04/2014","08/26/2015","06/11/2014","lot #350"
"Food","No","","68239","Terminated","STE FROMAGERE DU LIVRADOIS","N/A","","Fournols","","	","France","Voluntary: Firm Initiated","Press Release","CA, IL, MI, OH, NJ, & WI","F-2006-2014","Class I","Montboissie du haut- Livradois   Manufactured by Ste Fromagere du Livradois 63980  Fournols  13lbs or cut and wrapped (weight may vary)  wrapped in a wax paper in a case or wrapped in plastic wrap if cut; refrigerated","46 cases (1 per case)","Ste Fromagere du Livradois of Fournols, France is recalling Haut Livradois brand Raclette and Montboissie cheeses lot#350 because they have the potential to be contaminated with Salmonella, an organism which can cause serious and sometimes fatal infections in young children, frail or elderly people, and others with weakened immune systems.","05/07/2014","06/04/2014","08/26/2015","06/11/2014","lot #350"
"Food","No","","68291","Terminated","Us Tov, Inc. Dba U.s. Trading Company","21118 Cabot Blvd","","Hayward","CA","	94545-1130","United States","Voluntary: Firm Initiated","Press Release","Retail locations in MN,OH, KY, NY, CO, WA, CA, MO, IN, MI","F-2004-2014","Class I","Dragonfly Brand Crushed Chili Powder, Net Wt.  6.3 oz plastic tubs.  Product of Thailand  UPC 7 21557-53317 8    Packed for:  U.S. Trading Co., 21118 Cabot Blvd., Hayward, CA  94545","44 cartons (48 x 6.3 0z tubs per carton)","IEH sample of Crushed Chili Powder collected at retail was positive for Salmonella Ba reilly.","05/13/2014","06/04/2014","03/02/2015","06/11/2014","Lot 359XP"
"Biologics","No","","55401","Terminated","Talecris Plasma Resources, Inc.","625 Dorr St","","Toledo","OH","	43604-8023","United States","Voluntary: Firm Initiated","Letter","NC","B-0696-14","Class II","Source Plasma","308 units","Blood products, collected from donors for whom donor suitability was not adequately determined, were distributed.","03/02/2010","06/02/2014","06/02/2014","06/11/2014","3390027291, 3390026997, 3390034901, 3390034613, 3390034177, 3390033892, 3390033469, 3390033180, 3390032797, 3390032529, 3390032271, 3390031693, 3390031410, 3390031031, 3390029276, 3390028939, 3390028671, 3390012919, 3390012722, 3390030301, 3390029888, 3390029304, 3390028888, 3390028585, 3390028144, 3390027839, 3390027478, 3390027200, 3390026795, 3390026532, 3390026022, 3390025464, 3390025215, 3390024882, 3390024316, 3390024051, 3390023876, 3390023612, 3390023015, 3390022664, 3390022459, 3390022147, 3390021905, 3390021626, 3390019372, 3390019174, 3390018812, 3390018481, 3390018240, 3390017846, 3390017612, 3390017216, 3390016985, 3390016654, 3390016420, 3390016106, 3390015849, 3390015489, 3390015259, 3390014959, 3390014685, 3390014384, 3390014163, 3390013933, 3390013733, 3390013439, 3390013224, 3390012946, 3390012751, 3390012496, 3390012103, 3390011903, 3390011682, 3390011462, 3390011210, 3390010971, 3390010750, 3390003006, 3390002682, 3390002337, 3390002045, 3390021152, 3390020917, 3390020618, 3390020404, 3390020051, 3390019867, 3390019539, 3390018923, 3390018752, 3390018194, 3390017706, 3390017561, 3390017127, 3390016973, 3390016583, 3390016403, 3390016009, 3390015815, 3390015402, 3390015217, 3390014798, 3390014667, 3390014308, 3390019301, 3390018546, 3390018197, 3390017940, 3390017520, 3390017318, 3390016944, 3390016722, 3390016374, 3390016162, 3390036116, 3390031303, 3390031155, 3390029200, 3390029014, 3390036586, 3390036446, 3390007066, 3390004328, 3390004253, 3390003906, 3390003853, 3390003481, 3390003270, 3390003136, 3390001924, 3390001865, 3390001651, 3390001566, 3390014569, 3390014401, 3390026741, 3390026095, 3390025709, 3390025082, 3390024857, 3390024485, 3390024287, 3390023891, 3390023238, 3390022907, 3390022358, 3390022127, 3390021606, 3390021266, 3390020711, 3390020484, 3390020126, 3390019573, 3390019354, 3390019028, 3390018815, 3390018493, 3390018259, 3390017879, 3390017618, 3390021969, 3390021741, 3390021435, 3390021243, 3390020890, 3390020690, 3390020350, 3390020113, 3390019558, 3390019214, 3390019006, 3390018674, 3390018458, 3390018090, 3390017832, 3390017442, 3390017212, 3390016872, 3390016640, 3390016305, 3390016086, 3390015487, 3390015110, 3390014918, 3390014571, 3390014398, 3390014067, 3390013927, 3390013722, 3390013545, 3390013207, 3390012955, 3390012738, 3390013995, 3390013471, 3390013180, 3390013010, 3390009581, 3390008723, 3390008521, 3390007959, 3390007784, 3390031592, 3390031279, 3390030572, 3390000462, 3390000207, 3390008676, 3390008321, 3390007988, 3390007742, 3390006452, 3390006151, 3390005812, 3390005552, 3390005379, 3390033489, 3390032843, 3390032470, 3390031999, 3390026996, 3390026612, 3390026388, 3390026014, 3390025744, 3390025366, 3390025123, 3390024760, 3390024521, 3390024169, 3390023928, 3390023650, 3390022104, 3390021885, 3390021557, 3390021370, 3390021042, 3390020824, 3390020502, 3390020281, 3390017016, 3390016786, 3390016441, 3390016234, 3390014703, 3390014493, 3390014174, 3390014006, 3390015699, 3390015340, 3390014217, 3390014041, 3390013727, 3390013538, 3390013216, 3390012962, 3390032851, 3390032598, 3390032307, 3390031899, 3390031424, 3390001169, 3390001070, 3390036430, 3390035900, 3390034548, 3390033581, 3390033129, 3390032883, 3390032483, 3390032321, 3390032036, 3390031335, 3390031146, 3390029914, 3390029726, 3390029227, 3390028524, 3390028243, 3390027786, 3390027531, 3390027084, 3390026866, 3390026441, 3390026213, 3390025809, 3390025577, 3390025112, 3390024609, 3390024012, 3390023739, 3390023383, 3390022838, 3390022414, 3390022217, 3390021850, 3390021670, 3390021134, 3390020559, 3390020037, 3390019772, 3390019501, 3390019208, 3390018939, 3390018673, 3390018413, 3390018079, 3390017722"
"Devices","No","","67453","Terminated","Hospira Inc.","275 N Field Dr","","Lake Forest","IL","	60045-2579","United States","Voluntary: Firm Initiated","Letter","Worldwide Distribution - USA nationwide including District of Columbia, Puerto Rico, and US Virgin Islands; Australia, Argentina, Bahrain, Belgium, Bosnia and Herzegovina, Brazil, Bulgaria, Canada, Chile, Colombia, Croatia, Czech Republic, Egypt, Finland, France, Germany, Greece, Hong Kong, Hungary, Israel, Italy, Jordan, Kuwait, Luxembourg, Mexico, Oman, Peru, Poland, Portugal, Qatar, Russia, San Marino, Saudi Arabia, South Africa, Spain, Sweden, Switzerland, Syria, Taiwan, Turkey, United Arab Emirates, United Kingdom, and Yemen.","Z-1702-2014","Class II","LifeCare 5000 Pump (Plum 1.6) infusion pump, indicated for  volumetric infusion of critical drugs and fluids by intravenous (I.V.) administration.","List Number 02507: 132,889 pumps","There is the potential for the door roller assembly on the Plum LifeCare 5000 Series and Plum XL families of infusers to break. In the event of a broken door roller pin, the door cannot appropriately lock the cassette in the right position. Depending on the conditions of a broken door roller pin, a number of events can occur. The door cannot be closed or a cassette/door alarm or a false occlusion","01/24/2014","06/03/2014","11/07/2016","06/11/2014","List Number: 02507; Serial Numbers: All."
"Devices","No","","67453","Terminated","Hospira Inc.","275 N Field Dr","","Lake Forest","IL","	60045-2579","United States","Voluntary: Firm Initiated","Letter","Worldwide Distribution - USA nationwide including District of Columbia, Puerto Rico, and US Virgin Islands; Australia, Argentina, Bahrain, Belgium, Bosnia and Herzegovina, Brazil, Bulgaria, Canada, Chile, Colombia, Croatia, Czech Republic, Egypt, Finland, France, Germany, Greece, Hong Kong, Hungary, Israel, Italy, Jordan, Kuwait, Luxembourg, Mexico, Oman, Peru, Poland, Portugal, Qatar, Russia, San Marino, Saudi Arabia, South Africa, Spain, Sweden, Switzerland, Syria, Taiwan, Turkey, United Arab Emirates, United Kingdom, and Yemen.","Z-1703-2014","Class II","Plum XL,  Micro Macro Plum XL3 with data port, and Micro Macro Plum XL with data port infusion pumps, indicated for intravenous, arterial, short-term epidural, and parenteral administration of general I.V. fluids, medications, nutritional fluids, and blood/blood products to patients in hospital and home care environments.","List Number 11555: 17,887 pumps; List Number 11855: 1,292 pumps; List Number 11859: 147,399 pumps","There is the potential for the door roller assembly on the Plum LifeCare 5000 Series and Plum XL families of infusers to break. In the event of a broken door roller pin, the door cannot appropriately lock the cassette in the right position. Depending on the conditions of a broken door roller pin, a number of events can occur. The door cannot be closed or a cassette/door alarm or a false occlusion","01/24/2014","06/03/2014","11/07/2016","06/11/2014","List Number: 11555; Serial Numbers: All.   List Number: 11855; Serial Numbers: All.   List Number: 11859; Serial Numbers: All."
"Devices","No","","67453","Terminated","Hospira Inc.","275 N Field Dr","","Lake Forest","IL","	60045-2579","United States","Voluntary: Firm Initiated","Letter","Worldwide Distribution - USA nationwide including District of Columbia, Puerto Rico, and US Virgin Islands; Australia, Argentina, Bahrain, Belgium, Bosnia and Herzegovina, Brazil, Bulgaria, Canada, Chile, Colombia, Croatia, Czech Republic, Egypt, Finland, France, Germany, Greece, Hong Kong, Hungary, Israel, Italy, Jordan, Kuwait, Luxembourg, Mexico, Oman, Peru, Poland, Portugal, Qatar, Russia, San Marino, Saudi Arabia, South Africa, Spain, Sweden, Switzerland, Syria, Taiwan, Turkey, United Arab Emirates, United Kingdom, and Yemen.","Z-1704-2014","Class II","Plum XL3 Multi line Infusion System, Micro Macro Plum XL3 Multi line Infusion System, and Micro Macro Plum XL Infusion System.  Infusion pumps for intravenous. arterial, short-term epidural, and parenteral administration of general I.V. fluids, medications, nutritional fluids, and blood/blood products to patients in hospital and home care environments.","List Number 11781: 1,828 pumps; List Number 11845: 13,700 pumps; List Number 11846: 22,671 pumps","There is the potential for the door roller assembly on the Plum LifeCare 5000 Series and Plum XL families of infusers to break. In the event of a broken door roller pin, the door cannot appropriately lock the cassette in the right position. Depending on the conditions of a broken door roller pin, a number of events can occur. The door cannot be closed or a cassette/door alarm or a false occlusion","01/24/2014","06/03/2014","11/07/2016","06/11/2014","List Number: 11781; Serial Numbers: All.   List Number: 11845; Serial Numbers: All.   List Number: 11846; Serial Numbers: All."
"Drugs","No","","67532","Terminated","Pfizer Inc.","235 East 42nd Street","","New York","NY","	10017-5703","United States","Voluntary: Firm Initiated","Letter","Nationwide, Italy and Republic of South Korea","D-1356-2014","Class II","GREENSTONE BRAND fluconazole for Oral Suspension, ORANGE FLAVORED, 40 mg/mL, when reconstituted, Rx only, Distributed by Greenstone LLC Peapack, NJ 07977.  MADE IN INDIA.  NDC 59762-5030-1","4,155 bottles","Defective Container: Tamper evident ring failures discovered on some bottles.","01/29/2014","05/30/2014","03/14/2017","06/11/2014","Lot # A358502; Exp 01/15"
"Cosmetics","No","","67779","Terminated","Kiss My Face","144 Main Street","","Gardner","NY","	12525","United States","Voluntary: Firm Initiated","Two or more of the following: Email, Fax, Letter, Press Release, Telephone, Visit","USA nationwide, Singapore, Ireland, Canada, Czech Republic, Saipan, Panama, Norway, and Nigeria.","F-1980-2014","Class II","KISS MY Face Grapefruit & Bergamot Foaming Soap: 1) Net Wt. 8.75 Fl Oz (258 mL), UPC 0 28367 83309 3; 2) Net Wt. 17.5 Fl Oz (516 mL), UPC 0 28367 83479 3.  Distributed by Kiss My Face LLC, Gardiner, NY 12525, Made in USA.","23,875 bottles","Kiss My Face, LLC has recalled various foaming hand soap products due to Pseudomonas aeruginosa/fluorescens contamination.","03/18/2014","05/30/2014","06/01/2018","06/11/2014","Lot numbers: 1) K102512, K020513, K032113, K050913, K100213, K011414; 2) K122012, K011613, K032213, K041613, K051013, K091613, K100113"
"Cosmetics","No","","67779","Terminated","Kiss My Face","144 Main Street","","Gardner","NY","	12525","United States","Voluntary: Firm Initiated","Two or more of the following: Email, Fax, Letter, Press Release, Telephone, Visit","USA nationwide, Singapore, Ireland, Canada, Czech Republic, Saipan, Panama, Norway, and Nigeria.","F-1981-2014","Class II","KISS MY Face Lemon & Ginger Foaming Soap: 1) Net Wt. 8.75 Fl Oz (258 mL) - UPC 0 28367 83473 1, 2) Net Wt. 17.5 Fl Oz (516 mL) - UPC 028367 834779.  Distributed by Kiss My Face LLC, Gardiner, NY 12525, Made in USA.","7,978 bottles","Kiss My Face, LLC has recalled various foaming hand soap products due to Pseudomonas aeruginosa/fluorescens contamination.","03/18/2014","05/30/2014","06/01/2018","06/11/2014","Lot numbers: 1) K110112, K031913, K031813, K071513, K011314; 2) K122112, K011713, K031913, K071613, K081613, K012114"
"Cosmetics","No","","67779","Terminated","Kiss My Face","144 Main Street","","Gardner","NY","	12525","United States","Voluntary: Firm Initiated","Two or more of the following: Email, Fax, Letter, Press Release, Telephone, Visit","USA nationwide, Singapore, Ireland, Canada, Czech Republic, Saipan, Panama, Norway, and Nigeria.","F-1982-2014","Class II","KISS MY Face Lavender & Chamomile Foaming Soap: 1) Net Wt. 8.75 Fl Oz, UPC 0 28367 83308 6; 2) Net Wt. 17.5 Fl Oz (516 mL), 028367 834786.  Distributed by Kiss My Face LLC, Gardiner, NY 12525, Made in USA.","11,721 bottles","Kiss My Face, LLC has recalled various foaming hand soap products due to Pseudomonas aeruginosa/fluorescens contamination.","03/18/2014","05/30/2014","06/01/2018","06/11/2014","Lot numbers: 1) K110212, K032013, K050613, K081513, K092513; 2) K031913, K050613, K092613"
"Cosmetics","No","","67779","Terminated","Kiss My Face","144 Main Street","","Gardner","NY","	12525","United States","Voluntary: Firm Initiated","Two or more of the following: Email, Fax, Letter, Press Release, Telephone, Visit","USA nationwide, Singapore, Ireland, Canada, Czech Republic, Saipan, Panama, Norway, and Nigeria.","F-1983-2014","Class II","KISS MY Face obsessively natural KIDS Self-Foaming Hand Wash, orange U smart, Net Wt. 8 Fl Oz (236 mL), UPC 0 28367 83591 2. Distributed by Kiss My Face LLC, Gardiner, NY 12525, Made in USA.","9,255 bottles","Kiss My Face, LLC has recalled various foaming hand soap products due to Pseudomonas aeruginosa/fluorescens contamination.","03/18/2014","05/30/2014","06/01/2018","06/11/2014","Lot numbers: K121112, K032513, K050813, K011514, K021014"
"Devices","No","","67926","Terminated","Brainlab AG","Kapellenstrasse 12","","Feldkirchen","","	","Germany","Voluntary: Firm Initiated","Letter","Worldwide Distribution -  US Nationwide in the states of AZ, AR, CA, FL, KY, MA, NE, NY, TN, TX and the countries of Argentina, Australia, Brazil, Finland, India, Japan, Netherlands, Oman, Russia, and Taiwan","Z-1707-2014","Class II","ExacTrac 5.5, an Image Processing System used for patient positioning for radiation therapy or radiosurgery.","40 systems (worldwide)","When using a specific plan update workflow in combination with a non-Brainlab treatment planning system (TPS), there is a possibility in ExacTrac 5.5.5 to generate an unintended blend of two initially separate plans of the same patient.","04/15/2014","06/03/2014","04/24/2017","06/11/2014","ExacTrac software version 5.5.5 is included in the following model / catalog numbers:     1) 20818B ET SOFTWARE 5.5.5;   2) 20820 ET SOFTWARE UPDATE 5.0 TO 5.5;   3) 49905D EXACTRAC COMPLETE SYSTEM UPG 3.X TO 5.5;   4) 49908C EXACTRAC SOFTWARE UPGRADE 3.X TO 5.5;   5) 49909A EXACTRAC SOFTWARE UPGRADE 4.X TO 5.5;   6) 49918 ET SOFTWARE UPDATE 5.5.X TO 5.5.5;   7) 49919 ET SOFTWARE UPDATE 5.0.X TO 5.5.5;   8) 49660A ET INFRARED SOFTWARE 5.5.5;   9) 49961 ET DATA PREP/REVIEW SYSTEM;   10) 49986 ET SYSTEM UPGRADE 3.X TO 5.5 NEW VAULT;   11) 49987 ET SYSTEM UPGRADE 4.X TO 5.5 NEW VAULT;   12) 49988 ET SYSTEM UPGRADE 4.X TO 5.5 SAME VAULT;   13) 49989 ET SYSTEM UPGRADE 5.0 TO 5.5 NEW VAULT;   14) 49990 ET SYSTEM UPGRADE 5.0 TO 5.5 SAME VAULT;   15) 49991 ET SYSTEM UPGRADE 5.5 TO 5.5 NEW VAULT"
"Devices","No","","67967","Terminated","Siemens Medical Solutions USA, Inc","51 Valley Stream Pkwy","","Malvern","PA","	19355","United States","Voluntary: Firm Initiated","Letter","US Nationwide Distribution in the states of IA, TX, FL, NE, NY, OH, NC, KS, IL, CA, OK including PR.","Z-1721-2014","Class II","Siemens SOMATOM Emotion 16, Emotion 6, and SOMATOM Spirit Computed Tomography Systems     Product Usage:  To produce cross-sectional images of the body by computer reconstruction of x-ray transmission data from either the same axial plane taken at different angles or spiral planes taken at different angles.","345","The rubber damper may degrade and break, causing loosening of the motor mounting plates, which could lead to a series of events that could place the operator and patient at risk of injury.","03/21/2014","06/04/2014","03/16/2015","06/11/2014","Material numbers: 10165977, 10045692 , and 10165888  with serial numbers: 32187  31158  31215  31222  31313  31354  32118  32120  32123  32125  32126  32127  32129  32139  29161  27229  29185  27415  27212  29364  29186  29165  29233  29182  27235  29338  29176  29376  27232  29181  27369  29295  27230  29198  27244  29286  29126  27338  29302  27231  27334  29394  29264    32141  32156  32159"
"Devices","No","","68006","Terminated","Synthes, Inc.","1302 Wrights Ln E","","West Chester","PA","	19380-3417","United States","Voluntary: Firm Initiated","Letter","US Distribution including the states of FL, NJ and MN.","Z-1681-2014","Class II","Synthes XRL Medium Trial - Central Body, an instrument used as part of the Synthes XRL System, a vertebral body replacement device.   For spinal surgery. The Synthes XRL device is intended to be used with the Synthes supplemental internal fixation systems (e.g., USS, including MATRIX, Pangea, and TSLP).","3","Two lots of the Synthes XRL Medium Trial-Central Body device were incorrectly etched with the incorrect dimensions for height.","04/08/2014","06/02/2014","09/10/2015","06/11/2014","Product no. 03.807.507, lot no. 8029684, and product no. 03.807.508, lot no. 8029689."
"Drugs","No","","68009","Terminated","Golden State Medical Supply Inc.","5187 Camino Ruiz","","Camarillo","CA","	93012-8601","United States","Voluntary: Firm Initiated","E-Mail","Nationwide","D-1357-2014","Class II","LOSARTAN POTASSIUM Tablets, USP, 50 mg, 30 count bottles, Rx only, Manufactured by Arrow Pharm (Malta) Ltd., Bizebbugia, Malta, Packaged by GSMS, Inc. Camarillo, CA --- NDC 60429-317-30  ","6,042 bottles","Presence of Foreign Substance; some bottles may contain debris that was swept up during cleaning","04/14/2014","06/02/2014","07/09/2014","06/11/2014","Lot Number GS003057. Exp Date 03/2016."
"Devices","No","","68039","Terminated","Small Bone Innovations, Inc.","1711 S Pennsylvania Ave","","Morrisville","PA","	19067-2507","United States","Voluntary: Firm Initiated","Letter","US Nationwide Distribution in the states of IN, NC, WA, NH, and CT.","Z-1720-2014","Class II","SBi RingFix Olive Wires    Product Usage:  These are temporary devices indicated for: osteosynthesis of fractures with small osteoarticular fragments, fixation of open and closed fractures, arthrodesis, sepsis, limb lengthening, and osteotomy.","44","Small Bone Innovations (SBI) is recalling non-sterile RingFIX Olive Wires labeled as item #451-3004 Drill tip 1.8 mm diameter 400mm olive k-wire packaged with item #451-3005 Bayonet tip 1.8mm diameter 400mm olive k-wire inside.","04/07/2014","06/04/2014","10/20/2014","06/11/2014","item #451-3004,  lot V3R0R."
"Cosmetics","No","","68046","Terminated","Lafco Enterprises Inc","285 Lafayette St","","New York","NY","	10012-3367","United States","Voluntary: Firm Initiated","Two or more of the following: Email, Fax, Letter, Press Release, Telephone, Visit","Nationwide and Foreign distribution to South Korea and England","F-1996-2014","Class II","True Liquid Hand Soap, 15 oz container. Redwood Fragrance","195 bottles","Lafco Enterprises, Inc. dba LAFCO NY is recalling all lots and all varieties of its True Liquid hand soap due to a potential bacterial contamination.","04/18/2014","06/03/2014","05/13/2016","06/11/2014","All lot codes are included"
"Cosmetics","No","","68046","Terminated","Lafco Enterprises Inc","285 Lafayette St","","New York","NY","	10012-3367","United States","Voluntary: Firm Initiated","Two or more of the following: Email, Fax, Letter, Press Release, Telephone, Visit","Nationwide and Foreign distribution to South Korea and England","F-1997-2014","Class II","True Liquid Hand Soap, 15 oz container. Marine Fragrance","","Lafco Enterprises, Inc. dba LAFCO NY is recalling all lots and all varieties of its True Liquid hand soap due to a potential bacterial contamination.","04/18/2014","06/03/2014","05/13/2016","06/11/2014","All lot codes are included"
"Cosmetics","No","","68046","Terminated","Lafco Enterprises Inc","285 Lafayette St","","New York","NY","	10012-3367","United States","Voluntary: Firm Initiated","Two or more of the following: Email, Fax, Letter, Press Release, Telephone, Visit","Nationwide and Foreign distribution to South Korea and England","F-1998-2014","Class II","True Liquid Hand Soap, 15 oz container. Chamomile Lavender Fragrance","1134 bottles","Lafco Enterprises, Inc. dba LAFCO NY is recalling all lots and all varieties of its True Liquid hand soap due to a potential bacterial contamination.","04/18/2014","06/03/2014","05/13/2016","06/11/2014","All lot codes are included"
"Cosmetics","No","","68046","Terminated","Lafco Enterprises Inc","285 Lafayette St","","New York","NY","	10012-3367","United States","Voluntary: Firm Initiated","Two or more of the following: Email, Fax, Letter, Press Release, Telephone, Visit","Nationwide and Foreign distribution to South Korea and England","F-1999-2014","Class II","True Liquid Hand Soap, 15 oz container. Gardenia Fragrance","518 bottles","Lafco Enterprises, Inc. dba LAFCO NY is recalling all lots and all varieties of its True Liquid hand soap due to a potential bacterial contamination.","04/18/2014","06/03/2014","05/13/2016","06/11/2014","All lot codes are included"
