Product Type,Recently Updated Record,Last Modified Date,Event ID,Status,Recalling Firm,Address1,Address2,City,State/Province,Postal Code,Country,Voluntary/Mandated,Initial Firm Notification of Consignee or Public,Distribution Pattern,Recall Number,Classification,Product Description,Product Quantity,Reason for Recall,Recall Initiation Date,Center Classification Date,Termination Date,Report Date,Code Info
"Food","No","","83160","Terminated","Nature's Touch Frozen Foods (West)","31122 South Fraser Way","","Abbotsford","British Columbia","	","Canada","Voluntary: Firm initiated","Press Release","Alaska, Arizona, California, Colorado, Hawaii, Idaho, Nebraska, Nevada, New Mexico, Oregon, South Dakota, Washington, Wyoming, Texas and Utah","F-1528-2019","Class I","Signature Select Avocado Chunks, 12 oz. (340 g) Stand-up pouch  Re-sealable, Keep Frozen;  UPC 2113009412    Ingredient: Avocado Chunks, Key Lime Juice    Distributed by Better Living Brands  Pleasanton, CA    Product of Peru, Packed in Canada","1334 cases","Washington State Department of Agriculture sampled and tested frozen avocado and found Listeria monocytogenes.","06/18/2019","07/03/2019","08/27/2019","07/10/2019","Best Before OCT 11 20"
"Drugs","No","07/16/2019","83207","Ongoing","PharMEDium Services, LLC","36 Stults Rd","","Dayton","NJ","	08810","United States","Voluntary: Firm initiated","Letter","Nationwide within the United States","D-1488-2019","Class I","Hydromorphone HCl in 0.9% sodium chloride, 0.5mg per mL, 1 mL in 3mL BD  Syringe, PharMEDium 913 N Davis Ave Cleveland, MS 38732, 800-523-7749, NDC 61553-352-78","28,140 syringes","Incorrect Product Formulation; Firm's customer resource center (CRC) statement indicates that the product is sulfite free, however the product is produced with a raw material that contains sulfite","06/07/2019","07/16/2019","","07/10/2019","Lot #: 190670030D,190670031D, 190670032D, 190670033D, Exp. 6/9/2019;   190710015D, 190710016D, 190710017D, 190710018D, 190710019D, Exp. 6/11/2019; 190730028D, 190730029D, 190730030D, Exp. 6/13/2019;   190740018D, Exp.6/16/2019;  190770028D, 190770029D, Exp. 6/17/2019;   190780027D, 190780028D, 190780029D, Exp. 6/18/2019; 190790030D, Exp. 6/19/2019; 190800012D, 190800013D, 190800014D, 190800015D, 190800016D, Exp.6/20/2019; 190810033D, 190810034D, 190810035D,190810036D, Exp.6/23/2019; 190840002D, Exp. 6/24/2019; 190870008D, Exp. 6/27/2019; 190910015D, Exp. 7/1/2019; 190980033D, Exp. 7/8/2019; 190990017D, 190990030D, Exp. 7/9/2019; 191000035D, Exp. 7/10/2019; 191010008D,191010009D, 191010010D, Exp. 7/11/2019;  191050002D, Exp.7/15/2019; 191120002D, Exp.7/22/2019; 191160001D, Exp. 7/28/2019; 191210020D, 191210021D, 191210022D, Exp.7/31/2019; 191220017D, Exp.8/1/2019."
"Food","No","07/22/2019","81048","Terminated","Ozark Country Kitchen","3601 Highway 123","","Dunnegan","MO","	65640-9655","United States","Voluntary: Firm initiated","Telephone","Distributed to stores and distributors in Missouri.","F-1588-2019","Class II","Sorghum, Mfg. by Ozark Country Sorghum, Dunnegan, MO 65640, Net Wt. 2 lb. 14 OZ. packaged in glass jars","Unknown.","Product contains high level of nitrates. Public health officials in Iowa are investigating two cases of methemoglobinemia possibly associated with consumption of the product.","09/18/2018","07/22/2019","09/24/2019","07/10/2019","No codes"
"Devices","No","","82784","Ongoing","Ortho-Clinical Diagnostics","100 Indigo Creek Dr","","Rochester","NY","	14626-5101","United States","Voluntary: Firm initiated","Letter","US Nationwide Distribution","Z-1933-2019","Class II","VITROS 250 Chemistry System, Product Code 8132086,   (UDI # 10758750004409)    Product Usage:  Performs discrete clinical tests on serum, urine, and cerebral spinal fluid specimens. Methodologies include colorimetric (CM), potentiometric (PM), rate (RT), and immuno-rate (IR) tests using multi-layered VITROS Slides.  ","5020 units","Potential negative drift in Creatine Kinase (CK) results when used on the VITROS 250 and 350 Systems.","04/08/2019","07/03/2019","","07/10/2019","All lots"
"Devices","No","","82784","Ongoing","Ortho-Clinical Diagnostics","100 Indigo Creek Dr","","Rochester","NY","	14626-5101","United States","Voluntary: Firm initiated","Letter","US Nationwide Distribution","Z-1934-2019","Class II","VITROS 250AT Chemistry System, Product Code 1758143,  (UDI # 10758750000036)    Product Usage:  Performs discrete clinical tests on serum, urine, and cerebral spinal fluid specimens. Methodologies include colorimetric (CM), potentiometric (PM), rate (RT), and immuno-rate (IR) tests using multi-layered VITROS Slides.  ","57 units","Potential negative drift in Creatine Kinase (CK) results when used on the VITROS 250 and 350 Systems.","04/08/2019","07/03/2019","","07/10/2019","All lots"
"Devices","No","","82784","Ongoing","Ortho-Clinical Diagnostics","100 Indigo Creek Dr","","Rochester","NY","	14626-5101","United States","Voluntary: Firm initiated","Letter","US Nationwide Distribution","Z-1935-2019","Class II","VITROS 250 Chemistry System Refurbished, Product Code 6801759,  (UDI # 10758750001330)    Product Usage:  Performs discrete clinical tests on serum, urine, and cerebral spinal fluid specimens. Methodologies include colorimetric (CM), potentiometric (PM), rate (RT), and immuno-rate (IR) tests using multi-layered VITROS Slides.  ","2411 units","Potential negative drift in Creatine Kinase (CK) results when used on the VITROS 250 and 350 Systems.","04/08/2019","07/03/2019","","07/10/2019","All lots"
"Devices","No","","82784","Ongoing","Ortho-Clinical Diagnostics","100 Indigo Creek Dr","","Rochester","NY","	14626-5101","United States","Voluntary: Firm initiated","Letter","US Nationwide Distribution","Z-1936-2019","Class II","VITROS 350 Chemistry System, Product Code   6802153, (UDI # 10758750002054)    Product Usage:  Performs discrete clinical tests on serum, urine, and cerebral spinal fluid specimens. Methodologies include colorimetric (CM), potentiometric (PM), rate (RT), and immuno-rate (IR) tests using multi-layered VITROS Slides.  ","3889 units","Potential negative drift in Creatine Kinase (CK) results when used on the VITROS 250 and 350 Systems.","04/08/2019","07/03/2019","","07/10/2019","All lots"
"Biologics","No","","82806","Terminated","LifeShare Blood Centers","1321 College Dr","","Texarkana","TX","	75503-3531","United States","Voluntary: Firm initiated","FAX","Texas; Illinois","B-0588-2019","Class II","Red Blood Cells, Leukocytes Reduced","1 unit","Blood products, collected from a donor who was at risk for variant Creutzfeldt-Jakob disease (vCJD), were distributed.","03/29/2019","06/28/2019","06/28/2019","07/10/2019","W036519759021"
"Biologics","No","","82806","Terminated","LifeShare Blood Centers","1321 College Dr","","Texarkana","TX","	75503-3531","United States","Voluntary: Firm initiated","FAX","Texas; Illinois","B-0589-2019","Class II","Blood and Blood Products for Reprocessing","1 unit","Blood products, collected from a donor who was at risk for variant Creutzfeldt-Jakob disease (vCJD), were distributed.","03/29/2019","06/28/2019","06/28/2019","07/10/2019","W036519759021"
"Biologics","No","","82815","Terminated","BPL Plasma, Inc.","122 Yale Blvd SE","","Albuquerque","NM","	87106-4012","United States","Voluntary: Firm initiated","E-Mail","United Kingdom","B-0594-2019","Class II","Source Plasma","6 units","Source Plasma, collected from a donor who received a tattoo within one year of donation, was distributed.","03/12/2019","06/28/2019","06/28/2019","07/10/2019","AY1108830; AY1109040; AY1109891; AY1110177; AY3003852; AY3004080"
"Biologics","No","","82861","Terminated","New York Blood Center, Inc.","1200 Prospect Ave","","Westbury","NY","	11590-2723","United States","Voluntary: Firm initiated","FAX","Pennsylvania; New York","B-0598-2019","Class II","Red Blood Cells, Leukocytes Reduced","1 unit","Blood products, for which donor eligibility screening was incorrectly performed, were distributed.","03/25/2019","06/28/2019","06/28/2019","07/10/2019","W047017152305"
"Biologics","No","","82861","Terminated","New York Blood Center, Inc.","1200 Prospect Ave","","Westbury","NY","	11590-2723","United States","Voluntary: Firm initiated","FAX","Pennsylvania; New York","B-0600-2019","Class II","Pooled Cryoprecipitated AHF","1 unit","Blood products, for which donor eligibility screening was incorrectly performed, were distributed.","03/25/2019","06/28/2019","06/28/2019","07/10/2019","W047017138194"
"Biologics","No","","82861","Terminated","New York Blood Center, Inc.","1200 Prospect Ave","","Westbury","NY","	11590-2723","United States","Voluntary: Firm initiated","FAX","Pennsylvania; New York","B-0601-2019","Class II","Red Blood Cells, Leukocytes Reduced, Irradiated","1 unit","Blood products, for which donor eligibility screening was incorrectly performed, were distributed.","03/25/2019","06/28/2019","06/28/2019","07/10/2019","W047018101840"
"Devices","No","","82868","Ongoing","Johnson & Johnson Surgical Vision Inc","1700 E Saint Andrew Pl","","Santa Ana","CA","	92705-4933","United States","Voluntary: Firm initiated","Letter","US Distribution to states of: NC, NV, TX, NY, UT, C, MN, NY, WA, NJ, OH, NV, CA and Internationally to: Australia and Japan.","Z-1893-2019","Class II","Disposable 25GA Vitrectomy Cutter, REF NGP0025, RX Only, Abbott Medical Optics Inc.,      The product provides the item necessary to perform one vitrectomy procedure. It is used to remove vitreous from the eye. It has been designed as a disposable (single use)    ","392 units","Packaging error, 20GA Vitrectomy Cutter may be found in a 25GA package.  Use of a Vitrectomy cutter that is a different size than expected could lead to the need to alter the surgical technique, including corneal incision enlargement.","09/24/2018","06/28/2019","","07/10/2019","Lot Number: 60084881  Mfg. date: 2017-09-05 Exp. date: 2020-09-05  UDI: (01)05050474534117 (17)200905(10)60084881"
"Devices","No","","82879","Ongoing","Beckman Coulter Inc.","250 S Kraemer Blvd","","Brea","CA","	92821-6232","United States","Voluntary: Firm initiated","Letter","Distribution was nationwide, including Puerto Rico.  There was also military/government distribution.    Foreign distribution was made to Canada, Argentina, Brazil, Chile, Colombia, Mexico, Peru, Philippines, Singapore, and Taiwan.","Z-1937-2019","Class II","iChem VELOCITY Urine Chemistry Strips, REF 800-7212, 100 test strips/vial.  The firm name on the label is Beckman Coulter Ireland, Inc., Co. Clare, Ireland, Made in Germany.","956,798/100 test strip vials","Falsely elevated (false positive) urobilinogen patient results due to an increase in the sensitivity of the urobilinogen reaction.","10/18/2018","07/03/2019","","07/10/2019","Lot numbers beginning with lot 7212143 except for: 7212146, 7212148, 7212160, 7212162, 7212163 and 7212164."
"Devices","No","","82920","Ongoing","Bio-Rad Laboratories, Inc","6565 185th Ave Ne","","Redmond","WA","	98052-5039","United States","Voluntary: Firm initiated","Letter","Distribution was nationwide to medical facilities, including to Puerto Rico.  There was also government/military distribution.  There was no foreign distribution.","Z-1906-2019","Class II","EVOLIS Microplate System (Catalog no. 89700) with TimeLiner Data Management Software, (Catalog no. 90471A.","213 devices","User-induced circumstances can contribute to the EVOLIS Microplate Processor System not handling repeat testing requests/results properly and may contribute to transmitting erroneous results to the  customer's Laboratory Information System (LIS).","01/10/2019","06/30/2019","","07/10/2019","Software version 1.4, UDI for the software is 03610520562024."
"Devices","No","","82971","Ongoing","Madison Polymeric Engineering","965 W Main St","","Branford","CT","	06405-3453","United States","Voluntary: Firm initiated","Letter","The products were distributed to the following US states:  AZ, CA, FL, IA, IL, IN, MA, MD, MO, PA, TN, TX, WA.","Z-1924-2019","Class II","Draco Enzymatic Deep-Cleaning Pad with Ready-to-Use Enzymatic Detergent, Product Number HY0305Z","2723","This product has been contaminated with Stenotrophomonas lactiubi.","05/08/2019","07/02/2019","","07/10/2019","Lot Numbers EX20191121P  EX20191126P  EX20191127P  EX20191212X  EX20191213X  EX20200125X"
"Devices","No","","82971","Ongoing","Madison Polymeric Engineering","965 W Main St","","Branford","CT","	06405-3453","United States","Voluntary: Firm initiated","Letter","The products were distributed to the following US states:  AZ, CA, FL, IA, IL, IN, MA, MD, MO, PA, TN, TX, WA.","Z-1925-2019","Class II","First Step Draco Pad, Product Number EP-4D","10570","This product has been contaminated with Stenotrophomonas lactiubi.","05/08/2019","07/02/2019","","07/10/2019","Lot Numbers EX20191221X  EX20191226X  EX20191227X  EX20191228X"
"Devices","No","","82979","Ongoing","Phadia Ab","Rapsgatan Plant","Rapsgatan 7","Uppsala","","	","Sweden","Voluntary: Firm initiated","Letter","US Nationwide n the states of NJ, NY, MI, WV, TX  including  PR","Z-1907-2019","Class II","EliA RF IgM Well, REF 14-5600-01    Product Usage:  Usage:  EliA RF IgM is intended for the in vitro quantitative measurement of IgM class rheumatoid factor antibodies in human serum and plasma (Li-heparin and EDTA) to aid in the diagnosis of rheumatoid arthritis in conjunction with other laboratory and clinical findings. EliA RF IgM uses the EliA IgM method on the instrument Phadia 100, Phadia 250, Phadia 2500 and Phadia 5000.  ","30 kits","Potential for reporting low assay results","05/10/2019","07/01/2019","","07/10/2019","UDI (01) 07333066010854 (17) 200630 (10) 0085  Lot Number - 0085"
"Devices","No","","82980","Ongoing","Siemens Healthcare Diagnostics, Inc.","500 Gbc Dr Ms 514","","Newark","DE","	19702-2466","United States","Voluntary: Firm initiated","Letter","Worldwide distribution.","Z-1913-2019","Class II","ADVIA Chemistry Creatine Kinase (CK_L) reagent, Product Code 10729780, UDI Number: 00630414008943 - Product Usage: The ADVIA¿ Chemistry Creatine Kinase (CK_L) assay is for in vitro diagnostic use in the quantitative determination of creatine kinase activity in human plasma (lithium heparin) or serum on ADVIA Chemistry XPT systems. The assay can be used to aid in the diagnosis and treatment of myocardial infarction and muscle diseases, such as Duchenne progressive muscular dystrophy.","3,386","A steady upward trend in blank (u) absorbance was observed","05/03/2019","07/02/2019","","07/10/2019","Serial Numbers: 465336,465663,468449"
"Devices","No","","82980","Ongoing","Siemens Healthcare Diagnostics, Inc.","500 Gbc Dr Ms 514","","Newark","DE","	19702-2466","United States","Voluntary: Firm initiated","Letter","Worldwide distribution.","Z-1914-2019","Class II","Atellica CH Creatine Kinase (CK_L) Reagent, Product Code 11097640, UDI Number: 00630414006642 - Product Usage: The ADVIA¿ Chemistry Creatine Kinase (CK_L) assay is for in vitro diagnostic use in the quantitative determination of creatine kinase activity in human plasma (lithium heparin) or serum on ADVIA Chemistry XPT systems. The assay can be used to aid in the diagnosis and treatment of myocardial infarction and muscle diseases, such as Duchenne progressive muscular dystrophy.","899","A steady upward trend in blank (u) absorbance was observed","05/03/2019","07/02/2019","","07/10/2019","Serial Numbers: 280765, 280766, 280767"
"Devices","No","","82991","Ongoing","Medtronic Navigation, Inc.-Littleton","300 Foster St","","Littleton","MA","	01460-2017","United States","Voluntary: Firm initiated","Letter","Worldwide Distribution - US Nationwide  Foreign:  ALGERIA  AUSTRALIA  AUSTRIA  BAHRAIN  BELGIUM  BRAZIL  BULGARIA  CANADA  CANADA  CHILE  CHINA  COLOMBIA  CROATIA  CZECH REPUBLIC  DENMARK  EGYPT  FINLAND  FRANCE  GERMANY  GREECE  HONG KONG  INDIA  IRELAND  ISRAEL  ITALY  JAPAN  JORDAN  KAZAKHSTAN  KOREA  KOREA, REPUBLIC OF  KUWAIT  LEBANON  LIBYAN ARAB JAMAHIRIYA  LK  MEXICO  NETHERLANDS  NEW ZEALAND  NICARAGUA  POLAND  PORTUGAL  PUERTO RICO  RUSSIAN FEDERATION  SAUDI ARABIA  SINGAPORE  SLOVAKIA  SOUTH AFRICA  SPAIN  SWEDEN  SWITZERLAND  TAIWAN  THAILAND  TURKEY  UNITED ARAB EMIRATES  UNITED KINGDOM  VENEZUELA","Z-1932-2019","Class II","Medtronic 0-arm TM 1000 Imaging Systems: Bl-700-00027-XXX and B1-700-00028-XXX (where XXX indicates the system voltage):  Product Name Model#/ CFN  OARM ASSY 8170000027 SYSTEM PRODUCT BI70000027  OARM ASSY BI70000027R SYS PRODUCT RWK BI70000027R  BASE OARM 8170000027100 SYSTEM !DOV BI70000027100  BASE OARM Bl70000027100R SYSTEM lOOV RWK Bl70000027100R  BASE OARM 8170000027120 SYSTEM 120V 8170000027120  BASE OARM Bl70000027120R SYSTEM 120V RWK BI70000027120R  BASE OARM Bl70000027230 SYSTEM 230V 8170000027230  BASE OARM Bl70000027230R SYSTEM 230V RWK BI70000027230R  OARM ASSY BI70000027GER SYS PRODUCT GER BI70000027GER  OARM ASSY Bl70000027GERR SYS PRODUCT REFURB BI70000027GERR  BASE OARM 8170000028100 SYS lOOV 8170000028100  BASE OARM BI70000028120 SYS 120V 8170000028120  BASE OARM BI70000028120R 3RD EDIT REFURB BI70000028120R  BASE OARM BI70000028230 SYS 230V BI70000028230  BASE OARM BI70000028230R 3RD EDIT REFURB Bl70000028230R    Product Usage:  The 0-arrn Imaging System is a mobile x-ray system designed for 2D fluoroscopic and 3D imaging and is intended to be used where a physician benefits from 2D and 3D information of anatomi~ structures and objects with high x-ray attenuation such as bony anatomy and metallic objects. The 0-arm Imaging System is compatible with certain Image Guided Surgery Systems.  ","832 units","The 0-arm 1000 Imaging System uses energy from the batteries to generate X-rays and move the system. If a charger board is not functioning properly, the batteries will not receive a full recharge of the potential capacity and results in the inability of the system to take X-rays, open the gantry, and move the system from one place to another, which may affect the ability to continue use within the operating room until the charger board and/or the batteries are replaced","05/01/2019","07/03/2019","","07/10/2019","Serial Numbers: US:  00102  00103R  00105  00112R  00113  00116R  00117R  00118R  00126  00128R  00129  00131  00133  00134  00135  00138  00140  00147  00148  00149  00152  00157  00158  00164R  00167  00168  00170  00171  00173  00176  00178  00179  00182  00184R  00185  00186  00188  00189  00190  00191  00199  00202  00205  00210R  00211  00212  00214  00215  00218  00219  00221  00222  00224  00225  00226  00229  00232R  00234R  00235  00236  00238R  00239  00242  00248  00256  00257  00261  00262  00267  00269  00270  00273  00274R  00275  00277  00280  00282  00288  00289R  00293  00294  00296  00297  00300  00305  00306R  00307  00308  00309R  00311  00312R  00313  00314  00315  00317  O-Arm 318  00319R  00333  00335  00341  00342  00343  00344  00347  00348  00350  00351  00359  00360  00362  00363  00365  00366  00369  00370  00373  00377  00378  00379  00381  00383  00385  00391  00392  00394  00396  00398  00399  00400  00401  00404  00405  00406  00408  00409  00410  00412  00415  00416  00418R  O-Arm 420  00428  00429  00432  00433  00435  00438R  00439  00441  00442  00443  00444  00445  00446R  00447  00449  00450  00452  00453  O-arm 457  00458  00461  00462  00465  00466R  00469  00470  00471  00474  00475  00476  00479  00480  00484  00485  00487  00489  00490  00494  00496  00497  00499  00500  00502  00503  00507  O-arm 510  00511  00512  00513  00523  00524  00525  00526  00530  00531  00532  00534  00535  00538  00539R  00540  00541  00542  00543  00544  00546  00547  00550  00551  00553  00554  00555  00556  00561  00562  00564  00566  00567  00568  00569  00570  00572  00573  00574  00576  00579  00581  00582R  00583  00584  00586  00587  00588  00592  00595  00597  00598  00599  00600  00602  00603  00604  00608  00611  00614  00618  00622  00623  00627  00628  00634  00639  00640  00645  00655  00659  00664  00665  00667  00668  00669  00670  00671  00672  00673  00674  00675  00676  00677  00678A  00679  00680  00686  00688  00689  00690  00691  00694  00696  00699  00700  00704  00705  00707  00708  00709  00712  00713  00714  B13080721  B13080722  00726  00727  B13090729  00730  00731  00732  00734  00735  00736  00737  00738  00742  00744  00749  00750  00751  00752  00753  00755  00756  00757  B13120763  B13120764  B13120766  B13120768  B14010769  B14010774  B14010775R  B14010777  B14010780  B14030785  B14020786  B14020788  B14020792  B14020795  B14030796  B14030797  B14030803  O-arm 804  B14030808  B14040810  B14040814  B14040816  B14040817  B14040819  B14050826  B14050827  O-Arm 831  B14070835  B14060836  O-arm 842  B14070846  B14070847  B14070849  B14070851  B14070852  B14070854  00856  B14070857  00858  B14080859  B14080861  B14080862  B14090863  B14080864  B14080865  B14080866  B14080867  B14080871  B14090872  B14090873  B14090874  B14090880  B14090881  B14090882  B14090883  B14090884  B14090885  B14100886  B14100887  B14100888  B14100889  B14100890  B14100891  B14100893  B14100894  B14100895  B14110896  B14110898  B14110899  B14110901  B14110902  B14110903  B14110904  B14120905  B14120906  B14120907  B14120908  B14120909  B14120910  B14120911  B14120912  B14120913  B14120915  B14120916  B14120917  B14120918  B15010919  B15010920  B15010921  B15010922  B15010923  B15010924  B15010926  B15020925  B15020927  B15020928  B15020937  B15020940  B15020941  B15020942  B15030945  B15030946  B15030947  B15030948  B15030951  B15030952  B15030953  B15030955  B15040958  B15040959  B15040960  B15040961  B15050971  B15050972  B15050975  B15060976  00977  B15060980  B15060984  B15060987  B15060988  B15070992  B15070999  B15071000  B15071003  B15071004  B15081005  B15081008  B15091012  B15091014R  B15091017  B15091018  B15091019  B15091020  B15091023  B15091024  B15091026  B15091028  B15091030  B15091032  B15101039  B15121049  B15121058  B15121064  B15121072  B16011082  B16011095  B16031115  B16031120  B16041136  B16041138  B16051159  B16081226  B16101239    Serial Numbers: OUS  00110R  00119  00121  00122   00125  00139  00143  00144  00145  00146  00151  00154  00160  00163  00172  00174  00180R  00196  00197  00201  00206  00207  00208R  00213  00216  00217  00220  00223  00228  00230  00231  00233  00237  00241R  00243  00246R  00247  00250  00251  00252  00253  00263  00264  00265  00266  00276  00278  00279  00283  00284  00285  00286  00287  00290  00291  00292  00295  00301  00303  00320  00321  00322  00323  00324  00325  00326R  00328  00329  00330  00331R  00332R  00334  00336  00337  00338  00339  00345  00349  00353  00354  00357  00361  00364  00367  00368  00371  00372  00375  00376  00380  00384  00386  00388  00393  00397  00402  00407  00411  00417  00421  00422  00423  00424  00425  00427  00430  00431  00436  00440  00448  00451  00454  00455  00456R  00460  00463  00464  00467  00468  00472  00478  00481  00482  00483  00486  00491  00492R  00493  00495  00501  00504  00506  00509  00514  00515  00516  00517  00518  00519  00520  00521  00522  00527  00528  00529  00533  00536  00537R  00549  00552  00557  00558R  00559  00563  00565  00571  00575  00577  00580  00585  00589  00590R  00591  00593  00594  00601  00605  00606  00607  00609  00610  00612  613  00615  00616  00619R  00620  00621R  00624  00625  00626  00630  00631  00632  00633  00635  00636  00637  00638  00641  00642  00643  00644  00647  00648  00649  00650  00651  00652  00653  00654  00657  00658  00660  00661  00662  00663  00666R  B13050681  B13050682  B13060683  00684  B13050685  00687  00692  00693  00697  B13060698  00701  00702  00703  B13070710  B13080711  B13080715  B13080716  B13080717  B13080718  B13080719  B13080720  B13090723  B13080724  00725  00728R  00739  00740  00741  00743  00745R  00746  00747  00748  00758  00759  00760  00761  00762  B13120765  B13120770  B14010771  B14010772  B14020773  B14010776  B14010778  B14010779  B14010781  B14010782  B14020784  B14030787  B14020789  B14020790  B14020793  B14020794  B14030798  B14030799  B14030800  B14030801  B14030802  B14030805  B14030806  B14030807  B14040811  B14040812  B14040813  B14050815  00818  B14040820  B14050821  B14050822  B14050823  B14050824  B14050828  B14050829  B14060832  B14060833  B14060834  00837  B14060838  B14070840  00841  B14070843  00844  B14070845  00848  00850  00853  00855  B14080860  00868  B14080869  00870  00892R  B14110897R  B15020929  B15020938  B15030954  00969  00970  00979  00991  00995  00996  B15101034  B15101041  01048  01078  01088  01093  B16011100  B16021102  B16021105  B16021106  B16021111  B16021112  B16031114  01119  B16031126  01130  B16041137  B16041150  B16051155  B16061164  01184  B16061190  B16061196  01202  B16071207  B16071213  B16071215  B16081234  B17031257  B16111259  B16111272  B16111273  B17011287  B17041310  B17101333  B17101445  B17061451  B17061456  B17071466  B17071480  B17081487  B17101496  B17091526  B17121536  B17121544  B17121561  B17121573  B17121576  B17121581  B17121584  B18021586  B18021593  B18021594  B18041601"
