"Devices","No","","82998","Ongoing","GE Healthcare, LLC","3000 N Grandview Blvd","","Waukesha","WI","	53188-1615","United States","Voluntary: Firm initiated","Letter","Worldwide Distribution: US (nationwide) to states of: FL, GA, IL, IN, LA, MA, MO, NJ, NY, OR, PA, SC, SD, TX, and WA; and countries of : Brazil, Canada, Chile, France, French Polynesia, Germany, India, Italy, Japan, Kuwait, Lebanon, Singapore, Spain and United Kingdom.","Z-1910-2019","Class II","Centricity Universal Viewer 6.0    Is a device that displays medical images and data from various imaging sources, and from other healthcare information sources.","145 (87 US 103 OUS)","There is the possibility of viewing studies directly from the Enterprise Archive or VNA with incorrect patient images because the updated series or study is not present in the archive.","05/16/2019","07/01/2019","","07/10/2019","UDI # 840682103800   Model # 2098249-002  Software Version: 6.0.9, 6.0SP9.01, CPACS 6.0 SP9.0.1, UV 6.0 SP9.0.1, UV 6.0 SP9.01.1, UV 6.0 SP9.0.1.2, UV 6.0 SP9.01.3, UV6.0 SP9.01.4, UV 6.0 SP9.01.5, UV 6.0 SP9.0.1.6, UV Version 6.0 SP5.0.4.1, UV Version 6.0 SP9, UV Version 6.0 SP9.0.0.1, UV Version 6.0 SP901, UV Version 6.0 SP9011, and UV Version 6.0 SP902"
"Devices","No","","82998","Ongoing","GE Healthcare, LLC","3000 N Grandview Blvd","","Waukesha","WI","	53188-1615","United States","Voluntary: Firm initiated","Letter","Worldwide Distribution: US (nationwide) to states of: FL, GA, IL, IN, LA, MA, MO, NJ, NY, OR, PA, SC, SD, TX, and WA; and countries of : Brazil, Canada, Chile, France, French Polynesia, Germany, India, Italy, Japan, Kuwait, Lebanon, Singapore, Spain and United Kingdom.","Z-1911-2019","Class II","Centricity PACS Foundation    Centricity PACS software product is intended for the storage, reading, diagnostic review, analysis, annotation, distribution, printing, editing, and processing of digital images and data acquired from diagnostic imaging devices.","92 (47 US 103 OUS)","There is the possibility of viewing studies directly from the Enterprise Archive or VNA with incorrect patient images because the updated series or study is not present in the archive.","05/16/2019","07/01/2019","","07/10/2019","UDI # 840682104807  Model # 2098268-001  Software Version CPACS 6.0 SP9, CPACS 6.0 SP9.0.1 and CPACS 6.0 SP9.0.1.5"
"Devices","No","","82999","Ongoing","Infinium Medical, Inc","12151 62nd St Ste 5","","Largo","FL","	33773-3702","United States","Voluntary: Firm initiated","Two or more of the following: Email, Fax, Letter, Press Release, Telephone, Visit","Distributed nationwide to California, Georgia, Louisiana, Florida, Maryland, Minnesota, Puerto Rico, South Carolina, Virginia, Wisconsin.","Z-1926-2019","Class II","CLEO Patient Monitor /Tranquility VS Patient Monitor","95 devices","The CLEO & Tranquility VS Patient Monitors 510(k) indications for use in the United States did not include the temperature monitor accessory option.","05/31/2019","07/02/2019","","07/10/2019","Serial Numbers - A18094501812, A18014501391, A18014600053, A18014600070, A18014600080, A18014501432, A18014501438, A17074501202, A17084501263, A17024500996, A16054500521, 45000082,  45000084, 45000085, 45000057,45000058, A1 8094501659, A17044501052, A17024500972, A160104500653, A160104500674, A160104500685, A160104500701, A16084500604, A16084500605, A15104500320,  A15 104500407, A15104500257, 45000083, 45000043, 45000044, 45000045, A17024500996, A18094501642, A18094501674, A18094501696, A17074501227, 45000072, 48000001, 48000002, 48000003, A1 8094501639,  A18094501652, A18094501657, A18094501702, A18094501719, A18044600082, A18044600083, A18044600087, A18044600089, A18044600092, A17124501378, A17124501384, A17124501385,  A17124501386, A17124501387, A17024800002, A17024800004, A17024800006, A17024800007, A17024800008, A17024800012, A17024800013, A17024800018, A17024800021, A17024800022,  A17024800024, A17024800028, A17024800030, A1702480003 1, A17024800032, A17024800039, A17024800043, A17024800046, A17024800048, A17024800050, A17024800009, A17024800014,  A17024800015, A17024800016, A17024800017, A17024800019, A17024800020, A17024800025, A17024800026, A17024800027, A17024800029, A17024800033, A17024800034, A17024800037,  A17024800038, A17024800040, A17024800042, A17024800044, A17024800047, A17024800049."
"Devices","No","","83015","Ongoing","Baxter Healthcare Corporation","1 Baxter Pkwy","","Deerfield","IL","	60015-4625","United States","Voluntary: Firm initiated","Letter","US Nationwide Distribution and Internationally to: Canada and Bermuda.","Z-1908-2019","Class II","REVACLEAR 300 Dialyzer, Product Code 114745L     Revaclear 300 and Revaclear 400 dialyzers are indicated for treatment of chronic and acute renal failure by hemodialysis.","1249272 units","There is a potential presence of ruptured dialyzer fibers which may lead to a blood leak during treatment.  ","05/31/2019","07/01/2019","","07/10/2019","UDI 07332414123055  Lot Numbers:  C419105401  C419105501  C419105601  C419105701  C419105801  C419105901  C419106001  C419106101  C419106201  C419106301  C419106401  C419106501  C419106601  C419106701  C419106801  C419106901  C419107001  C419107101  C419107201  C419107301  C419107401  C419107501  C419107601  C419107701  C419107801  C419107901  C419108001  C419108101  C419108201  C419108301  C419108401  C419108501  C419108601  C419108701  C419108801  C419108901  C419109001  C419109101  C419109201  C419109301  C419109401  C419109501  C419109601  C419109801  C419110001  C419110101  C419110201  C419110301  C419110401  C419110501  C419110601  C419110701  C419110801  C419111001  C419111101  C419111301  C419111501  C419111601  C419111701"
"Devices","No","","83015","Ongoing","Baxter Healthcare Corporation","1 Baxter Pkwy","","Deerfield","IL","	60015-4625","United States","Voluntary: Firm initiated","Letter","US Nationwide Distribution and Internationally to: Canada and Bermuda.","Z-1909-2019","Class II","REVACLEAR 400 Dialyzer, Product Code 114746L     Revaclear 300 and Revaclear 400 dialyzers are indicated for treatment of chronic and acute renal failure by hemodialysis.","65403 units","There is a potential presence of ruptured dialyzer fibers which may lead to a blood leak during treatment.  ","05/31/2019","07/01/2019","","07/10/2019","UDI 07332414124076  Lot Numbers:  C419205101  C419205201  C419205301"
"Devices","No","","83024","Ongoing","Zimmer Biomet, Inc.","56 E Bell Dr","","Warsaw","IN","	46582-6989","United States","Voluntary: Firm initiated","Letter","Worldwide Distribution - US Nationwide:  AL, AR, AZ, CA, CO, FL, GA, ID, IL, IN, KS, KY, LA, MA, MD, MI, MN, MO, NC, NE, NJ, NM, NY, OH OK, OR, PA, SC, TN, TX, UT, WA, WI, WV, and Puerto Rico.    Products were distributed to the following foreign countries:  Australia, Canada, Chile, Japan, Netherlands.","Z-1946-2019","Class II","DVR Crosslock ePAK Screw Driver, Model Number 212000002    Product Usage:  These DVR Express Disposable Instruments are used to facilitate implantation of orthopedic medical devices in trauma.  ","3022 total","There is a potential for weak seals of the sterile packaging.","05/28/2019","07/04/2019","","07/10/2019","Lot Numbers: 235471  235472  235473  235474  235475  187762  193492  193493  193494  193495  193496  193565  BF10LBJ  BFI0LBJ  BFI0M9E  BFI0N10  BFI0N11  BFI0P39  I0N0X  I0N0XR  I0N0Y  I0N10  I0N11  I0N5B  I0P39  225207  BFIOLBJ  I0N5P"
"Devices","No","","83024","Ongoing","Zimmer Biomet, Inc.","56 E Bell Dr","","Warsaw","IN","	46582-6989","United States","Voluntary: Firm initiated","Letter","Worldwide Distribution - US Nationwide:  AL, AR, AZ, CA, CO, FL, GA, ID, IL, IN, KS, KY, LA, MA, MD, MI, MN, MO, NC, NE, NJ, NM, NY, OH OK, OR, PA, SC, TN, TX, UT, WA, WI, WV, and Puerto Rico.    Products were distributed to the following foreign countries:  Australia, Canada, Chile, Japan, Netherlands.","Z-1947-2019","Class II","DVR Crosslock ePAK Depth Gauge, Model Number 212000003    Product Usage:  These DVR Express Disposable Instruments are used to facilitate implantation of orthopedic medical devices in trauma.  ","3022 total","There is a potential for weak seals of the sterile packaging.","05/28/2019","07/04/2019","","07/10/2019","Lot Numbers: 226646  230493  231877  232682  235476  BFI0LBKR  187763  193566  BF10LBK  BFA012345  BFI0LBK  BFI0M4H  BFI0M9F  BFI0N13  BFI0N14  BFION15  I0N12  I0N12R  I0N13  BF10M9F  BFIOLBK"
"Devices","No","","83024","Ongoing","Zimmer Biomet, Inc.","56 E Bell Dr","","Warsaw","IN","	46582-6989","United States","Voluntary: Firm initiated","Letter","Worldwide Distribution - US Nationwide:  AL, AR, AZ, CA, CO, FL, GA, ID, IL, IN, KS, KY, LA, MA, MD, MI, MN, MO, NC, NE, NJ, NM, NY, OH OK, OR, PA, SC, TN, TX, UT, WA, WI, WV, and Puerto Rico.    Products were distributed to the following foreign countries:  Australia, Canada, Chile, Japan, Netherlands.","Z-1948-2019","Class II","K-Wire Trochar Tip, Model Number 212000008    Product Usage:  These DVR Express Disposable Instruments are used to facilitate implantation of orthopedic medical devices in trauma.  ","3022 total","There is a potential for weak seals of the sterile packaging.","05/28/2019","07/04/2019","","07/10/2019","Lot Numbers: 187764  193497  193567  232280  232683  232684  232685  232686  233858  234049  235477  BFI0LJ8  BFI0M5B  BFI0MAV  BFI0N16  BFI0NNN  I0N17  I0N18  BFI0LJ8R  BFI0MAVR  BF10LJ8  BF10MAV  BFIOLI8  I0NNN"
"Devices","No","","83040","Ongoing","Bio-Detek, Inc.","525 Narragansett Park Dr","","Pawtucket","RI","	02861-4323","United States","Voluntary: Firm initiated","Letter","Distributed to accounts in AZ, CA, CO, CT, FL, LA, MN, NV, OH, PA, TN, UT, and WY. International distribution to Canada, Germany, France, and Italy.","Z-1945-2019","Class II","ZOLL Pro-padz Liquid Gel Radiolucent, Part numbers: 8900-2105-01 (12/case) and 8900-2106-01 (single)","1789","Some of the electrodes may have been assembled incorrectly, preventing delivery of defibrillation or pacing therapy.","05/28/2019","07/03/2019","","07/10/2019","Lots 1719, 1719A, and 1819"
"Biologics","No","","83048","Terminated","American Natl. Red Cross-Greater Chesapeake & Potomac Region","4700 Mount Hope Dr","","Baltimore","MD","	21215-3200","United States","Voluntary: Firm initiated","Telephone","Pennsylvania; California","B-0706-2019","Class II","Cryoprecipitated AHF","1 unit","Blood products, for which donor eligibility screening was incorrectly performed, were distributed.","04/11/2019","06/28/2019","06/28/2019","07/10/2019","W205318134627"
"Biologics","No","","83069","Terminated","Mississippi Valley Regional Blood Center","1408 W University Ave","","Urbana","IL","	61801-2341","United States","Voluntary: Firm initiated","FAX","Illinois","B-0711-2019","Class II","Red Blood Cells, Leukocytes Reduced","1 unit","Leukoreduced Red Blood Cell product, collected from a donor who lived in a malarial endemic area, was distributed.","04/12/2019","06/28/2019","06/28/2019","07/10/2019","W333518006114"
"Biologics","No","","83077","Terminated","Inova Health Care Services","45745 Nokes Blvd Ste 160","","Sterling","VA","	20166-2493","United States","Voluntary: Firm initiated","FAX","Virginia","B-0712-2019","Class II","Red Blood Cells, Leukocytes Reduced","2 units","Leukoreduced Red Blood Cell products, collected from a donor who traveled to a malarial endemic area, were distributed.","05/15/2019","06/28/2019","06/28/2019","07/10/2019","W089819101410; W089819200231"
"Biologics","No","","83078","Terminated","OneBlood, Inc.","10100 Dr Martin Luther King Jr St N","","St Petersburg","FL","	33716-3806","United States","Voluntary: Firm initiated","FAX","Florida","B-0713-2019","Class II","Apheresis Platelets, Platelet Additive Solution Added, Leukocytes Reduced","2 units","Apheresis Blood product, which was labeled as leukoreduced, but was not tested to verify white blood cell count, was distributed.","05/29/2019","06/28/2019","06/28/2019","07/10/2019","W036819088229 (double collection)"
"Biologics","No","","83080","Terminated","BioLife Plasma Services","5550 Sergeant Rd","","Sioux City","IA","	51106-4716","United States","Voluntary: Firm initiated","Other","Austria","B-0715-2019","Class II","Source Plasma","1 unit","Source Plasma, collected from a donor who received a tattoo within one year of donation, was distributed.","04/30/2019","06/28/2019","06/28/2019","07/10/2019","18SIAD9696"
"Devices","No","","83081","Ongoing","Siemens Medical Solutions USA, Inc","40 Liberty Blvd","","Malvern","PA","	19355-1418","United States","Voluntary: Firm initiated","E-Mail","US Nationwide distributed in the states of AK, AL, AZ, CA, CO, CT, DC, FL, GA, IA, IL, IN, KS, LA, MA, MD, MI, MN, MO, MS, MT, NC, NE, NJ, NY, OH, PA, SC, TX, VA, WA, WI, and Puerto Rico.","Z-1915-2019","Class II","SOMATOM go.Up (Model #11061610) with syngo.CT software versions VA20A, VA20A_SP0, VA20_SP1. Product Usage: This computed tomography system is intended to generate and process cross-sectional images of patients by computer reconstruction of x-ray transmission data. The images delivered by the system can be used by a trained physician as an aid in diagnosis. The images delivered by the system can be used by trained staff as an aid in diagnosis, treatment preparation and radiation therapy planning. This CT system can be used for low dose lung cancer screening in high risk populations. High risk populations are as defined by professional medical societies.","9","The potential sporadic performance problems may result in scanning workflow interruptions and unexpected user  notifications.  This may cause a delay in diagnosis or patient scans.","05/28/2019","07/02/2019","","07/10/2019","Serial Number: 112552  112551  112555  112519  112542  112545  112541  112536  112573"
"Devices","No","","83081","Ongoing","Siemens Medical Solutions USA, Inc","40 Liberty Blvd","","Malvern","PA","	19355-1418","United States","Voluntary: Firm initiated","E-Mail","US Nationwide distributed in the states of AK, AL, AZ, CA, CO, CT, DC, FL, GA, IA, IL, IN, KS, LA, MA, MD, MI, MN, MO, MS, MT, NC, NE, NJ, NY, OH, PA, SC, TX, VA, WA, WI, and Puerto Rico.","Z-1916-2019","Class II","SOMATOM go.Now (Model #11061620), with syngo.CT software versions VA20A, VA20A_SP0, VA20_SP1.  Product Usage: This computed tomography system is intended to generate and process cross-sectional images of patients by computer reconstruction of x-ray transmission data. The images delivered by the system can be used by a trained physician as an aid in diagnosis. The images delivered by the system can be used by trained staff as an aid in diagnosis, treatment preparation and radiation therapy planning. This CT system can be used for low dose lung cancer screening in high risk populations. High risk populations are as defined by professional medical societies.","53","The potential sporadic performance problems may result in scanning workflow interruptions and unexpected user  notifications.  This may cause a delay in diagnosis or patient scans.","05/28/2019","07/02/2019","","07/10/2019","Serial Number: 111379  111374  111307  111225  111313  111350  111306  111281  111323  111219  111232  111271  111351  111369  111332  111370  111266  111371  111355  111310  111308  111328  111345  111310  111319  111286  111378  111338  111236  111352  111324  111344  111233  111368  111366  111230  111299  111315  111273  111249  111373  111289  111250  111317  111333  111297  111237  111341  111367  111303  111293  111302  111277"
"Devices","No","","83081","Ongoing","Siemens Medical Solutions USA, Inc","40 Liberty Blvd","","Malvern","PA","	19355-1418","United States","Voluntary: Firm initiated","E-Mail","US Nationwide distributed in the states of AK, AL, AZ, CA, CO, CT, DC, FL, GA, IA, IL, IN, KS, LA, MA, MD, MI, MN, MO, MS, MT, NC, NE, NJ, NY, OH, PA, SC, TX, VA, WA, WI, and Puerto Rico.","Z-1917-2019","Class II","SOMATOM go.All (Model #11061630), with syngo.CT software versions VA20A, VA20A_SP0, VA20_SP1.  Product Usage: This computed tomography system is intended to generate and process cross-sectional images of patients by computer reconstruction of x-ray transmission data. The images delivered by the system can be used by a trained physician as an aid in diagnosis. The images delivered by the system can be used by trained staff as an aid in diagnosis, treatment preparation and radiation therapy planning. This CT system can be used for low dose lung cancer screening in high risk populations. High risk populations are as defined by professional medical societies.","24","The potential sporadic performance problems may result in scanning workflow interruptions and unexpected user  notifications.  This may cause a delay in diagnosis or patient scans.","05/28/2019","07/02/2019","","07/10/2019","Serial Number: 117515  117476  117529  117492  117501  117515  117500  117522  117523  117484  117498  117517  117512  117505  117479  117516  117510  117495  117482  117521  117496  117508  117533  117483"
"Devices","No","","83081","Ongoing","Siemens Medical Solutions USA, Inc","40 Liberty Blvd","","Malvern","PA","	19355-1418","United States","Voluntary: Firm initiated","E-Mail","US Nationwide distributed in the states of AK, AL, AZ, CA, CO, CT, DC, FL, GA, IA, IL, IN, KS, LA, MA, MD, MI, MN, MO, MS, MT, NC, NE, NJ, NY, OH, PA, SC, TX, VA, WA, WI, and Puerto Rico.","Z-1918-2019","Class II","SOMATOM go.Top (Model #1161640), with syngo.CT software versions VA20A, VA20A_SP0, VA20_SP1.  Product Usage: This computed tomography system is intended to generate and process cross-sectional images of patients by computer reconstruction of x-ray transmission data. The images delivered by the system can be used by a trained physician as an aid in diagnosis. The images delivered by the system can be used by trained staff as an aid in diagnosis, treatment preparation and radiation therapy planning. This CT system can be used for low dose lung cancer screening in high risk populations. High risk populations are as defined by professional medical societies.","30","The potential sporadic performance problems may result in scanning workflow interruptions and unexpected user  notifications.  This may cause a delay in diagnosis or patient scans.","05/28/2019","07/02/2019","","07/10/2019","Serial Number: 119103  119090  119098  119086  119081  119115  119125  119145  119148  119119  119132  119123  119133  119084  119085  119088  119087  119141  119083  119143  119153  119122  119120  119093  119109  119111  119144  119152  119142  119147"
"Devices","No","","83082","Ongoing","Siemens Medical Solutions USA, Inc","40 Liberty Blvd","","Malvern","PA","	19355-1418","United States","Voluntary: Firm initiated","Letter","Nationwide","Z-1894-2019","Class II","Siemens Artis zee floor -Interventional Fluoroscopic X-Ray System  Model Number: 10094135","63","Artis Zee, Artis Q, Artis Pheno or Artis Icono systems equipped with a DCS Extended or DCS Movable, the potential exists for individual screws of the screwed connection joining the pivot bearing to the ceiling-mounted support to work loose or snap off,  can result in severe injuries to patients and operating personnel","06/06/2019","06/28/2019","","07/10/2019","Serial Numbers:  135954  136032  136077  136043  136190  136197  136168  136143  136234  136383  136242  136393  136128  136147  136350  136256  136314  136548  136550  136557  136558  137165  137119  136607  137388  137231  137471  137591  137245  137369  137347  137329  137391  137479  137425  124006  138061  137461  137518  137567  137582  137667  137595  137656  138104  138190  124116  137714  124119  138012  138070  138017  138058  138194  138156  138214  138128  138180  138188  138260  138268  138311  138259"
"Devices","No","","83082","Ongoing","Siemens Medical Solutions USA, Inc","40 Liberty Blvd","","Malvern","PA","	19355-1418","United States","Voluntary: Firm initiated","Letter","Nationwide","Z-1895-2019","Class II","Siemens Artis zee ceiling -Interventional Fluoroscopic X-Ray System  Model Number: 10094137","276","Artis Zee, Artis Q, Artis Pheno or Artis Icono systems equipped with a DCS Extended or DCS Movable, the potential exists for individual screws of the screwed connection joining the pivot bearing to the ceiling-mounted support to work loose or snap off,  can result in severe injuries to patients and operating personnel","06/06/2019","06/28/2019","","07/10/2019","Serial Numbers:  147208  146637  146395  146728  146942  146697  146663  146731  146945  146774  146784  146866  147186  146867  146692  146869  146759  146776  146775  146797  146871  146801  146857  146803  146886  146758  146806  146851  146929  147157  146971  146919  146969  146973  146925  147695  146948  146964  147046  146861  147123  146883  147216  147866  146888  146955  147214  146921  147931  147100  146928  146946  147030  146983  146899  147089  146975  146963  146986  146960  146898  146937  146918  147047  146977  146993  147035  146982  147075  147084  146991  147114  147023  147233  147049  147036  147093  147009  147500  146996  147029  147174  147766  147113  147241  147083  147087  147124  147120  147119  147172  147692  147693  147775  147165  147167  147303  147079  147203  147107  147168  147144  147237  147240  147236  147239  147243  147234  147190  147175  147515  147559  147250  147254  147253  147252  147251  147649  147612  147557  147507  147516  147585  147528  147573  147264  147620  147558  147526  147604  147646  147581  147608  147849  147583  147553  147601  147659  147644  147701  147666  147635  147625  147905  147660  147842  147577  147587  147621  147670  147700  147662  147718  147737  147887  147676  147717  147783  147709  147364  125111  147734  147753  147893  147763  147956  147958  147957  147373  147955  147749  147760  147761  147821  147889  147847  147833  125003  147773  147800  147838  147816  147862  147921  147795  147926  147928  147925  147940  147880  147841  148274  147938  147891  148282  148242  148240  148239  125230  147894  147909  147882  148327  147896  147937  147892  147919  147910  147982  147923  147936  147954  147934  147952  147983  147992  125008  148375  147974  125010  125105  125106  125109  125100  148001  147977  148010  148230  125112  148022  148020  148235  148220  148029  148278  148025  148030  148285  125239  125208  125219  125212  148254  148318  148335  125115  125214  148352  148341  148326  125228  125227  125222  125210  125250  125226  125245  125254  148348  148316  125243  125240  148333  125244  125235  125232  148409  148407  148349  148384  148404  148382  148400  125253  125249  148423"
"Devices","No","","83082","Ongoing","Siemens Medical Solutions USA, Inc","40 Liberty Blvd","","Malvern","PA","	19355-1418","United States","Voluntary: Firm initiated","Letter","Nationwide","Z-1896-2019","Class II","Siemens Artis zee biplane-Interventional Fluoroscopic X-Ray System  Model Number: 10094141","120","Artis Zee, Artis Q, Artis Pheno or Artis Icono systems equipped with a DCS Extended or DCS Movable, the potential exists for individual screws of the screwed connection joining the pivot bearing to the ceiling-mounted support to work loose or snap off,  can result in severe injuries to patients and operating personnel","06/06/2019","06/28/2019","","07/10/2019","Serial Numbers:  153883  154041  153640  153772  154007  153870  153762  153700  153797  153827  153898  153779  153869  153952  153736  153829  153763  153998  153819  153758  153928  153760  153865  153903  153908  154592  153863  154785  154079  153988  153882  153831  153939  153875  153847  153930  153913  153890  153922  153992  153916  153975  154012  153947  154076  154086  154058  154028  154073  154048  154034  153987  154093  154090  154074  154052  154075  154406  154408  154459  154425  154423  154502  154084  154579  154546  154085  154471  154453  154097  154098  154544  154663  154576  154572  154560  154584  154571  154096  154514  154556  154509  154731  154536  154564  154739  154596  155147  154783  154653  154732  154687  154685  154779  154708  155150  154709  154715  154789  131011  131224  154800  131013  155119  131101  154814  131105  155122  131108  131110  155126  155131  155148  155189  131223  155195  131219  155203  155235  131231"
"Devices","No","","83082","Ongoing","Siemens Medical Solutions USA, Inc","40 Liberty Blvd","","Malvern","PA","	19355-1418","United States","Voluntary: Firm initiated","Letter","Nationwide","Z-1897-2019","Class II","Siemens Artis zeego--Interventional Fluoroscopic X-Ray System  Model Number: 10280959","29","Artis Zee, Artis Q, Artis Pheno or Artis Icono systems equipped with a DCS Extended or DCS Movable, the potential exists for individual screws of the screwed connection joining the pivot bearing to the ceiling-mounted support to work loose or snap off,  can result in severe injuries to patients and operating personnel","06/06/2019","06/28/2019","","07/10/2019","Serial Numbers:  160335  160430  160368  160469  160357  160370  160369  160509  160427  160433  160443  160428  160429  160463  160001  160461  160486  160800  160487  160488  160507  160840  160862  160856  160823  160914  160930  161235  160401"
"Devices","No","","83082","Ongoing","Siemens Medical Solutions USA, Inc","40 Liberty Blvd","","Malvern","PA","	19355-1418","United States","Voluntary: Firm initiated","Letter","Nationwide","Z-1898-2019","Class II","Siemens Artis Q floor --Interventional Fluoroscopic X-Ray System  Model Number: 10848280","12","Artis Zee, Artis Q, Artis Pheno or Artis Icono systems equipped with a DCS Extended or DCS Movable, the potential exists for individual screws of the screwed connection joining the pivot bearing to the ceiling-mounted support to work loose or snap off,  can result in severe injuries to patients and operating personnel","06/06/2019","06/28/2019","","07/10/2019","Serial Numbers:  103008  103030  103028  103258  103221  103222  103277  103220  103279  103285  103286  103295"
