Product Type,Recently Updated Record,Last Modified Date,Event ID,Status,Recalling Firm,Address1,Address2,City,State/Province,Postal Code,Country,Voluntary/Mandated,Initial Firm Notification of Consignee or Public,Distribution Pattern,Recall Number,Classification,Product Description,Product Quantity,Reason for Recall,Recall Initiation Date,Center Classification Date,Termination Date,Report Date,Code Info,More Code Info
"Food","No","","64466","Terminated","Lion Pavilion Ltd.","56-15 58th St","","Maspeth","NY","	11378-1113","United States","Voluntary: Firm Initiated","Press Release","Nationwide (according to press release)","F-2847-2015","Class I","Grassplot Ginger Slice, NET WT. 3.5 OZ. (100g) , UPC 7246 6247, PRODUCT OF CHINA ---  Firms on label: Manufactory: Grassplot Foodstuff Factory  ADD: Huangshan Road, Huangshan Mansion, suite 417 Shantou, Guangdong, China -- Distributed by: LION PAVILION LIMITED --- Nutrition Facts: Serving Size 25 g   Servings Per Container 4 ---  The product is packaged in a clear plastic bottle.","UNKNOWN","The product contained undeclared sulfites (735 ppm) based on sampling and analysis by New York State Department of Agriculture & Markets.","02/22/2013","07/14/2015","07/14/2015","07/22/2015","UPC 7246 6247 and no other coding"
"Food","No","","71381","Terminated","Ungar's Food Products, Inc.","9 Boumar Pl","","Elmwood Park","NJ","	07407","United States","Voluntary: Firm Initiated","Two or more of the following: Email, Fax, Letter, Press Release, Telephone, Visit","Nationwide","F-2852-2015","Class I","Dr. Praeger's California Veggie Burgers Gluten Free 11 oz. Manufactured by Dr. Praeger's Sensible Foods Elmwood Park, NJ 07047 www.drpraegers.com Made in the USA  UPC  080868000602","11,400 boxes","Dr. Praeger's Gluten Free California Burgers contain undeclared soy.","06/01/2015","07/15/2015","04/21/2016","07/22/2015","Case Lot F15BC-04A   Retail Box Lot # F15BC"
"Food","No","","71616","Terminated","Vitamin Cottage Natural Food Markets, Inc.","12612 W Alameda Pkwy","","Lakewood","CO","	80228-2824","United States","Voluntary: Firm Initiated","Two or more of the following: Email, Fax, Letter, Press Release, Telephone, Visit","Nationwide to Washington, Oregon, Idaho, Montana, Wyoming, Nevada, Utah, Arizona, New Mexico, Colorado, Texas, Oklahoma, Kansas, Nebraska, Missouri, Arkansas.  No foreign/govt/VA/military consignees.","F-2854-2015","Class I","Natural Grocers Caribbean Fruit & Nut Mix, Net Wt. (10 oz) (283g), packaged in plastic bag.","504 bags","Vitamin Cottage Natural Food Markets, Inc is recalling one lot of Natural Grocers brand Caribbean Nut & Fruit Mix as the product contains macadamia nuts that have the potential to be contaminated with Salmonella.","06/26/2015","07/16/2015","12/15/2015","07/22/2015","packed on date 15-148"
"Biologics","No","","38767","Terminated","The American National Red Cross South Carolina Region","2751 Bull St","","Columbia","SC","	29201-1725","United States","Voluntary: Firm Initiated","Telephone","CA & SC","B-0745-15","Class II","Red Blood Cells Leukocytes Reduced","1 unit","Blood products, collected from a donor for whom donor suitability was not adequately determined, were distributed.","06/26/2007","07/13/2015","07/13/2015","07/22/2015","36GQ40104"
"Biologics","No","","40285","Terminated","LifeSouth Community Blood Centers, Inc.","1200 McEver Rd Ext","","Gainesville","GA","	30504-3930","United States","Voluntary: Firm Initiated","Other","GA","B-0743-15","Class II","Red Blood Cells","1 unit","Blood products, collected in a manner that may have compromised the sterility of the collection system, were distributed.","05/31/2005","07/13/2015","07/13/2015","07/22/2015","71P792984"
"Biologics","No","","49268","Terminated","LifeSouth Community Blood Center, Inc","1200 McEver Rd Ext","","Gainesville","GA","	30504-3930","United States","Voluntary: Firm Initiated","FAX","GA","B-0744-15","Class II","Platelets Pheresis Leukocytes Reduced","1 unit","Blood product, which did not meet acceptable product specifications, was distributed","06/20/2008","07/13/2015","07/13/2015","07/22/2015","72H231424"
"Biologics","No","","69200","Terminated","Delta Blood Bank","65 N Commerce St","","Stockton","CA","	95202-2318","United States","Voluntary: Firm Initiated","FAX","CA and IN","B-0741-15","Class II","Red Blood Cells Leukocytes Reduced","1 unit","Blood products, collected from a donor who was at risk for variant Creutzfeldt-Jakob disease (vCJD), were distributed.","07/18/2014","07/13/2015","07/13/2015","07/22/2015","W128714061801"
"Biologics","No","","69200","Terminated","Delta Blood Bank","65 N Commerce St","","Stockton","CA","	95202-2318","United States","Voluntary: Firm Initiated","FAX","CA and IN","B-0742-15","Class II","Recovered Plasma","1 unit","Blood products, collected from a donor who was at risk for variant Creutzfeldt-Jakob disease (vCJD), were distributed.","07/18/2014","07/13/2015","07/13/2015","07/22/2015","W128714061801"
"Devices","No","","69760","Terminated","Breas Medical AB","Foretagsvagen 1","","Molnlycke","","	","Sweden","Voluntary: Firm Initiated","E-Mail","Worldwide - United States Nationwide Distribution and the countries: Argentina, Belgium, Chile, Cyprus, Denmark, Ecuador, Finland, France, Germany, Greece, Hong Kong, India, Ireland, Israel, Italy, Japan, Kuwait, Lebanon, Malaysia, Netherlands, Norway, Panama, Poland, Portugal, Russia, Saudi Arabia, Serbia, Singapore, Slovenia, Spain, Sweden, Switzerland, Thailand, Turkey, UAE and United Kingdom.","Z-2094-2015","Class II","Breas Vivo 50 Home Care Ventilator     Product Usage:  Respiratory Care  ","846 US","Unintended treatment termination could result from a keypad malfunction in some situations. The device erroneously interprets this as a Stop Treatment Instruction. An alarm will not sound, or be registered. Accessories and monitoring equipment connected to the Vivo 50 will stop functioning as the device enters stand-by mode.","11/07/2014","07/16/2015","04/07/2016","07/22/2015","All Vivo 50 Ventilators (215000, 215016) with firmware version 2.04"
"Devices","No","","69804","Terminated","Northern Digital Inc.","103 Randall Drive","","Waterloo","Ontario","	","Canada","Voluntary: Firm Initiated","Letter","US Nationwide Distribution","Z-2084-2015","Class II","NDI Disposable Reflective Marker Spheres for Brainlab IGS (Image Guided Surgical) system.      Product Usage:  Disposable reflective marker spheres are attached to reference arrays and instruments, thus enabling the infrared tracking systems to detect the position of the patient and instruments in the surgical field.  ","524, 700 spheres (41773 = 440,820 spheres; 41774 = 77,760 spheres and 41813 = 6,120 spheres)","Inadequate curing of adhesive, may cause the two halves of the spheres to separate.","06/10/2015","07/15/2015","10/03/2016","07/22/2015","1) Catalog Number: 41773 (90 pack) All Lots beginning with the prefix C / All expiration dates; 2) Catalog Number: 41774 (270 pack) All Lots beginning with the prefix C / All expiration dates; and 3) Catalog Number: 41813 (60 pack) All Lots beginning with the prefix C / All expiration dates"
"Devices","No","","70684","Terminated","Maquet Cardiovascular Us Sales, Llc","45 Barbour Pond Drive","","Wayne","NJ","	07470","United States","Voluntary: Firm Initiated","Letter","Worldwide Distribution - US (nationwide) and Internationally to Australia, Belgium, Brazil, China, Colombia, Croatia, Czech Republic, Ecuador, Finland, France, Germany, Hong Kong, India, Israel, Japan, Mexico, Netherlands, Peru, Poland, Portugal, Romania, Russia, Serbia, Singapore, South Africa, South Korea, Spain, Sweden, Switzerland, Taiwan, Thailand and United Arab Emirates.","Z-2083-2015","Class II","The FLOW-i Anesthesia System Axillary O2 and Suction Module, Device Part number: 66 79 847   FLOW-i Anesthesia System: Is indicated for administering inhalation anesthesia while controlling the entire ventilation of patients with no ability to breathe, as well as in supporting patients with a limited ability to breathe.The system is intended for use in a wide range of population: from neonatal to adult patients. The system is intended for use in hospital environments, except for the MRI environment, by healthcare professionals trained in inhalation anesthesia administration. Auxiliary O2 and Suction Module: Is an option available for the FLOW-i Anesthesia System. The module contains two main parts: Flowmeter unit: The intended use of the flowmeter is to provide oxygen for patient therapy. Suction unit: The intended use is to extract body fluids from the stomach and airways.","104 units","Maquet has identified that in some FLOW-i Anesthesia System Auxiliary O2 and Suction Modules, the suctioning function cannot be activated or controlled by the suction unit on/off switch leading to a decrease or loss of suctioning capability of the modules.","03/02/2015","07/15/2015","04/29/2016","07/22/2015","Device Part number: 66 79 847  Serial Numbers: 4, 14-24, 26-29, 31, 37, 40, 56, 138, 199, 205, 367, 369-372, 391, 394-395, 416, 466-491, 517, 519, 525, 567-568, 570, 582-583, 606, 613, 619, 627, 629-631, 633, 635-641, and 643-665"
"Devices","No","","70783","Terminated","Owen Mumford USA, Inc.","1755 W Oak Commons Ct","","Marietta","GA","	30062-2280","United States","Voluntary: Firm Initiated","Letter","Nationwide Distribution including FL, IL, NV, NJ, OH, and TN.","Z-2082-2015","Class II","Autopen Classic Automatic insulin delivery pen, 3.0ml x 2 unit 2-42 units, AN3800, Lot 7JH, NDC 08470-3800-01,    The product is a non-sterile automatic subcutaneous injection device which delivers insulin.","225 units","The dials in the Autopens are not working - the dial does not stay dialed, but springs right back to 0.  As a result, the patient could not dial up a dose of medicine to deliver via an injection.","12/11/2014","07/15/2015","07/11/2017","07/22/2015","Lot 7JH, UPC Code 384703800014"
"Food","No","","71189","Terminated","Tortilleria Provincia","1200 Clay St Unit B","","Bowling Green","KY","	42101-2025","United States","Voluntary: Firm Initiated","Two or more of the following: Email, Fax, Letter, Press Release, Telephone, Visit","Product was shipped to KY & OH","F-2849-2015","Class II","Tortilleria Provincia Refrigerate After Purchase White Corn Tortillas, Net Wt. 16 oz, 0 89780 10000 1 & 64 oz, 0 89780 10001 8, Tortilleria Provincia, 1200 B Clay St. Bowling Green, KY 42101 (270) 842-7733","732/64 oz bag","The firm used the same label clear plastic bags with Nutrition Facts and Ingredients listed for all three type corn tortillas (Yellow, White, and Blue); the color Yellow # 2 was written in lieu of Yellow # 6 for the Blue corn tortilla; additional color ingredients (FD&C BLUE No. 1, FD&C YELLOW No. 2, FD&C RED N. 40, SODIUM BENZOATE) are included for the White and Yellow corn tortillas.","05/06/2015","07/15/2015","11/19/2015","07/22/2015","04-04-15/ - 05/10/15; 04-29-15  05/3015; 05-02-15  06/1215"
"Food","No","","71189","Terminated","Tortilleria Provincia","1200 Clay St Unit B","","Bowling Green","KY","	42101-2025","United States","Voluntary: Firm Initiated","Two or more of the following: Email, Fax, Letter, Press Release, Telephone, Visit","Product was shipped to KY & OH","F-2850-2015","Class II","Tortilleria Provincia Refrigerate After Purchase Yellow Corn Tortillas, Net Wt. 16 oz, 0 89780 10000 1 & 64 oz, 0 89780 10001 8, Tortilleria Provincia, 1200 B Clay St. Bowling Green, KY 42101 (270) 842-7733","310/64 oz bag","The firm used the same label clear plastic bags with Nutrition Facts and Ingredients listed for all three type corn tortillas (Yellow, White, and Blue); the color Yellow # 2 was written in lieu of Yellow # 6 for the Blue corn tortilla; additional color ingredients (FD&C BLUE No. 1, FD&C YELLOW No. 2, FD&C RED N. 40, SODIUM BENZOATE) are included for the White and Yellow corn tortillas.","05/06/2015","07/15/2015","11/19/2015","07/22/2015","04-04-15/ - 05/10/15; 04-29-15  05/3015; 05-02-15  06/1215"
"Food","No","","71189","Terminated","Tortilleria Provincia","1200 Clay St Unit B","","Bowling Green","KY","	42101-2025","United States","Voluntary: Firm Initiated","Two or more of the following: Email, Fax, Letter, Press Release, Telephone, Visit","Product was shipped to KY & OH","F-2851-2015","Class II","Tortilleria Provincia Refrigerate After Purchase Blue Corn Tortillas, Net Wt. 16 oz, 0 89780 10000 1 & 64 oz, 0 89780 10001 8, Tortilleria Provincia, 1200 B Clay St. Bowling Green, KY 42101 (270) 842-7733","96/64 oz bags & 12/16 oz bags","The firm used the same label clear plastic bags with Nutrition Facts and Ingredients listed for all three type corn tortillas (Yellow, White, and Blue); the color Yellow # 2 was written in lieu of Yellow # 6 for the Blue corn tortilla; additional color ingredients (FD&C BLUE No. 1, FD&C YELLOW No. 2, FD&C RED N. 40, SODIUM BENZOATE) are included for the White and Yellow corn tortillas.","05/06/2015","07/15/2015","11/19/2015","07/22/2015","04-04-15/ - 05/10/15; 04-29-15  05/3015; 05-02-15  06/1215"
"Devices","No","","71271","Terminated","Stryker Instruments Div. of Stryker Corporation","4100 E Milham Ave","","Portage","MI","	49002-9704","United States","Voluntary: Firm Initiated","Letter","Nationwide Distribution-including the states of FL, IA, IL, IN, LA, MD, MN, MO, NC, NM, NY, PA, TN, TX, VA, and WI.","Z-2062-2015","Class II","0210-312-000-Woundcare Replacement kit with soft tip; 0210-318-000; Woundcare Replacement with fan tip; 0210-318-100- Woundcare Replacement Kit; 0210-318-200-Woundcare Replacement with retract coax tip.  Accessory to Stryker InterPulse Irrigation System, used for wound debridement, soft tissue debridement, and cleansing of medical, clinical, or surgical sites.","5,328 each (444 boxes)","Potential sterility breach in the packaging.  ","05/08/2015","07/13/2015","10/19/2015","07/22/2015","0210-312-000: 12138012, 12203012, 12229012, 12256012, 12293012, 12314012, 12338012, 13086012, 13140012, 13192012;  0210-318-000: 14140012,14258012;  0210-318-100: 12294012,13051012;  0210-318-200: 12143012, 12293012, 13066012, 14037012, 14112012"
"Devices","No","","71350","Terminated","Northern Digital Inc.","103 Randall Drive","","Waterloo","Ontario","	","Canada","Voluntary: Firm Initiated","Two or more of the following: Email, Fax, Letter, Press Release, Telephone, Visit","Worldwide - US Nationwide Distribution and the countries of Australia and Canada.","Z-2093-2015","Class II","NDI Disposable Reflective Marker Spheres for Brainlab IGS (Image Guided Surgery) system.    Product Usage:  Disposable reflective marker spheres are attached to reference arrays and instruments, thus enabling the infrared tracking systems to detect the position of the patient and instruments in the surgical field.  ","32,400 spheres","Inadequate curing of adhesive, which may cause the two halves of the spheres to separate.","05/20/2015","07/16/2015","10/13/2017","07/22/2015","1) Catalog Number: 41773 (90 pack) Lot # C102061501"
