"Biologics","No","","71388","Terminated","Lane Memorial Blood Bank","2211 Willamette St","","Eugene","OR","	97405-2847","United States","Voluntary: Firm Initiated","E-Mail","Korea, Republic Of(South)","B-0730-15","Class II","Blood and Blood Products for Reprocessing","1 unit","Blood product, collected from a donor who was at risk for variant Creutzfeldt-Jakob disease (vCJD), was distributed.","04/23/2015","07/13/2015","07/13/2015","07/22/2015","W137515201010"
"Biologics","No","","71389","Terminated","Blood Systems, Inc. dba United Blood Services Texas","424 S Mesa Hills Dr","","El Paso","TX","	79912-5441","United States","Voluntary: Firm Initiated","Other","Switzerland","B-0731-15","Class II","Blood and Blood Products for Reprocessing","1 unit","Blood products, collected from a donor who was at risk for variant Creutzfeldt-Jakob disease (vCJD), were distributed.","04/24/2015","07/13/2015","07/13/2015","07/22/2015","W0411140812078"
"Biologics","No","","71391","Terminated","American National Red Cross (The)","4860 Sheboygan Ave","","Madison","WI","	53705-2902","United States","Voluntary: Firm Initiated","FAX","IA; TX; WI; IL","B-0729-15","Class II","Platelets Pheresis Leukocytes Reduced","17 units","Blood products, which did not meet the acceptable product specifications, were distributed.","04/08/2015","07/13/2015","07/13/2015","07/22/2015","W203215849532; W2032158495321; W203215849538; W203215849545; W2032158495451; W2032158495452; W203215849549; W203215849555; W2032158495551; W2032158495552; W203215849562; W2032158495621; W2032158495622; W203215849568; W2032158495681; W203215849572; W2032158495721"
"Devices","No","","71407","Terminated","Omnilife Science Inc.","50 Oconnell Way Ste 10","","East Taunton","MA","	02718-1394","United States","Voluntary: Firm Initiated","Letter","US Nationwide Distribution in the states of: UT, CA, FL, TX, MA, GA, OK, VA, CT, OK, and WY.","Z-2064-2015","Class II","Apex ARC Hip Stem, HA Coated, Size 5; Product Code: HC-21005-HA    Product Usage:  The Apex ARC Hip Stem is the femoral component of a primary or revision total hip replacement. This femoral hip stem is intended for press-fit application and is provided sterile for single use. They are manufactured from titanium alloy. The stem has a proximal porous coating of titanium plasma spray under a coating of hydroxyapatite (HA)  ","146 devices","Product may breach the inner and outer sterile pouches during shipping or handling.","06/03/2015","07/14/2015","09/08/2015","07/22/2015","Lot Numbers:  5679, 5777, 7420, 7588, 7787, 8369, 8605, 8869, 9485, 9688, 18070"
"Drugs","No","","71409","Terminated","Fresenius Kabi USA, LLC","3 Corporate Dr","","Lake Zurich","IL","	60047-8930","United States","Voluntary: Firm Initiated","Letter","Nationwide,Hawaii, and Puerto Rico","D-1234-2015","Class II","Rifampin for Injection, USP 600mg/vial in a 20mL vial, Rx only, Manufactured for Fresenius Kabi LLC 3 Corporate Drive, Lake Zurich, IL, 60047, by Fresenius Kabi LLC, 2020 N Ruby Street, Melrose Park, IL 60160. NDC 63323-351-20      ","7,593 vials","Failed Impurities/Degradation Specifications; out-of-specification for color, impurity, and degradation","06/04/2015","07/14/2015","05/19/2016","07/22/2015","Lot #:  6109469, 6109470, Exp 10/2016"
"Food","No","","71422","Terminated","Kraft Foods North America","2901 Missouri Ave","","Granite City","IL","	62040-2032","United States","Voluntary: Firm Initiated","Telephone","The product was distributed to Sams Club Distribution Center, located at 1325 Central Ave, University Park, IL 60484.","F-2853-2015","Class II","CapriSun Variety Pack, with a multi colored plastic wrap with white and yellow lettering, covering 4 cartons. The 4 cartons consist of fruit punch (the effected product), wild cherry, pacific cooler, and strawberry kiwi.Fruit Punch Flavored Juice Drink Blend in a blue box with white lettering and fruit pictures. The carton contains 10,6 oz pouches.","1, 056 cases, 4 cartons per case, 10 pouches per carton.","Possible brass fragments in Capri Sun Fruit Punch Flavored Juice Drink Blend.","06/05/2015","07/15/2015","08/29/2016","07/22/2015","code date: 27 MAY 2016  UPC code for the case: 087684004449  UPC code for the carton of Fruit Punch Flavored Juice Drink Blend: 087684001073"
"Devices","No","","71423","Terminated","Biomet, Inc.","56 E Bell Dr","","Warsaw","IN","	46582-6989","United States","Voluntary: Firm Initiated","Letter","Domestic: None.    International:  Netherlands and Japan","Z-2058-2015","Class II","A.L.P.S., 3.5mm x 60 mm Cortical Locking Screw. Bone fixation screw","50 units","Sterile packaging was not sealed.  The implantation of an unsterile screw may lead to infection.","06/04/2015","07/10/2015","03/22/2016","07/22/2015","Part number:856135060  Lot: 061300"
"Food","No","","71458","Terminated","Khara Enterprises, LLC","1155 SW Division St Ste B12","","Bend","OR","	97702-1771","United States","Voluntary: Firm Initiated","Visit","distributed in Oregon","F-2842-2015","Class II","Baked Samosa Sweet Potato (Baked Indian pastry with a savory filling), Frozen package, Net wt. 7.5 oz., No UPC","12/7.5 oz. packages","Indian pastry Baked Samosa (sweet potato) is recalled due to undeclared soy lecithin.  The firm used a pan release Canola cooking oil spray which contains soy lecithin but finished product's label does not declare soy.","06/08/2015","07/10/2015","07/17/2015","07/22/2015","None"
"Devices","No","","71492","Terminated","Synthes (USA) Products LLC","1301 Goshen Pkwy","","West Chester","PA","	19380-5986","United States","Voluntary: Firm Initiated","Letter","Nationwide Distribution.","Z-2091-2015","Class II","Helical Blade Inserter for Trochanteric Fixation Nail-ADVANCED (TFNA); intended to secure the head element to the head element inserter to prevent disengagement during head element insertion.  Manual orthopedic surgical instrument.","32","The height of one of the three guiding pins of the Helical Blade Inserter for the TFNA is oversized. The Helical Blade Inserter is therefore unable to pass through the Blade/Screw Guide Sleeve (part 03.037.017).","06/10/2015","07/16/2015","08/18/2016","07/22/2015","Part Number Lot Numbers  03.037.024                       T102759"
"Devices","No","","71501","Terminated","Exactech, Inc.","2320 NW 66th Ct","","Gainesville","FL","	32653-1630","United States","Voluntary: Firm Initiated","Telephone","Nationwide Distribution to Florida only.","Z-2070-2015","Class II","Exactech Ambassador Cervical Plate System   The Exactech Ambassador Cervical Place System is intended for anterior cervical fixation (C2-T1) for the following: degenerative disc disease (DDD) (defined as neck pain of discogenic origin with degeration of the disc confirmed by history and radiographic studies), spondylolisthesis, trauma (i.e. fracture or dislocation), spinal stenosis, deformities or curvatures (i.e., scoliosis, kyphosis, and/or lordosis), tumor, pseudoarthrosis, and failed previous fusion.","4 devices.","Shipped to a single consignee prior to completion of final inspection.","05/21/2015","07/14/2015","07/16/2015","07/22/2015","Catalog Number 05-100-03-0042, Lot # 68122001."
"Devices","No","","71501","Terminated","Exactech, Inc.","2320 NW 66th Ct","","Gainesville","FL","	32653-1630","United States","Voluntary: Firm Initiated","Telephone","Nationwide Distribution to Florida only.","Z-2071-2015","Class II","Exactech Single Barrel Drill Guides  The Single Barrel Drill Guide is a nonpowered hand-held device intended for medical purposes to manipulate tissue, or for use with other devices in orthopedic surgery.","2 devices.","Shipped to a single consignee prior to completion of final inspection.","05/21/2015","07/14/2015","07/16/2015","07/22/2015","Catalog Number 05-109-14-0000, Lot # 68266001."
"Devices","No","","71515","Terminated","Etac Supply Center Ab","Langgatan 12","","Anderstorp","","	","Sweden","Voluntary: Firm Initiated","Letter","Nationwide Distribution including GA, CT and PA.","Z-2073-2015","Class II","Etac Supporter toilet armrest  Etac Supporter toilet armrests are foldable and have comfortable rounded grips for the hands. Supporter is simple to mount without the need for any tools. It fits both floor and wall mounted toilets. If space around the toilet is limited either armrest can easily be detached. Supporter includes seat ring and lid.","25 units","The Supporter toilet armrest has two Fast Nuts fixing the product to the toilet porcelain. The firm has reports of the two Fast Nuts coming loose and causing the Supporter to become unsteady.","06/15/2015","07/14/2015","07/14/2017","07/22/2015","Serial numbers higher than 224017"
"Devices","No","","71527","Terminated","Nidek Inc","47651 Westinghouse Dr","","Fremont","CA","	94539-7474","United States","Voluntary: Firm Initiated","Letter","US Distribution to the states of : CA, IL, MN, MO, OR, IL, UT RI, MA, WA, NE, NY, NJ, TX and WI.","Z-2067-2015","Class II","Dual Delivery 4DD-1 of GYC-1000 Green Laser Photocoagulator system  GYC4DD-1:    The Nidek Green Laser Photocoagulator Model GYC- 1000 is indicated for use in ophthalmic surgical procedures, including retinal and macular photocoagulation, iridotomy and trabeculoplasty.","22 units","Accessories to the GYC-1000 laser were missing Laser Aperture labels.","03/25/2015","07/14/2015","07/14/2015","07/22/2015","Model GYC4DD-1"
"Devices","No","","71527","Terminated","Nidek Inc","47651 Westinghouse Dr","","Fremont","CA","	94539-7474","United States","Voluntary: Firm Initiated","Letter","US Distribution to the states of : CA, IL, MN, MO, OR, IL, UT RI, MA, WA, NE, NY, NJ, TX and WI.","Z-2068-2015","Class II","Endophotocoagulation Delivery 4EP-1 of GYC-1000 Green Laser Photocoagulator System;  GYC4EP-01 0W02 and GYC4EP-1 0Z20;    The Nidek Green Laser Photocoagulator Model GYC- 1000 is indicated for use in ophthalmic surgical procedures, including retinal and macular photocoagulation, iridotomy and trabeculoplasty.","W020 - 1 unit; 0Z20- 6 units","Accessories to the GYC-1000 laser were missing Laser Aperture labels.","03/25/2015","07/14/2015","07/14/2015","07/22/2015","Model GYC4EP-01 0W02 and GYC4EP-1 0Z20;"
"Devices","No","","71528","Terminated","Exactech, Inc.","2320 NW 66th Ct","","Gainesville","FL","	32653-1630","United States","Voluntary: Firm Initiated","Letter","Distributed in the states of FL, GA, IL, NY, TX, and WA.","Z-2059-2015","Class II","Altiva / Exactech Spine, Large Set Screw, Catalog Number 28202, Lot Number AS05107.    Intended to provide immobilization and stabilization of spinal segments.","749 devices","Incorrect thread form on the screw.","03/06/2009","07/10/2015","07/14/2015","07/22/2015","Catalog Number 28202, Lot Number  AS05107"
"Devices","No","","71529","Terminated","Biomet, Inc.","56 E Bell Dr","","Warsaw","IN","	46582-6989","United States","Voluntary: Firm Initiated","Letter","Worldwide Distribution - US Nationwide in the states of NC, IN, PA, OH and the country of the Netherlands.","Z-2065-2015","Class II","Oxford Femoral Drill Guide Lateral IM Adapter     Product  Usage:   Drill guide. The Oxford Fixed Bearing Knee is a Partial knee replacement system consisting of a femoral component and a fixed bearing tibial component for use in the lateral compartment of the knee. Partial replacement of the articulating surfaces of the knee when only one side of the knee joint is affected due to the compartmental primary degenerative or post-traumatic degenerative disease, previous tibial condyle or plateau fractures, deformity or revision of previous partial arthroplasty in the affected compartment. The Oxford Fixed Lateral bearings are indicated for use in the lateral compartment and intended to be implemented with bone cement.  ","18","Oxford Femoral Drill Guide Lateral IM Adapter may have an undersized diameter that can cause an interference with PN: 32-422822, Oxford Microplasty IM Link.","06/03/2015","07/14/2015","03/15/2016","07/22/2015","Part Number: 32-423400  Lot Numbers: 238220, 664720,489620, 490930,021410, 507150"
"Devices","No","","71530","Terminated","Zimmer, Inc.","1800 W Center St","","Warsaw","IN","	46580-2304","United States","Voluntary: Firm Initiated","Two or more of the following: Email, Fax, Letter, Press Release, Telephone, Visit","Worldwide distribution.  US states of NC and AK; Taiwan, Japan, and Germany.","Z-2060-2015","Class II","ZNN Antegrade Femoral Nail (ZNN AF).  Orthopedic internal fixation device.","8","A single distributed ZNN Greater Trochanter Femoral Nail may have been dented.  Potential for fatigue of implant prior to sufficient fracture healing, which may result in need for implant removal and revision of fracture fixation to assure proper healing and avoid fracture malunion or nonunion.","06/17/2015","07/13/2015","03/15/2016","07/22/2015","Part 47-2492-320-10; lot 62763724"
"Food","No","","71536","Terminated","Ford Gum & Machine Company Inc","18 Newton Ave","","Akron","NY","	14001-1030","United States","Voluntary: Firm Initiated","Telephone","California","F-2845-2015","Class II","Project 7 CARAMEL APPLE Sugar Free Gum, approximately 32 lbs. -- Manufactured by: Ford Gum and Machine Company, 18 Newton Ave., Akron, New York 14001 --- The product was supplied in cardboard bulk boxes. with a label reading, ""Project 7 CARAMEL APPLE, approximately 32 pounds Sugar Free Gum"".   Each gum piece is 1.35 g coated tablet.  Ford gum produce a raw center, which gets coated, inspected and packed into the cardboard bulk boxes.","6496 pounds (203 cases @32 lb. each)","The bulk Project 7 Caramel Apple Sugar Free Gum contains undeclared milk from a caramel ingredient used in production.","06/19/2015","07/13/2015","04/11/2017","07/22/2015","Lot codes (located on the side of the boxes):  W013575 BB 9/25/16; W013575 BB 9/26/16; W012566 BB 8/19/16; W014461 BB 10/22/16."
"Food","No","","71542","Terminated","Project 7","302 N El Camino Real Ste 216","","San Clemente","CA","	92672-4775","United States","Voluntary: Firm Initiated","E-Mail","nationwide in US","F-2846-2015","Class II","Sour Caramel Apple Chewing, net wt .53 oz, Gum UPC 844911 002919.    Sour Caramel Apple chewing gum tablet packed in 12ct metalized PET Pouch with zipper.","88,206 units","Project 7  is recalling all lots of Sour Caramel Apple Chewing Gum because the caramel flavoring ingredient in the gum contains undeclared milk.","06/19/2015","07/13/2015","12/11/2015","07/22/2015","W012566 BB08/19/16  W014461 BB10/22/16  W013575 BB09/25/16  W013575 BB09/26/16"
"Biologics","No","","71545","Terminated","Belle Bonfils Memorial Blood Center","717 Yosemite St","","Denver","CO","	80230-6918","United States","Voluntary: Firm Initiated","Other","Switzerland","B-0738-15","Class II","Blood and Blood Products for Reprocessing","1 unit","Blood product, collected from a donor considered to be at increased risk for variant Creutzfeldt-Jakob Disease (vCJD), was distributed.","06/10/2015","07/13/2015","07/13/2015","07/22/2015","6633056;"
"Devices","No","","71549","Terminated","Biomet, Inc.","56 E Bell Dr","","Warsaw","IN","	46582-6989","United States","Voluntary: Firm Initiated","Letter","Domestic: TX NJ, NC, KY, MA, SD, MO, AL, IN, GA, AR  International: Netherlands, Japan, Costa Rica","Z-2072-2015","Class II","A.L.P.S. - Medium Bone Plate Forceps.  Orthopedic manual surgical instrument.","223","Medium Bone Plate Forceps was assembled with the incorrect grip arm tip.  Potential that the surgeon will be unable to provisionally clamp the plate to the patient's bone.","06/17/2015","07/14/2015","03/22/2016","07/22/2015","Part Number: 816301006  Lot Numbers: 099216, 093776, 093717, 093716, 088526, 081179, 072525, 072524"
"Devices","No","","71552","Terminated","Nobel Biocare Usa Llc","22715/22725 Savi Ranch Pkwy","","Yorba Linda","CA","	92887","United States","Voluntary: Firm Initiated","Letter","Worldwide Distribution-US (nationwide) and the countries of Australia, Austria, Belgium, Canada, Finland, France, Germany, Greece, Hong Kong, Hungary, Italy, Luxembourg, Netherlands, New Zealand, Norway, Portugal, South Africa, Spain, Switzerland, and United Kingdom.","Z-2074-2015","Class II","Abutment Retrieval Instrument Zirconia CC RP/WP, Article No. 37882 and Abutment Retrieval Kit, Article No. 37508 (Article No. 37882 was assembled in this kit).  Used to remove a zirconia abutment if the abutment is stuck in the implant connection due to a tight seat.  Endosseous dental implant instrument.","149 units total","One dimension of the affected instrument is incorrect. Therefore this instrument cannot be used to remove the metal adapter as intended.","06/22/2015","07/15/2015","09/18/2015","07/22/2015","Article No. 37882, Batch No. 96149;   Article No. 37508, Batch No. 814929, 815096, 815140, and 855021."
"Devices","No","","71555","Terminated","Viewray Incorporated","2 Thermo Fisher Way","","Oakwood Village","OH","	44146-6536","United States","Voluntary: Firm Initiated","Letter","US Nationwide Distribution in the states of CA, MO & WI","Z-2085-2015","Class II","Patient Handling System (Motion Control Software),     Product Usage:  Indicated for stereotactic radiosurgery and precision radiotherapy for lesions, tumors, and conditions anywhere in the body when radiation treatment is indicated.  ","3","ViewRay received a report that the couch moved unexpectedly into the bore after performing a RTCS reboot.","04/01/2015","07/16/2015","02/04/2016","07/22/2015","Model #10000, Serial #'s: 100, 101, and 102"
"Devices","No","","71559","Terminated","Musculoskeletal Transplant Foundation, Inc.","125 May St Ste 300","","Edison","NJ","	08837-3264","United States","Voluntary: Firm Initiated","Two or more of the following: Email, Fax, Letter, Press Release, Telephone, Visit","US Nationwide Distribution in the states of AZ, CA, CO, FL, IL, MI, MN, NC, NJ, NV, PA, TN, TX, UT, WA and WV.","Z-2075-2015","Class II","Allofix Insertion Kit, 2.0 mm, Single Drill,     Product Usage:  MTF Surgical Instruments are designed for the specific needs of the orthopedic surgeon and are intended to be used in conjunction with the associated allograft. This kit is for single use only.  ","117 units","Musculoskeletal Transplant Foundation is recalling a certain lot of Allofix Insertion Kits because they are labeled as having a 2.0mm diameter drill however it may contain a 2.4 mm diameter drill.","05/27/2015","07/15/2015","05/08/2017","07/22/2015","Product Code: 900920, Serial #:906912041001, Expiry date 01Mar2017"
"Devices","No","","71573","Ongoing","Elekta, Inc.","400 Perimeter Center Ter NE Ste 50","","Atlanta","GA","	30346-1227","United States","Voluntary: Firm Initiated","Letter","Worldwide Distribution - US including AZ, CA, GA, ID, IL, MO, NJ, NY, NC, OR, SC, TN, WV,  and Internationally to Austria, Brazil, Bulgaria, Canada, Colombia, Germany, Israel, Italy, Japan, Mexico, Russia, Taiwan, and Venezuela.","Z-2063-2015","Class II","MOSAIQ Oncology Information System  MOSAIQ is an oncology information system used to manage workflows for treatment planning and delivery. It supports information flow among healthcare facility personnel and can be used wherever radiotherapy and/or chemotherapy are prescribed.","74 Total (45 US)","A problem exists in MOSAIQ resulting in the incorrect field size being sent to the treatment machine for stereotactic plans using cones.","07/01/2015","07/14/2015","","07/22/2015","Software Version 2.41 and higher"
"Devices","No","","71585","Terminated","Alere Scarborough, Inc. dba Binax, Inc.","10 Southgate Rd","","Scarborough","ME","	04074-8303","United States","Voluntary: Firm Initiated","Letter","Nationwide Distribution including AR CA CO CT FL GA IA IL IN KS KY LA MA MD ME MO MS NC NE NJ NY OH PA SC TX VA WA WY.","Z-2095-2015","Class II","Alere i flu, Alere i, Alere Influenza A & B; Part Number (PN) 425-024  The Alere"" i Influenza A & B assay, performed on the Alere"" i Instrument, is a rapid molecular in vitro diagnostic test utilizing an isothermal nucleic acid amplification technology for the qualitative detection and discrimination of influenza A and B viral RNA in nasal swabs from patients with signs and symptoms of respiratory infection. It is intended for use as an aid in the differential diagnosis of influenza A and B viral infections in humans, in conjunction with clinical and epidemiological risk factors. The assay is not intended to detect the presence of influenza C virus.","257 Kits","Risk of false negative results due to microbial growth in the Sample Receiver of one lot of the Alere i Influenza A & B kit","06/26/2015","07/16/2015","09/15/2015","07/22/2015","Lot Number 0073853 (US distribution only)"
"Devices","No","","71593","Terminated","Sorin Group USA, Inc.","14401 W 65th Way","","Arvada","CO","	80004-3503","United States","Voluntary: Firm Initiated","Letter","Worldwide Distribution - US (nationwide) and Internationally to AL, AT, BE, BG, CH, CY, CZ, DE, DK, EE, ES, FI, FR, GB, GR, HR, HU, IE, IT, LT, LU, LV, MC, MK, MT, NL, NO, PL, PT, RO, RS, SE, SK, AE, AR, AU, AZ, BD, BH, BR, BY, CA, CL, CN, CO, CR, DZ, EC, EG, ET, GE, GY, HK, ID, IL, IN, IQ, IR, JO, JP, KR, KW, KZ, LB, LK, LY, MA, MN, MU, MX, MY, NG, NP, NZ, OM, PA, PE, PH, PK, PR, PS, QA, RE, RU, SA, SG, SV, SY, TH, TN, TR, TT, TW, UA, VN, ZA.","Z-2076-2015","Class II","Sorin  Stockert Heater-Cooler 3T, 230 V  Temperature control for extracorporeal perfusion of durations up to 6 hours.","2837","Potential colonization of organisms, including Mycobacteria, in Sorin Heater Cooler Devices, if proper disinfection and maintenance is not performed per Instructions for Use.","06/15/2015","07/15/2015","07/25/2018","07/22/2015","Product code 16-02-80 Serial number 16S10027-16S15641"
"Devices","No","","71593","Terminated","Sorin Group USA, Inc.","14401 W 65th Way","","Arvada","CO","	80004-3503","United States","Voluntary: Firm Initiated","Letter","Worldwide Distribution - US (nationwide) and Internationally to AL, AT, BE, BG, CH, CY, CZ, DE, DK, EE, ES, FI, FR, GB, GR, HR, HU, IE, IT, LT, LU, LV, MC, MK, MT, NL, NO, PL, PT, RO, RS, SE, SK, AE, AR, AU, AZ, BD, BH, BR, BY, CA, CL, CN, CO, CR, DZ, EC, EG, ET, GE, GY, HK, ID, IL, IN, IQ, IR, JO, JP, KR, KW, KZ, LB, LK, LY, MA, MN, MU, MX, MY, NG, NP, NZ, OM, PA, PE, PH, PK, PR, PS, QA, RE, RU, SA, SG, SV, SY, TH, TN, TR, TT, TW, UA, VN, ZA.","Z-2077-2015","Class II","Sorin  Stockert Heater-Cooler 3T, 240 V / 60 Hz  Temperature control for extracorporeal perfusion of durations up to 6 hours.","21","Potential colonization of organisms, including Mycobacteria, in Sorin Heater Cooler Devices, if proper disinfection and maintenance is not performed per Instructions for Use.","06/15/2015","07/15/2015","07/25/2018","07/22/2015","Product code 16-02-81 Serial number 16S10743-16S11708"
"Devices","No","","71593","Terminated","Sorin Group USA, Inc.","14401 W 65th Way","","Arvada","CO","	80004-3503","United States","Voluntary: Firm Initiated","Letter","Worldwide Distribution - US (nationwide) and Internationally to AL, AT, BE, BG, CH, CY, CZ, DE, DK, EE, ES, FI, FR, GB, GR, HR, HU, IE, IT, LT, LU, LV, MC, MK, MT, NL, NO, PL, PT, RO, RS, SE, SK, AE, AR, AU, AZ, BD, BH, BR, BY, CA, CL, CN, CO, CR, DZ, EC, EG, ET, GE, GY, HK, ID, IL, IN, IQ, IR, JO, JP, KR, KW, KZ, LB, LK, LY, MA, MN, MU, MX, MY, NG, NP, NZ, OM, PA, PE, PH, PK, PR, PS, QA, RE, RU, SA, SG, SV, SY, TH, TN, TR, TT, TW, UA, VN, ZA.","Z-2078-2015","Class II","Sorin  Stockert Heater-Cooler 3T, 208 V / 60 Hz  Temperature control for extracorporeal perfusion of durations up to 6 hours.","283","Potential colonization of organisms, including Mycobacteria, in Sorin Heater Cooler Devices, if proper disinfection and maintenance is not performed per Instructions for Use.","06/15/2015","07/15/2015","07/25/2018","07/22/2015","Product code 16-02-82 Serial number 16S10772-16S15523"
"Devices","No","","71593","Terminated","Sorin Group USA, Inc.","14401 W 65th Way","","Arvada","CO","	80004-3503","United States","Voluntary: Firm Initiated","Letter","Worldwide Distribution - US (nationwide) and Internationally to AL, AT, BE, BG, CH, CY, CZ, DE, DK, EE, ES, FI, FR, GB, GR, HR, HU, IE, IT, LT, LU, LV, MC, MK, MT, NL, NO, PL, PT, RO, RS, SE, SK, AE, AR, AU, AZ, BD, BH, BR, BY, CA, CL, CN, CO, CR, DZ, EC, EG, ET, GE, GY, HK, ID, IL, IN, IQ, IR, JO, JP, KR, KW, KZ, LB, LK, LY, MA, MN, MU, MX, MY, NG, NP, NZ, OM, PA, PE, PH, PK, PR, PS, QA, RE, RU, SA, SG, SV, SY, TH, TN, TR, TT, TW, UA, VN, ZA.","Z-2079-2015","Class II","Sorin  Stockert Heater-Cooler 3T, 127 V / 60 Hz  Temperature control for extracorporeal perfusion of durations up to 6 hours.","28","Potential colonization of organisms, including Mycobacteria, in Sorin Heater Cooler Devices, if proper disinfection and maintenance is not performed per Instructions for Use.","06/15/2015","07/15/2015","07/25/2018","07/22/2015","Product code 16-02-83 Serial number 16S11455-16S15190"
"Devices","No","","71593","Terminated","Sorin Group USA, Inc.","14401 W 65th Way","","Arvada","CO","	80004-3503","United States","Voluntary: Firm Initiated","Letter","Worldwide Distribution - US (nationwide) and Internationally to AL, AT, BE, BG, CH, CY, CZ, DE, DK, EE, ES, FI, FR, GB, GR, HR, HU, IE, IT, LT, LU, LV, MC, MK, MT, NL, NO, PL, PT, RO, RS, SE, SK, AE, AR, AU, AZ, BD, BH, BR, BY, CA, CL, CN, CO, CR, DZ, EC, EG, ET, GE, GY, HK, ID, IL, IN, IQ, IR, JO, JP, KR, KW, KZ, LB, LK, LY, MA, MN, MU, MX, MY, NG, NP, NZ, OM, PA, PE, PH, PK, PR, PS, QA, RE, RU, SA, SG, SV, SY, TH, TN, TR, TT, TW, UA, VN, ZA.","Z-2080-2015","Class II","Sorin  Stockert Heater-Cooler 3T, 120 V / 60 Hz  Temperature control for extracorporeal perfusion of durations up to 6 hours.","1755","Potential colonization of organisms, including Mycobacteria, in Sorin Heater Cooler Devices, if proper disinfection and maintenance is not performed per Instructions for Use.","06/15/2015","07/15/2015","07/25/2018","07/22/2015","Product code 16-02-85 Serial number 16S10958-16S15634"
