"Food","No","","68555","Terminated","Plaze Inc","104 Bolte Ln","","Saint Clair","MO","	63077-3218","United States","Voluntary: Firm Initiated","E-Mail","Distribution was made to MO.  There was no government/military/foreign distribution.","F-2236-2014","Class II","Professional Bak-klene All Purpose No-Stick Bakery Spray, packaged in 14-oz. aerosol cans.","130/6/14-oz. can cases","The product contains undeclared wheat.","06/09/2014","07/30/2014","08/06/2014","08/06/2014","4135 1 CAKE 1800 thru 2100  (1800-2100 = military times affected)"
"Biologics","No","","68575","Terminated","Carter BloodCare/ WE & Lela I Stewart Blood Center, Inc","815 S Baxter Ave","","Tyler","TX","	75701-2205","United States","Voluntary: Firm Initiated","Letter","Texas; Austria","B-0873-14","Class II","Red Blood Cells Leukocytes Reduced","1 unit","Blood products, collected from a donor whose health history was inadequately determined, were distributed.","06/10/2014","07/30/2014","07/30/2014","08/06/2014","W035212339643K;"
"Biologics","No","","68575","Terminated","Carter BloodCare/ WE & Lela I Stewart Blood Center, Inc","815 S Baxter Ave","","Tyler","TX","	75701-2205","United States","Voluntary: Firm Initiated","Letter","Texas; Austria","B-0874-14","Class II","Cryoprecipitated AHF","1 unit","Blood products, collected from a donor whose health history was inadequately determined, were distributed.","06/10/2014","07/30/2014","07/30/2014","08/06/2014","W035212339643K;"
"Devices","No","","68615","Terminated","Medtronic Neuromodulation","7000 Central Ave Ne","","Minneapolis","MN","	55432-3568","United States","Voluntary: Firm Initiated","Letter","Worldwide Distribution - USA including CA, CO, FL, IL, KS, KY, LA, MN, MT, NC, NE, OR, TX, VA, and UT, and Internationally to Canada, Spain, and United Kingdom.","Z-2118-2014","Class II","Medtronic Nexdrive Micropositioning Drive. Models Ml-1000 and Ml-2000.      For use in conjunction with the Medtronic Nexframe Stereotactic System for the precise positioning of microelectrodes and implantable leads.  A stereotactic guidance system used in conjunction with Medtronic StealthStation Navigation Systems-image-guided surgery (IGS) systems-for Deep Brain Stimulation (DBS) procedures.","300  EXPANDED 10/02/2014 130 devices","Potential for misalignment of the Z-stage scale. Using one of these devices for a procedure could result in the microelectrode being inserted to an incorrect target depth.","06/11/2014","07/25/2014","01/22/2015","08/06/2014","Lot numbers:  082605614, 082601414, 082602014, 082634313, 082630913, 082629713, 082629613, 082626913, 082623113, 082621413, and 082618213.      EXPANDED 10/02/2014 Lot Numbers:  082616214, 082616314,  082618314, and 082618414."
"Biologics","No","","68636","Terminated","Stryker Medical Division of Stryker Corporation","3800 E Centre Ave","","Portage","MI","	49002-5826","United States","Voluntary: Firm Initiated","Letter","Product was shipped to the following states: Nationwide including Puerto Rico.    Product was also shipped to the following countries: Algeria, Argentina, Bangladesh, Belgium, Brazil, Canada, France, Greece, Hong Kong, Indonesia, Italy, Japan, Malaysia, Netherlands, Pakistan, Peru, Phillipines, Saudi Arabia, Singapore, Sweden, Turkey, United Arab Emirates, United Kingdom & Venezuela.","B-0880-14","Class II","Medi-Temp Blood/Fluid Warming Cassette, Stryker Medical, 3800 E. Centre Avenue, Portage, MI 49002  ","315,029 units","Blood/Fluid Warmer Cassettes, associated with complaints in regards to malformed threads on the female luer fitting of specific models, were distributed.","07/15/2014","07/31/2014","07/28/2017","08/06/2014","Model # D25310CE; Lot #'s: M0112, M0113, M0114, M0212, M0213, M0214, M0214, M0314, M0412, M0413, M0414, M0512, M0514, M0514, M0612, M0614, M0712, M0713, M0713, M0714, M0714, M0812, M0814, M0814, M0914, M1012, M1014, M1112, M1113, M1114, M1213, M1213, M1214, M1313, M1313, M1412, M1413, M1413, M1512, M1513, M1513, M1611, M1612, M1613, M1711, M1712, M1713, M1713, M1812, M1813, M1813, M1911, M1912, M2011, M2012, M2111, M2113, M2211, M2213, M2213, M2311, M2312, M2313, M2313, M2412, M2413, M2413, M2612, M2713, M2811, M2812, M2911, M2912, M2913, M2913, M3011, M3012, M3013, M3013, M3111, M3112, M3113, M3113, M3211, M3312, M3313, M3313, M3412, M3511, M3612, M3613, M3712, M3713, M3811, M3911, M4011, M4012, M4112 & M4211  Model # D25315CE; Lot # s: M0112, M0213, M0413, M0414, M0414, M0512, M0612, M0713, M1014, M1114, M1511, M1611, M1813, M1912, M1913, M2212, M2411, M2413, M2513, M2611, M2613, M2913, M3111, M3113, M3211, M3213, M3413, M3511, M3513, M3513, M3611, M3612, M3713, M3812, M3813, M3813, M4011, M4012, M4111 & M4212  Model # D25340CE; Lot # s: M0312, M1112, M1511, M1712, M1811, M2311, M2312, M2411, M2513, M2712, M2712, M3011, M3213, M3311, M3611 & M3711.   Model # D25310NL; Lot # s: M0312, M0412, M0414, M0414, M0713, M0812, M0913, M0913, M1012, M1314, M1511, M1811, M1812, M2011, M2013, M2211, M2212, M2411, M2412, M2413, M2512, M2513, M2513, M2711, M2811, M3011, M3012, M3111, M3311, M3413, M3512, M3711, M3812, M3812, M4011 & M401"
"Devices","No","","68657","Terminated","Zimmer, Inc.","1800 W Center St","","Warsaw","IN","	46580-2304","United States","Voluntary: Firm Initiated","","Worldwide Distribution - US including the states of  CA and OH., and the countries of  BRAZIL, CHINA, KOREA  and TAIWAN.","Z-2131-2014","Class II","Zimmer Periarticular Locking Plate System Distal Radial Volar Plate Lateral Column (1st generation stainless steel only).  Orthopedic fixation plate.    For temporary internal fixation and stabilization of osteotomies and fractures.","28 units","A complaint was received in which it was reported that an 8-hole plate from lot 62276042 had an enlarged hole that is unable to lock the screw, which resulted in the screw head pulling through plate hole.","06/10/2014","07/30/2014","01/09/2015","08/06/2014","Part Number 00-2358-014-04; lot 62276042"
"Food","No","","68677","Terminated","Richard's Rub & Seasonings, LLC","281 Sw 41st St","","Renton","WA","	98057-4930","United States","Voluntary: Firm Initiated","Press Release","Direct consignees in state of Washington.","F-2233-2014","Class II","Richards Too Good BBQ Sauce. 12 oz.    Product is packaged in 12 oz tall glass bottles with metal screw caps and black heat resistant tamper seals.","unknown","Richards Rubs & Seasonings LLC is recalling Richards Too Good BBQ Sauce, Richards Too Good Hot Sauce and Richards Too Good Teriyaki Sauce because they may have been improperly processed and because they may have the potential to be contaminated with Clostridium botulinum, which can cause botulism, a serious and potentially fatal foodborne illness.","06/27/2014","07/29/2014","12/10/2014","08/06/2014","Product bears not codes.    The products being recalled were distributed up to the date of June 17, 2014."
"Food","No","","68677","Terminated","Richard's Rub & Seasonings, LLC","281 Sw 41st St","","Renton","WA","	98057-4930","United States","Voluntary: Firm Initiated","Press Release","Direct consignees in state of Washington.","F-2234-2014","Class II","Richards Too Good Hot Sauce. 12 oz.    Product is packaged in 12 oz tall glass bottles with metal screw caps and black heat resistant tamper seals.","unknown","Richards Rubs & Seasonings LLC is recalling Richards Too Good BBQ Sauce, Richards Too Good Hot Sauce and Richards Too Good Teriyaki Sauce because they may have been improperly processed and because they may have the potential to be contaminated with Clostridium botulinum, which can cause botulism, a serious and potentially fatal foodborne illness.","06/27/2014","07/29/2014","12/10/2014","08/06/2014","Product bears not codes.    The products being recalled were distributed up to the date of June 17, 2014."
"Food","No","","68677","Terminated","Richard's Rub & Seasonings, LLC","281 Sw 41st St","","Renton","WA","	98057-4930","United States","Voluntary: Firm Initiated","Press Release","Direct consignees in state of Washington.","F-2235-2014","Class II","Richards Too Good Teriyaki Sauce. 12 oz.    Product is packaged in 12 oz tall glass bottles with metal screw caps and black heat resistant tamper seals.","unknown","Richards Rubs & Seasonings LLC is recalling Richards Too Good BBQ Sauce, Richards Too Good Hot Sauce and Richards Too Good Teriyaki Sauce because they may have been improperly processed and because they may have the potential to be contaminated with Clostridium botulinum, which can cause botulism, a serious and potentially fatal foodborne illness.","06/27/2014","07/29/2014","12/10/2014","08/06/2014","Product bears not codes.    The products being recalled were distributed up to the date of June 17, 2014."
"Devices","No","","68681","Terminated","Dynarex Corporation","10 Glenshaw St","","Orangeburg","NY","	10962-1207","United States","Voluntary: Firm Initiated","Letter","Worldwide Distribution -- USA, Canada, and Mexico.","Z-2117-2014","Class II","CPR Shield With One Way Valve and Barrier Filter, Reorder No. 4921 --- Dynarex label, 100 per case --- Manufactured for: Dynarex Corporation - Made in China.    Used as a physical barrier for mouth to mouth resuscitation.","Domestic: 208 cases; Foreign: 42 cases","""THIS SIDE UP"" is on the wrong side of the product. This error poses a potential health hazard if the wrong labeling is followed by caregivers.","07/02/2014","07/25/2014","04/20/2017","08/06/2014","Lot Numbers 28619 & 28621"
"Devices","No","","68697","Terminated","Teleflex Medical","4024 Stirrup Creek Dr","","Durham","NC","	27703-9000","United States","Voluntary: Firm Initiated","Letter","U.S. Nationwide","Z-2130-2014","Class II","RUSCH, TruLite, One-Piece Disposable Laryngoscope Handle Blade Combination, Non-Sterile, Rx Only, Distributed by: Teleflex Medical.","6,246 units","There is a possibility the handle of the laryngoscope may heat up and melt the end cap.","06/30/2014","07/29/2014","03/21/2017","08/06/2014","Product Code: 004660000, (Size Miller 0), Lot numbers: 1306602, 1308602 & 1310602; Product Code: 004660001, (Size Miller 1), Lot numbers: 1306612, 1308612 & 1310612; Product Code: 004660002, (Size Miller 2), Lot numbers: 1306622, 1308622, 1309622 & 1310622; Product Code: 004660003, (Size Miller 3), Lot numbers: 1306632 & 1310632; Product Code: 004660004, (Size Miller 4), Lot numbers: 1306642, 1308642 & 1309642; Product Code: 004660010, (Size Miller 00), Lot numbers: 1306592, 1308592, 1309592, 1312592 & 1401592; Product Code: 004661002, (Size Mac 2), Lot numbers: 1306522, 1308522 & 1310522; Product Code: 004661003, (Size Mac 3), Lot numbers: 1306532, 1308532 & 1310532 and Product Code: 004661004, (Size Mac 4), Lot numbers: 306542, 1308542 & 1309542."
"Devices","No","","68706","Terminated","Ra Medical Systems Inc","1930 Kellogg Ave","","Carlsbad","CA","	92008-6581","United States","Voluntary: Firm Initiated","Letter","Worldwide Distribution - USA (Nationwide) and Internationally to: Korea, Kuwait, and Saudi Arabia.","Z-2123-2014","Class II","PHAROS Excimer Laser, Model No. EX-308    UVB phototherapy for the treatment of psoriasis, vitiligo, atopic dermatitis and leukoderma","435 units","RA Medical Systems is recalling the PHAROS EX-308 Excimer Laser because there is a possibility that the laser may calibrate with the iris closed.","06/30/2014","07/28/2014","09/09/2014","08/06/2014","Serial Numbers:    40  41  99  112  114  119  124  234  237  250  251  271  272  274  276  283  299  302  306  314  315  316  319  321  323  324  325  326  329  333  337  350  351  352  356  357  358  359  360  382  383  394  396  397  398  400  402  404  405  407  409  411  414  417  418  419  420  421  423  424  428  430  431  441  450  455  457  459  460  462  463  464  465  467  471  475  476  480  482  483  484  486  488  490  491  494  495  496  497  500  505  507  509  512  516  518  519  525  526  527  528  529  531  532  533  534  535  537  538  539  541  543  546  550  552  553  554  555  556  557  559  560  561  562  563  565  566  567  570  571  572  573  574  576  579  580  582  583  585  586  588  589  591  592  593  594  595  597  598  599  600  601  602  603  604  605  606  609  610  614  615  617  622  623  624  628  629  631  632  633  635  636  637  638  639  644  645  646  647  648  649  654  655  656  657  659  661  662  663  664  665  667  668  669  672  673  674  678  682  683  684  685  686  687  688  689  690  692  694  695  697  698  699  700  702  703  705  706  707  708  709  712  713  714  715  716  717  718  719  720  721  722  901  902  903  904  905  908  909  911  912  914  915  916  917  918  921  922  923  925  926  927  928  929  930  931  932  933  935  936  938  939  940  941  942  943  944  948  949  950  951  952  954  955  956  957  958  959  960  961  962  963  964  967  968  969  970  971  972  973  974  975  976  977  978  979  980  981  982  983  984  985  986  987  988  989  990  991  992  993  994  995  996  997  999  1000  1001  1002  1003  1004  1005  1006  1007  1008  1009  1010  1014  1015  1016  1017  1018  1021  1022  1023  1024  1025  1027  1028  1029  1030  1031  1032  1034  1035  1036  1037  1039  1040  1041  305  307  327  331  386  415  425  437  443  444  445  446  447  448  540  577  578  618  619  620  621  353  454  312  322  328  330  335  346  348  349  370  381  385  387  410  510  511  515  524  558  575  608"
"Food","No","","68717","Terminated","GM Manufacturing Inc.","1500 W 135th St","","Gardena","CA","	90249-2230","United States","Voluntary: Firm Initiated","Letter","CA","F-2242-2014","Class II","Tiger-X, Blister Packs","11,218 units","GM Manufacturing is recalling dietary supplements due to significant violations of the cGMP regulations for dietary supplements.","07/03/2014","07/31/2014","09/16/2014","08/06/2014","No lot numbers"
"Food","No","","68717","Terminated","GM Manufacturing Inc.","1500 W 135th St","","Gardena","CA","	90249-2230","United States","Voluntary: Firm Initiated","Letter","CA","F-2243-2014","Class II","Samurai-X, Blister Packs","21,394 units","GM Manufacturing is recalling dietary supplements due to significant violations of the cGMP regulations for dietary supplements.","07/03/2014","07/31/2014","09/16/2014","08/06/2014","No lot numbers"
"Food","No","","68717","Terminated","GM Manufacturing Inc.","1500 W 135th St","","Gardena","CA","	90249-2230","United States","Voluntary: Firm Initiated","Letter","CA","F-2244-2014","Class II","Samurai Gold, Blister Packs","3,500 units","GM Manufacturing is recalling dietary supplements due to significant violations of the cGMP regulations for dietary supplements.","07/03/2014","07/31/2014","09/16/2014","08/06/2014","No lot numbers"
"Food","No","","68717","Terminated","GM Manufacturing Inc.","1500 W 135th St","","Gardena","CA","	90249-2230","United States","Voluntary: Firm Initiated","Letter","CA","F-2245-2014","Class II","Gold, Blister Packs","5,039 units","GM Manufacturing is recalling dietary supplements due to significant violations of the cGMP regulations for dietary supplements.","07/03/2014","07/31/2014","09/16/2014","08/06/2014","No lot numbers"
"Food","No","","68717","Terminated","GM Manufacturing Inc.","1500 W 135th St","","Gardena","CA","	90249-2230","United States","Voluntary: Firm Initiated","Letter","CA","F-2246-2014","Class II","Oyavon, Blister Packs","3,404 units","GM Manufacturing is recalling dietary supplements due to significant violations of the cGMP regulations for dietary supplements.","07/03/2014","07/31/2014","09/16/2014","08/06/2014","No lot numbers"
"Food","No","","68717","Terminated","GM Manufacturing Inc.","1500 W 135th St","","Gardena","CA","	90249-2230","United States","Voluntary: Firm Initiated","Letter","CA","F-2247-2014","Class II","Adam, Blister Packs","9,500 units","GM Manufacturing is recalling dietary supplements due to significant violations of the cGMP regulations for dietary supplements.","07/03/2014","07/31/2014","09/16/2014","08/06/2014","No lot numbers"
"Food","No","","68717","Terminated","GM Manufacturing Inc.","1500 W 135th St","","Gardena","CA","	90249-2230","United States","Voluntary: Firm Initiated","Letter","CA","F-2248-2014","Class II","Actimeta, Blister Packs","5,104 units","GM Manufacturing is recalling dietary supplements due to significant violations of the cGMP regulations for dietary supplements.","07/03/2014","07/31/2014","09/16/2014","08/06/2014","No lot numbers"
"Food","No","","68717","Terminated","GM Manufacturing Inc.","1500 W 135th St","","Gardena","CA","	90249-2230","United States","Voluntary: Firm Initiated","Letter","CA","F-2249-2014","Class II","Affirm XL, Blister Packs","4,000 units","GM Manufacturing is recalling dietary supplements due to significant violations of the cGMP regulations for dietary supplements.","07/03/2014","07/31/2014","09/16/2014","08/06/2014","No lot numbers"
"Food","No","","68717","Terminated","GM Manufacturing Inc.","1500 W 135th St","","Gardena","CA","	90249-2230","United States","Voluntary: Firm Initiated","Letter","CA","F-2250-2014","Class II","Platinum A, Blister Packs","6,250 units","GM Manufacturing is recalling dietary supplements due to significant violations of the cGMP regulations for dietary supplements.","07/03/2014","07/31/2014","09/16/2014","08/06/2014","No lot numbers"
"Food","No","","68717","Terminated","GM Manufacturing Inc.","1500 W 135th St","","Gardena","CA","	90249-2230","United States","Voluntary: Firm Initiated","Letter","CA","F-2251-2014","Class II","Platinum B, Blister Packs","5,000 units","GM Manufacturing is recalling dietary supplements due to significant violations of the cGMP regulations for dietary supplements.","07/03/2014","07/31/2014","09/16/2014","08/06/2014","No lot numbers"
"Food","No","","68717","Terminated","GM Manufacturing Inc.","1500 W 135th St","","Gardena","CA","	90249-2230","United States","Voluntary: Firm Initiated","Letter","CA","F-2252-2014","Class II","Ninja Mojo, small vinyl Packs","50,000 units","GM Manufacturing is recalling dietary supplements due to significant violations of the cGMP regulations for dietary supplements.","07/03/2014","07/31/2014","09/16/2014","08/06/2014","LOT08152013  EXPDEC2016"
"Food","No","","68717","Terminated","GM Manufacturing Inc.","1500 W 135th St","","Gardena","CA","	90249-2230","United States","Voluntary: Firm Initiated","Letter","CA","F-2253-2014","Class II","Single Mojo, small vinyl Packs","45,000 units","GM Manufacturing is recalling dietary supplements due to significant violations of the cGMP regulations for dietary supplements.","07/03/2014","07/31/2014","09/16/2014","08/06/2014","LOT08162013  EXPDEC2016"
"Food","No","","68717","Terminated","GM Manufacturing Inc.","1500 W 135th St","","Gardena","CA","	90249-2230","United States","Voluntary: Firm Initiated","Letter","CA","F-2254-2014","Class II","Double Mojo, small vinyl Packs","40,000 units","GM Manufacturing is recalling dietary supplements due to significant violations of the cGMP regulations for dietary supplements.","07/03/2014","07/31/2014","09/16/2014","08/06/2014","LOT08172013  EXPDEC2016"
"Food","No","","68717","Terminated","GM Manufacturing Inc.","1500 W 135th St","","Gardena","CA","	90249-2230","United States","Voluntary: Firm Initiated","Letter","CA","F-2255-2014","Class II","Ginseng Power, Blister Packs","3,025 units","GM Manufacturing is recalling dietary supplements due to significant violations of the cGMP regulations for dietary supplements.","07/03/2014","07/31/2014","09/16/2014","08/06/2014","No Lot numbers"
"Food","No","","68717","Terminated","GM Manufacturing Inc.","1500 W 135th St","","Gardena","CA","	90249-2230","United States","Voluntary: Firm Initiated","Letter","CA","F-2256-2014","Class II","Calcium Formula, 250 cc HDPE Bottles","501 units","GM Manufacturing is recalling dietary supplements due to significant violations of the cGMP regulations for dietary supplements.","07/03/2014","07/31/2014","09/16/2014","08/06/2014","EXP08.2016"
"Food","No","","68717","Terminated","GM Manufacturing Inc.","1500 W 135th St","","Gardena","CA","	90249-2230","United States","Voluntary: Firm Initiated","Letter","CA","F-2257-2014","Class II","Green Coffee Bean","1,110 units","GM Manufacturing is recalling dietary supplements due to significant violations of the cGMP regulations for dietary supplements.","07/03/2014","07/31/2014","09/16/2014","08/06/2014","EXP08.2016   EXP10.2016"
"Food","No","","68717","Terminated","GM Manufacturing Inc.","1500 W 135th St","","Gardena","CA","	90249-2230","United States","Voluntary: Firm Initiated","Letter","CA","F-2258-2014","Class II","Shark Formula, 250 cc HDPE Bottles","1,503 units","GM Manufacturing is recalling dietary supplements due to significant violations of the cGMP regulations for dietary supplements.","07/03/2014","07/31/2014","09/16/2014","08/06/2014","EXP10.2016   EXP11.2016  EXP12.2016"
"Food","No","","68717","Terminated","GM Manufacturing Inc.","1500 W 135th St","","Gardena","CA","	90249-2230","United States","Voluntary: Firm Initiated","Letter","CA","F-2259-2014","Class II","Bitter Melon, 225cc HDPE Bottle","380 units","GM Manufacturing is recalling dietary supplements due to significant violations of the cGMP regulations for dietary supplements.","07/03/2014","07/31/2014","09/16/2014","08/06/2014","EXP10.2016"
"Food","No","","68717","Terminated","GM Manufacturing Inc.","1500 W 135th St","","Gardena","CA","	90249-2230","United States","Voluntary: Firm Initiated","Letter","CA","F-2260-2014","Class II","Chanca Piedra, 225cc HDPE Bottles","378 units","GM Manufacturing is recalling dietary supplements due to significant violations of the cGMP regulations for dietary supplements.","07/03/2014","07/31/2014","09/16/2014","08/06/2014","EXP10.2016"
"Food","No","","68717","Terminated","GM Manufacturing Inc.","1500 W 135th St","","Gardena","CA","	90249-2230","United States","Voluntary: Firm Initiated","Letter","CA","F-2261-2014","Class II","Rinozan, 250cc HDPE Bottles","501 units","GM Manufacturing is recalling dietary supplements due to significant violations of the cGMP regulations for dietary supplements.","07/03/2014","07/31/2014","09/16/2014","08/06/2014","EXP09.2016"
"Food","No","","68717","Terminated","GM Manufacturing Inc.","1500 W 135th St","","Gardena","CA","	90249-2230","United States","Voluntary: Firm Initiated","Letter","CA","F-2262-2014","Class II","Una De Gato, 225cc HDPE Bottle","502 units","GM Manufacturing is recalling dietary supplements due to significant violations of the cGMP regulations for dietary supplements.","07/03/2014","07/31/2014","09/16/2014","08/06/2014","EXP12.2016"
"Food","No","","68717","Terminated","GM Manufacturing Inc.","1500 W 135th St","","Gardena","CA","	90249-2230","United States","Voluntary: Firm Initiated","Letter","CA","F-2263-2014","Class II","Saw Palmetto, Glass Bottle","501 units","GM Manufacturing is recalling dietary supplements due to significant violations of the cGMP regulations for dietary supplements.","07/03/2014","07/31/2014","09/16/2014","08/06/2014","EXP11.2016"
"Food","No","","68717","Terminated","GM Manufacturing Inc.","1500 W 135th St","","Gardena","CA","	90249-2230","United States","Voluntary: Firm Initiated","Letter","CA","F-2264-2014","Class II","Garcinia Cambogia, 225cc HDPE Bottle","829 units","GM Manufacturing is recalling dietary supplements due to significant violations of the cGMP regulations for dietary supplements.","07/03/2014","07/31/2014","09/16/2014","08/06/2014","EXP04.2017"
"Food","No","","68717","Terminated","GM Manufacturing Inc.","1500 W 135th St","","Gardena","CA","	90249-2230","United States","Voluntary: Firm Initiated","Letter","CA","F-2265-2014","Class II","BTI Lean Formula, 400cc HDPE Bottle","1,000 units","GM Manufacturing is recalling dietary supplements due to significant violations of the cGMP regulations for dietary supplements.","07/03/2014","07/31/2014","09/16/2014","08/06/2014","LT7345  EX10.16"
"Food","No","","68717","Terminated","GM Manufacturing Inc.","1500 W 135th St","","Gardena","CA","	90249-2230","United States","Voluntary: Firm Initiated","Letter","CA","F-2266-2014","Class II","DMSA, 100cc HDPE bottle","414 units","GM Manufacturing is recalling dietary supplements due to significant violations of the cGMP regulations for dietary supplements.","07/03/2014","07/31/2014","09/16/2014","08/06/2014","LOTKZ8010  EXP10.2016"
"Food","No","","68717","Terminated","GM Manufacturing Inc.","1500 W 135th St","","Gardena","CA","	90249-2230","United States","Voluntary: Firm Initiated","Letter","CA","F-2267-2014","Class II","Noni Supplement, Capsules","200,100 units","GM Manufacturing is recalling dietary supplements due to significant violations of the cGMP regulations for dietary supplements.","07/03/2014","07/31/2014","09/16/2014","08/06/2014","9/23/13 > 9/30/13"
"Food","No","","68717","Terminated","GM Manufacturing Inc.","1500 W 135th St","","Gardena","CA","	90249-2230","United States","Voluntary: Firm Initiated","Letter","CA","F-2268-2014","Class II","Therapeutic Care A, B, C, 225cc HDPE Bottles for A,B.  Capsules for C","168,874 units","GM Manufacturing is recalling dietary supplements due to significant violations of the cGMP regulations for dietary supplements.","07/03/2014","07/31/2014","09/16/2014","08/06/2014","LOTKZ1350, EXP11/2016  LOT KZ1351, EXP11/2016  LOTKZ1352, EXP11/2016"
"Food","No","","68717","Terminated","GM Manufacturing Inc.","1500 W 135th St","","Gardena","CA","	90249-2230","United States","Voluntary: Firm Initiated","Letter","CA","F-2269-2014","Class II","Actra-SX, Vinyl Bags","188 units","GM Manufacturing is recalling dietary supplements due to significant violations of the cGMP regulations for dietary supplements.","07/03/2014","07/31/2014","09/16/2014","08/06/2014","11/1/13"
