"Devices","No","","71718","Terminated","Trumpf Medical Systems, Inc.","1046 Legrand Blvd","","Charleston","SC","	29492-7672","United States","Voluntary: Firm initiated","Letter","Worldwide Distribution-US (nationwide) including Puerto Rico, and the countries of  Angola, Antilles, Argentina, Austria, Australia, Azerbaijan, Bosnia and Herzegovina, Belgium, Bulgaria, Bahrain, Brasilia, Belarus, Canada, Switzerland, Chile, China, Columbia, Cyprus, Czech Republic, Germany, Denmark, Algerian, Ecuador, Estonia, Egypt, Spain, Finland, France, Gabon, United Kingdom, Georgian Republic, Greece, Hong Kong, Croatia, Hungary, Indonesia, Ireland, Israel, India, Iraq, Iran, Iceland, Italy, Jordan, Japan, Kenya, South Korea, Kuwait, Kazakhstan, Lebanon, Liechtenstein, Lithuania, Luxembourg, Latvia, Libya, Morocco, Macedonia, Myanmar/Burma, Malta, Mauritius, Mexico, Malaysia, Netherlands, Norway, New Zealand, Peru, Philippines, Pakistan, Poland, Palestine, Portugal, Qatar, Romania, Russia, Saudi Arabia, Sudan, Sweden, Singapore, Slovenia, Slovakia, San Marino, Syria, Thailand, Turkmenistan, Tunisia, Turkey, Taiwan, Ukraine, United Arabian Emirates, Uruguay, Venezuela, British Virgin Islands, Vietnam, Kosovo, Serbia and South Africa.*","Z-2356-2015","Class II","Trumpf Ceiling Mounted Surgical Lighting Systems,TruVidia SD, User Manual #1400191.    The TRUMPF surgical lights are intended to locally illuminate an operating or examination area of the patient's body with a high intensity light.","9,287 units total","Complaints received of the front joint of the spring arm AC 2000 could break at the interface to the monitor.","07/27/2015","08/07/2015","05/03/2017","08/19/2015","The following Material numbers may appear on any of the attached recalled/corrected units: Material #0376288, Description: Federarm 3kg, 3 polig (Swing); 0376289, Federarm 12-18kg, 5-polig Kamera eco; 0376290, Federarm TFT Stop AC 2000, 9-15kg; 0376291, Federarm TFT Stop AC 3000, 12-18kg; 0376292, Federarm TFT Stop Space bis 30kg; 0376293, Federarm 3-polig NRH; 0376294, Federarm 5-polig NRH; 0376295, Federarm 3-polig NRH gerader Abgang; 0376296, Federarm 5-polig NRH gerader Abgang; 0379528, FA AC3000, Stop 7-11KG; 0385719, FA AC 2000 NRH mobil 3p, 12-18kg NG; 1387323, Federarmsicherungssegment AC3000; 1387324, Federarmsicherungssegment AC2000; 1388338, Federarm 12-18 kg 3 polig, HEL2; 1388339, Federarm 12-18 kg 5 polig HEL2; 1388340, Federarm 12-18 kg 9 polig (HELION); 1408906, FA AC2 Stop max 11kg; 1471010, FA AC2000 3p, 12-18kg; 1471011, FA AC2000 Stop 12-18kg; 1471012, FA AC2000 NRH 3p, 12-18kg; 1471013, FA AC2000, 7p, 12-18kg; 1471014, FA AC2000 NRH 7p, 12-18kg; 1471015, FA AC3000 3p, 23-30kg; 1471016, FA AC2000 Stop 6-11kg; 1471017, FA AC2000 TruVidia 7p, 3,5-7kg; 1471018, FA AC2000 Stop 3,5-7kg; 1471351, FA AC3000 NRH 3p, 23-30kg; 1502084, FA AC2 NRH f¿r HEL2, 3POL.; 1504731, Federarm 9-POLIG NRH HEL2; 1507085, (R)FEDERARM AC2000; 1645860, FA AC 2000 NRH mobil 7p, 12-18kg NG; 1645861, FA AC 2000 NRH 7p, 12-18kg NG; 1649687, FA AC 2000 SlimLine STOP, 12-18kg; 1649872, FA AC 2000 SlimLine 3p, 12-18kg; 1649997, Deckenrohr 2f Slimline 1000; 1774143, Ausleger AC2000, 750mm, 3p; 1982310, FA AC2000 MAVIG Protegra2 6-11kg; 1982311, FA AC2000 MAVIG Protegra2 12-18kg; 1982312, FA AC2000 3p, 13,5-21kg; 1982313, FA AC2000 NRH 3p, 13,5-21kg; 4024211, Federarm AC2000; 4024212, FA AC2 Stop; 4024213, FA AC3; 4024214, FA AC3000 Stop, 12-18kg; 4024215, FA AC5000 Stop; 4024651, FA AC3000, 7p; 4024652, FA AC2 3K; 024848, Federarm AC3000 NRH; 4025574, FA AC3000 Stop 23-30 kg; 4025575, FA AC5000 Stop max 15 kg; 4025576, FA AC2 K TruVidia; 8800900, Federarm HELION L+ 12,5 kg 5-polig; 8800901, Federarm HELION M+ 12,5 kg 3-polig; 8800905, Federarm HEL L/L+, 11,4 kg 3-polig; 8800906, Federarm HELION M NRH; 8800907, Federarm FA 77 V 11,4 kg 3 polig; 8800908, Federarm FA 77 V 6,8 kg 3 polig; 8800909, Federarm f¿r L-Leuchte So-Version; 8800910, Federarm f¿r M-Leuchte So-Version; 8800911, Federarm FA 77 V 13 kg 3 polig; 8800915, Federarm FA 77 N 11,4 kg5 polig; 8800916, Federarm FA 77 N 6,8 kg 5 polig; 8800919, Federarm FA 77 N 13 kg 5 polig; 8800920, Federarm FA 77 N 8,9 kg 5 polig; 8800925, Federarm FA 77 N 11,4 kg 7 polig; 8800926, Federarm Helion M NRH 7-polig; 8800929, Federarm FA 77 N 13 kg 7 polig; 8800930, Federarm FA 77 N 8,9 kg 7 polig; 8801000, Federarm HELION M+ 8.3 kg 5-polig; 8801001, Federarm HELION M+ 8,3 kg 3-polig; 8801007, Federarm AC 2000, 9-15 kg O. Elektrik; 8801008, Federarm AC 2000, 7-12 kg 5 polig; 8801009, Federarm AC 2000, 12-18 kg 5 polig; 8801010, Federarm Acrobat 2000 12-18 kg; 8801011, Federarm; 8801012, Federarm AC 2000 7-15 kg 3 polig mit; 8801013, Federarm AC 2000, 9-15 kg 7 polig; 8801014, Federarm f¿r Helion M; 8801015, Federarm AC 2000, 1-3,5 kg 7 polig; 8801016, Federarm AC2000 9-15 kg 5-polig; 8801017, Federarm HELION S Mobile; 8801018, Federarm AC 2000, 12-18 kg 3 polig; 8801019, Federarm AC 2000, 1-3,5 kg 3 polig; 8801020, Federarm AC 2000, 12-18 kg 7 polig; 8801021, Federarm AC 2000, 1-3,5KG, Adapt. Anschl; 8801033, Federarm Deckenanschlu¿ HELS; 8801050, Federarm AC 3000, 12-18 kg ohne Elektr.; 8801051, Federarm SPACE 20-40 kg ohne Elektrik; 8801101, Federarm SWING 2-3 kg 3 POL. 120 Volt; 8801102, Federarm SWING 2-3 kg 3 POL. 230 Volt; 8801103, Federarm f¿r HELION S; 8801104, Federarm SWING 2-3 kg 3 polig; 8807200, Federarm 6.5kg f¿r HELION M+ Mobile; 8894025, Federarm WA 77, 8,3 kg 3 polig; 1425487, FA AC2 STOP 3,5KG - MAX 7KG; 1768718; FA AC 77, NRH 3P; 0385246, FA AC2000 NRH 3P, 12-18KG; 4024790, FA AC3000 NRH 7P; 1419354, FA AC3000 STOP (17 -26KG); 0384021, FA AC2000 NRH MOBIL 3P  12-18KG; 0385247, FA AC2 000 NRH MOBIL 7P, 12-18KG; 1695239, ACHSE 1F WL 800, 3P + FA SWING; 1695224, ACHSE 1F ZA 800, 3P + FA SWING; 1886331, BEFESTIGUNGSSET FA AC 77/2000/SWING; and Material #1695225, Description: STATIV MOBIL TL1000, 3P + FA SWING."
"Devices","No","","71718","Terminated","Trumpf Medical Systems, Inc.","1046 Legrand Blvd","","Charleston","SC","	29492-7672","United States","Voluntary: Firm initiated","Letter","Worldwide Distribution-US (nationwide) including Puerto Rico, and the countries of  Angola, Antilles, Argentina, Austria, Australia, Azerbaijan, Bosnia and Herzegovina, Belgium, Bulgaria, Bahrain, Brasilia, Belarus, Canada, Switzerland, Chile, China, Columbia, Cyprus, Czech Republic, Germany, Denmark, Algerian, Ecuador, Estonia, Egypt, Spain, Finland, France, Gabon, United Kingdom, Georgian Republic, Greece, Hong Kong, Croatia, Hungary, Indonesia, Ireland, Israel, India, Iraq, Iran, Iceland, Italy, Jordan, Japan, Kenya, South Korea, Kuwait, Kazakhstan, Lebanon, Liechtenstein, Lithuania, Luxembourg, Latvia, Libya, Morocco, Macedonia, Myanmar/Burma, Malta, Mauritius, Mexico, Malaysia, Netherlands, Norway, New Zealand, Peru, Philippines, Pakistan, Poland, Palestine, Portugal, Qatar, Romania, Russia, Saudi Arabia, Sudan, Sweden, Singapore, Slovenia, Slovakia, San Marino, Syria, Thailand, Turkmenistan, Tunisia, Turkey, Taiwan, Ukraine, United Arabian Emirates, Uruguay, Venezuela, British Virgin Islands, Vietnam, Kosovo, Serbia and South Africa.*","Z-2357-2015","Class II","Trumpf Ceiling Mounted Surgical Lighting Systems,TruVidia HD, User Manual #1513140.    The TRUMPF surgical lights are intended to locally illuminate an operating or examination area of the patient's body with a high intensity light.","9,287 units total","Complaints received of the front joint of the spring arm AC 2000 could break at the interface to the monitor.","07/27/2015","08/07/2015","05/03/2017","08/19/2015","The following Material numbers may appear on any of the attached recalled/corrected units: Material #0376288, Description: Federarm 3kg, 3 polig (Swing); 0376289, Federarm 12-18kg, 5-polig Kamera eco; 0376290, Federarm TFT Stop AC 2000, 9-15kg; 0376291, Federarm TFT Stop AC 3000, 12-18kg; 0376292, Federarm TFT Stop Space bis 30kg; 0376293, Federarm 3-polig NRH; 0376294, Federarm 5-polig NRH; 0376295, Federarm 3-polig NRH gerader Abgang; 0376296, Federarm 5-polig NRH gerader Abgang; 0379528, FA AC3000, Stop 7-11KG; 0385719, FA AC 2000 NRH mobil 3p, 12-18kg NG; 1387323, Federarmsicherungssegment AC3000; 1387324, Federarmsicherungssegment AC2000; 1388338, Federarm 12-18 kg 3 polig, HEL2; 1388339, Federarm 12-18 kg 5 polig HEL2; 1388340, Federarm 12-18 kg 9 polig (HELION); 1408906, FA AC2 Stop max 11kg; 1471010, FA AC2000 3p, 12-18kg; 1471011, FA AC2000 Stop 12-18kg; 1471012, FA AC2000 NRH 3p, 12-18kg; 1471013, FA AC2000, 7p, 12-18kg; 1471014, FA AC2000 NRH 7p, 12-18kg; 1471015, FA AC3000 3p, 23-30kg; 1471016, FA AC2000 Stop 6-11kg; 1471017, FA AC2000 TruVidia 7p, 3,5-7kg; 1471018, FA AC2000 Stop 3,5-7kg; 1471351, FA AC3000 NRH 3p, 23-30kg; 1502084, FA AC2 NRH f¿r HEL2, 3POL.; 1504731, Federarm 9-POLIG NRH HEL2; 1507085, (R)FEDERARM AC2000; 1645860, FA AC 2000 NRH mobil 7p, 12-18kg NG; 1645861, FA AC 2000 NRH 7p, 12-18kg NG; 1649687, FA AC 2000 SlimLine STOP, 12-18kg; 1649872, FA AC 2000 SlimLine 3p, 12-18kg; 1649997, Deckenrohr 2f Slimline 1000; 1774143, Ausleger AC2000, 750mm, 3p; 1982310, FA AC2000 MAVIG Protegra2 6-11kg; 1982311, FA AC2000 MAVIG Protegra2 12-18kg; 1982312, FA AC2000 3p, 13,5-21kg; 1982313, FA AC2000 NRH 3p, 13,5-21kg; 4024211, Federarm AC2000; 4024212, FA AC2 Stop; 4024213, FA AC3; 4024214, FA AC3000 Stop, 12-18kg; 4024215, FA AC5000 Stop; 4024651, FA AC3000, 7p; 4024652, FA AC2 3K; 024848, Federarm AC3000 NRH; 4025574, FA AC3000 Stop 23-30 kg; 4025575, FA AC5000 Stop max 15 kg; 4025576, FA AC2 K TruVidia; 8800900, Federarm HELION L+ 12,5 kg 5-polig; 8800901, Federarm HELION M+ 12,5 kg 3-polig; 8800905, Federarm HEL L/L+, 11,4 kg 3-polig; 8800906, Federarm HELION M NRH; 8800907, Federarm FA 77 V 11,4 kg 3 polig; 8800908, Federarm FA 77 V 6,8 kg 3 polig; 8800909, Federarm f¿r L-Leuchte So-Version; 8800910, Federarm f¿r M-Leuchte So-Version; 8800911, Federarm FA 77 V 13 kg 3 polig; 8800915, Federarm FA 77 N 11,4 kg5 polig; 8800916, Federarm FA 77 N 6,8 kg 5 polig; 8800919, Federarm FA 77 N 13 kg 5 polig; 8800920, Federarm FA 77 N 8,9 kg 5 polig; 8800925, Federarm FA 77 N 11,4 kg 7 polig; 8800926, Federarm Helion M NRH 7-polig; 8800929, Federarm FA 77 N 13 kg 7 polig; 8800930, Federarm FA 77 N 8,9 kg 7 polig; 8801000, Federarm HELION M+ 8.3 kg 5-polig; 8801001, Federarm HELION M+ 8,3 kg 3-polig; 8801007, Federarm AC 2000, 9-15 kg O. Elektrik; 8801008, Federarm AC 2000, 7-12 kg 5 polig; 8801009, Federarm AC 2000, 12-18 kg 5 polig; 8801010, Federarm Acrobat 2000 12-18 kg; 8801011, Federarm; 8801012, Federarm AC 2000 7-15 kg 3 polig mit; 8801013, Federarm AC 2000, 9-15 kg 7 polig; 8801014, Federarm f¿r Helion M; 8801015, Federarm AC 2000, 1-3,5 kg 7 polig; 8801016, Federarm AC2000 9-15 kg 5-polig; 8801017, Federarm HELION S Mobile; 8801018, Federarm AC 2000, 12-18 kg 3 polig; 8801019, Federarm AC 2000, 1-3,5 kg 3 polig; 8801020, Federarm AC 2000, 12-18 kg 7 polig; 8801021, Federarm AC 2000, 1-3,5KG, Adapt. Anschl; 8801033, Federarm Deckenanschlu¿ HELS; 8801050, Federarm AC 3000, 12-18 kg ohne Elektr.; 8801051, Federarm SPACE 20-40 kg ohne Elektrik; 8801101, Federarm SWING 2-3 kg 3 POL. 120 Volt; 8801102, Federarm SWING 2-3 kg 3 POL. 230 Volt; 8801103, Federarm f¿r HELION S; 8801104, Federarm SWING 2-3 kg 3 polig; 8807200, Federarm 6.5kg f¿r HELION M+ Mobile; 8894025, Federarm WA 77, 8,3 kg 3 polig; 1425487, FA AC2 STOP 3,5KG - MAX 7KG; 1768718; FA AC 77, NRH 3P; 0385246, FA AC2000 NRH 3P, 12-18KG; 4024790, FA AC3000 NRH 7P; 1419354, FA AC3000 STOP (17 -26KG); 0384021, FA AC2000 NRH MOBIL 3P  12-18KG; 0385247, FA AC2 000 NRH MOBIL 7P, 12-18KG; 1695239, ACHSE 1F WL 800, 3P + FA SWING; 1695224, ACHSE 1F ZA 800, 3P + FA SWING; 1886331, BEFESTIGUNGSSET FA AC 77/2000/SWING; and Material #1695225, Description: STATIV MOBIL TL1000, 3P + FA SWING."
"Devices","No","","71724","Ongoing","Fresenius Medical Care Holdings, Inc.","920 Winter St","","Waltham","MA","	02451-1521","United States","Voluntary: Firm initiated","Letter","Nationwide Distribution","Z-2373-2015","Class II","Naturalyte Liquid Bicarbonate Concentrate 6.4 liter bottle  A Dialysate Concentrate for Hemodialysis (liquid)  Product Code: 08-4000-LB  ","2,264,028","Expansion of recall to lots manufactured in 2015 due to the potential for bacterial contamination.","07/16/2015","08/12/2015","","08/19/2015","Lots begin with: 15AMLB, 15BMLB, 15CMLB."
"Devices","No","","71729","Terminated","Synthes (USA) Products LLC","1301 Goshen Pkwy","","West Chester","PA","	19380-5986","United States","Voluntary: Firm initiated","Letter","Worldwide Distribution.","Z-2359-2015","Class II","8.5mm Reamer Head for Flexible Intramedullary Nailing System; An orthopedic manual surgical instrument is a nonpowered hand-held device intended for medical purposes to manipulate tissue or for use with other devices in orthopedic surgery. This generic type of device includes the cerclage applier, awl, bender, drill brace, broach, burr, corkscrew, countersink, pin crimper, wire cutter, prosthesis driver, extractor, file, fork, needle holder, impactor, bending or contouring instrument, compression instrument, passer, socket positioner, probe, femoral neck punch, socket pusher, reamer, rongeur, scissors, screwdriver, bone skid, staple driver, bone screw starter, surgical stripper, tamp, bone tap, trephine, wire twister, and wrench.","4329","The possibility exists for intraoperative reamer head breakages which could also allow for un-retrieved fragments of non-implant grade material: additional lot numbers identified. No new adverse events reported.     ","07/01/2015","08/10/2015","08/26/2016","08/19/2015","Part Number 352.085, Sold lot numbers: 4399543  4411503  4420609  4425217  4500163  4500164  4500686  4516589  4606034  4606035  4619636  4631667  4646360  4658303  4660046  4676339  4691146  4691147  4705949  4720351  4720352  4757916  4769298  4769248  4799766  4790646  4798484  4856180  4882851  4899798  4919634  4937255  4937251  4956701  4956699  4977566  4994239  5018161  5018284  5034158  5034157  5050564  5052365  5065433  5087496  5102055  5102054  5124415  5124416  5140714  5140716  5161068  5185228  5203705  5226958  5226959  5248981  5249272  5249274  5249278  5294388  5299855  5299857  5299856  5299858  5362321  5454350  5454351  5471078  5493666  5508984  5535700  5554801  5575607  5582834  5610290  5635000  5652084  5665722  5697107  5718304  5735831  5756081  5769433  5784706  5813830  5837326  5870257  20141  20290  20291  21025  20713  21372  21677  21829  22717  20292  22981  21201  22592  23390  21927  23439  23944  24091  24334  24510  24917  24934  25076  25171  25178  4800264  4803085"
"Food","No","","71742","Terminated","Raymond-Hadley Corp.","89 Tompkins Street","","Spencer","NY","	14883-9759","United States","Voluntary: Firm initiated","Two or more of the following: Email, Fax, Letter, Press Release, Telephone, Visit","NY, MA, ME, DE, MD","F-2944-2015","Class II","Pride of Africa brand Enriched Farina, Net Weight 5 lb. (2.27 kg), UPC 016712016840 --- Product of The Raymond-Hadley Corp. Spencer, NY 14883 --- Product is packaged in a clear plastic pouch with green, brown and white artwork.","200 cases (6 x 5 lbs. packages per case)","Pride of Africa Enriched Farina label failed to declare the presence of wheat.","07/20/2015","08/10/2015","05/05/2017","08/19/2015","Lot 02015-1 and 12415-1"
"Food","No","","71743","Terminated","Optimal Nutrition, Inc","7678 Miramar Rd","","San Diego","CA","	92126-4202","United States","Voluntary: Firm initiated","E-Mail","US","F-2962-2015","Class II","FITzee Foods Paleo Turkey Meatloaf all sizes (small, medium, large and XL)","290 units","Optimal Nutrition dba FITzee Foods is recalling Paleo Meatloaf because it contains green beans which is on recall due to Listeria monocytogenes.","07/17/2015","08/13/2015","10/27/2015","08/19/2015","all sizes; from: June 20, 2015 through July 16, 2015."
"Drugs","No","","71750","Terminated","GlaxoSmithkline Consmer Healthcare","1000 GSK Drive","","Moon Township","PA","	15108","United States","Voluntary: Firm initiated","Letter","Nationwide, Puerto Rico & Taiwan","D-1317-2015","Class II","biotene Gentle Mint Gel, 4.5 oz.(127.6 g) tubes, Manufactured by Oratech, South Jordan, UTAH 84095, Distributed by GlaxoSmithKline, Consumer Healthcare, L.P., Moon Township, PA 15108, NDC 0135-0488-01","30,516 tubes","Presence of Foreign Substance: Fragments of wood found when the product was extruded onto a toothbrush.","07/15/2015","08/11/2015","04/19/2017","08/19/2015","Lot #    Y2J101, Y2J111, Exp 08/15  Y3D031, Exp 02/16"
"Drugs","No","","71750","Terminated","GlaxoSmithkline Consmer Healthcare","1000 GSK Drive","","Moon Township","PA","	15108","United States","Voluntary: Firm initiated","Letter","Nationwide, Puerto Rico & Taiwan","D-1318-2015","Class II","biotene Gentle Formula FLUORIDE TOOTHPASTE Fresh Mint Original, a) 0.70 oz (19.8 g) tubes., (NDC 0135-0557-02) , b) 0.75 oz. (21.3 g) tubes, (NDC 0135-0487-02), c) 4.3 oz. (121.9 g) tubes, (NDC 0135-0557-01), d) 4.5 oz. (127.6 g) tubes, (NDC 0135-0487-01), Manufactured by Oratech, South Jordan, UTAH 84095, Distributed by GlaxoSmithKline, Consumer Healthcare, L.P., Moon Township, PA 15108","366,192 tubes","Presence of Foreign Substance: Fragments of wood found when the product was extruded onto a toothbrush.","07/15/2015","08/11/2015","04/19/2017","08/19/2015","Lot #    a)    X3G121, X3H141, Exp 06/16  X3K121, Exp 09/16  X4D281, Exp 03/17  X4G181, Exp 06/17    b)    X3C041, Exp 01/16    c)    X3F032, Exp 04/16  X3G101, X3G131, Exp 06/16  X3H171, X3H211, X3H291, Exp 07/16  X3J271, Exp 08/16  X3K021, X3K171, X3K291, Exp 09/16  X3M121, Exp 10/16  X3N171, Exp 11/16  X4B061, X4B081, Exp 01/17  X4C121, X4C251, Exp 02/17  X4D291, X4D301, Exp 03/17  X4E081, X4G131, Exp 04/17  X4H111, Exp 06/17    d)    X2H021, Exp 07/15   X2K151, X2K231 Exp 09/15  X3B211,X3C012, X3C011, Exp 01/16  X3C141, X3C251, Exp 02/16  X3G021, Exp 06/16"
"Drugs","No","","71750","Terminated","GlaxoSmithkline Consmer Healthcare","1000 GSK Drive","","Moon Township","PA","	15108","United States","Voluntary: Firm initiated","Letter","Nationwide, Puerto Rico & Taiwan","D-1319-2015","Class II","biotene Gentle Formula FLUORIDE TOOTHPASTE GENTLE MINT , 4.3 oz.(121.9 g) tubes, Manufactured by Oratech, South Jordan, UTAH, 84095, Distributed by GlaxoSmithKline, Consumer Healthcare, L.P., Moon Township, PA 15108 NDC 0135-0558-01","111,892 tubes","Presence of Foreign Substance: Fragments of wood found when the product was extruded onto a toothbrush.","07/15/2015","08/11/2015","04/19/2017","08/19/2015","Lot #    Y3E211, Exp 04/16  Y3G231, Y3G251, Exp 06/16  Y3J231,Y3N191 Exp 08/16  Y3N171, Exp 11/16  Y4A141, Exp 12/16  Y4C271, Exp 02/17  Y4E131, Exp 04/17  Y4G101, Exp 05/17  Y4H191, Exp 06/17"
"Drugs","No","","71750","Terminated","GlaxoSmithkline Consmer Healthcare","1000 GSK Drive","","Moon Township","PA","	15108","United States","Voluntary: Firm initiated","Letter","Nationwide, Puerto Rico & Taiwan","D-1320-2015","Class II","biotene PBF Toothpaste (Plaque-Biofilm Loosening Formula), a) 4.3 oz. (121.9 g) tubes, (NDC 0135-0559-01), biotene¿ PBF Paste, b) 4.5 oz.(127.6 g) tubes, (NDC 0135-0490-02), Manufactured by Oratech, South Jordan, UTAH 84095, Distributed by GlaxoSmithKline, Consumer Healthcare, L.P., Moon Township, PA 15108","50,860 tubes","Presence of Foreign Substance: Fragments of wood found when the product was extruded onto a toothbrush.","07/15/2015","08/11/2015","04/19/2017","08/19/2015","Lot #     a)    Z3M191, Exp 10/15  Z4C081, Exp 02/16  Z4H171, Exp 07/16    b)    Z2K301, Exp 10/15  Z3D181, Exp 04/16"
"Drugs","No","","71750","Terminated","GlaxoSmithkline Consmer Healthcare","1000 GSK Drive","","Moon Township","PA","	15108","United States","Voluntary: Firm initiated","Letter","Nationwide, Puerto Rico & Taiwan","D-1321-2015","Class II","SENSODYNE EXTRA FRESH COMPLETE PROTECTION, 3.4 oz.(96.4 g) tubes, Manufactured by Oratech, South Jordan UTAH 84095, Distributed by GlaxoSmithKline, Consumer Healthcare, L.P., Moon Township, PA 15108, NDC 0135-0572-02","50,860 tubes","Presence of Foreign Substance: Fragments of wood found when the product was extruded onto a toothbrush.","07/15/2015","08/11/2015","04/19/2017","08/19/2015","Lot #    C4D061, Exp 03/16  C4E161, C4E211, Exp 04/16  C4F051, Exp 05/16  C4H111, Exp 07/16"
"Drugs","No","","71750","Terminated","GlaxoSmithkline Consmer Healthcare","1000 GSK Drive","","Moon Township","PA","	15108","United States","Voluntary: Firm initiated","Letter","Nationwide, Puerto Rico & Taiwan","D-1322-2015","Class II","SENSODYNE COMPLETE PROTECTION, 3.4 oz. (96.4 g)tubes, Manufactured by Oratech, South Jordan UTAH 84095, Distributed by GlaxoSmithKline, Consumer Healthcare, L.P., Moon Township, PA 15108,  NDC 0135-0573-02","81,376 tubes","Presence of Foreign Substance: Fragments of wood found when the product was extruded onto a toothbrush.","07/15/2015","08/11/2015","04/19/2017","08/19/2015","Lot #    B4D031, Exp 03/16  B4E101, Exp 04/16  B4F261,B4F291,B4G011, Exp 05/16  B4G031, B4G091, Exp 06/16  B4J031, Exp 07/16"
"Drugs","No","","71750","Terminated","GlaxoSmithkline Consmer Healthcare","1000 GSK Drive","","Moon Township","PA","	15108","United States","Voluntary: Firm initiated","Letter","Nationwide, Puerto Rico & Taiwan","D-1323-2015","Class II","SENSODYNE EXTRA FRESH REPAIR & PROTECT, 3.4 oz. (96.4 g) tubes, Manufactured by Oratech, South Jordan, UTAH 84095, Distributed by GlaxoSmithKline, Consumer Healthcare, L.P., Moon Township, PA 15108,  NDC 0135-0547-02","335,676 tubes","Presence of Foreign Substance: Fragments of wood found when the product was extruded onto a toothbrush.","07/15/2015","08/11/2015","04/19/2017","08/19/2015","Lot #     Q3H061, Q3H081, Q3H101, Q3H131, Exp 07/15  Q3J101, Q3J121, Q3J261, Q3J291, Exp 08/15  Q3K161, Q3K181, Q3K211, Q3M021, Exp 09/15  Q3M071, QEM251, Exp 10/15  Q3N021, Q3N211, Exp 11/15  Q4A071, Q4A111, Q4A251, Q4B201, Exp 12/15  Q4C151, Q4C191, Exp 12/16  Q4D111, Q4D151, Q4D151R, Exp 03/16  Q4E151, Q4E151R, Q3E152, Exp 04/16  Q4F161, Q4F201, Exp 05/16  Q4G271, Q4G301, Exp 06/16  Q4J051, Exp 08/16"
"Drugs","No","","71750","Terminated","GlaxoSmithkline Consmer Healthcare","1000 GSK Drive","","Moon Township","PA","	15108","United States","Voluntary: Firm initiated","Letter","Nationwide, Puerto Rico & Taiwan","D-1324-2015","Class II","SENSODYNE WITH FLUORIDE REPAIR & PROTECT, a) 0.8 oz.(23 g) tubes, (NDC 0135-0548-01);  b) 3.4 oz. (96.4 g) tubes, (NDC 0135-0548-02) Manufactured by Oratech, South Jordan, UTAH 84095, Distributed by GlaxoSmithKline, Consumer Healthcare, L.P., Moon Township, PA 15108","325,504 tubes","Presence of Foreign Substance: Fragments of wood found when the product was extruded onto a toothbrush.","07/15/2015","08/11/2015","04/19/2017","08/19/2015","Lot #     a)     R3J181, Exp 08/15   R4A191, R4A192, R41291, R4B011, Exp 12/15  R4C111, Exp 02/16     Lot # b)    R3G291, R3H011, Exp 06/15  R3H191, R3H261, R3H291, Exp 07/15  R3J171, R3J182, R3J191, R3J241, Exp 08/15  R3K031, R3K121, R3K221, R3K291, Exp 09/15  R3M111, R3M181, Exp 10/15  R3N081, R3N101, Exp 11/15  R4A211, Exp 12/15  R4B281, Exp 01/16  R4C041, R4C291, R4D021, Exp 02/16  R4D081, Exp 03/16  R4E231, Exp 04/16  R4F081, Exp 05/16  R4G191, Exp 06/16  R4H031, R4H071, R4H271, Exp 07/16"
"Food","No","","71752","Terminated","Krusinskis Finest Meat Products","6300 Heisley Ave","","Cleveland","OH","	44105-1226","United States","Voluntary: Firm initiated","Letter","Product was shipped to the following state: OH.","F-2941-2015","Class II","Janka Fully Cooked Apricot Pierogi Ingredients: DOUGH: Blended Flour (Wheat Flour, Malted Barley Flour, Niacin, Iron, Potassium Bromate, Thiamine Mononitrate, Riboflavin), Water, Whole Milk, Eggs, Dried Potatoes (Color and Flavor Protected with Sodium Bisulfate, Citric Acid and BHT), Oleomargarine (Liquid Soybean Oil, Partially Hydrogenated Soybean Oil, Water, Salt, Vegetable Lecithin, Vegetable Mono and Diglycerides, Whey Citric Acid, Calcium Disodium EDTA and Sodium Benzoate as preservatives. Artificially Flavored, Colored with Carotene, Vitamin A Palmitate Added), Salt, Sugar.  FILLING: Sugar Syrup, Apricots prepared with Sulphur, Corn Syrup, Vegetable Stabilizer.  FD & C Yellow #6.","75/5lb boxes","Food recall due to misbranding/incorrect labeling of Janka Apricot Pierogies.  Yellow #5 not included on label of final product.","04/03/2015","08/11/2015","10/19/2015","08/19/2015","No codes applied to product"
"Food","No","","71775","Terminated","Restaurant Depot","1524 132nd St","","College Point","NY","	11356-2440","United States","Voluntary: Firm initiated","Two or more of the following: Email, Fax, Letter, Press Release, Telephone, Visit","CT, MA, NJ, NY & PA","F-2959-2015","Class II","JAMES FARM GARDEN PEAS CHICHAROS, NET Wt. 40 OZ (2.5 LBS), FRESH FROZEN, UPC 7 60695 01000, product is packed in plastic bags and shipped as 12 units/40 oz. per carton, Net Wt. 30lb.  Distributed by RD/Jet, LLC 15-24 132 nd Street College Point, NY 11356.  PRODUCT OF POLAND.","289 bags/40 oz (2.5 LBS)","Jetro Restaurant Depot has initiated a recall due to Listeria monocytogenes contamination.","07/23/2015","08/13/2015","06/12/2018","08/19/2015","06.11.2015"
