"Devices","No","","80460","Ongoing","ICU Medical de Mexico, S.A. de C.V.","Avenida Cuarzo 250","Ensenada","Ejido Maneadero","","	","Mexico","Voluntary: Firm initiated","Letter","US distribution to AZ, MA, NC, OH, TX, VA, WA.      Worldwide distribution to Belgium, France, Germany.","Z-2815-2018","Class II","10"" Smallbore Ext Set w/6-Port NanoClave Manifold (Orange, Red, Blue, Purple, Yellow, Green Rings), NanoClave (Light Blue Ring), Check Valve, Clamp, Rotating Luer.  ","150 pouches","ICU Medical is expanding the scope of their previously initiated recall to include additional I.V. Administration Sets with NanoClave manifold due to the potential to develop a leak or for separation between the female luer and the NanoClave manifold.","03/01/2018","08/16/2018","","08/22/2018","Item Number AM6128.      a. Lot Number 3423330, UDI Number (01) 1 0887709 08696 5 (17) 220401 (30) 50 (10) 3423330,  Expiration Date 04/01/2022;    b. Lot Number 3476737, UDI Number (01) 1 0887709 08696 5 (17) 220601 (30) 50 (10) 3476737, Expiration Date 06/01/2022"
"Devices","No","","80460","Ongoing","ICU Medical de Mexico, S.A. de C.V.","Avenida Cuarzo 250","Ensenada","Ejido Maneadero","","	","Mexico","Voluntary: Firm initiated","Letter","US distribution to AZ, MA, NC, OH, TX, VA, WA.      Worldwide distribution to Belgium, France, Germany.","Z-2816-2018","Class II","6"" Smallbore Ext Set w/6-Port NanoClave Manifold, Check Valve, Clamp, Rotating Luer.","300 pouches","ICU Medical is expanding the scope of their previously initiated recall to include additional I.V. Administration Sets with NanoClave manifold due to the potential to develop a leak or for separation between the female luer and the NanoClave manifold.","03/01/2018","08/16/2018","","08/22/2018","Item Number AM6130.      a. Lot Number 3414534, UDI Number (01) 1 0887709 08771 9 (17) 220201 (30) 50 (10) 3414534,  Expiration Date 02/01/2022;    b. Lot Number 3442461, UDI Number (01) 1 0887709 08771 9 (17) 220501 (30) 50 (10) 3442461, Expiration Date 05/01/2022;    b. Lot Number 3509517, UDI Number (01) 1 0887709 08771 9 (17) 220801 (30) 50 (10) 3509517, Expiration Date 08/01/2022"
"Devices","No","","80467","Terminated","Hamilton Medical AG","Via Crusch 8","","Bonaduz","","	","Switzerland","Voluntary: Firm initiated","Letter","US distribution to CA, CO, IL, LA, MN, NY, OK, VA, WI.      Worldwide distribution to China, Germany, India, Indonesia, Israel, Kazakhstan, Korea, Pakistan, Taiwan, Poland, Armenia.","Z-2795-2018","Class II","Hamilton-C1 Ventilator Unit    Product Usage:  The HAMILTON-C1 ventilator is intended to provide positive pressure ventilation support to adults and pediatrics. The device is used in the in the intensive care ward, in the recovery room, and during transfer of ventilated patients within the hospital.  ","16 devices","An out of specification component on the control board may cause the ventilator to open the inspiratory channel and the expiratory valve. The ventilator will shut down and an emergency buzzer providing an acoustic alarm and the blinking alarm LED on the device s front side.","03/09/2018","08/13/2018","03/18/2019","08/22/2018","Serial Number: 12244, 12246, 12338, 12343, 12344, 12345, 12351, 12352, 12355, 12370, 12380, 12382, 12383, 12412, 12426, 12432"
"Devices","No","","80467","Terminated","Hamilton Medical AG","Via Crusch 8","","Bonaduz","","	","Switzerland","Voluntary: Firm initiated","Letter","US distribution to CA, CO, IL, LA, MN, NY, OK, VA, WI.      Worldwide distribution to China, Germany, India, Indonesia, Israel, Kazakhstan, Korea, Pakistan, Taiwan, Poland, Armenia.","Z-2796-2018","Class II","Hamilton-C3 Ventilator Unit    Product Usage:  The HAMILTON-C3 ventilator is intended to provide positive pressure ventilator support to adults, pediatrics, infants and neonates depending on its configuration. The device is used in the intensive care ward, intermediate care ward, emergency ward, long term acute care hospital or in the recovery room, and during transfer of ventilated patients within the hospital.  ","2 devices","An out of specification component on the control board may cause the ventilator to open the inspiratory channel and the expiratory valve. The ventilator will shut down and an emergency buzzer providing an acoustic alarm and the blinking alarm LED on the device s front side.","03/09/2018","08/13/2018","03/18/2019","08/22/2018","Serial Number: 3084, 3088"
"Devices","No","","80492","Terminated","Cook Inc.","750 N Daniels Way","","Bloomington","IN","	47404-9120","United States","Voluntary: Firm initiated","E-Mail","One distributor in Indiana; product was not further distributed to end users.","Z-2791-2018","Class II","VentriClear Ventricular Drainage Catheter Set, Cat. No. N-VVDC-01-ABRM    Product Usage:  The VentriClear Ventricular Drainage Catheter Set has been designed for obtaining access to a ventricular cavity of the brain for short-term use to externally drain fluid for the purpose of relieving elevated intracranial pressure or fluid volume.  ","250","This lot of VentriClear failed endotoxin testing.  Potential adverse events include immune responses ranging from non-specific febrile reaction to life-threatening systemic inflammatory response syndrome (SIRS).","05/31/2018","08/11/2018","04/11/2019","08/22/2018","lot 8639185"
"Devices","No","","80512","Ongoing","NxStage Medical, Inc.","350 Merrimack St","","Lawrence","MA","	01843-1748","United States","Voluntary: Firm initiated","Letter","Worldwide Distribution - US Nationwide in the countries of Australia, Canada, France, Germany, Italy, Kuwait, Netherlands, Saudi Arabia, Spain, Sweden, and UK.","Z-2793-2018","Class II","NxStage Express Fluid Warmer (FW-300, FW-300-A, FW-300-WW, FW-301, FW-301-A)    Product Usage:  The NxStage Express Fluid Warmer is an accessory to the NxStage System One used to warm therapy fluids prior to administration.  ","14975","There is a potential risk of electrical fire when fluid leaks into the power receptacle on the back of the warmer. The risk exists any time the warmer is plugged in. The firm has received 7 reports of smoke, sparks, or flames coming from the Express Fluid Warmer since 2016. No adverse events have been reported.","06/11/2018","08/13/2018","","08/22/2018","All units are affected. As of 6/11/18, the last serial number manufactured was W35452."
"Devices","No","","80519","Ongoing","Guangzhou Improve Medical Instruments Co., Ltd.","NO. 102 Kaiyuan Avenue","Science City","Guangzhou","","	","China","Voluntary: Firm initiated","E-Mail","Puerto Rico","Z-2790-2018","Class II","Improve Blood Collection Sets with Multiple Sample Luer Adapter - Sterile/EO    Product Usage:   The Blood Collection Set are single-use, sterile, winged needle bonded to a flexible tubing with luer adapter. The needle consists of (1) a winged needle, (2) a flexible tubing, (3) a luer adaptor. The products and evacuated blood collection tube/ syringe are used together for the collection of venous blood.   ","700,000","Complaints about the needle is not smooth, with discoloration, a kind of gel agglomeration on the needle tip.","10/19/2016","08/11/2018","","08/22/2018","Serial Number 102030132 Lots #'s: 20150210 and 20150410"
"Devices","No","","80530","Ongoing","Terumo Cardiovascular Systems Corporation","6200 Jackson Rd","","Ann Arbor","MI","	48103-9586","United States","Voluntary: Firm initiated","Telephone","Worldwide Distribution - US Nationwide in the states of AL, AZ, CA, FL, GA, IL, KY, LA, MA, MD, MI, MN, MO, MS, NC, NM, NY, OH, SC, TN, TX, WA, and WV. Foreign distribution to Middle East, Latin America, Europe, Japan, Canada, and Mexico.","Z-2750-2018","Class II","CDI Blood parameter monitoring system 500 H/SAT, Part No. 145883    Product Usage:  The CDI System 500 provides continuous, on-line monitoring of the extracorporeal partial pressure of oxygen and carbon dioxide, pH, potassium, oxygen saturation, hematocrit, hemoglobin and temperature. In addition, calculated values of base excess, bicarbonate, oxygen saturation, and oxygen consumption may also be provided. These parameters are displayed at either actual temperature or adjusted to 37C. For documentation purposes, the system 500s integral printer provides a hard copy of displayed parameters.  ","128 in total","H/Sat Hybrid Intensity Shift has been seen in a subset of the H/Sat population, which has resulted in an increase of Hybrids failing the H/Sat Color Chip Test which is an automated self-test when the device is powered on. This will not result in device inaccuracy, only Color Chip Test Failure which disables the H/Sat module.","06/26/2018","08/10/2018","","08/22/2018","H011684                         H011685                         H011686                         H011687                         H011688                         H011689                         H011691                         H011692                         H011693                         H011694                         H011695                         H011696                         H011697                         H011699                         H011700                         H011701                         H011702                         H011704                         H011705                         H011706                         H011707                         H011708                         H011709                         H011710                         H011711                         H011712                         H011713                         H011714                         H011715                         H011717                         H011718                         H011719                         H011721                         H011722                         H011723                         H011725                         H011726                         H011727                         H011730                         H011731                         H011732                         H011733                         H011735                         H011736                         H011737                         H011738                         H011742                         H011744                         H011745                         H011747                         H011749                         H011750                         H011751                         H011752                         H011753                         H011754                         H011755                         H011756                         H011757                         H011758                         H011759                         H011760                         H011761                         H011762                         H011766                         H011772                         H011778                         H011779                         H011780                         H011781                         H011783                         H011784                         H011785                         H011786                         H011788                         H011789                         H011790                         H011791                         H011792                         H011793                         H011794                         H011795                         H011796                         H011797                         H011798                         H011799                         H011800                         H011801                         H011803                         H011804                         H011805                         H011806                         H011807                         H011808                         H011809                         H011810                         H011811                         H011812                         H011813                         H011814                         H011815                         H011817                         H011819                         H011821                         H024598                         H024599                         H024600                         H024601                         H024602                         H024603                         H024604                         H024605                         H024606                         H024607                         H024608                         H024611                         H024612                         H024613                         H024614                         H024615                         H024616                         H024617                         H024618                         H024620                         H024621                          H024624                         H024625                         H024626                         H024627                         H024628                         H024629                         H024631                         H024632                         H024633                         H024635                         H024636                         H024637                         H024638                         H024639                         H024641                         H024642                         H024643                         H024645                         H024647                         H024649                         H024652                         H024654                         H024655                         H024657                         H024659                         H024674"
"Devices","No","","80530","Ongoing","Terumo Cardiovascular Systems Corporation","6200 Jackson Rd","","Ann Arbor","MI","	48103-9586","United States","Voluntary: Firm initiated","Telephone","Worldwide Distribution - US Nationwide in the states of AL, AZ, CA, FL, GA, IL, KY, LA, MA, MD, MI, MN, MO, MS, NC, NM, NY, OH, SC, TN, TX, WA, and WV. Foreign distribution to Middle East, Latin America, Europe, Japan, Canada, and Mexico.","Z-2751-2018","Class II","Monitor with one Blood Parameter Module and one HSat Probe; 500AHCT  Monitor with two Blood Parameter modules and one HSat Probe; 500AVHCT    Product Usage:  The CDI System 500 provides continuous, on-line monitoring of the extracorporeal partial pressure of oxygen and carbon dioxide, pH, potassium, oxygen saturation, hematocrit, hemoglobin and temperature. In addition, calculated values of base excess, bicarbonate, oxygen saturation, and oxygen consumption may also be provided. These parameters are displayed at either actual temperature or adjusted to 37C. For documentation purposes, the system 500s integral printer provides a hard copy of displayed parameters.  ","128 in total","H/Sat Hybrid Intensity Shift has been seen in a subset of the H/Sat population, which has resulted in an increase of Hybrids failing the H/Sat Color Chip Test which is an automated self-test when the device is powered on. This will not result in device inaccuracy, only Color Chip Test Failure which disables the H/Sat module.","06/26/2018","08/10/2018","","08/22/2018","H011684                         H011685                         H011686                         H011687                         H011688                         H011689                         H011691                         H011692                         H011693                         H011694                         H011695                         H011696                         H011697                         H011699                         H011700                         H011701                         H011702                         H011704                         H011705                         H011706                         H011707                         H011708                         H011709                         H011710                         H011711                         H011712                         H011713                         H011714                         H011715                         H011717                         H011718                         H011719                         H011721                         H011722                         H011723                         H011725                         H011726                         H011727                         H011730                         H011731                         H011732                         H011733                         H011735                         H011736                         H011737                         H011738                         H011742                         H011744                         H011745                         H011747                         H011749                         H011750                         H011751                         H011752                         H011753                         H011754                         H011755                         H011756                         H011757                         H011758                         H011759                         H011760                         H011761                         H011762                         H011766                         H011772                         H011778                         H011779                         H011780                         H011781                         H011783                         H011784                         H011785                         H011786                         H011788                         H011789                         H011790                         H011791                         H011792                         H011793                         H011794                         H011795                         H011796                         H011797                         H011798                         H011799                         H011800                         H011801                         H011803                         H011804                         H011805                         H011806                         H011807                         H011808                         H011809                         H011810                         H011811                         H011812                         H011813                         H011814                         H011815                         H011817                         H011819                         H011821                         H024598                         H024599                         H024600                         H024601                         H024602                         H024603                         H024604                         H024605                         H024606                         H024607                         H024608                         H024611                         H024612                         H024613                         H024614                         H024615                         H024616                         H024617                         H024618                         H024620                         H024621                          H024624                         H024625                         H024626                         H024627                         H024628                         H024629                         H024631                         H024632                         H024633                         H024635                         H024636                         H024637                         H024638                         H024639                         H024641                         H024642                         H024643                         H024645                         H024647                         H024649                         H024652                         H024654                         H024655                         H024657                         H024659                         H024674"
"Devices","No","","80533","Ongoing","Withings Sas","2 rue Maurice Hartmann","","Issy les Moulineaux","","	","France","Voluntary: Firm initiated","Letter","US Nationwide Distribution","Z-2829-2018","Class II","Nokia BPM+  Wireless Blood Pressure Monitor    Product System, measurement, blood-pressure, non-invasive","Total 44,000 units (15,139 US/ 28,861 OUS)","Device could not meet the requirements for systolic pressure","06/11/2018","08/16/2018","","08/22/2018","7024260310"
"Devices","No","","80534","Ongoing","Zimmer Biomet, Inc.","56 E Bell Dr","","Warsaw","IN","	46582-6989","United States","Voluntary: Firm initiated","Two or more of the following: Email, Fax, Letter, Press Release, Telephone, Visit","US distribution to CA, GA, IL, MO, NY, and VA.","Z-2820-2018","Class II","ARCOS Modular Revision Hip System, item number 11-300814  orthopedic hip prosthesis femoral stem.","12","Two lots of the Echo BI-Metric Hip Stem and ARCOS Modular Revision Hip Stem may have been comingled. Potential health consequences include extension of surgery time to find a replacement component.","06/08/2018","08/14/2018","","08/22/2018","lot 621550  UDI (01)00880304474154(17)280206(10)621550"
"Devices","No","","80534","Ongoing","Zimmer Biomet, Inc.","56 E Bell Dr","","Warsaw","IN","	46582-6989","United States","Voluntary: Firm initiated","Two or more of the following: Email, Fax, Letter, Press Release, Telephone, Visit","US distribution to CA, GA, IL, MO, NY, and VA.","Z-2821-2018","Class II","ECHO Bi-Metric Hip System, Reduced Proximal Profile, Standard 135o neck, item number 192414.  orthopedic hip prosthesis femoral stem","12","Two lots of the Echo BI-Metric Hip Stem and ARCOS Modular Revision Hip Stem may have been comingled. Potential health consequences include extension of surgery time to find a replacement component.","06/08/2018","08/14/2018","","08/22/2018","lot 944680.  UDI (01)00880304463370(17)280206(10)944680"
"Devices","No","","80539","Ongoing","ConvaTec, Inc","7900 Triad Center Dr Ste 400","","Greensboro","NC","	27409-9076","United States","Voluntary: Firm initiated","Letter","worldwide Distribution: US (nationwide) and countries of: Australia, Austria, Canada, Bahrain, Bangladesh, Belgium, Chile, China, Colombia, Croatia, Czech Republic, Denmark, Estonia, Finland, France, Germany, Hungary, India, Israel, Italy, Kenya, Kuwait, Malta, Mauritius, Netherlands,Norway, Portugal, Qatar, Romania, Saudi Arabia, Singapore, Slovenia, South Africa, South Korea, Spain, Sweden, Switzerland, Taiwan, Turkey, United Kingdom, United Arab Emirates, and Vietnam.","Z-2744-2018","Class II","AbViser AutoValve IAP (intra- abdominal pressure) Monitoring Device, Patient mount: a) REF ABV300, b) REF ABV301     AbViser is a sterile non-invasive disposable intra- abdominal pressure monitoring device containing aspiration tubing, infusion tubing, valves and optional pressure transducers for the measurement of intra- abdominal bladder pressure. The device attaches directly to the patient s existing urinary catheter/drain system providing both an enclosed fluid path for infusing fluid into the bladder catheter in order to monitor the hydrostatic pressure in the bladder.","3881 units","Bubble Leak Testing on AbViser AutoValve IAP Monitoring Devices without Transducer confirmed the potential for a pinhole breach in the sterile barrier.","07/03/2018","08/10/2018","","08/22/2018","a) ABV 300: Lot Number 150924  b) ABV 301: Lot Numbers:  160937, 161023, 161128, 170120, 170514, 170732, 170801, 170829"
"Devices","No","","80540","Terminated","Nico Corp.","250 E 96th St Ste 125","","Indianapolis","IN","	46240-3872","United States","Voluntary: Firm initiated","Two or more of the following: Email, Fax, Letter, Press Release, Telephone, Visit","US Nationwide distribution","Z-2822-2018","Class II","NICO Shepherd' s Hook - Greenberg, sterile. An accessory to NICO s BrainPath device  Part Number: NN-8024    ","204 devices","Mislabeled hook pouch included a transport/storage label  rather than the product label containing key product information such as part number, lot number, and expiration date, etc","06/19/2018","08/14/2018","11/09/2018","08/22/2018","Lot Number: 37LG1834  Exp. Date: 11Jan 2020"
"Devices","No","","80552","Ongoing","Mako Surgical Corporation","2555 Davie Rd Ste 110","","Davie","FL","	33317-7424","United States","Voluntary: Firm initiated","Letter","Worldwide Distribution - US Nationwide in the states of AL, AR, AZ, CA, CO, CT, FL, GA, IA, ID, IL, IN, KY, LA, MA, MD, ME, MI, MN, MO, MS, NC, ND, NE, NH, NJ, NV, NY, OH, OK, OR, PA, RI, SC, TN, TX, UT, VA, WA, WI, WY  and the countries of Australia, Hong Kong, India, Italy, Korea, Midrand Allandale, Netherlands, Singapore, and United Kingdom","Z-2794-2018","Class II","Rio System Irrigation Clip - Catalog # 111690    Product Usage:  The RESTORIS Partial Knee Application (PKA) for use with the Robotic Arm Interactive Orthopedic System (RIO) is intended to assist the surgeon in providing software defined spatial boundaries for orientation and reference information to anatomical structures during orthopedic procedures. The RESTORIS Partial Knee Application (PKA) for use with the Robotic Arm Interactive Orthopedic System (RIO) is indicated for use in surgical knee procedures, in which the use of stereotactic surgery may be appropriate, and where reference to rigid anatomical bony structures can be identified relative to a CT based model of the anatomy. These procedures include unicondylar knee replacement and/or patellofemoral knee replacement.  ","10,606","Out of tolerance.","05/10/2018","08/13/2018","","08/22/2018","Lots #'s: 176364, 178346, 181337, 185213, 186561, 189709, 190559, 193643, and 195763A1."
