Product Type,Recently Updated Record,Last Modified Date,Event ID,Status,Recalling Firm,Address1,Address2,City,State/Province,Postal Code,Country,Voluntary/Mandated,Initial Firm Notification of Consignee or Public,Distribution Pattern,Recall Number,Classification,Product Description,Product Quantity,Reason for Recall,Recall Initiation Date,Center Classification Date,Termination Date,Report Date,Code Info,More Code Info,More Code Info
"Devices","No","","80508","Ongoing","Vyaire Medical","26125 N Riverwoods Blvd","","Mettawa","IL","	60045-3420","United States","Voluntary: Firm initiated","Letter","Domestic Distribution:  AZ, CA, CT, FL, GA, IA, IL, IN, MA, MD, MN,  NJ, OH, OK, SD, TX, WA, WI.","Z-2826-2018","Class I","The Tri-Flo Subglottic Suction System        ","2150 Units Total","Vyaire Medical has discovered potential patient safety risk with associated with the Tri-Flow Subglottic Suction System. The distal soft tip of the catheter has been identified as having the potential to break off during patient use and result in aspiration of a solid foreign body.","06/20/2018","08/21/2018","","08/29/2018","Part number: CM28010;    Lot/Serial Numbers:  0001158835 , 0001158836, 0001158837, 0001185564,  0001194114 , 0004008255, 0004008256."
"Devices","No","","80545","Ongoing","Compass Health Brands (Corporate Office)","6753 Engle Rd","","Middleburg Heights","OH","	44130-7934","United States","Voluntary: Firm initiated","Letter","US nationwide distribution to AL, CT, FL, GA, KY, MS, NC, NY, TN, and TX.","Z-2741-2018","Class I","CPAP Mask Cushion, Model Nos. PB781S, PB781M, PB781L, 781S, 781M and 781L    Product Usage:  A CPAP mask is attached to an end user s face and a CPAP machine, to treat end users with sleep apnea. The replacement cushion is a non-durable component that requires replacement every 3 - 6 months. The cushion is used for both comfort and to provide a seal between the face and the mask.  ","742","A May 2015 design change in the cushion seal replacement part and accompanying elbow replacement part resulted in incompatibility of the new cushion seal with the previous design of the elbow. Use of the new cushion seal with the previous design elbow could lead to unacceptable CO2 porting. As there was no model number change for this design change, customers may not be aware of the incompatibility.","06/18/2018","08/20/2018","","08/29/2018","All units manufactured after May 1, 2015"
"Food","No","","80588","Terminated","Gift Services Inc Warehouse","1800 W Fourth Plain Blvd Ste 120B","","Vancouver","WA","	98660-1367","United States","Voluntary: Firm initiated","Press Release","sold directly to consumers nationwide through two online retail platforms GiftTree.com and 1stopflorists.com","F-1839-2018","Class I","Sherman Candy Caramels are individually wrapped in plastic and then sealed in a cardboard flexible carton.  Each Sherman Candy Caramels contains 3 pieces inside and sold in the following gift baskets:    Metropolitan Gourmet Gift Basket.   Encore Gourmet Gift Basket.   Toast of California Wine Basket.   California Classic Gift Basket.  The 5th Avenue Wine Gift Basket.  Country Estate Gift Basket.  Veuve Clicquot Tasting Gift Basket.    No other products within these gift baskets are subject to recall. Sherman Candy Caramels are not sold separately.      The Sherman Candy Caramels label is read in parts: ""***SHERMAN CANDY CO. CARAMELS ***Ingredients: Milk Chocolate (sugar, milk, chocolate liquor, cocoa butter, soy lecithin [an emulsifier], vanilla), Dark Chocolate (sugar, chocolate liquor, cocoa butter, soy lecithin [an emulsifier], vanilla), Coconut Oil, White Chocolate (sugar, cocoa butter, whole milk powder, soy lecithin (an emulsifier), nautral vanilla flavor), Butter Oil, Natural Flavor, Soy Lecithin, Salt ***CONTAINS: Coconut, Milk, Soy ***"".","38,079 packages","Sherman Candy Caramels product is recalled due to undeclared pecans, walnuts, almonds and/or peanuts.","07/20/2018","08/21/2018","02/08/2019","08/29/2018","None.    Product expiration dates included 12/16/17, 1/26/18, 2/20/18, 4/10/18, 7/13/18, 7/18/18, 9/18/18 12/29/18, 4/24/19, 6/5/19, 7/2/19."
"Food","No","","80599","Ongoing","Peanut Processors, Inc.","7329 Albert St","","Dublin","NC","	28332","United States","Voluntary: Firm initiated","Telephone","Product was shipped to AR & TN.","F-1840-2018","Class I","Peanut Paste/Butter bulk tankers","93,620 lbs","The firm was notified by a customer that the product test positive for Salmonella","07/20/2018","08/21/2018","","08/29/2018","Lot#: E-18191 & Lot#: E-18191-1"
"Devices","No","","80619","Terminated","bioMerieux, Inc.","100 Rodolphe St","","Durham","NC","	27712-9402","United States","Voluntary: Firm initiated","Letter","Worldwide distribution.  US nationwide including Puerto Rico, Bermuda, Brazil, Canada, China, Curacao, Costa Rica, Dominican Republic, Ecuador, France, Guatemala, Indonesia, Israel, Hong Kong, South Korea, South Africa, Mexico, Myanmar, Nicaragua, Peru, Philippines, Paraguay, Singapore, Thailand, El Salvador, and Vietnam.","Z-2817-2018","Class I","bioMerieux VITEK 2 Gram Positive Cefoxitin Screen, VITEK 2 Gram Positive AST for Oxacillin, VITEK SYSTEMS General Susceptibility Card      Cefotoxin and AST for Oxacillin      bioMerieux VITEK 2 AST-P631  bioMerieux VITEK 2 AST-GP67 Test Kit  bioMerieux VITEK 2 AST-GP71 Test Kit  bioMerieux VITEK 2 AST-GP75 Test Kit  bioMerieux VITEK 2 AST-GP78 Test Kit    Components for an automated invitro diagnostic system consisting of instruments, software and reagent cards designed for the ID and antimicrobial susceptibility testing of bacteria and yeast.  ","13,961,320 US","Customer reports indicated an increase in the rate of non-detected MRSA in association with the VITEK 2 AST-P631 product.","01/26/2018","08/17/2018","05/20/2019","08/29/2018","VITEK 2 AST-P631, Ref # 414961 UDI  03573026426804 OXSF, multiple Gram Positive Cards all lots of cards with Oxacillin and Cefotoxin        OX, OXSF, multiple Gram Positive Cards    all lots of cards with Oxacillin and Cefotoxin    VITEK 2 AST-GP67 Test Kit, Ref: # 22226  UDI  03573026242060, OX, OXSF, multiple Gram Positive Cards, all lots of cards with Oxacillin and Cefotoxin.  VITEK 2 AST-GP71 Test Kit, Ref: #410750  UDI 03573026355173, OX, OXSF, multiple Gram Positive Cards, all lots of cards with Oxacillin and Cefotoxin.  VITEK 2 AST-GP75 Test Kit, Ref: #415670  UDI 03573026437183, OX, OXSF, multiple Gram Positive Cards, all lots of cards with Oxacillin and Cefotoxin.  VITEK 2 AST-GP78 Test Kit, Ref: #421051  UDI 03573026553982, OX, OXSF, multiple Gram Positive Cards, all lots of cards with Oxacillin and Cefotoxin."
"Food","No","","80687","Ongoing","HP Hood LLC","160 Hood Way","","Winchester","VA","	22602-5321","United States","Voluntary: Firm initiated","Two or more of the following: Email, Fax, Letter, Press Release, Telephone, Visit","Product was distributed in the continental US in 24 states.","F-1832-2018","Class I","Blue Diamond Almond Breeze Almond Milk, Half Gallon","24,209 cases (72,627 gallons) distributed","HP Hood LLC, has initiated a recall of Blue Diamond Almond Breeze Almond Milk, Half Gallon, because the product tested positive for milk allergen.","08/01/2018","08/17/2018","","08/29/2018","SEP 02 18 HH:MM (military time) H5 L# (1 or 2) 51-4109."
"Drugs","No","09/07/2018","80719","Ongoing","Westminster Pharmaceuticals Llc","1 & 2","154 Downing Street","Olive Branch","MS","	38654","United States","Voluntary: Firm initiated","Letter","Nationwide in the USA and Puerto Rico","D-1178-2018","Class I","Levothyroxine and Liothyronine (Thyroid Tablets, USP), 1 grain (60 mg), 100-count bottles, Rx Only, Manufactured for: Westminster Pharmaceuticals, LLC, 154 Downing Street, Unit 1 & 2, Olive Branch, MS 38654, NDC 69367-156-04.","Unknown","Failed Content Uniformity Specifications: Product was manufactured using an adulterated active pharmaceutical ingredient; additionally, lack of process controls and good manufacturing practices resulted in finished product failing content uniformity specifications which can result in a product having a strength that is more or less than is labeled.","08/03/2018","09/07/2018","","08/29/2018","Lot #: 15617VP03, 15617VP01, 15617VP-02, Exp 7/31/2019;  15617VP06, 15617VP05, Exp 11/30/2019; 15617VP04, 15618004, 15618002, Exp 12/31/2019; 15618009, 15618008, Exp 2/29/2020; 15618011, Exp 3/31/2020."
"Drugs","No","09/07/2018","80719","Ongoing","Westminster Pharmaceuticals Llc","1 & 2","154 Downing Street","Olive Branch","MS","	38654","United States","Voluntary: Firm initiated","Letter","Nationwide in the USA and Puerto Rico","D-1179-2018","Class I","Levothyroxine and Liothyronine (Thyroid Tablets, USP), 1 & 1/2 grain (90 mg), 100-count bottles, Rx Only, Manufactured for: Westminster Pharmaceuticals, LLC, 154 Downing Street, Unit 1 & 2, Olive Branch, MS 38654, NDC 69367-157-04.","Unknown","Failed Content Uniformity Specifications: Product was manufactured using an adulterated active pharmaceutical ingredient; additionally, lack of process controls and good manufacturing practices resulted in finished product failing content uniformity specifications which can result in a product having a strength that is more or less than is labeled.","08/03/2018","09/07/2018","","08/29/2018","Lot #: 15717VP-01, 15717VP-02, 15717VP-03, Exp 7/31/2019; 15717002, Exp 12/31/2019; 15718004, Exp 3/31/2020."
"Drugs","No","09/07/2018","80719","Ongoing","Westminster Pharmaceuticals Llc","1 & 2","154 Downing Street","Olive Branch","MS","	38654","United States","Voluntary: Firm initiated","Letter","Nationwide in the USA and Puerto Rico","D-1180-2018","Class I","Levothyroxine and Liothyronine (Thyroid Tablets, USP), 1/2 grain (30 mg), 100-count bottles, Rx Only, Manufactured for: Westminster Pharmaceuticals, LLC, 154 Downing Street, Unit 1 & 2, Olive Branch, MS 38654, NDC 69367-155-04.","Unknown","Failed Content Uniformity Specifications: Product was manufactured using an adulterated active pharmaceutical ingredient; additionally, lack of process controls and good manufacturing practices resulted in finished product failing content uniformity specifications which can result in a product having a strength that is more or less than is labeled.","08/03/2018","09/07/2018","","08/29/2018","Lot #: 15517VP01, 15517VP02, 15517VP03, Exp 8/31/2019; 15518001, Exp 12/31/2019; 15518002, Exp 3/31/2020."
"Drugs","No","09/07/2018","80719","Ongoing","Westminster Pharmaceuticals Llc","1 & 2","154 Downing Street","Olive Branch","MS","	38654","United States","Voluntary: Firm initiated","Letter","Nationwide in the USA and Puerto Rico","D-1181-2018","Class I","Levothyroxine and Liothyronine (Thyroid Tablets, USP), 1/4 grain (15 mg), 100-count bottles, Rx Only, Manufactured for: Westminster Pharmaceuticals, LLC, 154 Downing Street, Unit 1 & 2, Olive Branch, MS 38654, NDC 69367-159-04.","Unknown","Failed Content Uniformity Specifications: Product was manufactured using an adulterated active pharmaceutical ingredient; additionally, lack of process controls and good manufacturing practices resulted in finished product failing content uniformity specifications which can result in a product having a strength that is more or less than is labeled.","08/03/2018","09/07/2018","","08/29/2018","Lot #: 15917VP03, 15917VP02, 15917VP01, Exp 10/31/2019; 15918004, 15918003, 15918002, 15918001, Exp 12/31/2019; 15918VP03, 15918VP02, 15918VP01, 15918005, Exp 2/29/2020; 15918007, 15918006, Exp  3/31/2020."
"Drugs","No","09/07/2018","80719","Ongoing","Westminster Pharmaceuticals Llc","1 & 2","154 Downing Street","Olive Branch","MS","	38654","United States","Voluntary: Firm initiated","Letter","Nationwide in the USA and Puerto Rico","D-1182-2018","Class I","Levothyroxine and Liothyronine (Thyroid Tablets, USP), 2 grain (120 mg), 100-count bottles, Rx Only, Manufactured for: Westminster Pharmaceuticals, LLC, 154 Downing Street, Unit 1 & 2, Olive Branch, MS 38654, NDC 69367-158-04.","Unknown","Failed Content Uniformity Specifications: Product was manufactured using an adulterated active pharmaceutical ingredient; additionally, lack of process controls and good manufacturing practices resulted in finished product failing content uniformity specifications which can result in a product having a strength that is more or less than is labeled.","08/03/2018","09/07/2018","","08/29/2018","Lot #: 15817VP-01, 15817VP-02, 15817VP-03, Exp 9/30/2019; 15818001, Exp 3/31/2020."
"Food","No","08/24/2018","80784","Terminated","Country Favor Inc.","5881 55th St","","Maspeth","NY","	11378-3101","United States","Voluntary: Firm initiated","Press Release","Retail stores nationwide (AR, CT, FL, IL, IN, KY, LA, MA, MI, MN, NC, NY, PA, RI, TN, TX, VA, & WI).","F-1856-2018","Class I","BEST TASTE BRAND SNACK GINGER SLICED, Net Weight 200g, 7 OZ, Distributed by; COUNTRY FAVOR., INC U.S.A;  PRODUCT OF VIETNAM","50 cases (40 -7 oz. packages per case = 14,000 - 7 oz. packages in total)","Product contains high levels of undeclared sulfites.","08/06/2018","08/24/2018","10/11/2018","08/29/2018","Product is uncoded"
"Food","No","","80815","Terminated","SALT & STRAW LLC","110 SE 2nd Ave","","Portland","OR","	97214-1036","United States","Voluntary: Firm initiated","Press Release","Distributed in CA, OR, and WA.    Firm also sold via saltandstraw.com to internet consumers and shipped to AZ, CA, CO, CT, DE, FL, GA, IA, IL, KY, LA, MA, MD, ME, MI, MN, NH, NJ, NV, NY, OH, OK, OR, PA, SC, TN, TX, UT, VA, WA, and WI.","F-1846-2018","Class I","Chocolate Gooey Brownie Ice Cream, packaged in pint-sized containers (473 mL), net wt 378 g; 1 gal. container, or 3 gal. tubs.    3 gal. tubs were sold to Salt & Straw Retail Scoop Shops only.    1 gal. containers are sold to wholesale accounts only.","4,088 Pints; 661/3 Gallon Tubs; 18/1 Gallon Tubs","Chocolate Gooey Brownie Ice Cream is recalled due to possible undeclared peanuts.","08/14/2018","08/23/2018","02/08/2019","08/29/2018","***For PINTS sold to consumers:    41-404 (plant code): lot numbers 18201, 18203, 18212, 18213, 18214, 18219, 18221, and 18223.    06-1626F (plant code): lot numbers 18217, 18219, and 18221.    ***For 3-GAL sold to Salt & Straw retail Scoop Shops:    41-404 (plant code): Lot numbers: 180718, 180719-B, 180722, 180731, 180801, 180802, 180804, 180807, 180809, and 180811.    06-1626F  (plant code): lot numbers: 180805, 180807, 180808, and 180809.    ***For 1-GAL containers sold to wholesale accounts:    41-404 (plant code): lot number 18201, 18204, 18216, 18222"
"Devices","No","","80174","Ongoing","LIEBEL-FLARSHEIM COMPANY LLC","1034 S Brentwood Blvd","","Saint Louis","MO","	63117-1223","United States","FDA Mandated","Letter","US Distribution to: AL, AZ, CA, CT, CO, FL GA, HI,  IA, IL, ID,  KS, KY, MD, MI, Michigan, MN, NC, NH, NV, NY, OK, OH, PA, SC, TN, TX, VA,  WA, WI,  and WV,","Z-2833-2018","Class II","Liebel-Flarsheim Hydra Vision Urology X-Ray System (DR)      Liebel-Flarsheim urology systems facilitate radiologic and/or fluoroscopic procedures requiring a beam of diagnostic quality radiation, primarily for urological applications such as functional x-ray diagnostics, endourology and minimal invasive urology/ surgery.","313","Software issue.  The difference between the display and dosimeter readings In the Child/Pediatric automatic exposure mode is in the range of 52-65%.  The display in all other modes deviated by less than 35% from the dosimeter readings.","02/27/2017","08/21/2018","","08/29/2018","Product ID :   750732  SHF-635RF,    750733  SHF-835RF"
"Devices","No","","80174","Ongoing","LIEBEL-FLARSHEIM COMPANY LLC","1034 S Brentwood Blvd","","Saint Louis","MO","	63117-1223","United States","FDA Mandated","Letter","US Distribution to: AL, AZ, CA, CT, CO, FL GA, HI,  IA, IL, ID,  KS, KY, MD, MI, Michigan, MN, NC, NH, NV, NY, OK, OH, PA, SC, TN, TX, VA,  WA, WI,  and WV,","Z-2834-2018","Class II","Liebel-Flarsheim Direct Digital Imaging System (DDIS)     Liebel-Flarsheim urology systems facilitate radiologic and/or fluoroscopic procedures requiring a beam of diagnostic quality radiation, primarily for urological applications such as functional x-ray diagnostics, endourology and minimal invasive urology/ surgery.","28","Software issue.  The difference between the display and dosimeter readings In the Child/Pediatric automatic exposure mode is in the range of 52-65%.  The display in all other modes deviated by less than 35% from the dosimeter readings.","02/27/2017","08/21/2018","","08/29/2018","Product ID  750736  SHF-635RF,   750737 SHF-835RF"
"Devices","No","","80340","Ongoing","CAREstream Medical LLC","774 Northlake Blvd Ste 1016","","Altamonte Springs","FL","	32701-6709","United States","Voluntary: Firm initiated","Letter","Domestic Distribution: AK, AL, AR ,AZ, CA, CO, CT, DC, FL, GA, IA, ID, IL, IN, KS, KY, LA, MA, MD, ME, MI, MN, MO, MS, MT, NC, ND, NH, NJ, NM, NV, NY, OH, OK, OR, PA, RI, SC, SD, TN, TX, UT, VA, VT, WA, WI, WV.      International Distribution:  Canada and Morocco.","Z-2887-2018","Class II","CAREstream ProNox Nitrous Oxide Delivery System labeled as the following:     a. CMI-0100 PNX, Pro-Nox Mixer - Canadian;      b. CMI-0100-PNX-HS, Pro-Nox Complete Hospital Roll Stand System - Nitrous Oxide Delivery System;      c. CMI-0100-PNX-HS-NO2H, Pro-Nox Hospital System without Oxygen Regulator;      d. CMI-0100-PNX-HSWM, Pro-Nox Hospital System Wall Mount with Universal Mount (GCX) scavenger;      e. CMI-0100-PNX-NHS, Pro-Nox Complete Roll Stand Nitrous Oxide Delivery System (Non-hospital);      f. CMI-0100-PNX-NHS-PS, Pro-Nox Complete Roll Stand Nitrous Oxide Delivery System with Passive Scavenger;      g. CMI-0100-PNX-US, Pro-Nox mixer, 6' high-pressure O2 and N2O hoses  ","919 Units Total","Two analgesic gas delivery system oxygen/nitrous oxide mixers were reported to have delivered higher levels of nitrous oxide than specification during routine testing.","05/15/2018","08/22/2018","","08/29/2018","Item Number CMI-0100-PNX-xxx"
"Devices","No","","80414","Ongoing","O-Two Medical Technologies, Inc.","7575 Kimbel Street","","Mississauga","","	","Canada","Voluntary: Firm initiated","Letter","AK, CA, FL","Z-2885-2018","Class II","O-Two Equinox¿ Relieve N2O/O2 Analgesic Gas Mixing and Delivery System  Model#: 01EQ1000  ","3  units","Higher levels of nitrous oxide delivered than specification","05/14/2018","08/22/2018","","08/29/2018","Serial Number: EQ1332-17, EQ3001-18, EQ3003-18"
"Devices","No","","80487","Ongoing","TriMed Inc.","27533 Avenue Hopkins","","Santa Clarita","CA","	91355-3910","United States","Voluntary: Firm initiated","Letter","Worldwide Distribution in the state of TX and countries of Australia, China Sweden","Z-2877-2018","Class II","Ulnar Osteotomy Compression Plate, Short  Model: UOCP-S    Product Usage:  The UOCP-S is provided non-sterile with the required fixation screws and surgical instrumentation. The TriMed Ulnar Osteotomy Plate is intended for use in osteotomy procedures of the ulna.  ","722","Two instrument holes located on the side of the plate, which act to align the saw guide are located on the wrong side of the plate","04/16/2018","08/18/2018","","08/29/2018","Lot Numbers: 10003, 10017"
"Food","No","09/04/2018","80488","Terminated","Gourmet International Inc.","5253 Patterson Ave Se","","Grand Rapids","MI","	49512","United States","Voluntary: Firm initiated","Two or more of the following: Email, Fax, Letter, Press Release, Telephone, Visit","Domestic:  IL       MI       WI       CA       MN       OH       WA       VA          Product Imported from Turkey","F-1953-2018","Class II","SPARKLING GRAPEFRUIT JUICE DRINK, 6/34 oz., glass bottles	  ","403 Assorted Cases / 2418 units (total)","Gourmet International Inc. is voluntarily recalling LItaly Sparkling Juice Beverages due to packaging concerns following multiple reports of leaking caps.","07/05/2018","09/04/2018","10/04/2018","08/29/2018","All L'ITALY SPARKLING FRUIT JUICE BEVERAGES products, all lot/date codes    914512 SPARKLING GRAPEFRUIT JUICE DRINK UPC  1-91414-00512-2 6/34oz"
"Food","No","09/04/2018","80488","Terminated","Gourmet International Inc.","5253 Patterson Ave Se","","Grand Rapids","MI","	49512","United States","Voluntary: Firm initiated","Two or more of the following: Email, Fax, Letter, Press Release, Telephone, Visit","Domestic:  IL       MI       WI       CA       MN       OH       WA       VA          Product Imported from Turkey","F-1954-2018","Class II","SPARKLING LEMON JUICE DRINK , 6 /34 oz., glass bottles		  	","403 Assorted cases / 2418 units (total)","Gourmet International Inc. is voluntarily recalling LItaly Sparkling Juice Beverages due to packaging concerns following multiple reports of leaking caps.","07/05/2018","09/04/2018","10/04/2018","08/29/2018","All L'ITALY SPARKLING FRUIT JUICE BEVERAGES products, all lot/date codes  914513 SPARKLING LEMON JUICE DRINK  UPC  1-91414-00513-9     6/34 oz"
"Food","No","09/04/2018","80488","Terminated","Gourmet International Inc.","5253 Patterson Ave Se","","Grand Rapids","MI","	49512","United States","Voluntary: Firm initiated","Two or more of the following: Email, Fax, Letter, Press Release, Telephone, Visit","Domestic:  IL       MI       WI       CA       MN       OH       WA       VA          Product Imported from Turkey","F-1955-2018","Class II","SPARKLING LIME JUICE DRINK, 6/34 oz, glass bottles		  ","403 Assorted cases / 2418 units (total)","Gourmet International Inc. is voluntarily recalling LItaly Sparkling Juice Beverages due to packaging concerns following multiple reports of leaking caps.","07/05/2018","09/04/2018","10/04/2018","08/29/2018","All L'ITALY SPARKLING FRUIT JUICE BEVERAGES products, all lot/date codes  914514 SPARKLING LIME JUICE DRINK  UPC  1-91414-00514-6 6/34 oz"
"Food","No","09/04/2018","80488","Terminated","Gourmet International Inc.","5253 Patterson Ave Se","","Grand Rapids","MI","	49512","United States","Voluntary: Firm initiated","Two or more of the following: Email, Fax, Letter, Press Release, Telephone, Visit","Domestic:  IL       MI       WI       CA       MN       OH       WA       VA          Product Imported from Turkey","F-1956-2018","Class II","SPARKLING MANDARIN JUICE DRINK, 6/34 oz., glass bottles  ","403 Assorted cases / 2418 units (total)","Gourmet International Inc. is voluntarily recalling LItaly Sparkling Juice Beverages due to packaging concerns following multiple reports of leaking caps.","07/05/2018","09/04/2018","10/04/2018","08/29/2018","All L'ITALY SPARKLING FRUIT JUICE BEVERAGES products, all lot/date codes  914515 SPARKLING MANDARIN JUICE DRINK UPC  1-91414-00515-3 6/34 oz"
"Food","No","09/04/2018","80488","Terminated","Gourmet International Inc.","5253 Patterson Ave Se","","Grand Rapids","MI","	49512","United States","Voluntary: Firm initiated","Two or more of the following: Email, Fax, Letter, Press Release, Telephone, Visit","Domestic:  IL       MI       WI       CA       MN       OH       WA       VA          Product Imported from Turkey","F-1957-2018","Class II","SPARKLING POMEGRANETE JUICE DRNK, 6/34 oz., glass bottles  ","403 Assorted cases / 2418 units (total)","Gourmet International Inc. is voluntarily recalling LItaly Sparkling Juice Beverages due to packaging concerns following multiple reports of leaking caps.","07/05/2018","09/04/2018","10/04/2018","08/29/2018","All L'ITALY SPARKLING FRUIT JUICE BEVERAGES products, all lot/date codes    914516 SPARKLING POMEGRANETE JUICE DRNK UPC  1-91414-00516-0 6/34 oz"
"Food","No","09/04/2018","80488","Terminated","Gourmet International Inc.","5253 Patterson Ave Se","","Grand Rapids","MI","	49512","United States","Voluntary: Firm initiated","Two or more of the following: Email, Fax, Letter, Press Release, Telephone, Visit","Domestic:  IL       MI       WI       CA       MN       OH       WA       VA          Product Imported from Turkey","F-1958-2018","Class II","SPARKLING SOUR CHERRY JUICE DRINK, 6/34 oz., glass bottles    ","403 Assorted cases / 2418 units (total)","Gourmet International Inc. is voluntarily recalling LItaly Sparkling Juice Beverages due to packaging concerns following multiple reports of leaking caps.","07/05/2018","09/04/2018","10/04/2018","08/29/2018","All L'ITALY SPARKLING FRUIT JUICE BEVERAGES products, all lot/date codes     914517 SPARKLING SOUR CHERRY JUICE DRINK UPC 1-91414-00517-7 6/34OZ"
"Devices","No","","80491","Ongoing","Biomerieux Inc","595 Anglum Rd","","Hazelwood","MO","	63042-2320","United States","Voluntary: Firm initiated","Letter","US Nationwide Distribution in the states of AK, AL, AR, AZ, CA, CO, DC, FL, GA, IA, IL, IN, KS, KY, LA, MA, MD, MI, MN, MO, MS, MT, NC, ND, NH, NJ, NY, OH, OK, OR, PA, SC, TN, TX, UT. VA. VT. WA. WI, and WV","Z-2874-2018","Class II","bioM¿rieux VITEK 2 NH ID Test Kit    Product Usage:  Is an automated system consisting of instruments, software and reagent cards designed for the ID and antimicrobial susceptibility testing of bacteria and yeast.  ","57 cartons","Missing desiccant.","01/23/2018","08/17/2018","","08/29/2018","Batch/Lot: 245057043 Exp. Date 19JUN2019"
"Devices","No","","80543","Ongoing","Zimmer Biomet, Inc.","56 E Bell Dr","","Warsaw","IN","	46582-6989","United States","Voluntary: Firm initiated","Letter","AR, AZ, CA, FL, GA, IN, KY, LA, MA, MI, MN, MO, MT, NJ, NY, OH, SC, TX, UT & WI","Z-2875-2018","Class II","Connecting Bolt, Model 14-442093","247 units","Product was manufactured from the incorrect material, which shows a potential decrease in the fatigue strength of the connecting bolt that can lead to fracture.","06/18/2018","08/17/2018","","08/29/2018","..."
