"Food","No","","62847","Terminated","Clif Bar And Company","1451 66th St","","Emeryville","CA","	94608-1004","United States","Voluntary: Firm Initiated","Press Release","The distributors in MA and WI.","F-2130-2012","Class II","Chocolate Chip CLIF Bars, 2.4-oz (68g), individually wrapped, UPC: 7-22252-10090","4608 Bars","A small amount of Blueberry Crisp CLIF bars were inadvertently placed in Chocolate Chip CLIF bar wrappers and placed inside correctly labeled Blueberry Crisp CLIF bar 12-pack boxes. Retailers sell to consumers in 12-pack boxes, and sometimes as individual bars.","08/13/2012","09/05/2012","04/03/2013","09/12/2012","Best By date 17MAR13G3"
"Food","No","","62855","Terminated","American Importing Co, Inc","550 Kasota Ave SE","","Minneapolis","MN","	55414-2811","United States","Voluntary: Firm Initiated","Telephone","AL, AZ, ALR, CA, FL, GA, IL, IN, KS, KY, ME, MS, MO, NE, NM, NY, OH, OK, PA, SC, TN, TX, VA, WA, WY.","F-2124-2012","Class II","Nature's Harvest, pine nuts, Net WT 3 oz (85 g), Distributed by Amport Foods, 550 Kasota Ave, SE., Minneapolis, MN 55414, 3 00 71725 72753 4.  Case Label Stock No. 5640 8/3 oz Nature's Harvest, Pine Nuts Best by: 12-28-12 363x1E1, 3 00 71725 72753 5.    Amport Foods Bags:  Amport Foods, Pine Nuts, Net WT 4 0 z (113 g), 0 71725 70172 5, American Importing Co. Inc, Minneapolis, MN 5514.    Case label: Stock No 50578 12/4 oz, Amport, Pine Nuts Best by: 03-28-13 3621F1, 1 00 71725 70172 2.     Amport Foods Tubs:  Pine Nuts, Net WT 4 0 z (113 g), 0 71725 71180 9, Best BY: 01-10-13    0102 MM1,  Distributed by American Importing Co, INC, Minneapolis, MN 55414.  Tub Case Label: Item #41130 12/4 oz,  Amport Foods, Pine Nuts,   Best by: 01-10-13 0102MM1, 1 00 71725 71180 6.    ","5,441 cases or 50,100 individual packages","Amport Foods is recalling one lot of pine nuts  because there may be undeclared Peanuts present in the product.","08/08/2012","09/05/2012","06/13/2013","09/12/2012","Best By 12-28-12, 363X1E1, 08:30 (Nature's Harvest)    Best By 03-28-13, 3621F1, 08:30 (Amport bags)    Best By 01-10-13, 0102MM (Amport tubs)"
"Food","No","","62872","Terminated","Drucker Labs LP","1600 Capital Ave Ste 100","","Plano","TX","	75074-8187","United States","Voluntary: Firm Initiated","Letter","Nationwide and to Canada","F-2126-2012","Class II","intraKID Lot 658 with a Best By date of 12/12, 33 oz and 2 oz bottles","2026 bottles","After extensive testing and investigation, Drucker Labs has determined that an incorrect form of Vitamin B3, Nicotinic Acid, was used in the manufacturing of intraKID Lot 658.  This nutrient may cause a temporary symptom in a small number of consumers.  This symptom, commonly known as Niacin Flush, may include itching, redness, or warmth of the skin.  This typically subsides within 15  20 minut","08/13/2012","09/05/2012","10/07/2014","09/12/2012","Lot 658 with a Best By date of 12/12"
"Food","No","","62888","Terminated","Atlantic Fisheries","8195nw 67th Street","","Miami","FL","	33166","United States","Voluntary: Firm Initiated","Letter","Product was distributed to Winn Dixie Distribution Centers in FL, AL, and LA.","F-2128-2012","Class II","Fresh Mahi Mahi Fillets,10 lb Styrofoam case, labeled in part: ""***Mahi Fillets S/ON Costa Rica Wild****KEEP AT 38 OR BELOW Keep refrigerated***ATLANTIC FISHERIES 8195 NW 67TH ST MIAMI FLORIDA 33166***TEL***FAX 305-594-4301***PACK U.S.A.","580 lbs","Atlantic Fisheries recalled 580 lbs of Mahi Mahi Fillets due to histamine levels over 50 ppm.","08/13/2012","09/05/2012","05/22/2014","09/12/2012","Sell by dates of 8/11/12, 8/13/12, and 8/14/12."
"Devices","No","","62891","Terminated","AmeriWater Inc","1303 Stanley Ave","","Dayton","OH","	45404-1015","United States","Voluntary: Firm Initiated","Letter","Worldwide distribution: USA (nationwide) including states of: AL, AR, CO, CT, FL, GA, IL, IN, KS, MA, MD, MO, MS, NC, NY, OH, OK, SC, TN, TX and VA; and country of: Canada.","Z-2321-2012","Class II","AmeriWater MRO Dialysis RO+ System, AmeriWater 1303 Stanley Avenue, Dayton, OH 45404 (800) 535-5585 www.AMERIWATER.com.    The AmeriWater MRO Portable Reverse Osmosis Systems are water treatment systems intended for use in hemodialysis applications. They are designed to pre-treat and purify potable water for use in making dialysate for hemodialysis and to meet current AAMI and Federal (U.S.) standards. The AmeriWater Portable MROS model is intended for use in a hospital, clinic, dialysis center, or for home care for single patient use. The AmeriWater Portable MRO1 model is for treatment of up to two patients in a hospital, clinic, or dialysis centers.","80 Units","The firm was notified that a malfunction of the device was caused by an incorrect fuse 32 volt 15 amp fuses instead of 250 volt 15 amp fuses, that was installed in the water system.  The incorrect fuse may result in excessive heat in the fuse holder eventually resulting in failure of the device to operate.","08/09/2012","09/06/2012","04/17/2014","09/12/2012","Model Number MROS, Catalog #00MROS20, 00MROS21 & Model Number MRO1, Catalog #00MRO120, and 00MRO121; Model Number(s): MROS and MRO1; Serial #'s 31000 to 31079."
"Devices","No","","62928","Terminated","Toshiba American Medical Systems Inc","2441 Michelle Dr","P.O. Box 2068","Tustin","CA","	92780-7047","United States","Voluntary: Firm Initiated","Letter","US (nationwide) distribution including the states of Ohio and Texas.","Z-2315-2012","Class II","Toshiba Ultra-Short Magnetic Resonance Imaging System, EXCELART Vantage. MRT-1503/P5-Vantage MRI System.    MR imaging.","3 units","The firm recalled due to a potentail problem with the position of the hold in the lug teminals on the power cables connected to the terminal blocks on the gradient coil.","02/21/2012","09/06/2012","09/07/2012","09/12/2012","MRT-1503/P5-Vantage MRI System.   Serial Codes: P5A0632002, P5B06Y2005, P5B0712006, P3F11Z2143."
"Devices","No","","62949","Terminated","Quality Electrodynamics LLC","700 Beta Dr Ste 100","","Mayfield Village","OH","	44143-2378","United States","Voluntary: Firm Initiated","Other","Worldwide distribution: USA (nationwide): Tennessee only and country of: Germany","Z-2314-2012","Class II","TxRx Knee 15 Coil 3T.    For use in conjunction with magnetic resonance scanners to produce diagnostic images of the knee that can be interpreted by a trained physician.","17 units","On July 27, 2012, it was reported to the firm that the Siemens 3T 15ch Knee Coil was not functional because the coil identification code for the device was incorrect.","07/27/2012","09/06/2012","02/19/2013","09/12/2012","QED part numbers:  Q7000057/QED000057/QSV000057  Siemens part numbers:  10606829 / 10606614    Serial #s: 1002-1012, 1016-1020, and 1022."
"Food","No","","62961","Terminated","The Humphrey Popcorn Co","20810 Miles Pkwy","","Warrensville Heights","OH","	44128-5508","United States","Voluntary: Firm Initiated","Letter","Product was distributed to the states of Ohio, Pennsylvania, New York, Florida.  There were no US governernment consignees or foreign consignees.","F-2132-2012","Class II","Humphrey Candy Kisses, 4 oz. individually wrapped and contained in a clear plastic bag, UPC Code 81084 00002. Bags are packed 40 to a case.","145.5 cases","On 6/5/2012 the firm voluntarily recalled their Candy Kisses due to undeclared milk on the label.","06/05/2012","09/06/2012","02/11/2014","09/12/2012","Dated 2-23-12 to 5-23-12"
"Food","No","","62961","Terminated","The Humphrey Popcorn Co","20810 Miles Pkwy","","Warrensville Heights","OH","	44128-5508","United States","Voluntary: Firm Initiated","Letter","Product was distributed to the states of Ohio, Pennsylvania, New York, Florida.  There were no US governernment consignees or foreign consignees.","F-2133-2012","Class II","Humphrey Chocolate Drizzle, 5 oz. in a clear plastic bag, UPC Code 8108400009. Bags are packed 12 to a case.","415.4 cases","On 6/5/2012 the firm voluntarily recalled their Chocolate Drizzle Popcorn due to undeclared soy lecithin on the label.","06/05/2012","09/06/2012","02/11/2014","09/12/2012","Dated 2-23-12 to 5-23-12"
"Devices","No","","62967","Terminated","RAYSEARCH LABORATORIES AB","Sveavaegen 9","","Stockholm","","	","Sweden","Voluntary: Firm Initiated","Letter","Worldwide distribution: USA (nationwide) including states of: FL, MA, NJ, and NY; and countries of: Canada Germany, Netherlands and Switzerland.","Z-2324-2012","Class II","Brand name:  RayStation.  Generic name: Treatment Planning System.  Software version and build numbers are 2.5.0.144 and 2.5.1.89.  Product lifetime is 5 years.    RayStation is a software system designed for treatment planning and analysis of radiation therapy. The treatment plans provide treatment unit set-up parameters and estimates of dose distributions expected during the proposed treatment, and may be used to administer treatments after review and approval by the intended user. The system functionality can be configured based on user needs. The intended users of RayStation shall be clinically qualified radiation therapy staff trained in using the system.","19 units","The firm decided to recall when an issue was found with the dose calculation in RayStation 2.5, Raystation 2.5.1. The problem has not caused any patient mistreatment or other incidents. However, the user must be aware of this information to avoid incorrect dose calculations during treatment planning. The dose calculation is not correctly normalized in the unusual case of preventing the optimizatio","05/09/2012","09/06/2012","01/25/2013","09/12/2012","Software version and build numbers are 2.5.0.144 and 2.5.1.89.  Product lifetime is 5 years."
"Devices","No","","62982","Terminated","Capintec Inc","620 Alpha Dr","","Pittsburgh","PA","	15238","United States","Voluntary: Firm Initiated","Letter","Worldwide distribution: USA (nationwide) and countries of: Argentina, Belgium, Brazil, Canada, China, Greece, Hong Kong, India, Israel, Malaysia, Philippines, Spain, South Korea, Thailand, and Turkey.","Z-2312-2012","Class II","Capintec Captus 3000 Thyroid Uptake System     Nuclear uptake probe intended to be used by trained Nuclear Medicine Technologists to perform thyroid uptake procedures, which consist of the measurement of organ uptake and circulating radioactivity.","256","Customers who received a Capintec Captus 3000 Thyroid Uptake System with Software Revisions 1.22, 1.23, 1.24, 1.25, and 1.26 may encounter an error while using the thyroid uptake protocol ?Measure Liquid and Subtract Residual.""  This protocol was a new feature added to Software Revision 1.22 in January 2011.  The error occurs only if the user does NOT measure the residual dose immediately after me","07/24/2012","09/05/2012","12/10/2013","09/12/2012","Catalog numbers for new systems: 5430-0076, 5430-0077, 5430-0103, and 5430-0087.  Catalog numbers for conversion systems: 5430-0118 and 5430-0119.  Serial numbers for new systems: 901006 through 901394, inclusive.  Serial numbers for conversion systems: CNV 674 through CNV 730, inclusive.  Also affected are devices which were serviced and devices for which customers received software upgrades between January 20, 2011 and June 30, 2012 with Revision 1.22, 1.23, 1.24, 1.25, or 1.26.  (NOTE: Item number 5430-0075, Captus 3000 well counter system, is excluded.  This system does not have the ability to perform thyroid uptake procedures.)"
"Biologics","No","","63022","Terminated","Rocky Mountain Lions Eye Bank","1675 Aurora Ct., EI- 2049","P.O. Box 6026, Aurora, CO  80045","Aurora","CO","	80045-2517","United States","Voluntary: Firm Initiated","E-Mail","Japan","B-2522-12","Class II","Cornea","1","Corneas, recovered in a manner that may increase the risk of the introduction, transmission, or spread of communicable diseases, were distributed.","08/07/2012","08/31/2012","08/31/2012","09/12/2012","121180100"
"Biologics","No","","63023","Terminated","Lions Eye Bank of Texas","6501 Fannin , NC-100","","Houston","TX","	77030","United States","Voluntary: Firm Initiated","FAX","Texas","B-2521-12","Class II","Cornea","1","Expired human cornea was distributed.","06/14/2012","08/31/2012","08/31/2012","09/12/2012","120114100"
"Biologics","No","","63024","Terminated","Upstate New York Transplant Services","110 Broadway St","","Buffalo","NY","	14203-1677","United States","Voluntary: Firm Initiated","Telephone","New York","B-2520-12","Class II","Cornea","2","Human corneas, recovered from donors whose donor eligibility may have been determined with inaccurate and/or  incomplete donor records, were distributed.","07/12/2012","08/31/2012","08/31/2012","09/12/2012","100791OD; 100791OS"
"Biologics","No","","63025","Terminated","RTI Biologics, Inc.","11621 Research Cir","","Alachua","FL","	32615-6825","United States","Voluntary: Firm Initiated","Telephone","Oklahoma","B-2523-12","Class II","Tendon","1","Human tendon, with a swab culture positive for coagulase-negative Staphylococcus, was distributed.","02/13/2012","09/05/2012","09/05/2012","09/12/2012","8169473"
"Biologics","No","","63026","Terminated","RTI Biologics, Inc.","11621 Research Cir","","Alachua","FL","	32615-6825","United States","Voluntary: Firm Initiated","Letter","Arizona; Pennsylvania; South Carolina; Oregon; Maryland; California; Florida","B-2524-12","Class II","Tendon","7","Human tendons, with a culture positive for coagulase negative Staphylococcus, were distributed.","07/31/2012","09/05/2012","09/05/2012","09/12/2012","7576144; 7576145; 7576146; 7576147; 7576148; 7576149; 7576150"
"Devices","No","","63042","Terminated","Siemens Medical Solutions USA, Inc","51 Valley Stream Pkwy","","Malvern","PA","	19355","United States","Voluntary: Firm Initiated","Letter","Nationwide Distribution- including the states of GA, ID, IL, IA, KS, NC, OH, SD, TX, and WI.","Z-2322-2012","Class II","Siemens Mobilett Mira.    Mobile X-Ray System.","20","During regular product monitoring, Siemens has become aware of a potential issue with the Mobilett Mira system.  During normal clinical operation the switch on the motor drive handle of the unit may become loose and slide horizontally to the right and become trapped under the cover.  This may cause the system to continuously move.  In response, Siemens has issued Update Instruction XP038/12/S to r","08/21/2012","09/06/2012","04/03/2014","09/12/2012","Model number 10273100 -- serial numbers 1034, 1038, 1041, 1042, 1043, 1053, 1057, 1070, 1079, 1081, 1088, 1098, 1099, 1102, 1103, 1105, 1106, 1107, 1108, and 1112."
"Biologics","No","","63051","Terminated","Viacord Processing Laboratory","2375 Progress Dr","","Hebron","KY","	41048-8758","United States","Voluntary: Firm Initiated","Telephone","New York","B-2525-12","Class II","Umbilical Cord Blood Stem Cells","1","Umbilical cord blood stem cells, not tested in accordance with the manufacturer's instructions to adequately and appropriately reduce the risk of transmission of relevant communicable disease agents, were distributed.","07/18/2012","08/31/2012","08/31/2012","09/12/2012","111112016"
"Biologics","No","","63052","Terminated","Lions Eye Institute for Transplant & Research, Inc.","1410 N 21st St","","Tampa","FL","	33605-5313","United States","Voluntary: Firm Initiated","Letter","California; Florida","B-2526-12","Class II","Cornea","2","Human corneas, recovered from a donor whose donor eligibility may have been been determined with inaccurate and/or incomplete donor records, were distributed.","07/24/2012","08/31/2012","08/31/2012","09/12/2012","2010063945; 2010063946"
"Biologics","No","","40008","Terminated","American Red Cross Blood Services","4050 Lindell Blvd","","Saint Louis","MO","	63108-3202","United States","Voluntary: Firm Initiated","Telephone","MO","B-2494-12","Class III","Red Blood Cells Leukocytes Reduced","4 units","Blood products, tested using the Hematastat equipment that was missing the daily quality control records, were distributed.","03/30/2005","09/06/2012","09/06/2012","09/12/2012","11GW59870, 11GW59871, 11GW59874, 11GW59876"
"Food","No","","62695","Terminated","Clif Bar And Company","1451 66th St","","Emeryville","CA","	94608-1004","United States","Voluntary: Firm Initiated","Press Release","Distributed to Targets and Walmarts in 25 states.","F-2119-2012","Class III","CLIF Bar Brand Coconut Chocolate Chip CLIF Bars, 6-pack boxes, UPC: 7-22252-66030-5    Product is manufactured by  Harlan Bakeries in Indianapolis, IN.","53,453 boxes. Each box contains 6 bars","The product contains undeclared Coconut in the ingredient statement. The Coconut Chocolate Chip bars were inadvertently placed in White Chocolate Macadamia CLIF Bar wrappers and these mislabeled bars were placed inside correctly labeled Coconut Chocolate Chip CLIF Bar boxes.","07/30/2012","09/04/2012","04/03/2013","09/12/2012","Best By date: 16MAY13G1 on both carton and individual bars contained within."
"Food","No","","62695","Terminated","Clif Bar And Company","1451 66th St","","Emeryville","CA","	94608-1004","United States","Voluntary: Firm Initiated","Press Release","Distributed to Targets and Walmarts in 25 states.","F-2120-2012","Class III","CLIF Bar Brand White Chocolate Macadamia CLIF Bar, 2.4 oz (68g), Individually wrapped bars    Product is manufactured by  Harlan Bakeries in Indianapolis, IN.","53,453 boxes. Each box contains 6 bars","The product contains undeclared Coconut in the ingredient statement. The Coconut Chocolate Chip bars were inadvertently placed in White Chocolate Macadamia CLIF Bar wrappers and these mislabeled bars were placed inside correctly labeled Coconut Chocolate Chip CLIF Bar boxes.","07/30/2012","09/04/2012","04/03/2013","09/12/2012","Best By date: 16MAY13G1"
"Devices","No","","62757","Terminated","Trek Diagnostic Systems","982 Keynote Cir Ste 6","","Cleveland","OH","	44131-1873","United States","Voluntary: Firm Initiated","Letter","Worldwide Distribution - USA including AL, AR, AZ, CA, CO , CT, FL, GA, IA, ID, IL, IN, KS, LA, MA, MD, ME, MI, MN, MO, NC, NE, NJ, NY, OH, OK, OR, PA, RI, SD, TN, TX, VA, VT, WA, WI, WV, and WY.  Internationally to the countries of Bahamas, Bangladesh, Brazil, Canada, Chile, China, Colombia, Czech Republic, France, India, Ireland, Italy, Japan, Jordan, Kenya, Kuwait, Malaysia, Mexico, Pakistan, Peru, Philippines, Portugal, Puerto Rico, Russian Federation, South Africa, Spain, Thailand, Turkey, and United Kingdom","Z-2323-2012","Class III","VersaTREK Windows Software, Version 5.4.3 is a component of the VersaTrek System. The Software CD will be individually packaged using a standard CD plastic case and placed into a standard CD mailer    The VersaTREK System is for cultivating and recovering microorganisms, especially bacteria and yeasts, from blood and other normally sterile body fluids.","333 units","Review of instrument software databases and investigation of two customer reports determined that on rare occasions (less than 0.3%), following the removal of a positive signaling bottle from the VersaTREK instrument, the positive test result inadvertently reverted to a negative result in the instrument database.","07/23/2012","09/06/2012","06/18/2013","09/12/2012","Software: Cat. 6133-30-3, Version 5.4.3."
"Biologics","No","","62810","Terminated","Blood Systems Inc/dba United Blood Services","1115 25th Avenue","","Meridian","MS","	39301-3912","United States","Voluntary: Firm Initiated","Other","Mississippi; Switzerland","B-2514-12","Class III","Recovered Plasma","1","Blood products, which were collected from a donor in which donor suitability was not adequately determined, were distributed.","04/16/2012","09/06/2012","09/06/2012","09/12/2012","W041611058803X;"
"Biologics","No","","62819","Terminated","Community Blood Centers of Florida, Inc.","1700 N State Road 7","","Lauderhill","FL","	33313-5006","United States","Voluntary: Firm Initiated","Telephone","Pennsylvania; Florida; New York","B-2475-12","Class III","Blood and Blood Products for Reprocessing","1 unit","Blood products, which were collected from a donor in which donor suitability was not adequately determined, were distributed.","03/22/2012","09/06/2012","09/06/2012","09/12/2012","W036810147118;"
"Biologics","No","","62824","Terminated","The American National Red Cross - Southern Region","9851 Commerce Way","","Douglasville","GA","	30135-3101","United States","Voluntary: Firm Initiated","E-Mail","California","B-2497-12","Class III","Plasma Frozen","1 unit","Blood product, collected from a donor in whom donor suitability was not adequately determined, was distributed.","06/04/2012","09/06/2012","09/06/2012","09/12/2012","03KH50314;"
"Biologics","No","","62841","Terminated","Community Blood Centers of Florida, Inc.","1700 N State Road 7","","Lauderhill","FL","	33313-5006","United States","Voluntary: Firm Initiated","FAX","Florida; New Zealand","B-2506-12","Class III","Blood and Blood Products for Reprocessing","1 unit","Blood products, which were collected from a donor in which donor suitability was not adequately determined, were distributed.","07/02/2012","09/06/2012","09/06/2012","09/12/2012","W036811000752;"
"Devices","No","","62852","Terminated","Steris Corporation","5960 Heisley Rd","","Mentor","OH","	44060-1834","United States","Voluntary: Firm Initiated","Letter","Worldwide Distribution--USA (nationwide) including the states of  AL, AZ, CA, FL, IL, IN, KY, LA, MO, MS, NJ, OH, PA, SD, TX, and VA., and the countries of  Japan, Peru, and Suriname.","Z-2325-2012","Class III","100 ft roll of tubing inside a cardboard box. Medical devices are sealed into the tubes prior to ethylene oxide sterilization. Tube maintains sterility of the enclosed medical devices until opened.","77 packs","On 7/20/2012 the firm became aware that a lot of tubing was distributed by the supplier after it was rejected by Steris due to failing process indicators.","08/02/2012","09/06/2012","09/04/2013","09/12/2012","Product code KCT; Lot number: 60263"
"Biologics","No","","62935","Terminated","Plasmacare Inc","2840 E 116th Street","","Cleveland","OH","	44120","United States","Voluntary: Firm Initiated","E-Mail","California","B-2516-12","Class III","Source Plasma","1","Blood product, collected from a donor, whose suitability to donate was not adequately determined, was distributed.","05/01/2012","09/06/2012","09/06/2012","09/12/2012","2160040852;"
"Biologics","No","","62936","Terminated","Plasmacare Inc","2840 E 116th Street","","Cleveland","OH","	44120","United States","Voluntary: Firm Initiated","E-Mail","California","B-2517-12","Class III","Source Plasma","2","Blood products, collected from a donor, whose suitability to donate was not adequately determined, were distributed.","05/01/2012","09/06/2012","09/06/2012","09/12/2012","2160081369; 2160083182;"
"Biologics","No","","62938","Terminated","Plasmacare Inc","2840 E 116th Street","","Cleveland","OH","	44120","United States","Voluntary: Firm Initiated","E-Mail","California","B-2518-12","Class III","Source Plasma","2","Blood products, collected from a donor, whose suitability to donate was not adequately determined, were distributed.","05/01/2012","09/06/2012","09/06/2012","09/12/2012","2160063161; 2160068978;"
