Product Type,Recently Updated Record,Last Modified Date,Event ID,Status,Recalling Firm,Address1,Address2,City,State/Province,Postal Code,Country,Voluntary/Mandated,Initial Firm Notification of Consignee or Public,Distribution Pattern,Recall Number,Classification,Product Description,Product Quantity,Reason for Recall,Recall Initiation Date,Center Classification Date,Termination Date,Report Date,Code Info
"Food","No","","65733","Terminated","Healthmaxx Global Inc.","16231 Elza Dr.","","Hacienda Heights","CA","	91745","United States","Voluntary: Firm Initiated","Letter","CA, MD, and NY","F-1923-2013","Class I","MAX Brand SUPER SELENIUM 250, 180 Count Tablets    Product labeling reads in part:""MAX SUPER SELENIUM 250 ***Dietary Supplement 180 Tablet***0 65176 06756 1***Manufactured in FDA Approved Facility For:HealthMax Products Co. Altadena, CA 91001***"".    ","4139 bottles","In response to a FDA inspection, the firm initiated this voluntary recall of various dietary supplements due to the following problems of mislabeling: 1) product named on the label is not actual product contained; 2)ingredients listed are not actual ingredients contained.","06/10/2013","09/24/2013","11/14/2014","10/02/2013","Lot # S0703  UPC 0 65176 06756 1"
"Food","No","","66167","Terminated","Garden-Fresh Foods, Inc.","726 S 12th St.","","Milwaukee","WI","	53204-1211","United States","Voluntary: Firm Initiated","Two or more of the following: Email, Fax, Letter, Press Release, Telephone, Visit","retail Spartan stores located in MI and Toledo, OH.","F-1911-2013","Class I","spartan fresh selections american potato salad, Net Wt. 16 oz (1 LB) 454g.  UPC 11213-90320.","Unknown","One lot of Spartan Fresh Selections American Potato Salad has the potential to be contaminated with Listeria monocytogenes.","08/30/2013","09/20/2013","03/16/2016","10/02/2013","Use by 09/06/13/04"
"Food","No","","66224","Terminated","KDK Management, Inc., dba Bubbles Baking Co.","15215 Keswick St.","","Van Nuys","CA","	91405","United States","Voluntary: Firm Initiated","Press Release","CA & Arizona","F-1909-2013","Class I","First Street Blueberry Muffins (S 45395), 14 oz., 9 trays/case,  UPC 0 4151210833 4","9,229 cases","Bubbles Baking Co. is recalling Blueberry muffins and Loaf cakes because they may contain undeclared milk and soy.","09/10/2013","09/20/2013","02/14/2014","10/02/2013","Lot Codes:    12355, 12361, 12365, 12365, 13013, 13007, 13008, 13022, 13029, 13030, 13031, 13001, 13032, 13038, 13039, 13042, 13049, 13050, 13051, 13058, 13059, 13063, 13064, 13070, 13073, 13079, 13084, 13085, 13086, 13091, 13093, 13094, 13098, 13099, 13102, 13105, 13107, 13114, 13115, 13116, 13122, 13123, 13124, 13128, 13129, 13130, 13134, 13140, 13142, 13143, 13151, 13152, 13152, 13154, 13156, 13157, 13162, 13163, 13165,13169, 13170, 13171, 13173, 13175, 13176, 13177, 13178, 13183, 13184, 13187, 13192, 13198, 132013,13200, 13199, 13210,13217, 13219, 13220,13221, 13233, 13235, 13237, 13239."
"Food","No","","66224","Terminated","KDK Management, Inc., dba Bubbles Baking Co.","15215 Keswick St.","","Van Nuys","CA","	91405","United States","Voluntary: Firm Initiated","Press Release","CA & Arizona","F-1910-2013","Class I","First Street Blueberry Muffins Loaf (S 45383), 16 oz., 12 trays/case, UPC 0 41512 10854 9.","9,229 cases total","Bubbles Baking Co. is recalling Blueberry muffins and Loaf cakes because they may contain undeclared milk and soy.","09/10/2013","09/20/2013","02/14/2014","10/02/2013","Lot Codes:    12355, 12361, 12365,  12365, 13013, 13007, 13008, 13022, 13029, 13030, 13031, 13001, 13032, 13038, 13039, 13042, 13049, 13050, 13051, 13058, 13059, 13063, 13064, 13070, 13073, 13079, 13084, 13085, 13086, 13091, 13093, 13094, 13098, 13099, 13102, 13105, 13107, 13114, 13115, 13116, 13122, 13123, 13124, 13128, 13129, 13130, 13134, 13140, 13142, 13143, 13151, 13152, 13152, 13154, 13156, 13157, 13162, 13163, 13165,13169, 13170, 13171, 13173, 13175, 13176, 13177, 13178, 13183, 13184, 13187, 13192, 13198, 132013,13200, 13199, 13210,13217, 13219, 13220,13221, 13233, 13235, 13237, 13239."
"Food","No","","66319","Terminated","Irene's Bakery & Gourmet Kitchen, Inc.","1690 Winchester Rd","","Bensalem","PA","	19020-4540","United States","Voluntary: Firm Initiated","Telephone","Local and nationwide wholesale distributors and retail markets.","F-1946-2013","Class I","Irene's Black & White Cookies, 8 oz. (226.4g)     All Natural.    Ingredients: Sugar, wheat flour, water, eggs, canola oil, unmodified food starch, corn syrup, vegetable fat, cocoa powder processed with alkali, mono and diglycerides, sea salt, sodium acid pyrophosphate, sodium bicarbonate, mono calcium phosphate, soy lecithin, natural flavors.     May contain traces of tree nuts.     Manufactured by Irene's Bakery and Gourmet Kitchen, Bensalem, PA.","2008 packages (87 cases of  24 or 16 eight oz. packages/case)","Undeclared whey powder (milk allergen) sub-ingredient of chocolate confectionery coating used in manufacturing of Black & White Cookies.","08/26/2013","09/25/2013","08/27/2014","10/02/2013","actual date code information are not available. Two-week expiration dates are assigned by the retail store upon receipt of shipment from the manufacturer."
"Devices","No","","64236","Terminated","Synthes USA HQ, Inc.","1302 Wrights Ln E","","West Chester","PA","	19380-3417","United States","Voluntary: Firm Initiated","Letter","Worldwide Distribution - USA including CO, PA, TN, VA, TN, WA, and internationally to Czech Republic.","Z-2282-2013","Class II","Synthes Oracle Spacer System Slap Hammer, Part Number 03.809.690, Lot Number 3723847    The Oracle Spacer is indicated for use in patients with degenerative disc disease (DDD) at one or two contiguous levels from L2 to S1 whose condition requires the use of interbody fusion combined with supplemental fixation. The Oracle Spacer is indicated as a vertebral body replacement device intended for use in the thoracolumbar spine (T1-L5) to replace a diseased vertebral body resected or excised during partial and total vertebrectomy procedures or the treatment of tumor or trauma (i.e., fracture), to achieve anterior decompression of the spinal cord and neural tissues, and to restore the height of the collapsed vertebral body. The Slap Hammer, 03.809.690, is a dual sided device with two separate attachment options. The Slap Hammer allows a user (surgeon) to remove a previously placed trial implants.","27","This recall is being initiated in response to complaints received where it was reported that the proximal end of the Slap Hammer broke during use.","01/11/2013","09/26/2013","08/31/2015","10/02/2013","Part number 03.809.690, Lot Number 6723847"
"Devices","No","","65009","Terminated","Synthes USA HQ, Inc.","1302 Wrights Ln E","","West Chester","PA","	19380-3417","United States","Voluntary: Firm Initiated","Letter","Nationwide Distribution including CA,and VA.    .","Z-2278-2013","Class II","Synthes 3.5 MM LCP(R) Distal Humerus System    The Synthes 3.5 MM LCP Distal Humerus System is intended for fixation of fractures of the distal humerus, olecranon, and ulna in adults and adolescents (12-21) in which the growth plates have fused. Specifically, distal humerus plates are indicated for intra-articular fractures, comminuted supracondylar fractures, osteotomies, malunions and non-unions of the distal humerus.","2","Recall is being initiated due to the part being mislabeled (Part Number 241.267 was mislabeled with Part Number 241.276).","03/08/2013","09/25/2013","05/21/2015","10/02/2013","Part Number 241.267, lot number 8037923"
"Devices","No","","65348","Terminated","Invacare Corporation","1200 Taylor St","","Elyria","OH","	44035-6248","United States","Voluntary: Firm Initiated","Letter","Worldwide Distribution - USA including AK, AL, AR, AZ, CA, CO, CT, DC, DE, FL, GA, HI, IA, ID, IL, IN, KS, KY, LA, MA, MD, ME, MI, MN, MO, MS, MT, NC, ND, NE, NH, NJ, NM, NV, NY, OH, OK, OR, PA, RI, SC, SD, TN, TX, UT, VA, VT, WA, WI, WV, and WY.   Internationally to Canada, Australia, Bermuda, Brazil, China, Costa Rica, Germany, France, United Kingdom, Guam, Hong Kong, Israel, India, Kuwait, New Zealand, Puerto rico, Qatar, Saudi Arabia, Singapore, Thailand, Trinidad, Tobago, and South Africa.","Z-2270-2013","Class II","Invacare Power Wheelchair, one per box    To provide mobility to a person restricted to a sitting position.","166,230","Unintended slowing or deceleration, and on rare occasion,  unanticipated and unattended acceleration of power wheelchairs equipped with SPJ and MPJ type joysticks.","06/04/2013","09/23/2013","01/04/2016","10/02/2013","The following Joystick model numbers and respective part numbers are affected by this recall:   CSPJ, 1121239; SPJPLUS, 1127291; SPJAP, 1136937; SPJAPM, 1136938; CMPJM6, 1164361; CMPM6U, 1644361; MPJM6, 1136885; MPJM6U, 1136885; 1558M6, 1136887; 1558MM6, 1136887; 1500M6, 1136889; PACM6, 1136888; PACM6, 1167927; PSRM6, 1139941; PSRM6, 1140046; PSRM6, 1140047; PSRM6, 1140048; PSRM6, 1144844; PSRM6, 1144845; and PSFM6, 1139944.     The following Power Wheelchair model numbers (affected date ranges are included in the 1525712 6-3-13 001C model numbers FINAL xlsx document) are affected by this recall:  M61UKRD; 3GAR; 3GARBASE; 3GAR-CG; 3GRX; 3GRXBASE; 3GRX-CG; 3GSEAT-CG; 3GSTRX-TS; 3GTQ3; 3GTQ3-CG; 3GTQ3-MCG; 3GTQ3V; 3GTQ-CG; 3GTQ-MCG; 3GTQSE; 3GTQSEBASE; 3GTQSE-CG; 3GTQSE-PTO; 3GTQSP; 3GTQSPBASE; 3GTQSP-TS; FDX; FDX-CG; FDX-MCG; M41BB; M41RB; M41RBCN; M51 PBLUEBASE; M51 PREDBASE; M51BB; M51-CG; M51CGBB; M51CGRB; M51P; M51PBB; M51PBLUEBASE; M51PR; M51PRB; M51PREDBASE; M51RB; M51RBCN; M51SEAT-CG; M61; M61 PBLUE; M61 PRED ; M61 ; KRDBASE; M61(1144227); M61FBLUE; M61FRAD; M61FRED; M61R; M61RB(1144227); M61RBCN; M61RED; M61SEAT; M61UK; M61UK REDBASE; M61UKRD; M61UKRDBASE; M71; M71JR; M71R; M71SEAT; M71-TS; M91; M91-C; M91-M; M91R; M91-R; M91SEAT; M91-TS; M94; M94-C; PTBASE; PTORB; PWORBITS; R51; R51LXP; TDX3; TDX3BASE; TDX3-PS; TDX3SE; TDX3SEBASE; TDX3SE-PS; TDX3SE-TS; TDX3-TS; TDX4; TDX4BASE; TDX4-PS; TDX4-TS; TDX5; TDX5BASE; TDX5-PS; TDX5-TS; TDXSC; TDXSC2-CG; TDXSCSEAT; TDXSCV; TDXSEAT; TDXSI; TDXSI-2; TDXSI-2-S; TDXSI-CG; TDXSI-HD; TDXSI-HD-S; TDXSISEAT; TDXSISEAT-HD; TDXSIV; TDXSIV-2; TDXSIV-2-S; TDXSIV-HD; TDXSIV-HD-S; TDXSP; TDXSPBASE; TDXSP-CG; TDXSP-CG-GT; TDXSP-GT; TDXSP-MCG; TDXSP-MCG-GT; TDXSPREE; TDXSPREE-CG; TDXSPREESEAT; TDXSPSEAT; TDXSR; TDXSR-CG; TDXSR-CG-HD; TDXSR-HD; TDXSR-MCG; TDXSR-MCG-HD; TDXSRSEAT; TDXSRV; and TDXSRV-HD."
"Food","No","","65733","Terminated","Healthmaxx Global Inc.","16231 Elza Dr.","","Hacienda Heights","CA","	91745","United States","Voluntary: Firm Initiated","Letter","CA, MD, and NY","F-1925-2013","Class II","MAX Brand Bio-Cell Collagen II, 100 Count Softgels    Product labeling reads in part:""MAX Bio-Cell CollagenII Dietary Supplement 100 Softgels*** 0 65176 08108 6***Manufactured for:HealthMax Products Co. Altadena, CA 91001***"".    ","9069 bottles","In response to a FDA inspection, the firm initiated this voluntary recall of various dietary supplements due to the following problems of mislabeling: 1) product named on the label is not actual product contained; 2)ingredients listed are not actual ingredients contained.","06/10/2013","09/24/2013","11/14/2014","10/02/2013","Lot # CL0925  UPC 0 65176 08108 6"
"Food","No","","65733","Terminated","Healthmaxx Global Inc.","16231 Elza Dr.","","Hacienda Heights","CA","	91745","United States","Voluntary: Firm Initiated","Letter","CA, MD, and NY","F-1926-2013","Class II","Hyper II DHA/EPA, 100 Count Softgels.    Product labeling reads in part:""Hyper II DHA/EPA Refined Deep Sea Fish Oil 50% DHA - 30% EPA***Dietary Supplement 100 Softgels***6 65176 05274 3***Manufactured  for:HealthMax Products Co. Altadena, CA 91001***"".    ","2863 bottles","In response to a FDA inspection, the firm initiated this voluntary recall of various dietary supplements due to the following problems of mislabeling: 1) product named on the label is not actual product contained; 2)ingredients listed are not actual ingredients contained.","06/10/2013","09/24/2013","11/14/2014","10/02/2013","Lot # F0202  UPC 6 65176 05274 3"
"Devices","No","","65883","Terminated","Microgenics Corp","46360 Fremont Blvd","","Fremont","CA","	94538-6406","United States","Voluntary: Firm Initiated","Letter","US Distribution including the states of  DC, MA, NJ, TX. FL, CA, WA, NY, TX, CT, KY, LA, AR, TN, AL, GA, CT, VA, NC, KS, MD, OH and IL","Z-2267-2013","Class II","DRI Cocaine Metabolite Assay, labeled as Multigent Cocaine Assay for Abbott Laboratories.  100 ml, IVD    Mfg by:  Microgenics Corporation,  46360 Fremont Blvd.  Fremont, CA 94538    The DRI Cocaine Metabolite Enzyme Immunoassay is a homogeneous enzyme intended for the qualitative and semi-quantitative determination of benzoylecgonine (Cocaine Metabolite) in human urine with either 300 ng/mL or 150 ng/mL as a cutoff calibrator. The assay provided only a preliminary analytical test result. A more specific alternative chemical method must be used to obtain a confirm analytical result.","1473 units in distribution.","Surveillance of reagent stability for specific lots of  DRI Cocaine Metabolite Reagent show an unexpected decreasing change in the reaction rate, indicating a faster than expected reagent degradation.","07/23/2013","09/23/2013","12/02/2013","10/02/2013","Part no. 0055, lot number 60053405, Exp 2/29/2016;  Part No. 0056, lot number 60053396, Exp 2/29/2016;  Part No. 10014593, lot number 60112588, Exp 2/29/2016; - not distributed  Part number #l40-20, lot number 24215M500, Exp 8/13/14."
"Drugs","No","","65889","Terminated","Core Pharma Llc","215 Wood Ave","","Middlesex","NJ","	08846-2554","United States","Voluntary: Firm Initiated","Letter","Nationwide","D-1062-2013","Class II","Pyridostigmine Bromide Tablets 60 mg, USP Rx Only 100 Tablets, Manufactured and Distributed by: CorePharma, LLC Middlesex, NJ 08846 NDC 64720-128-10  NDC 64720-128-10","960 bottles","Failed Stability Specifications: Pyridostigmine Bromide tablets, is being recalled due to an out of specification test result during stablity testing.","07/02/2013","09/20/2013","08/25/2014","10/02/2013","109497; Exp. 12/15"
"Devices","No","","65922","Terminated","Stryker Medical Division of Stryker Corporation","3800 E Centre Ave","","Portage","MI","	49002-5826","United States","Voluntary: Firm Initiated","Letter","Worldwide Distribution - USA including MI, WI, VA and internationally to Canada.","Z-2283-2013","Class II","The FL23SE Bed is an AC-powered adjustable hospital bed with four built-in electric DC motors and remote controls that is intended for medical purposes. It can be operated by the patient or the caregiver to adjust the height and surface contour of the bed. The bed includes movable and latchable siderails.  The FL23SE Bed is intended for use with patients for procedures, therapy, recovery in healthcare environments, and to transport patients between bays and procedural rooms.    The FL23SE Bed is intended for use with patients for procedures, therapy, recovery in healthcare environments, and to transport patients between bays and procedural rooms.","61 units","The nurse call cable (Part Number: QDF23-0571) on the FL23SE Bed is located right under the opening of the bed head box. If an accessory (i.e. IV pole) is inserted into this slot, the circuit directing the nurse call system can be damaged.","08/19/2013","09/26/2013","01/29/2014","10/02/2013","Model Numbers: FL23SE with nurse call option: OL235017 & OL235018  List of Affected Devices:  J60267 J60425 J60009 J60001 J60094  J60095 J60096 J60348 J60349 J60350  J60351 J60352 J60353 J60354 J60360  J60361 J60362 J60363 J60364 J60365  J60366 J60367 J60368 J60369 J60370  J60371 J60372 J60373 J60374 J60375  J60376 J60377 J60378 J60379 J60380  J60381 J60382 J60383 J60384 J60385  J60386 J60387 J60388 J60389 J60390  J60391 J60392 J60393 J60394 J60395  J60396 J60397 J60398 J60399 J60400  J60401 J60402 J60403 J60404 J60405  J60512"
"Devices","No","","65981","Terminated","Terumo Cardiovascular Systems Corporation","125 Blue Ball Rd","","Elkton","MD","	21921-5315","United States","Voluntary: Firm Initiated","Letter","Nationwide Distribution including WA, IN, OK, TX, MI, CA, NY, CT, AZ, FL, WV, NC, VA, PA, TN, GA, AL, MA, SC, OH, MS, MO, SD, WI, AR, AND NV.","Z-2261-2013","Class II","Terumo Pall AL6X Arterial Blood Line Filter, labeled in part Terumo Cardiovascular Systems Corporation, packaged as part of a Terumo Cardiovascular Procedure Kit or as a single, sterile filter unit    Single/Sterile Terumo Pall AL6X Arterial Filter: The Terumo Pall AL6X Arterial Filter is indicated for use in cardiopulmonary bypass procedures for the removal of micro-emboli greater than 40 microns in size, including gas emboli, fat emboli and aggregates composed of platelets, red blood cells and other debris from the arterial line and where the flow rate will not exceed 8 liters per minute. Cardiovascular Procedure (Convenience) Kit that includes the Terumo Pall AL6X Arterial Filter: The Cardiovascular Procedure Kits are indicated for use only in the extracorporeal circuit for the cardiopulmonary bypass procedures for which the user designed. The sterile cardiovascular procedure kit is intended to be used one time for periods up to 6 hours.    ","15,817 filters","Medical device used in cardiovascular procedures is defective.","07/26/2013","09/20/2013","07/28/2015","10/02/2013","Recalled filters sold singly are identified with Part Number AL6X with the following lot codes:    MM19,                            MN23,                            NC15,                            ND01,                            ND08,                            ND29,                           NE11,                            NE18,                            NE25,                            NF09,                            NF31,                            PA23,                            PD05,                            PE02,                            PF14,                            PF21,                            PG04,                            PG11,                            PG18,                            PG25,                            PH09,                            PH16,                            PH30,                            PK06,                            PK13,                            PL24,                            PM01,                            PM08,                            PM22,                            PM29,                            PN12,                            PN26,                            PP17,                            PP31,                            QA07,                            QA14,                            QA21,                            QC04,                            QC25,                            QD11,                            QD18,                            QD25,                            QE08,                            QE15,                            QE22,                            QE29,                            QF06,   QF28,  MM26,                            NL12,                            NM24,                            NP12, and PA30;                                                                                                                      Affected filters, also Part # AL6X, packaged within Terumo Cardiovascular Convenience Kits are identified with the following lot codes:    PN19,                            QA14,                            QC11R,                           QD04,                            QE15,                            QF06,                            QF13,                            NM31,                            NP05,                            PC20,                            PD05,                            QF28,                            QC04,                            PD26,                            PG04,                            PE23R,                           PK13,                            PK20,                            QA21,                            QC11,                            QC11A,                           QD11,                            QE01,                            PL17,                            QE08,                            NK08,                            PG25,                            PN26,                            QC18,                           NN07,                            NN07R,                           PA16,                            PA16R,                           PC27,                            PC27R,                           PF07,                            PL24,                            PD12,                            PE09,                            PE30,                            PH09,                            PL10,                            PE23,                            PF14,                            PG18,                            PK06,                            PM01,                            PM22,                            PN12,                            QA02,                           QA28,                            QC25,                            QD25,                            NK01,                            NK08R,                           PH23,                            PH16,                            PL10A,                           PM15,                            PP10,                            PP17,                             QD18,                            QE22,                            NM17,                            NM17A,                           PC06,                            PC06R,                           PE09R,                           QE01A,                           QE15A,                           QE15T,                           QE15TA,                          QE15TC,                          QF13T,                           QF20,                            QF20T,                           NA10R,                           NA17R,                           ND14,                            ND28,                            ND28T,                           NE11T,                           NE18,                            NF23,                            NG06,                            NG20,                            NH11,                            NH18,                           NK15,                            NL12,                            NL26,                            NM03,                            NM10,                            NM24,                            NN14,                            NN28,                            NP12,                            PA30,                            PC13,                            PD19,                            PE16,                            PF07A,                           PF21,                            PK27,                            PK27A,                           PL04,                            PM08,                            PP03,                            QA14T,                           QE29,                            QF28T,                           QF28TA,                          PG11,                            PH30,                            PH30A,                           PN26A,                           QA07,                            NH25,                            NK29,                            PE02,                            PF29,                            PN19,                            QG17,                            PK13A,                           QD11A,                           MN22,                            NE25,                            NF31,                            PM29,                            PA09,                            QG03,                            PA02,                            PH23T,                         PG11T,                           QC18R,                           QF06A,                           PH09T,                           PH09TA,                          QF13TA,                          QF20TA, and QF20TC"
