"Devices","No","","83797","Ongoing","Medtronic Vascular Galway DBA Medtronic Ireland","Parkmore Business Park West","","Galway","","	","Ireland","Voluntary: Firm initiated","Letter","worldwide","Z-0123-2020","Class II","Solarice Rapid Exchange Balloon Dilatation Catheter, Product Numbers:  SLC1506X, SLC1510X, SLC1512X, SLC1515X, SLC1520X, SLC2006X, SLC2010X, SLC2012X, SLC2015X, SLC2020X, SLC2025X, SLC2030X, SLC22510X, SLC22515X, SLC22520X, SLC22525X, SLC2506X, SLC2510X, SLC2512X, SLC2515X, SLC2520X, SLC2525X, SLC2530X, SLC27512X, SLC27515X, SLC27520X, SLC3010X, SLC3012X, SLC3015X, SLC3020X, SLC3025X, SLC3030X, SLC3506X, SLC3510X, SLC3512X, SLC3515X, SLC3520X, SLC3530X, SLC4010X, SLC4012X, SLC4015X, SLC4020X, SLC4025X, SLC4030X (OUS DISTRIBUTION ONLY)","98675 units","Medtronic has determined that some catheters have a slightly higher diameter stylette causing removal difficulties.","09/03/2019","10/11/2019","","10/23/2019","Product Number / CFN GTIN Lot  SLC1506X 00643169680005 217427355  SLC1510X 00643169680012 217253572  SLC1510X 00643169680012 217298666  SLC1510X 00643169680012 217387126  SLC1510X 00643169680012 217427354  SLC1510X 00643169680012 217487816  SLC1512X 00643169680029 217218112  SLC1512X 00643169680029 217253582  SLC1512X 00643169680029 217387128  SLC1512X 00643169680029 217487818  SLC1512X 00643169680029 217542634  SLC1512X 00643169680029 217859789  SLC1515X 00643169680036 217246455  SLC1515X 00643169680036 217253577  SLC1515X 00643169680036 217306789  SLC1515X 00643169680036 217415822  SLC1515X 00643169680036 217427365  SLC1515X 00643169680036 217823443  SLC1515X 00643169680036 217859165  SLC1515X 00643169680036 217940024  SLC1520X 00643169680043 217253580  SLC1520X 00643169680043 217306787  SLC1520X 00643169680043 217427359  SLC1520X 00643169680043 217542633  SLC1520X 00643169680043 217646425  SLC1520X 00643169680043 217668582  SLC1520X 00643169680043 217799249  SLC1520X 00643169680043 217859164  SLC2006X 00643169680050 217435326  SLC2006X 00643169680050 217913786  SLC2010X 00643169680067 217253573  SLC2010X 00643169680067 217297545  SLC2010X 00643169680067 217387127  SLC2010X 00643169680067 217427356  SLC2010X 00643169680067 217646867  SLC2010X 00643169680067 217668585  SLC2010X 00643169680067 217676631  SLC2010X 00643169680067 217905820  SLC2012X 00643169680074 217253578  SLC2012X 00643169680074 217298670  SLC2012X 00643169680074 217306788  SLC2012X 00643169680074 217415824  SLC2012X 00643169680074 217434925  SLC2012X 00643169680074 217602539  SLC2012X 00643169680074 217668687  SLC2012X 00643169680074 217799250  SLC2012X 00643169680074 217859791  SLC2012X 00643169680074 217940066  SLC2015X 00643169680081 217218115  SLC2015X 00643169680081 217253574  SLC2015X 00643169680081 217271254  SLC2015X 00643169680081 217298669  SLC2015X 00643169680081 217306223  SLC2015X 00643169680081 217404046  SLC2015X 00643169680081 217418812  SLC2015X 00643169680081 217418907  SLC2015X 00643169680081 217427706  SLC2015X 00643169680081 217435327  SLC2015X 00643169680081 217498815  SLC2015X 00643169680081 217615647  SLC2015X 00643169680081 217646871  SLC2015X 00643169680081 217668584  SLC2015X 00643169680081 217713076  SLC2015X 00643169680081 217721607  SLC2015X 00643169680081 217777612  SLC2015X 00643169680081 217799251  SLC2015X 00643169680081 217884509  SLC2015X 00643169680081 217913790  SLC2020X 00643169680098 217218110  SLC2020X 00643169680098 217246457  SLC2020X 00643169680098 217253575  SLC2020X 00643169680098 217271253  SLC2020X 00643169680098 217298667  SLC2020X 00643169680098 217306220  SLC2020X 00643169680098 217387130  SLC2020X 00643169680098 217404047  SLC2020X 00643169680098 217418908  SLC2020X 00643169680098 217487822  SLC2020X 00643169680098 217498821  SLC2020X 00643169680098 217676628  SLC2020X 00643169680098 217713075  SLC2020X 00643169680098 217727927  SLC2020X 00643169680098 217799252  SLC2020X 00643169680098 217850364  SLC2020X 00643169680098 217905822  SLC2025X 00643169680104 217271251  SLC2025X 00643169680104 217542635  SLC2025X 00643169680104 217905821  SLC2030X 00643169680111 217218119  SLC2030X 00643169680111 217427363  SLC2030X 00643169680111 217602538  SLC2030X 00643169680111 217704778  SLC2030X 00643169680111 217777614  SLC22510X 00643169680135 217487815  SLC22510X 00643169680135 217646423  SLC22515X 00643169680159 217427362  SLC22515X 00643169680159 217646422  SLC22520X 00643169680166 217721606  SLC22520X 00643169680166 217913787  SLC22525X 00643169680173 217415820  SLC22525X 00643169680173 218025488  SLC2506X 00643169680180 217823441  SLC2510X 00643169680197 217218122  SLC2510X 00643169680197 217401003  SLC2510X 00643169680197 217427357  SLC2510X 00643169680197 217693881  SLC2510X 00643169680197 217913792  SLC2510X 00643169680197 218034774  SLC2512X 00643169680203 217271257  SLC2512X 00643169680203 217306225  SLC2512X 00643169680203 217415825  SLC2512X 00643169680203 217434924  SLC2512X 00643169680203 217498822  SLC251 2X 00643169680203 217606584  SLC2512X 00643169680203 217695006  SLC2512X 00643169680203 217859787  SLC2512X 00643169680203 217913793  SLC2515X 00643169680210 217253581  SLC2515X 00643169680210 217306786  SLC2515X 00643169680210 217401005  SLC2515X 00643169680210 217418813  SLC2515X 00643169680210 217418906  SLC2515X 00643169680210 217427709  SLC2515X 00643169680210 217487819  SLC2515X 00643169680210 217498813  SLC2515X 00643169680210 217542636  SLC2515X 00643169680210 217602540  SLC2515X 00643169680210 217646866  SLC2515X 00643169680210 217693884  SLC2515X 00643169680210 217859788  SLC2515X 00643169680210 217905823  SLC2515X 00643169680210 218045287  SLC2520X 00643169680227 217271256  SLC2520X 00643169680227 217387129  SLC2520X 00643169680227 217404048  SLC2520X 00643169680227 217418909  SLC2520X 00643169680227 217434922  SLC2520X 00643169680227 217487821  SLC2520X 00643169680227 217498819  SLC2520X 00643169680227 217542632  SLC2520X 00643169680227 217646868  SLC2520X 00643169680227 217695009  SLC2520X 00643169680227 217859162  SLC2520X 00643169680227 217913794  SLC2525X 00643169680234 217218108  SLC2525X 00643169680234 217675585  SLC2530X 00643169680241 217246456  SLC2530X 00643169680241 217434923  SLC2530X 00643169680241 217498814  SLC2530X 00643169680241 217615649  SLC2530X 00643169680241 217704782  SLC2530X 00643169680241 217777613  SLC27512X 00643169680265 217427360  SLC27512X 00643169680265 217602535  SLC27512X 00643169680265 217695007  SLC27512X 00643169680265 217850362  SLC27515X 00643169680272 217542631  SLC27515X 00643169680272 217602534  SLC27515X 00643169680272 217646421  SLC27515X 00643169680272 217713071  SLC27515X 00643169680272 217799248  SLC27520X 00643169680289 217298668  SLC27520X 00643169680289 217387131  SLC27520X 00643169680289 217704783  SLC27520X 00643169680289 217832948  SLC3010X 00643169680319 217271255  SLC3010X 00643169680319 217693880  SLC3010X 00643169680319 217850363  SLC3012X 00643169680326 217306224  SLC3012X 00643169680326 217415821  SLC3012X 00643169680326 217498812  SLC3012X 00643169680326 217646869  SLC3012X 00643169680326 217704781  SLC3012X 00643169680326 217850360  SLC3015X 00643169680333 217246458  SLC3015X 00643169680333 217253579  SLC3015X 00643169680333 217306790  SLC3015X 00643169680333 217418910  SLC3015X 00643169680333 217498816  SLC3015X 00643169680333 217615646  SLC3015X 00643169680333 217693885  SLC3015X 00643169680333 217832949  SLC3015X 00643169680333 217913791  SLC3020X 00643169680340 217253571  SLC3020X 00643169680340 217297544  SLC3020X 00643169680340 217306222  SLC3020X 00643169680340 217401004  SLC3020X 00643169680340 217498818  SLC3020X 00643169680340 217646872  SLC3020X 00643169680340 217695008  SLC3020X 00643169680340 217859163  SLC3025X 00643169680357 217306221  SLC3025X 00643169680357 217487817  SLC3030X 00643169680364 217218124  SLC3030X 00643169680364 217427708  SLC3030X 00643169680364 217602537  SLC3030X 00643169680364 217850358  SLC3506X 00643169680401 217246454  SLC3506X 00643169680401 217713072  SLC3510X 00643169680418 217668583  SLC3512X 00643169680425 217913789  SLC3515X 00643169680432 217271252  SLC3515X 00643169680432 217415823  SLC3515X 00643169680432 217498817  SLC3515X 00643169680432 217668580  SLC3515X 00643169680432 217913788  SLC3520X 00643169680449 217646424  SLC3520X 00643169680449 217676626  SLC3520X 00643169680449 217832947  SLC3520X 00643169680449 217850361  SLC3530X 00643169680463 217940068  SLC4010X 00643169680517 217246459  SLC4012X 00643169680524 217668581  SLC4012X 00643169680524 217905819  SLC4015X 00643169680531 217498820  SLC4015X 00643169680531 217615648  SLC4015X 00643169680531 217859790  SLC4020X 00643169680548 217427353  SLC4020X 00643169680548 217487820  SLC4020X 00643169680548 217606585  SLC4025X 00643169680555 217823440  SLC4030X 00643169680562 217823444"
"Devices","No","","83819","Ongoing","Xodus Medical Inc","702 Prominence Dr","","New Kensington","PA","	15068-7052","United States","Voluntary: Firm initiated","Letter","Worldwide Distribution - US Nationwide in the States of : CA, ID, IL, LA, MD, NY, OH, OK, TX, VA, WI and OUS: Malaysia, Kuwait, Australia, Canada, UAE, Ireland, Korea, Saudi Arabia, Japan, Mexico","Z-0149-2020","Class II","Electrosurgical Tip Cleaner  REF: 138029    Product Usage:  electrosurgical accessory","176,080 each","The sterile barrier of some devices may have been affected","09/19/2019","10/16/2019","","10/23/2019","Lot # 17NOV27  17DEC08  17DEC08A  17DEC15  17DEC15A  18JAN05  18JAN05A  18JAN19  18FEB02  18FEB02A  18FEB16  18MAR02  18MAR19      UDI: Case   20787551000539 and  Each - 00787551000535"
"Devices","No","","83819","Ongoing","Xodus Medical Inc","702 Prominence Dr","","New Kensington","PA","	15068-7052","United States","Voluntary: Firm initiated","Letter","Worldwide Distribution - US Nationwide in the States of : CA, ID, IL, LA, MD, NY, OH, OK, TX, VA, WI and OUS: Malaysia, Kuwait, Australia, Canada, UAE, Ireland, Korea, Saudi Arabia, Japan, Mexico","Z-0150-2020","Class II","Electrosurgical Tip Cleaner  REF: 62-8499-001    Product Usage:  electrosurgical accessory","170,000 each","The sterile barrier of some devices may have been affected","09/19/2019","10/16/2019","","10/23/2019","Lot # 16DEC19  17JAN06  17FEB10  17MAR27  17OCT09  17OCT09A  17OCT23  17OCT23A  18JAN05  18JAN05A  18JAN19  18MAR02  18MAR19  18MAR19A    UDI: Case   20787551000584 and Each - 00787551000580"
"Devices","No","","83819","Ongoing","Xodus Medical Inc","702 Prominence Dr","","New Kensington","PA","	15068-7052","United States","Voluntary: Firm initiated","Letter","Worldwide Distribution - US Nationwide in the States of : CA, ID, IL, LA, MD, NY, OH, OK, TX, VA, WI and OUS: Malaysia, Kuwait, Australia, Canada, UAE, Ireland, Korea, Saudi Arabia, Japan, Mexico","Z-0151-2020","Class II","Cautery Tip Cleaner  REF: 30500    Product Usage:  electrosurgical accessory","255,000 each","The sterile barrier of some devices may have been affected","09/19/2019","10/16/2019","","10/23/2019","Lot # 16DEC19  17JAN06  17JAN06A  17JAN23  17FEB27  17MAR13  17MAR13A  17APR03  17APR14  17MAY24  17MAY24A  17MAY24B  17JUN27  17JUL17  17AUG01  17SEP22  17SEP22A  17OCT23  17NOV27  17NOV27A  17DEC15  18JAN19  18JAN19A  18FEB16  18MAR02  18MAR19  18MAR19A      UDI: Case   20787551000577 and Each   00787551000573"
"Devices","No","","83826","Ongoing","Olympus Corporation of the Americas","3500 Corporate Pkwy","PO Box 610","Center Valley","PA","	18034-0610","United States","Voluntary: Firm initiated","Letter","US Nationwide distribution.","Z-0159-2020","Class II","Berkeley Disposa-Filter used with Berkeley VC-10 Vacuum Curettage System - Product Usage: designed for rapid transcervical aspiration of the uterine cavity.  Part# 54298-10/pack","1106 boxes (10 filters/box)","Berkeley Disposa-Filter may possess an insufficient ultrasonic weld defect which joins the two-halves of the filter cartridge, thus the housing could separate","09/12/2019","10/17/2019","","10/23/2019","Lot number: 494604"
"Devices","No","","83831","Ongoing","Integra LifeSciences Corp.","311 Enterprise Dr","","Plainsboro","NJ","	08536-3344","United States","Voluntary: Firm initiated","Visit","The products were distributed to the following US states:  CA, CO, CT, FL, IN, NY, OK, PA, TX, WI, and WV.  The products were distributed to the following foreign countries:  Australia, Belgium.","Z-0124-2020","Class II","Cerelink ICP Monitor, Model Number 826820;  intended for use as an interface between compatible strain-gauge type pressure transducers and standard physiological pressure monitoring systems.","189","There is a potential for a progressive decline in observed ICP readings of the monitor during use.","09/12/2019","10/12/2019","","10/23/2019","All systems"
"Drugs","No","","83848","Ongoing","Aurobindo Pharma USA Inc.","279 Princeton Hightstown Rd","","East Windsor","NJ","	08520-1401","United States","Voluntary: Firm initiated","Letter","Nationwide in the US","D-0143-2020","Class II","Dextroamphetamine Sacharate, Amphetamine Aspartate, Dextroamphetamine Sulfate and Amphetamine Sulfate Tablets, Mixed Salts of a single Entity Amphetamine Product), 20mg, 100-count bottle, RX Only, Distributed by: Aurobindo Pharma USA Inc., Dayton, NJ 08810, NDC 13107-073-01   ","11,129 100-count bottles","Superpotent Drug: Amphetamine Mixed Salts 20mg have been found to be out of specification for weight and thickness.","09/19/2019","10/15/2019","","10/23/2019","Batch 07319032A1, Exp 02/2021"
"Food","No","","83922","Ongoing","Friendly Fruit Market dba Sid Wainer & Son","2301 Purchase St","","New Bedford","MA","	02746-1686","United States","Voluntary: Firm initiated","Two or more of the following: Email, Fax, Letter, Press Release, Telephone, Visit","Products distributed in: MA, ME, CT, NY, VT, VA, RI, DC, FL","F-0051-2020","Class II","Jansal Valley brand Indulgent Snack Mix NET WT 12 OZ (340 G) in plastic clamshells, Ingredients: apricots, almonds, banana chips, coconut, cashews, dates, raisins, hazelnuts, pecans, pepitas, walnuts, papaya, pineapple. Contains: almonds, cashews, soy. This product is packaged in a facility that also packages tree nuts, peanuts, wheat, soy and dairy  Distributed Exclusively by Sid Wainer & Son New Bedford, MA 02746 USA JANSALVALLEY.COM  UPC: 708152322901","1438 clamshells","Products were labeled with incorrect ingredient listing. The ingredients listed on the label include multiple allergens (almonds, cashews, coconut, hazelnuts, peacans, walnuts, cashews, soy). Label lists allergens that are not actually in the product. Allergens actually present in the product are: almonds, cashews and soy.","10/01/2019","10/17/2019","","10/23/2019","Lots: 11736, 11582, 11665, 10693, 9907  Best By Dates: 8/21/2019, 8/28/2019, 9/8/2019, 9/12/2019, 9/21/2019, 12/21/2019, 12/28/2019, 1/1/2020, 1/5/2020, 1/12/2020, 1/18/2020"
"Food","No","","83922","Ongoing","Friendly Fruit Market dba Sid Wainer & Son","2301 Purchase St","","New Bedford","MA","	02746-1686","United States","Voluntary: Firm initiated","Two or more of the following: Email, Fax, Letter, Press Release, Telephone, Visit","Products distributed in: MA, ME, CT, NY, VT, VA, RI, DC, FL","F-0052-2020","Class II","Jansal Valley brand Energize Snack Mix NET WT 5 OZ (142 G) in plastic clamshells, Ingredients: apricots, almonds, banana chips, coconut, cashews, dates, raisins, hazelnuts, pecans, pepitas, walnuts, papaya, pineapple. Contains: almonds, cashews, coconut, hazelnuts, pecans, walnuts.isins, vegetable oil). Contains: peanuts, almonds, cashews, coconut, hazelnuts, walnuts. This product is packaged in a facility that also packages tree nuts, peanuts, wheat, soy and dairy  Distributed Exclusively by Sid Wainer & Son New Bedford, MA 02746 USA JANSALVALLEY.COM  UPC: 708152329412","562 clamshells","Products were labeled with incorrect ingredient listing. The ingredients listed on the label include multiple allergens (almonds, cashews, coconut, hazelnuts, pecans, walnuts, peanuts). Label lists allergens that are not actually in the product. Allergens actually present in the product are: peanuts, almonds, cashews, coconut, hazelnuts, walnuts.","10/01/2019","10/17/2019","","10/23/2019","Lots: 12303196, 11582, 10909, 10467  Best By Dates: 7/11/2019, 8/6/2019, 8/11/2019, 8/20/2019, 9/4/2019, 9/14/2019, 10/4/2019, 10/11/2019, 10/23/2019, 11/06/2019, 11/08/2019, 11/10/2019, 11/20/2019, 11/21/2019, 1/1/2020, 1/29/2020, 2/26/2020"
"Food","No","10/30/2019","83933","Ongoing","Northern Fisheries Ltd.","21 Burchard Ave","","Little Compton","RI","	02837-1602","United States","Voluntary: Firm initiated","E-Mail","GA, PA, MD, MN, & VA","F-0092-2020","Class II","Frozen, raw tuna steaks individually packed in 8 oz. vacuum packages. Sold in cardboard cases (10 Lbs. per case).","850 cases (8,500 Lbs.)","Northern Fisheries Ltd. was notified by two of their customers that they each received several consumer complaints from consumers who experienced symptoms of scombroid (histamine) poisoning after consuming tuna steaks and tuna loins distributed by Northern Fisheries Ltd.","09/30/2019","10/30/2019","","10/23/2019","Lot # 0058800, UPC Code: 815838020669  Production date: 6/13/2019  Best if used by date: 6/13/2021"
"Food","No","10/30/2019","83933","Ongoing","Northern Fisheries Ltd.","21 Burchard Ave","","Little Compton","RI","	02837-1602","United States","Voluntary: Firm initiated","E-Mail","GA, PA, MD, MN, & VA","F-0093-2020","Class II","Frozen, raw tuna loins packed in vacuum packages weighing between 5-8 Lbs. each. Packed in cardboard cases (30 Lbs. per case).","345 cases (10,350 Lbs.)","Northern Fisheries Ltd. was notified by two of their customers that they received several consumer complaints from consumers who experienced symptoms of scombroid (histamine) poisoning after consuming tuna steaks distributed by Northern Fisheries Ltd.","09/30/2019","10/30/2019","","10/23/2019","Lot # 0058796   UPC # 815838020621  Production date: 6/13/2019  Best if used by date: 6/13/2021"
"Food","No","","83936","Ongoing","Gullah Gourmet, Inc.","95 Tall Oak Ave","","Charleston","SC","	29407-6766","United States","Voluntary: Firm initiated","Letter","Product was distributed to the following states: AL, FL, GA, IN, KY, LA, MD, MN, MS, NC, NY, OH, PA, SC, TN & VA.","F-0036-2020","Class II","Nana's Been a Nut Bread NET WT. 11oz/311.74g cloth bag CONTAINS WHEAT AND SOY. MADE ON EQUIPMENT THAT MAKES PRODUCTS CONTAINING WHEAT, EGGS, MILK, SOY AND TREE NUTS. GULLAH BOURMET Inc. CHARLESTON, SC 29407 UPC 6 50305 01045 9","673/11 oz bags","The product ingredient statement does not list walnuts in the product.","10/04/2019","10/16/2019","","10/23/2019","Item #: 1045. Expiration date 01/30/2020"
"Biologics","No","","83940","Terminated","Rhode Island Blood Center, A Division of New York Blood Center, Inc.","405 Promenade St","","Providence","RI","	02908-4833","United States","Voluntary: Firm initiated","FAX","Massachusetts","B-0049-2020","Class II","Apheresis Platelets, Leukocytes Reduced, Irradiated","1 unit","Irradiated Apheresis Platelets, which were labeled as leukoreduced but were not tested to verify white blood cell count, were distributed.","09/05/2019","10/11/2019","10/11/2019","10/23/2019","W051719110855"
"Biologics","No","","83956","Terminated","ARUP Laboratories, Inc.","9786 S. Sandy Parkway","","Sandy","UT","	84070","United States","Voluntary: Firm initiated","Telephone","Utah","B-0060-2020","Class II","Apheresis Platelets, Leukocytes Reduced","1 unit","Plateletpheresis product, not meeting product specifications, was distributed.","08/15/2019","10/16/2019","10/16/2019","10/23/2019","W158019801484;"
"Drugs","No","","83960","Ongoing","Macleods Pharma Usa Inc","666 Plainsboro Rd Bldg 200 Ste 230","","Plainsboro","NJ","	08536-0009","United States","Voluntary: Firm initiated","Letter","Product was shipped to 8 distributors who may have further distributed the product.","D-0140-2020","Class II","Pioglitazone Hydrochloride Tablets USP 15 mg, 30 count bottles, Rx only, Manufactured for: Macleods Pharma USA, Inc., Plainsboro, NJ, Manufactured by: Macleods Pharmaceuticals Ltd., Baddi, Himachal Pradesh, India  NDC 33342-054-07","31,968 bottles","Superpotent","09/23/2019","10/11/2019","","10/23/2019","Lot # BPF901A, exp. date 12/2021"
"Food","No","","83967","Completed","G&C Food Distributors, Inc.","3407 Walters Rd","","Syracuse","NY","	13209-9725","United States","Voluntary: Firm initiated","E-Mail","Retailer and Distributors in 9 states (AL, CT, FL, MA, ME, NY, PA, WI, and WV) and 1 foreign country (Belize).","F-0060-2020","Class II","Frozen blackberries, packaged in 16 ounce (454 gram) plastic bags (12 bags per master case).     Plastic bags labeled with: PREMIUM QUALITY, KEEP FROZEN, NON-GMO, CORNERSTONE PREMIUM FOODS, Blackberries, GREAT FOR SMOOTHIES, NET WEIGHT 16 OZ. (454g), INGREDIENTS: BLACKBERRIES, GC 1 092 9, PROD. CODE 16924, PROD. OF CHILE, BEST BY 04/2021, UPC 8 55104 00765 9, DISTRIBUTED BY: Cornerstone Premium Foods, Syracuse, NY 13209.    Master cases labeled with: 12/1LB BLACKBERRIES, GC 1 092 9, GRADE A, PRODUCT OF CHILE, PRODUCT CODE 16924, BEST BY 04/2021, DISTRIBUTED BY CORNERSTONE PREMIUM FOODS SYRACUSE NY.","299 cases (each packed 12 bags x 1 lb)","Product is contaminated with norovirus.","10/03/2019","10/22/2019","","10/23/2019","GC 1 092 9, PROD. CODE 16924, PROD. OF CHILE, BEST BY 04/2021, UPC 8 55104 00765 9"
"Drugs","No","","84011","Ongoing","Ingenus Pharmaceuticals Llc","4190 Millenia Blvd","","Orlando","FL","	32839-6408","United States","Voluntary: Firm initiated","Letter","U.S.A. Nationwide","D-0146-2020","Class II","Leucovorin Calcium Injection, USP 500 mg*/50 mL (10 mg/mL) 50 mL Single-Dose Vial NDC 50742-464-50 Rx Only Ingenus Pharmaceuticals, LLC. Orlando, FL 32839","16485 vials","Crystallization: Presence of particulate matter identified as API crystallization","10/09/2019","10/17/2019","","10/23/2019","Lot#: 18048, 18049 Exp. 04/2020; 18050 Exp 05/2020; 19036 Exp 12/2020"
"Biologics","No","","83660","Terminated","CSL Plasma, Inc.","690 Peoria St Unit M","","Aurora","CO","	80011-8233","United States","Voluntary: Firm initiated","Other","Switzerland","B-0023-2020","Class III","Source Plasma","2 units","Blood products, collected from a donor in which donor suitability was not adequately determined, were distributed.","06/21/2019","10/11/2019","10/11/2019","10/23/2019","70212952905; 70212899788"
"Biologics","No","","83661","Terminated","CSL Plasma, Inc.","3419 N Patterson Ave","","Winston Salem","NC","	27105-3659","United States","Voluntary: Firm initiated","Other","IL","B-0022-2020","Class III","Source Plasma","2 units","Blood products, collected from a donor in which donor suitability was not adequately determined, were distributed.","06/26/2019","10/11/2019","10/11/2019","10/23/2019","12403413520; 12403420041"
"Biologics","No","","83662","Terminated","Csl Plasma, Inc.","5550 E Washington St","","Indianapolis","IN","	46219-6426","United States","Voluntary: Firm initiated","Other","IL","B-0021-2020","Class III","Source Plasma","3 units","Blood products, collected from a donor in which donor suitability was not adequately determined, were distributed.","06/19/2019","10/16/2019","10/16/2019","10/23/2019","41201831988; 41201787315; 41201763778"
"Biologics","No","","83667","Terminated","New York Blood Center, Inc.","310 E 67th St","","New York","NY","	10065-6275","United States","Voluntary: Firm initiated","FAX","PA; NY; NJ","B-0032-2020","Class III","Apheresis Platelets Washed, Leukocytes Reduced, Irradiated","17 units","Blood products, which may have been exposed to unacceptable storage temperatures, were distributed.","07/18/2019","10/11/2019","10/11/2019","10/23/2019","W047019109542; W047019109542; W047019109540; W047019109539; W047019109539; W047019109538; W047019109536; W047019109536; W047019109536; W047019109535; W047019109533; W047019109529; W047019109527; W047019109527; W047019109524; W047019109521; W047019109521"
"Biologics","No","","83667","Terminated","New York Blood Center, Inc.","310 E 67th St","","New York","NY","	10065-6275","United States","Voluntary: Firm initiated","FAX","PA; NY; NJ","B-0033-2020","Class III","Apheresis Platelets, Leukocytes Reduced","11 units","Blood products, which may have been exposed to unacceptable storage temperatures, were distributed.","07/18/2019","10/11/2019","10/11/2019","10/23/2019","W047019109542; W047019109540; W047019109539; W047019109538; W047019109535; W047019109533; W047019109529; W047019109529; W047019109527; W047019109524; W047019109520"
"Devices","No","","83806","Ongoing","Roche Diagnostics Operations, Inc.","9115 Hague Rd","","Indianapolis","IN","	46256-1025","United States","Voluntary: Firm initiated","Letter","US Nationwide distribution including the states of AL, AZ, CA, CT, FL, GA, HI, IA, IL, IN, KY, LA, MA, MD, MI, MO, NE, NH, NJ, NY, OH, OK, PA, PR, RI, SC, TN, TX, UT, VA and WI.","Z-0152-2020","Class III","Roche Diagnostics cobas Integra Albumin Gen.2  Catalog Number: 05166861190 - Product Usage: In vitro test for the quantitative determination of the albumin in human serum and plasma on Roche/Hitachi cobas c systems.","7,032 units","Due to low Quality Control recovery and invalid Calibration.","09/11/2019","10/16/2019","","10/23/2019","Lot # 33962301"
"Devices","No","","83806","Ongoing","Roche Diagnostics Operations, Inc.","9115 Hague Rd","","Indianapolis","IN","	46256-1025","United States","Voluntary: Firm initiated","Letter","US Nationwide distribution including the states of AL, AZ, CA, CT, FL, GA, HI, IA, IL, IN, KY, LA, MA, MD, MI, MO, NE, NH, NJ, NY, OH, OK, PA, PR, RI, SC, TN, TX, UT, VA and WI.","Z-0153-2020","Class III","Cobas c Bilirubin Total Gen.3  Catalog Number: 05795419190 - Product Usage: In vitro test for the quantitative determination of the total bilirubin in serum and plasma of adults and neonates on Roche/Hitachi cobas c systems.","2,304 units","Due to low Quality Control recovery and invalid Calibration.","09/11/2019","10/16/2019","","10/23/2019","Lot # 36133801"
