Product Type,Recently Updated Record,Last Modified Date,Event ID,Status,Recalling Firm,Address1,Address2,City,State/Province,Postal Code,Country,Voluntary/Mandated,Initial Firm Notification of Consignee or Public,Distribution Pattern,Recall Number,Classification,Product Description,Product Quantity,Reason for Recall,Recall Initiation Date,Center Classification Date,Termination Date,Report Date,Code Info
"Food","No","","71309","Terminated","Aksar LLC","21592 Atlantic Blvd Ste 130B","","Sterling","VA","	20166-6858","United States","Voluntary: Firm initiated","E-Mail","Products were distributed in area of USA only in states of Virginia, Maryland & North Carlina since December 2014. Accounts were Food service & retail grocery stores. There were no US Government accounts.","F-0135-2016","Class I","AKSAR  (life taste and beyond)  Cashew Pieces     4040615  Net Wt: 7oz (200gm)  , Net Wt: 28oz (800gm)    4051315  Net Wt: 400 gms (14oz) , Net Wt: 5lb    20 NEWLAND COURT, STERLING, VA 20165  Phone # 703-880-9802 , FAX # 703-880-1602  ","4708.32 lbs","The USFDA alerted firm during current inspection that a sample collected by agency had tested positive for Salmonella .  The firm decided to recall the product .","05/20/2015","11/05/2015","01/11/2016","11/11/2015","4040615  Net Wt: 7oz (200gm)  , Net Wt: 28oz (800gm)    4051315  Net Wt: 400 gms (14oz) , Net Wt: 5lb"
"Food","No","","72195","Terminated","A.M.S. Exotic Llc","720 S Alameda St","","Los Angeles","CA","	90021-1616","United States","Voluntary: Firm initiated","E-Mail","U.S. distribution to the following; CT and SC  No foreign distribution.","F-0149-2016","Class I","Earth Exotic Brussels Sprouts   Net. Wt. 8 oz. (227 g)  Net. Wt. 32 oz (2 LBS) 907 g","36cs of 12/8oz and 18cs of 5/32oz","AMS Exotic, LLC is recalling Earth Exotic Brussels Sprouts due to potential Listeria monocytogenes contamination.","09/07/2015","11/05/2015","04/12/2016","11/11/2015","lot # 117536  Use by Date of  09/24/15  lot # 117564  Use by Date of  09/24/15"
"Food","No","","72257","Terminated","Greencore USA, Inc.","320 Commerce Park Rd","","North Kingstown","RI","	02852-8419","United States","Voluntary: Firm initiated","Letter","266 Starbucks retail stores in Massachusetts, Rhode Island, New Hampshire, New York, Connecticut, Vermont and Maine.","F-0123-2016","Class I","Evolution Fresh Nonfat Greek Yogurt with Strawberry and Granola, 6.1oz., UPC: 7 6211107474 4","994 units","Product may contain undeclared almonds.","09/22/2015","10/30/2015","11/10/2015","11/11/2015","Enjoy by 9/24"
"Food","No","","72260","Terminated","Hilltop Farm","1300 Pear Orchard Rd","","Granbury","TX","	76048-6932","United States","Voluntary: Firm initiated","Telephone","Texas","F-0127-2016","Class I","Giant Red Mustard Hydroponic Micro Greens packaged in 2 oz. plastic hinged clamshell","12 clamshells","Salmonella positive","09/22/2015","11/02/2015","04/12/2016","11/11/2015","UPC 68907647027"
"Food","No","","72260","Terminated","Hilltop Farm","1300 Pear Orchard Rd","","Granbury","TX","	76048-6932","United States","Voluntary: Firm initiated","Telephone","Texas","F-0128-2016","Class I","Spicy Mix Hydroponic Micro Greens packaged in 2 oz. plastic hinged clamshell","18 clamshells","Salmonella positive","09/22/2015","11/02/2015","04/12/2016","11/11/2015","UPC 68907646927"
"Food","No","","72293","Terminated","Shearer's Foods Inc.","3636 Medallion Ave","","Newport","AR","	72112-9096","United States","Voluntary: Firm initiated","Letter","TX, AZ, OK, LA, MO, MS, AR, NM","F-0131-2016","Class I","ON THE BORDER MEXICAN GRILL & CANTINA Cafe Style Tortilla Chips 18 oz. bags","11,592 cases","Product may have been exposed to a milk-containing ingredient.","09/24/2015","11/05/2015","07/07/2016","11/11/2015","DEC 16 2015 SHA, DEC 17 2015 SHA, DEC 18 2015 SHA"
"Devices","No","","72319","Terminated","Hamilton Medical, Inc.","4990 Energy Way","","Reno","NV","	89502-4123","United States","Voluntary: Firm initiated","Letter","Nationwide Distribution","Z-0151-2016","Class I","HAMILTON-G5 Ventilator with software versions between V2.00 and V2.31.   Anesthesiology: The HAMILTON-G5 ventilator is designed for intensive care ventilation of adult and pediatric patients, and optionally infant and neonatal patients    ","1128","Ventilation and alarms of a HAMILTON-G5 ventilator can be suppressed unintentionally after the activation of a suctioning maneuver by the operator; this situation can occur regardless of the selected patient group (neonatal, pediatric and adult).","04/22/2014","11/04/2015","08/24/2017","11/11/2015","software versions between V2.00 and V2.31.  Ventilator catalog number: 1590001;  Software catalog number: 159700.    Serial numbers:   1231  1233  1234  1235  1014  1296  1593  1594  1595  1626  1628  1629  1631  1632  1633  1634  1637  1693  1697  1862  1863  2021  2411  2412  2413  2414  2416  2417  2418  2591  2592  2593  2594  2595  2681  2683  2686  2687  2689  2776  2777  2778  2779  2780  2781  2784  2785  2786  2787  2789  2790  2793  2794  2798  2803  2887  2947  2948  2951  2952  2953  2954  2958  2959  3362  3366  3368  3369  3371  3372  3375  3376  3377  3378  3379  3382  3383  3384  3548  3596  3598  3599  3600  3602  3609  3610  3612  3861  3869  3911  3912  3913  3976  3977  3978  3981  3987  3988  3990  3991  4004  4009  4012  4015  4016  4017  4019  4021    4023  4024  4026  4027  4028  4029  4030  4031  4034  4035  4037  4038  4050  4052  4053  4054  4059  4060  4071  4072  4076  4078  4083  4084  4086  4087  4089  4153  4155  4156  4159  4161  4180  4196  4197  4200  4202  4206  4207  4377  4394  4395  4396  4399  4401  4402  4403  4404  4405  4444  4447  4448  4449  4450  4452  4453  4459  4463  4465  4468  4469  4470  4471  4474  4475  4476  4477  4478  4483  4484  4485  4487  4488  4489  4490  4491  4492  4493  4494  4498  4560  4567  4568  4569  4570  4571  4572  4575  4578  4580  4583  4586  4588  4589  4596  4597  4599  4601  4607  4611  4615  4618  4619  4620  4622  4623  4625  4627  4629  4630  4632  4657  4664  4666  4667  4668  4671  4672  4673  4675  4676  4677  4679  4681  4682  4695  4698  4699  4700  4701  4702  4703  4774  4775  4776  4777  4778  4779  4780  4781  4782  4794  4903  4904  4907  4937  4938  4939  4940  4941  4942  4943  4945  4946  4947  4948  4949  4950  4951  4952  4953  5025  5038  5044  5049  5050  5054  5055  5057  5058  5059  5061  5062  5063  5064  5065  5253  5254  5256  5257  5262  5302  5304  5307  5308  5309  5310  5311  5312  5313  5357  5361  5362  5363  5374  5437  5452  5462  5468  5523  5764  5774  5791  5794  5803  5815  5816  5818  5820  5825  5826  5829  5831  5832  5835  5836  5839  5842  5843  6118  6119  6144  6152  6159  6319  6320  6336  6337  6345  6537  6556  6557  6561  6562  6829  6832  6833  6834  6835  6836  6837  6838  6841  6851  6856  6859  6867  6868  6869  6888  6889  6890  6985  6987  6989  6992  6994  7077  7078  7086  7329  7330  2684  2802  4025  4598  6806  6811  7526  7528  7529  7530  7531  7532  7684  7685  7706  7707  7770  7919  7948  7965  7971  7973  7984  7994  7996  7999  8119  8120  8122  8123  8131  8133  8134  8141  8506  8510  8516  8517  8520  8523  8531  8534  8535  8536  8539  8570  1278  1294  1413  1414  1415  1417  1418  1419  1420  2024  2025  2026  2027  2301  2302  2303  2888  28891599  1600  1601  1602  1603  1605  1606  1607  1608  1609  1610  1611  1612  1613  1614  1615  1616  1617  1618  1619  1865  1866  1867  1868  1869  1870  1871  1872  1873  1874  1875  1876  1877  1878  1879  1880  6620  6652  6665  6666  6668  6672  7588  7589  7590  2020  7993  2506  2521  2522  2523  2525  2526  2527  2530  2531  2532  2877  2878  2880  2881  2882  2883  2884  2885  2886  2890  2894  5026  5027  5028  5029  5030  5032  5039  5040  5045  5046  5047  5048  5051  5052  5053  3885  3887  3888  3889  4044  4047  4057  4073  4074  4075  4077  4079  4080  4081  4088  4090  4091  4092  4093  4094  4095  4097  4098  4099  4100  4103  4104  4106  4108  4109  4110  4111  4112  4113  4115  4117  4118  4141  4144  4145  4147  4148  4149  4150  4223  4225  4227  4345  4348  4351  4353  4354  4356  4357  4358  4359  4360  4365  4366  4367  4372  4096  4101  4102  4107  4222  4224  4226  4584  4591  4603  4604  4606  4654  4655  4658  4659  4660  4661  4662  4663  4665  4119  4120  4142  4143  4146  4152  4157  4158  4160  4162  4164  4454  4456  4464  4467  4472  4954  4955  4956  4957  4958  4959  4960  4961  4962  4963  6308  6311  6312  6314  6318  6323  7079  7085  7090  7091  7092  7095  7083  4600  4605  4608  4609  4610  4612  4 613  4614  4616  4617  4656  5248  5251  5245  5246  5249  5250  5255  5258  5259  5260  5261  5263  5332  5344  5345  5346  5347  5350  5351  5352  5353  5395  5397  5457  5465  5466  5481  5827  5830  6031  6039  6062  5451  5512  5516  5518  5592  5740  5533  5535  5456  5511  5522  5568  5569  5577  5624  5629  5651  5531  5542  5697  5704  5706  5709  5710  5712  5720  5723  5730  5732  5733  5824  5846  5851  5853  5857  5858  5876  5915  5930  5932  5933  5941  5948  6015  6024  6025  6026  6027  6028  6029  6030  6032  6033  6034  6049  6050  6055  6067  6069  6081  6072  6074  6075  6077  6078  6079  6080  6082  6083  6293  6303  6305  6306  6309  6315  6247  6265  6276  6292  8511  8512  8513  6247  6265  6276  6292  8511  8512  8513  6247  6265  6276  6292  8511  8512  8513  6247  6265  6276  6292  8511  8512  8513  6277  6278  6279  6291  6300  6307  6377  6409  6419  6432  6434  6438  6440  6441  6495  6498  6499  6621  6251  6289  6457  6460  6487  6489  6743  6749  6422  6423  6451  6454  6470  6503  6504  6506  6507  6509  6511  6512  6515  6517  6710  6740  6804  6893  6445  6446  6455  6469  6505  6508  6510  6522  6523  6437  6439  6442  6497  6588  6494  6560  6563  6574  6575  6576  6578  6579  6580  6582  6585  6586  6587  6589  6593  6594  6595  6597  6598  6599  6600  6601  6602  6603  6604  6605  6606  6607  6608  6609  6610  6611  6612  6596  6642  6649  6651  6654  6656  6669  6670  6625  6644  6646  6647  6648  6650  6653  6655  6657  6658  6659  6661  6662  6664  6671  6673  6995  6996  6999  7001  7022  7021  6739  6750  6752  6753  6755  6758  6870  6763  6791  6795  6887  7358  7376  7377  7400  7411  6991  7030  7061  7100  7706  7069  7072  7336  7409  7559  7560  7564  7575  7581  7585  7586  7593  7597  7604  7606  7646  7657  7658  7659  8256  7388  7391  7401  7402  7403  7412  7416  7428  7429  7433  7440  7445  7446  7447  7448  7449  7450  7451  7452  7453  7454  7455  7456  7457  7458  7459  7460  7461  7462  7463  7464  7465  7467  7468  7469  7470  7533  7534  7535  7536  7537  7538  7539  7566  7570  7599  7605  7996  7709  7854  7855  7857  7858  7853  7856  8118  8121  8124  8135  8136  8137  8238  8239  8240  8241  8362  8363  8364  8365  8368  8366  8367  8369  8371  8372  8373  8374  8375  8376  8400  8561  8564  8566  8567  8542  8543  8544  8546  8547  8548  8549  8550  8685  8686  8687  8788  8789  8790."
"Food","No","","72340","Terminated","Texas Star Nut and Food Co., Inc.","206 Market Ave","","Boerne","TX","	78006-3003","United States","Voluntary: Firm initiated","Press Release","IL, IN, TX","F-0133-2016","Class I","Nature's Eat Natural Macadamia Nuts NET WT 6 OZ (170g) in cello bags.","399 cases (12 bags per case)","Product tested positive for Salmonella.","10/02/2015","11/05/2015","02/02/2016","11/11/2015","Lot Codes: 35897001 Best By 06MAR16, 36157001 Best By 12MAR16, 37777001 Best By 14JUL16"
"Food","No","","72340","Terminated","Texas Star Nut and Food Co., Inc.","206 Market Ave","","Boerne","TX","	78006-3003","United States","Voluntary: Firm initiated","Press Release","IL, IN, TX","F-0134-2016","Class I","Southern Grove Simply Raw Trail Mix Raw Cashews, Walnuts and Macadamia Nuts NET WT 8 OZ (226g) in cello reclosable bags.","5943 cases (6 bags per case)","Product tested positive for Salmonella.","10/02/2015","11/05/2015","02/02/2016","11/11/2015","Lot Codes: 36242004 Best By 03/13/2016; 37534004 Best By 06/26/2016; 37409004 Best By 07/15/2016; 38177004 Best By 08/17/2016"
"Food","No","","72353","Terminated","MBG Marketing","04726 County Road 215","","Grand Junction","MI","	49056-9218","United States","Voluntary: Firm initiated","Telephone","Domestic: CA, MI, NY    Foreign: None  VA/DOD:  None","F-0129-2016","Class I","Naturipe Foods Frozen Blueberries, IQF, 30 lb. boxes and 1500 lb. Totes, packed in cardboard boxes with plastic bag liners; 50 boxes per pallet or 1 Tote per pallet","23,700 lbs.","MBG Marketing is recalling select pallets of Naturipe IQF Blueberries due to the potential presence of Salmonella.","08/14/2015","11/05/2015","09/19/2017","11/11/2015","Micro IDs: 15105197011, 15105197999, 15105185011, and 15105185999    Micro ID Numbers-Pallet Numbers:    15106180999 -54038223, 54038225, 54038240, 54038260, 54038274, 54038319, 54038323, 54038330, 54038340, 54038366, 54038402, 54038433, 54038434       15105185999- 54102219, 54102221, 54102126, 54102146, 54102150, 54102152, 54102155, 54102156, 54102175, 54102184       15105197011- 54103450, 54103451, 54103482, 54103486, 54103487, 54103530    15105197999 - 54103544"
"Food","No","","72370","Terminated","Whole Foods Market","550 Bowie St","","Austin","TX","	78703-4648","United States","Voluntary: Firm initiated","Press Release","Nationwide throughout the USA and UK","F-0130-2016","Class I","Organic Roquefort Papillon cheese packaged in clear plastic wrap","1593 pounds","Potential contamination with Listeria monocytogenes.","10/07/2015","11/05/2015","11/16/2016","11/11/2015","PLU 029536, all sell by dates"
"Food","No","","72419","Terminated","Nijay International, Inc.","700 S Stillwater Ln","","Anaheim","CA","	92807-4813","United States","Voluntary: Firm initiated","Press Release","Texas","F-0132-2016","Class I","Organic Coriander Powder (Dhania Powder), 60packs/case, UPC 40074 13813","8 cases","Nijay International is recalling Down to Earth Organic Coriander Powder because it has the potential to be contaminated with Salmonella.","10/14/2015","11/05/2015","01/11/2016","11/11/2015","Lot No.1404D25"
"Food","No","","72433","Terminated","Del Monte Fresh Produce N.A., Incorporated","15845 E 32nd Ave Ste D","","Aurora","CO","	80011-1571","United States","Voluntary: Firm initiated","Press Release","US distribution in retail store in the states: CO, KS, MO, NE, NM, OK, SD, UT and NY","F-0136-2016","Class I","Granny Smith green apples, shipped in unmarked plastic bags and cardboard boxes. Sold individually in retail stores.","5,962 apples","Apples have the potential to be contaminated with Listeria monocytogenes.","10/14/2015","11/05/2015","07/07/2016","11/11/2015","75950204 and 76067903."
"Food","No","","72510","Terminated","Biscomerica, Inc.","565 W. Slover Avenue","","Rialto","CA","	92376","United States","Voluntary: Firm initiated","Letter","Ohio","F-0137-2016","Class I","Cocoa buttons, item no. 80203, 80203-1, 25lb bulk case","3,595 units","Biscomerica is recalling cocoa buttons because it contains undeclared milk.","10/27/2015","11/05/2015","12/07/2015","11/11/2015","LOT No. B073016, A092916, A021717, A021817,   A030717, B030717, A031517, A031617, A033017, B033017"
"Devices","No","","69082","Terminated","Philips Medical Systems (Cleveland) Inc","595 Miner Rd","","Cleveland","OH","	44143-2131","United States","Voluntary: Firm initiated","Letter","Worldwide Distribution - US Distribution to the states of :  AL, AZ, CA, CO, DE, FL, GA, HI, IL, IN, KS, KY, LA, MA, MD, MO, ND, NE, NJ, NM, NV, NY, OH, OK, OR, PA, RI, TN, TX, UT, VA, WA, WI, WV, and WY., and to the countries of : Canada, Argentina, Australia, Austria, Belgium, Brazil, China, Denmark, Finland, France, Germany, Hong Kong, Israel, Italy, Japan, Jordan, Luxembourg, Mexico, Netherlands, Poland, Portugal, South Africa, South Korea, Spain, Sweden, Switzerland, Taiwan, Thailand, Turkey and UK.","Z-0197-2016","Class II","GEMINI PET/CT System, a diagnostic imaging system for fixed or mobile installations that combines Positron Emission Tomography (PET) and X-ray Computed Tomography (CT) systems.","264 units","The reason for this inspection is to determine if the Spindle Block Servo Controllers on the CT subsystem of potentially affected GEMINI PET/CT systems are susceptible to premature failure.","05/01/2008","11/02/2015","11/06/2015","11/11/2015","Model Name Model NUmber and serial number  GEMINI Dual 4535 679 00891 G097, G119, 101-103, 105-107, 109-117, 119-127, 131-144, 146-164, 1025, 2003506, 2003507, 1Z9Z591, 2Z9Z591, 3Z9Z591, 4Z9Z591, GY9Z591, HY9Z591, JY9Z591  GEMINI 16 Power 4535 679 58961 1002, 1004-1008, 1010-1015, 1017-1028, 1030-1034, 1035R, 1036A, 1037-1046, 101R, 1023a, G098, MNM4411  GEMINI GXL (6, 10, 16, and 16 Mobile) 4535 679 75691, 4535 679 81871, 4535 679 76581, 4535 679 71891 4001, 4003-4040, 4042-4089, 4091-4123, 4125-4127, 4129-4137, 4139-4143, 7011, 4097A, 4147a  GEMINI TF 16 Slice (16, 64, 64 Mobile and 16 Base) 4535 679 83931, 4535 674 47551, 4535 679 94741, 4535 674 41711 7001, 7003-7006, 7008, 7009, 7013-7017, 7022, 7024, 7025, 7027, 7028"
"Devices","No","","69712","Terminated","Philips Medical Systems, Inc.","3000 Minuteman Rd","","Andover","MA","	01810-1032","United States","Voluntary: Firm initiated","Letter","Worldwide Distribution - USA (nationwide), Australia, Austria, Bahrain, Belgium, Brunei Darussalam, Canada, China, Finland, France, Germany, Hong Kong, India, Indonesia, Ireland, Israel, Italy, Japan, Republic of Korea, Libyan Arab Jamahiriya, Lithuania, Mexico, Namibia, Netherlands, Palestine, Philippines, Poland, Portugal, Qatar, Russian Federation, Saudi Arabia, South Africa, Spain, Sweden, Switzerland, Taiwan, United Arab Emirates and United Kingdom.","Z-0204-2016","Class II","Philips HeartStart MRx Monitor/Defibrillators  Models: M3535A and M3536A","1553 units","1. Device will perform the weekly automated tests hourly, which could cause the therapy capacitors to degrade sooner than intended and 2. While connected to AC or DC power and with no battery installed or the battery installed has a charge level of less than 10%, the Ready for Use (RFU) indicator will not provide the expected low battery indication","11/19/2014","11/03/2015","08/15/2016","11/11/2015","Serial Numbers:  US00101159  US00322848  US00326834  US00328432  US00328439  US00328442  US00328443  US00328446  US00328450  US00328461  US00328464  US00328465  US00328468  US00328473  US00328478  US00330393  US00533518  US00533521 through US00535118  US00539526  US00540124  US00543102  US00543104  US00543138  US00543158  US00543161  US00543166  US00543167  US00543187  US00543204  US00543223  US00543239  US00546804"
"Devices","No","","70002","Completed","Philips Medical Systems, Inc.","3000 Minuteman Rd","","Andover","MA","	01810-1032","United States","Voluntary: Firm initiated","Letter","Worldwide Distribution - US Nationwide and the countries of AFGHANISTAN, ALBANIA, ARGENTINA, ARUBA, AUSTRALIA, AUSTRIA, AZERBAIJAN, BAHRAIN, BANGLADESH, BELGIUM, BOLIVIA, BOSNIA AND HERZEGOWINA, BRAZIL, BRUNEI DARUSSALAM, BULGARIA, CAMBODIA, CHILE, CHINA, COLOMBIA, COSTA RICA, CROATIA (local name: Hrvatska), CYPRUS, CZECH REPUBLIC, DENMARK, ECUADOR, EGYPT, EL SALVADOR, ESTONIA, ETHIOPIA, FINLAND, FRANCE, GERMANY, GHANA, GREECE, GUADELOUPE, HONG KONG, ICELAND, INDIA, INDONESIA, IRAN (ISLAMIC REPUBLIC OF), IRAQ, IRELAND, ISRAEL, ITALY, JAPAN, Jordan, KAZAKHSTAN, KENYA, REPUBLIC OF KOREA, KUWAIT, LAOS, LATVIA, LEBANON, LIBYAN ARAB JAMAHIRIYA, LITHUANIA, LUXEMBOURG, MACAU, MACEDONIA, MALAYSIA, MALTA, MEXICO, MONGOLIA, MOROCCO, MOZAMBIQUE, MYANMAR (Burma), NAMIBIA, NEPAL, NETHERLANDS, NETHERLANDS ANTILLES, NEW CALEDONIA, NEW ZEALAND, NICARAGUA, NIGERIA, NORWAY, OMAN, PAKISTAN, PALESTINE, PANAMA, PAPUA NEW GUINEA, PARAGUAY, PERU, PHILIPPINES, POLAND, PORTUGAL, PUERTO RICO, QATAR, REUNION, ROMANIA, RUSSIAN FEDERATION, SAUDI ARABIA, SERBIA, SINGAPORE, SLOVENIA, SOUTH AFRICA, SPAIN, SRI LANKA, SWEDEN, SWITZERLAND, TAIWAN, UNITED REPUBLIC OF TANZANIA, THAILAND, TRINIDAD AND TOBAGO, TUNISIA, TURKEY, TURKMENISTAN, UGANDA, UKRAINE, UNITED ARAB EMIRATES, and UNITED KINGDOM.","Z-0219-2016","Class II","HeartStart MRx monitor/defibrillator  Models M3535A, M3536A, M3536J, M3536M, M3536MC, M3536M2, M3536M4, M3536M5, M3536M6    Product Usage:  The HeartStart MRx is for use for the termination of ventricular tachycardia and ventricular fibrillation. The device is for use by qualified medical personnel trained in the operation of the device and qualified by training in basic life support, advanced cardiac support, or defibrillation. It must be used by or on the order of a physician  ","75,693 units","MRx monitor/defibrillator could reboot at an indeterminate time, potentially causing therapy to be interrupted or delayed","12/23/2014","11/05/2015","","11/11/2015","Model/Serial Number Range:   Model M3535A: US00100100 to US00578696  Model M3536A: US00100902 to US00576650  Model M3536J:  US00209838 to US00332675  Model M3536M:  US00500002 to US00553553  Model M3536MC: US00500001 to US00500087  Model M3536M2:  US00554176, US00554177, US00554178  Model M3536M4: US00500003 to US00574869  Model M3536M5: US00500001 to US00562935  Model M3536M6: US00554358 to US00576619"
"Devices","No","","71518","Terminated","ConMed Corporation","525 French Rd","","Utica","NY","	13502-5945","United States","Voluntary: Firm initiated","Letter","Worldwide - US distribution in the states of FL, OH, and the country of Spain.","Z-0205-2016","Class II","Arthroscopic Energy 50¿ Probe with Suction, Catalog number: AES-50S    Peoduct Usage:  For resection, ablation, and coagulation of soft tissue and hemostasis of blood vessels in arthroscopic and orthopedic surgical procedures.  ","276 devices","Probe programming error.  The incorrect program can generate more heat at the surgical site, resulting in an elevated probability of tissue damage.","06/17/2015","11/03/2015","04/11/2017","11/11/2015","1412161, 1410201, 1410271, 1412121, and 1412081"
"Devices","No","","72053","Terminated","Resource Optimization & Innovation Llc","2909 N Neergard Ave","","Springfield","MO","	65803","United States","Voluntary: Firm initiated","E-Mail","Product was distributed to one customer in Oklahoma.","Z-0229-2016","Class II","Regard Custom Surgical Pack, Item Number 880239, Sterile IV Pack.  Custom procedure trays contain surgical instruments and accessories intended for use during a surgical procedure.","255 packs","The kits contain pressure monitoring kits or sets which are being recalled as a result of flow restriction issues in the trifurcated IV set.","08/25/2015","11/05/2015","04/06/2017","11/11/2015","Lot 25787E, exp. date 1/19/2017"
"Devices","No","","72096","Terminated","Pyng Medical Corporation","210-13480 Crestwood Pl","","Richmond","","	","Canada","Voluntary: Firm initiated","Letter","Worldwide Distribution - US Distribution and to the countries of : Colombia,  France,  Canada,  Italy, Germany, Finland,  United Kingdom, Australia, The Netherlands, Japan, Hungary, Indonesia, Israel,  Mexico, Poland and Spain.","Z-0228-2016","Class II","MATResponder Tourniquet; Catalog number MATR: UPC 78353 00008;  MATCombat Tourniquet, Catalog number MATC; UPC 78353 00010;    MATResponder Tourniquet and MATCombat Tourniquet are essentially the same product with different color schemes    manual nonpneumatic tourniquet devices. The device provides for emergency blood flow occlusion to the limbs","6728","Once tested, it is required that the tourniquet be returned to its Ready position then placed in its packaging. Each  tourniquet was tested for functionality, but in some cases, the tourniquet was not returned to its  Ready position prior to packaging.  ","08/31/2015","11/05/2015","07/05/2016","11/11/2015","MATR: lot numbers; SL115802 (Exp 07/2024), SL12136 (Exp 08/2024), SL121360 (Exp 12/2024), SL114711 (Exp 01/2024)  MATC - lot numbers : SL12131 (Exp 07/2024), SL121312 (Exp 08/2024), SL113171 (Exp 10/2023)."
"Devices","No","","72097","Terminated","Dako North America Inc.","6392 Via Real","","Carpinteria","CA","	93013-2921","United States","Voluntary: Firm initiated","Letter","Worldwide Distribution - US (nationwide) Distribution including Puerto Rico and to the states of :  TX, SD, CA, FL, MA, MD, WV, NC, OH, DE, MI, NJ, CO, HI, AR, NY, LA, GA, NV, RI, IL, OK, CT, MO, VA, and DC., and to the countries of : Canada, Brazil and Costa Rica.","Z-0220-2016","Class II","EnVision FLEX/HRP visualization reagent found in the following kits:  EnVision FLEX, High pH (Link)  EnVision FLEX+, Mouse, High pH (Link)  EnVision FLEX Mini Kit, High pH (Link)  EnVision FLEX, High pH (Dako Omnis)    Multi-component, sealed package. For in vitro diagnostic use.","300 units","There is a defect in one lot of a buffer, non-specific background staining that has, in some instances, interfered with interpretation of the staining results.","09/04/2015","11/05/2015","04/25/2016","11/11/2015","Item No.:  K800021-2, K800221-2, K802321-2 (Link)  K801021-2, K801221-2, K802421-2 (AS/AS+)  GV80011-2, GV82311-2 (Dako Omnis)    Catalog/Model No.:  K8000  K8002  K8023  GV800    SM802 EnVision FLEX / HRP Lot 20019374 used in:  Envision FLEX, High pH (link) Lot No.: 20019097, 20020777, 20021381  Envision FLEX+, Mouse, High pH (link) Lot No.: 20019103, 20019113, 20020772  EnVision FLEX Mini Kit, High pH (Link) Lot No.: 20021362    DM 842 EnVision FLEX / HRP (Dako Omnis) Lot 20019013 used in:  EnVision FLEX, High pH (Dako Omnis) Lot No.: 20019102"
