Product Type,Recently Updated Record,Last Modified Date,Event ID,Status,Recalling Firm,Address1,Address2,City,State/Province,Postal Code,Country,Voluntary/Mandated,Initial Firm Notification of Consignee or Public,Distribution Pattern,Recall Number,Classification,Product Description,Product Quantity,Reason for Recall,Recall Initiation Date,Center Classification Date,Termination Date,Report Date,Code Info
"Devices","No","","66368","Terminated","Baylis Medical Corp *","5959 TransCanada Highway","","Montreal","","	","Canada","Voluntary: Firm initiated","Letter","Worldwide Distribution - USA Nationwide in the states of : NE, NH, NC, FL, PA, VA, MI, CA, AL, and TN  and the countries of China, Canada, Saudi Arabia, and Italy.","Z-0085-2014","Class I","Baylis Medical TorFlex Transseptal Guiding Sheath, Rx Only, non-pyrogenic, sterile.    Product Usage:  The TorFlex Transseptal Guiding Sheath kit (K102948) is a single use device consisting of three components: a sheath, a dilator, and a J-tipped guidewire. The kit is designed for safe and easy catheterization and angiography of specific heart chambers and locations.","370 devices","The TorFlex Transseptal Guiding Sheath Kits are being recalled due to the possibility that the sheath could remove particulate of less than 5 mm from the dilator. The particulate could potentially migrate into a patients bloodstream.","09/23/2013","11/01/2013","03/31/2015","11/13/2013","Part No. TF8-32-63-135, Lot TFFB070912; Part No.TF8-32-63-37, Lot TFFA310812; Part. No. TF8-32-63-37, Lot TFFB290113; Part No. TF8-32-63-45, Lot TFFA290113; Part No. TF8-32-63-45, Lot TFFB310812; Part No. TF8-32-63-45, Lot TFFC221211; Part No. TF8-32-63-55, Lot TFFA051212; Part No. TF8-32-63-55, Lot TFFA230812; Part No. TF8-32-63-55, Lot TFFB221211; Part No. TF8-32-63-55, Lot TFFB230113; Part No. TF8-32-63-90, Lot TFFA070213; Part No. TF8-32-63-90, Lot TFFA070912; Part No. TF8-32-81-135, Lot TFFH070912; Part No. TF8-32-81-37, Lot TFFD070912; Part No. TF8-32-81-45, Lot TFFE070912; Part No. TF8-32-81-55, Lot TFFF070912; Part No. TF8-32-81-90, Lot TFFG070912; Part No. TF8-38-62-S, Lot TFFA201212; Part No. TF85-32-63-37, Lot TFFC070912; Part No. TF85-32-63-45, Lot TFFA221211; Part No. TF85-32-63-45, Lot TFFA250512; Part No. TF85-32-63-45, Lot TFFC051212; Part No. TF85-32-63-45, Lot TFFC230812; Part No. TF85-32-63-55, Lot TFFA230113; Part No. TF85-32-63-55, Lot TFFA290812; Part No. TF85-32-63-55, Lot TFFB070612; Part No. TF85-32-63-90, Lot TFFB230812; Part No. TF85-32-63-90, Lot TFFC260413; Part No. TF85-32-63-90, Lot TFFC280213; Part No. TF85-32-63-90, Lot TFFF070213; Part No. TF85-32-81-135, Lot TFFC280912; Part No. TF85-32-81-37, Lot TFFA280912; and Part No. TF85-32-81-90, Lot TFFB280912"
"Food","No","","66401","Terminated","Safeway Inc","5918 Stoneridge Mall Rd","","Pleasanton","CA","	94588-3229","United States","Voluntary: Firm initiated","E-Mail","Alaska, Arizona, California, Colorado, Washington, DC, Delaware, Hawaii, Idaho, Illinois, Maryland, Montana, Nebraska, New Mexico,  Nevada, Oregon, Pennsylvania, South Dakota, Texas, Virginia, Washington and Wyoming","F-0122-2014","Class I","Angel Food Cake;  labeled for retail sale in the following stores:  Safeway, Carrs, Dominicks, Genuardis, Pak N Save, Pavilions, Randalls, Tom Thumb and Vons.  Angel Food Cake  0 lb. 12 oz. (340 g)  Black or White Base with Clear Lid","70,162","Incorrect labels were provided to stores that omitted milk and soy.","09/25/2013","11/07/2013","11/07/2013","11/13/2013","UPC code 211301010510 with sell by dates of 9/1/13 to 10/1/13."
"Food","No","","66401","Terminated","Safeway Inc","5918 Stoneridge Mall Rd","","Pleasanton","CA","	94588-3229","United States","Voluntary: Firm initiated","E-Mail","Alaska, Arizona, California, Colorado, Washington, DC, Delaware, Hawaii, Idaho, Illinois, Maryland, Montana, Nebraska, New Mexico,  Nevada, Oregon, Pennsylvania, South Dakota, Texas, Virginia, Washington and Wyoming","F-0123-2014","Class I","Holiday Decorated Angel Food Cake;  labeled for retail sale in the following stores:  Safeway, Carrs, Dominicks, Genuardis, Pak N Save, Pavilions, Randalls, Tom Thumb and Vons.  Holiday Decorated Angel Food Cake  1 lb. 14 oz. (850 g);  Black or White Base with Clear Lid; frosted/decorated","5","Incorrect labels were provided to stores that omitted milk and soy.","09/25/2013","11/07/2013","11/07/2013","11/13/2013","sell by dates of 9/1/13 to 10/1/13."
"Food","No","","66401","Terminated","Safeway Inc","5918 Stoneridge Mall Rd","","Pleasanton","CA","	94588-3229","United States","Voluntary: Firm initiated","E-Mail","Alaska, Arizona, California, Colorado, Washington, DC, Delaware, Hawaii, Idaho, Illinois, Maryland, Montana, Nebraska, New Mexico,  Nevada, Oregon, Pennsylvania, South Dakota, Texas, Virginia, Washington and Wyoming","F-0125-2014","Class I","Cake Angel Food Loaf: 1) Cake Angel Food Loaf;  labeled for retail sale in the following stores:  Safeway, Carrs, Dominicks, Genuardis, Pak N Save, Pavilions, Randalls, Tom Thumb and Vons.  Cake Angel Food Loaf  0 lb. 4 oz. (113 g)  Cake Angel Food Loaf  Individual loaf sold in package of 1 item  2) Cake Angel Food Loaf - 2 count  labeled for retail sale in the following stores:  Safeway, Carrs, Dominicks, Genuardis, Pak N Save, Pavilions, Randalls, Tom Thumb and Vons.  Angel Food Cake Loaf 2 Count  4 oz., and  10 oz. (283 g);  Angel Food Cake Loaf 2 Count  Individual loaf sold in package of 2 items.","1) 1099; 2) 4","Incorrect labels were provided to stores that omitted milk and soy.","09/25/2013","11/07/2013","11/07/2013","11/13/2013","sell by dates of 9/1/13 to 10/1/13."
"Food","No","","66426","Terminated","Giant Eagle, Inc.","101 Kappa Drive,Ridc Park","","Pittsburgh","PA","	15238","United States","Voluntary: Firm initiated","FAX","MD, OH, PA, WV","F-0102-2014","Class I","Giant Eagle Candy Place Candy Corn Mix in a clear plastic container, net wt. 13 oz, Distributed by Giant Eagle Inc.  UPC#3003406974","80 cases  (960 units) George Howe/79 cases (948 units) Giant Eagle","Undeclared  milk, egg, peanut, and soy allergens in Giant Eagle Candy Place Candy Corn Mix","09/25/2013","11/01/2013","10/13/2015","11/13/2013","Sell By Date 040814"
"Food","No","","66512","Terminated","yoders country market","15275 west andrew johnson hwy","","Bulls Gap","TN","	37711","United States","Voluntary: Firm initiated","E-Mail","Nationwide.","F-0115-2014","Class I","Custom made gift boxes containing:  HONEY ROASTED PEANUTS, Net Wt. 11 oz. (311G), Dist.By: Dutch Valley Food Distributors, Inc. Myerstown, PA 10787, UPC 8 77245 00143 3","24 units","Honey Roasted Peanuts, packaged in custom gift boxes, contained milk and wheat which were not declared on the label.","10/11/2013","11/04/2013","01/15/2014","11/13/2013","None"
"Food","No","","66579","Terminated","Kashmir Crown Baking LLC","710 West Linden Avenue","","Linden","NJ","	07036","United States","Voluntary: Firm initiated","Two or more of the following: Email, Fax, Letter, Press Release, Telephone, Visit","CA, Canada","F-0121-2014","Class I","KCB Pista Khatie  KCB Bakery Products Corp.  56-28 56th Street, Maspeth, NY 11378  Tel: (718) 786-9463 Fax (718) 361-0171  www.kbcusa.com    a) Net Wt. 30 OZ (850 G)    b) Net Wt. 13 OZ (369 G)    Packaged in a plastic clam shell container with stick-on labels.","24 cases x 12 plastic clam shell boxes; 15 cases x  13 clam shel boxes","The firm's Pista Khatie cookies with use by date 16 May 14 were tested by the Canadian Food Inspection Agency (CFIA) and found to contain 70 ppm of undeclared egg allergen. The label for this product states that it does not contain eggs.","10/17/2013","11/07/2013","04/19/2016","11/13/2013","Use By Date: 16 May 14; 13 oz. package UPC Code: 12042 00129; 30 oz. package UPC Code: 12042 00296"
"Biologics","No","","47702","Terminated","American National Red Cross (The)","6616 South 900 East","","Salt Lake City","UT","	84121-2492","United States","Voluntary: Firm initiated","Letter","UT","B-0099-14","Class II","Red Blood Cells, Leukocytes Reduced","1 unit","Blood products, collected from a donor for whom donor suitability was not adequately determined, were distributed.","02/13/2008","11/01/2013","11/01/2013","11/13/2013","20E65198"
"Biologics","No","","47702","Terminated","American National Red Cross (The)","6616 South 900 East","","Salt Lake City","UT","	84121-2492","United States","Voluntary: Firm initiated","Letter","UT","B-0100-14","Class II","Plasma Frozen","1 unit","Blood products, collected from a donor for whom donor suitability was not adequately determined, were distributed.","02/13/2008","11/01/2013","11/01/2013","11/13/2013","20E65198"
"Biologics","No","","49905","Terminated","CSL Plasma","817 Winchester Rd Ste 300","","Lexington","KY","	40505-3744","United States","Voluntary: Firm initiated","Letter","IL, Switzerland, Germany","B-0089-14","Class II","Source Plasma","70 units","Blood products, collected from a donor in which donor suitability was not adequately determined, were distributed.","07/15/2008","11/01/2013","11/01/2013","11/13/2013","0530530359; 0530516500; 0530513651; 0530513199; 0530511972; 0530511294; 0530510345; 0530509467; 0530509099; 0530507871; 0530507023; 0530506644; 0530504545; 0530483234; 0530482334; 0530480575; 0530479801; 0530479333; 0530478571; 0530478139; 0530477427; 0530476965; 0530475851; 0530475047; 0530474676; 0530473408; 0530472889; 0530472353; 0530469574; 0530469074; 0530468635; 0530468074; 0530467575; 0530466937; 0530466432; 0530465749; 0530465257; 0530464686; 0530464238; 0530463664; 0530463232; 0530462578; 0530462116; 0530544161; 0530530359; 0530516500; 0530513651; 0530513199; 0530512367; 0530511972; 0530511294; 0530510345; 0530509467; 0530509099; 0530507871; 0530507023; 0530506644; 0530505778; 0530505042; 0530504545; 0530483706; 0530483234; 0530482334;0530481899; 0530481105; 0530480575; 0530479801; 0530479333; 0530478571; 0530478139; 0530477427; 0530476965; 0530475851; 0530475047; 0530474676; 0530473408; 0530472889; 0530472353; 0530469574; 0530469074; 0530468635; 0530468074; 0530467575;0530466937; 0530466432; 0530465749; 0530465257; 0530464686; 0530464238; 0530463664; 0530463232; 0530462578; 0530462116; 0530461536; 0530461057; 0530460570; 0530459936; 0530459582; 0530459034; 0530458638; 0530457431; 0530457123; 0530456573; 0530456250; 0530455730; 0530455456; 0530454827; 0530454513; 0530453871; 0530453506; 0530452905; 0530452574; 0530451939; 0530451645"
"Devices","No","","63859","Terminated","Handicare Accessibility","2201 Hangar Place","#200","Allentown","PA","	18109","United States","Voluntary: Firm initiated","Letter","Worldwide distribution: USA (Nationwide) and country of: Canada.","Z-0171-2014","Class II","Handset component of the Handicare USA's Minivator Bath Bliss Reclining Bath Lifts (Bath Bliss), Part Number BP300-100/BP300-400RSUS (handset) - Model Numbers BBR0311USAB (blue) and BBR0311USSS (silver)    Handset component devices operate the Minivator Bath Bliss Reclining Bath Lift, a non-AC-powered patient lift consisting of a motorized actuator, powered mechanical seating device, temporarily secured in a bath, and used to lift and lower a patient in the vertical or reclining position while bathing.","3301 handsets","Firm became aware that two handsets in the affected batches became inoperable while the user was in the tub.","11/29/2012","11/06/2013","12/08/2014","11/13/2013","Handsets shipped with Bath Lifts belonging to the following serial numbers:  BH05100001 - BH05129999 and  BH06120001 - BH11129999; Handsets shipped as spare parts with the following serial numbers: BS05100001 - BS05129999 and BS06120001 - BS11129999."
"Devices","No","","65161","Terminated","Siemens Medical Solutions USA, Inc","51 Valley Stream Pkwy","","Malvern","PA","	19355","United States","Voluntary: Firm initiated","Letter","Nationwide Distribution","Z-0016-2014","Class II","Siemens RAD Fluoro Uro Systems - Luminos dRF, Ysio and Uroskop Omnia with software versions VB10D, VB10F, VB10C and VB10E.     Fluroscopic X-Ray Systems","23","Siemens has discovered through product monitoring a potential malfunction when using system operating with software versions VB10D, VB10F, VB10C and VB10.  During a RAD examination the possibility exists that radiation may continue longer than expected and may result in unnecessary dose applied during an acquisition.  Additionally, it is not possible for the user to stop the radiation manually; ho","05/06/2013","11/01/2013","11/06/2014","11/13/2013","Material 10094910, with serial numbers 1036, 1045, 1025, 1040, 1041, 1032, 1047 and 1035; Material 10281013, with serial numbers 21221, 21223, 21213, 21089, 21098, 21163, 21171, 21194, 21212, 21186, 21188, 21167, 21187 and 21189; Material 10281163, with serial number 31114."
"Devices","No","","65586","Terminated","Carestream Health Inc.","150 Verona St","","Rochester","NY","	14608-1733","United States","Voluntary: Firm initiated","Letter","Worldwide distribution: US (nationwide) including states of: AL, AR, AZ, CA, CO, FL, GA, IA, ID, IL, IN, IO, KS, LA, MA, MD, MI, MN, MO, NC, NY, OH, PA, SC, TN, TX, UT, VA, WI, and WV; and countries of: Australia, Brazil, Canada, Dubai, Germany, Japan, Kuwait, Malaysia, New Zealand, Saudi Arabia, Singapore, South Africa, Taiwan, and Thailand.","Z-0132-2014","Class II","DRX Revolution, Catalog #'s 1)1019397, 2) 1023415 (w/ installation warranty, US-only) and 3) 1023423 (w/ parts warranty, US-only).    The device is designed to perform radiographic x-ray examinations on all pediatric and adult patients, in all patient treatment areas","331 units","Carestream Health Inc. is conducting a recall for the Column end Cover present on the DRX Revolution Mobile X-Ray System due to the cover dislodging from the column.","06/19/2013","11/01/2013","05/20/2016","11/13/2013","Serial Numbers: All serial numbers manufactured since inception in June 21, 2012 until June 12, 2013"
"Devices","No","","65782","Terminated","Elekta, Inc.","400 Perimeter Center Ter Ne","Ste 50","Atlanta","GA","	30346-1227","United States","Voluntary: Firm initiated","Letter","Nationwide distribution: USA including the states of AZ, CA, FL, GA, MO, NJ, NM, NC, OR, TN and WV.","Z-0138-2014","Class II","Stereotactic Circular Collimator - 3D Line stereotatic Hardware Accessories    The device is part of the class of medical devices that are used in radiotherapy for the treatments of head tumors.","89","Potential for clinical errors.","07/23/2013","11/04/2013","11/18/2014","11/13/2013","933, 935, 936, 937, 940, 843, 844, 845, 846, 847, 833, 834, 835, 836, 837, 801, 802, 803, 804, 805, 908, 909, 910, 911, 912, 889, 890, 891, 892, 893, 894, 848, 849, 850, 851, 852, 853, 974, 975, 976, 977, 978, 1032, 1033, 1034, 928, 929, 930, 931, 932, 980, 981, 982, 983, 984, 1017, 1018, 1019, 1020, 1021, 883, 884, 885, 886, 1012, 1013, 1014, 1015, 1016, 1027, 1028, 1029, 1030, 1031, 941, 942, 943, 944, 945, 946, 947, 948, 949, 950, 903, 904, 905, 906, 907"
"Drugs","No","","66014","Terminated","Amneal Pharmaceuticals of New York, LLC.","85 Adams Avenue","","Hauppauge","NY","	11788","United States","Voluntary: Firm initiated","Letter","IL, NH, NJ, NY, OH, RI, TN","D-66014-001","Class II","Extended Phenytoin Sodium Capsules, USP, 100 mg, 1000 CAPSULES, Rx only, amneal PHARMACEUTICALS label, NDC 65162-212-11 --- Manufactured by: Amneal Pharmaceuticals of NY Hauppauge, NY 11788 Distributed by: Amneal Pharmaceuticals Glasgow, KY 42141","895 - 1000 count bottles","Failed dissolution specifications; 18 month CRT","08/17/2013","11/04/2013","07/17/2014","11/13/2013","Batch/Lot HL50611, exp. 1/2014"
"Devices","No","","66040","Terminated","Insight Instruments, Inc.","2580 Se Willoughby Blvd","","Stuart","FL","	34994-4701","United States","Voluntary: Firm initiated","Letter","Worldwide Distribution - USA (nationwide) including AZ, CA, FL, IN, MA, MD, TX, and WA and Internationally to Czech Republic, Germany, Netherlands, Spain, Switzerland, and Turkey.","Z-0144-2014","Class II","MLS Torpedo Mini-Light Ophthalmic single-port illumination.    Sutureless 25- gauge illuminator for vitreo-retinal surgery when full field illumination of bimanual surgery if desired.","10212","The product was registered and distributed as a Class I medical device and was subsequently determined to be a Class II medical device which requires FDA market clearance.","06/27/2013","11/04/2013","09/27/2017","11/13/2013","Part Number    Lot Number     Expiration  11007                M52934            04/2013  11017                M53017            04/2013  11007                M55285            07/2013  11007                M55869            08/2013  11007                M58610            12/2013  11007                M59575            02/2014  11007                M61781            05/2014"
"Devices","No","","66067","Terminated","Carestream Health Inc.","150 Verona St","","Rochester","NY","	14608-1733","United States","Voluntary: Firm initiated","Letter","Nationwide distribution:AL, AZ, AR, CA, CO, CT, DC, FL, GA, ID, IL, IN, IA, KS, KY, LA, MD, MA, MI, MN, MS, MI, MO, NE, NH, NJ, NM, NY, NC, OH, OK, OR, PA, RI, SC, TN, TX, UT, VT, VA, WA, WI, and WV.","Z-0179-2014","Class II","DRX- Revolution, Catalog number: 101937, 1023415 & 1023423.  Made in U.S.A. by Carestream Health, Inc. 150 Verona Street Rochester, NY 14608    to perform radiographic x-ray examinations on all pediatric and adult patients","190 units","Carestream Health Inc. has conducted a voluntary field action which includes the installation of a software patch on the following: DRX-Revolution Mobile X-Ray, DRX-Mobile and DRX Transportable Systems with DirectView Version 5.5 and 5.6 console software when used with DRX-1 Detector version 69 firmware. Carestream recently received reports of a non-diagnostic image on exams when a Normal Exposure","08/29/2013","11/07/2013","06/28/2016","11/13/2013","Model: DRXR-1  Serial numbers: all serial numbers manufactured with version 5.5 software and version 69 firmware"
"Devices","No","","66067","Terminated","Carestream Health Inc.","150 Verona St","","Rochester","NY","	14608-1733","United States","Voluntary: Firm initiated","Letter","Nationwide distribution:AL, AZ, AR, CA, CO, CT, DC, FL, GA, ID, IL, IN, IA, KS, KY, LA, MD, MA, MI, MN, MS, MI, MO, NE, NH, NJ, NM, NY, NC, OH, OK, OR, PA, RI, SC, TN, TX, UT, VT, VA, WA, WI, and WV.","Z-0180-2014","Class II","CARESTREAM DRX -Mobile Retrofit Kit, Catalog number: 1019397.  Made in U.S.A. by Carestream Health, Inc. 150 Verona Street Rochester, NY 14608    to perform radiographic x-ray examinations on all pediatric and adult patients","364 units","Carestream Health Inc. has conducted a voluntary field action which includes the installation of a software patch on the following: DRX-Revolution Mobile X-Ray, DRX-Mobile and DRX Transportable Systems with DirectView Version 5.5 and 5.6 console software when used with DRX-1 Detector version 69 firmware. Carestream recently received reports of a non-diagnostic image on exams when a Normal Exposure","08/29/2013","11/07/2013","06/28/2016","11/13/2013","Model: DRX Mobile  Serial numbers: all serial numbers manufactured with version 5.5 software and version 69 firmware"
"Devices","No","","66101","Terminated","Bayer Healthcare Llc","510 Oakmead Pkwy","","Sunnyvale","CA","	94085-4022","United States","Voluntary: Firm initiated","Letter","Worldwide Distribution - USA (nationwide) and Internationally to China, Argentina, Uruguay, Japan.","Z-0136-2014","Class II","Bayer brand A1CNow+ MULTI-TEST A1C SYSTEM TEST KITS (PART NUMBER 3021/08842610); Hemoglobin A1c Monitor; Glycosylated Hemoglobin Assay; Product is manufactured and distributed by   Bayer HealthCare LLC, Sunnyvale, CA       The A1CNow+ test provides quantitative measurement of the percent of glycated hemoglobin (%HbA1c or %A1C) levels in capillary (fingerstick) or venous whole blood samples. The test is for professional use to monitor glycemic control in people with diabetes.","138 Kits in US (Total 2452)","Test results from these lots may produce a high-bias reading (by up to 20%) that is outside of limits defined for stability and product accuracy when product is stored at room temperature four (4) to five (5) months after release.","08/26/2013","11/01/2013","01/14/2014","11/13/2013","Lot: 1300733 (US, China);   Lot: 1300712 (Argentina, Uruguay);  Lots: 1300711, 130012 (Japan)"
"Devices","No","","66112","Terminated","Edwards Lifesciences, LLC","12050 Lone Peak Pkwy","","Draper","UT","	84020-9414","United States","Voluntary: Firm initiated","Letter","Nationwide Distribution.","Z-0134-2014","Class II","Edwards Lifesciences Fem-Flex Femoral Arterial Cannula with Duraflo Coating, DIITFA02225, Sterile, RX only For Single Use Only,     Product Usage:  Edwards Lifesciences femoral access cannulae are intended for use in situations which require rapid femoral venous and arterial access for short-term (< 6 hours) cardiopulmonary bypass. Vessel access (venous or arterial) is left to the discretion of the physician. Femoral access cannulae may be used in pediatric populations or adult populations based on flow rate requirements and individual patient anatomy. Please consult labeling to determine pressure drop related to flow rates. Extracorporeal circuit components with a Duraflo coating are intended for use in cardiopulmonary surgery when a heparin coated blood path is desired.","80 units","Edwards Lifesciences is recalling two lots of Duraflo Cannulas due to reported complaints involving cracks in the t-connector of the devices which were confirmed during product evaluation.","08/26/2013","11/01/2013","02/22/2017","11/13/2013","Lot number 59388992 expiry 1/1/16"
"Devices","No","","66112","Terminated","Edwards Lifesciences, LLC","12050 Lone Peak Pkwy","","Draper","UT","	84020-9414","United States","Voluntary: Firm initiated","Letter","Nationwide Distribution.","Z-0135-2014","Class II","Edwards Lifesciences Dispersion Aortic Perfusion Cannula with Duraflo Coating, Sterile, RX only For Single Use Only,     Product Usage:  Aortic perfusion cannulae are intended for perfusion of the ascending aorta during short-term (< 6 hours) cardiopulmonary bypass procedures. Aortic cannulae in sizes 6Fr to 18Fr can be used in pediatric patient populations. Extracorporeal circuit components with a Duraflo coating are intended for use in cardiopulmonary surgery when a heparin coated blood path is desired.  ","140 units","Edwards Lifesciences is recalling two lots of Duraflo Cannulas due to reported complaints involving cracks in the t-connector of the devices which were confirmed during product evaluation.","08/26/2013","11/01/2013","02/22/2017","11/13/2013","Lot number 59261626 expiry 06/01/15"
"Devices","No","","66138","Terminated","Steris Corporation","5960 Heisley Rd","","Mentor","OH","	44060-1834","United States","Voluntary: Firm initiated","Letter","Nationwide distribution: USA including the states of Alabama, Arkansas, Florida, Georgia, Illinois, Indiana, Kansas, Kentucky, Louisiana, Maryland, Massachusetts, Michigan, Minnesota, Missouri, Nebraska, New Jersey, New York, Ohio, Oklahoma, Oregon, Pennsylvania, Texas, Virginia, Washington and Wisconsin.","Z-0141-2014","Class II","Harmony Equipment Management System, Model #603X/80XX, STERIS Corporation, Mentor, OH    Harmony Equipment Management Systems (EMS) are used in hospital facilities to provide ready access to medical gasses, electrical power and audio/visual data services, in addition to managing surgical support equipment such as endoscopic equipment, cautery devices and insufflators.","127 units","Dr¿ger Medical GmbH has notified STERIS of the potential for a break in the drive screw contained in the motorized ceiling supply unit, a component of the Harmony EMS system.  The ceiling supply unit controls the motorized adjustment of the height and rotation of the supply column.  Should a break occur in the drive screw, there is potential for the adjustable arm to drop down, causing the EMS sys","08/15/2013","11/06/2013","04/28/2014","11/13/2013","Serial numbers 0422503114 - 0426604096"
"Veterinary","No","","66170","Terminated","Zoetis Inc","100 Campus Dr","4th Floor","Florham Park","NJ","	07932","United States","Voluntary: Firm initiated","Letter","Product was distributed to the following states:  GA, AR, OK, TX, and VA.","V-001-2014","Class II","Bio-Cox Granular 60 Alpharma Brand of salinomycin sodium Type A Medicated Article Net Wt 50 LB, Marketed by Alpharma Inc. Bridgewater, New Jersey 08807, NADA # 128-686","1280 bags","Stability failure","09/09/2013","11/05/2013","08/14/2014","11/13/2013","HSK10293, HSK10294, HSK10295, HSK10296, HSK10297, HSK10298, HSK10299, HSK10300, HSK10301, HSK10302, HSK10303, HSK10304, HSK10305, HSK10306, HSK10307, and HSK10308."
"Devices","No","","66191","Terminated","Pinook-Usa","901 Central Florida Pkwy Ste A6","","Orlando","FL","	32824-8508","United States","Voluntary: Firm initiated","E-Mail","Worldwide Distribution-USA (nationwide) including  Puerto Rico and Guam and the states of AZ, CA, CO, FL, IL, MA, MD, MO, MT, NC, ND, NJ, NV, NY, TX, VA, and WA and the country of Canada.","Z-0176-2014","Class II","Pinook Mini Massager   Distributed by www.pinookusa.com.    Used to strengthen the abdominal muscles.","28,994 units (Mini and Micro)","Failure to submit a premarket submission and gain approval of a medical device.","05/23/2013","11/07/2013","09/29/2016","11/13/2013","ALL LOTS"
