"Devices","No","","72115","Terminated","Medtronic Inc.","8200 Coral Sea St Ne","","Saint Paul","MN","	55112-4391","United States","Voluntary: Firm initiated","Visit","Distributed in DC and the states of AR, CA, CO, DE, GA, IA, KY, ME, MI, MN, NY, OH, PA, TN, TX, and VA.","Z-0200-2016","Class II","Medtronic Achieve Cables, model 990066.  The sterile, single use only Electrical Cable (Model 990066) provides the conduction elements from the proximal end of the Achieve Catheter handle to standard shielded ECG pins that connect into standard electrophysiology recording and pacing equipment.  Medtronic Ablation Frontiers Achieve Mapping Catheter is indicated for multiple electrode  electrophysiological mapping of the cardiac structures of the heart.","64 units","64 units of Achieve Electrical Cables were shipped with a potential sterility breach.","09/29/2015","11/02/2015","03/09/2016","11/11/2015","Lot U531"
"Devices","No","","72161","Terminated","Bausch & Lomb Inc Irb","1400 Goodman St N","","Rochester","NY","	14609-3547","United States","Voluntary: Firm initiated","E-Mail","Distributed US (nationwide), Canada, Japan and Thailand.","Z-0206-2016","Class II","BAUSCH + LOMB Biotrue ONEday lenses (nesofilcon A), Product Order Number Biotrue SVS - 7201, STERILE, Rx Only; The lenses are available in 5 pack, 30 pack and 90 pack sizes; Biotrue ONEday Foil - Part Number 8098001, Biotrue ONEday 5 pack Carton International - Part Number 8101403, and Biotrue ONEday 90 pack Carton International - Part Number 8098203.","Domestic: 99,260 lenses; Foreign: 84,660 lenses","The firm determined that 25 lots had been manufactured with a minor surface defect occurring in the optical surface on each lens.  Complaints of Halo or Poor Visual Acuity.","09/03/2015","11/04/2015","06/06/2016","11/11/2015","Select -2.25/-3.00 Diopter Lot Numbers: W57209820 (exp. date 05/19/2019), W57210174 (exp. date 05/23/2019), W57210440 (exp. date 05/28/2019), W57211652 (exp. date 06/09/2019), W57211916 (exp. date 06/09/2019), W57212210 (exp. date 06/09/2019), W57212440 (exp. date 06/09/2019),   W57212697 (exp. date 06/09/2019), W57212926 (exp. date 06/09/2019),  W57213158 (exp. date 06/09/2019), W57213453 (exp. date 06/09/2019), W57213743 (exp. date 07/01/2019), W57213969 (exp. date 07/01/2019), W57214208 (exp. date 07/01/2019), W57214459 (exp. date 07/01/2019),   W57214717 (exp. date 07/01/2019), W57215039 (exp. date 07/01/2019), W57215293 (exp. date 07/01/2019), W57215517 (exp. date 07/01/2019), W57215783 (exp. date 07/01/2019)."
"Drugs","No","","72214","Terminated","Valeant Pharmaceuticals North America LLC","400 Somerset Corporate Blvd","","Bridgewater","NJ","	08807-2867","United States","Voluntary: Firm initiated","Letter","U.S. Nationwide","D-0163-2016","Class II","Fenoglide (fenofibrate) tablets, 120 mg Tablets, 90 Ct Bottle, Rx Only. Distributed by: Santarus, Inc. San Diego, CA 92130.  NDC: 68012-495-90.","3341 Bottles","Failed Dissolution Specifications: Failed 24 month dissolution testing.","09/04/2015","11/03/2015","03/14/2017","11/11/2015","Lot # 1300939, Expiry: March 2016."
"Devices","No","","72220","Terminated","Ortho-Clinical Diagnostics","100 Indigo Creek Dr","","Rochester","NY","	14626-5101","United States","Voluntary: Firm initiated","Letter","Worldwide Distribution: US (nationwide) including Puerto Rico, and countries of: Australia, Brazil, Canada, Chile, China, Colombia, England, France, Germany, India, Italy, Japan, Mexico, Republic of Panama, Singapore, Spain, and Venezuela.","Z-0231-2016","Class II","VITROS 5,1 FS Chemistry System, Catalog Number/Product Code 6801375, Unique Device Identifier No. 10758750001132, and VITROS 5,1 FS Chemistry System Refurbished, Catalog Number/Product Code 6801890, Unique Device Identifier No. 10758750001644.  Intended for use in the in vitro quantitative measurement of a variety of analytes of clinical interest.","Catalog # 6801375: Domestic 919; Foreign 1251; Catalog 6801890: Domestic 63, Foreign 147","Software Anomaly during ADD Installation on VITROS 5,1 FS Chemistry Systems using Software Versions 2.2.1 through 2.8. The user modified parameters would not be saved as expected, but remained changed to the default values obtained from the ADD disk.","09/10/2015","11/05/2015","05/29/2018","11/11/2015","Software Versions 2.2.1 through 2.8; Catalog # 6801375 Serial Numbers: 34000119 through 34002323; Catalog # 6801890 Serial Numbers:  J34000133, J34000193, J34000197, J34000212, J34000285, J34000316, J34000318, J34000337, J34000360, J34000420, J34000451, J34000478, J34000495, J34000497, J34000529, J34000538, J34000552, J34000557, J34000590, J34000596, J34000601, J34000631, J34000642, J34000761, J34000799, J34000805, J34000833, J34000851, J34000893, J34000946, J34000947, J34001006, J34001172, J34001218, J34001240, J34001243, J34001248, J34001251, J34001274, J34001297, J34001311, J34001317, J34001345, J34001378, J34001379, J34001389, J34001390, J34001396, J34001422, J34001472, J34001504, J34001569, J34001572, J34001612, J34001626, J34001633, J34001668, J34001755, J34001809, J34001840, J34001850, J34001875, J34001897."
"Devices","No","","72224","Terminated","Mako Surgical Corporation","2555 Davie Rd Ste 110","","Plantation","FL","	33317-7424","United States","Voluntary: Firm initiated","Two or more of the following: Email, Fax, Letter, Press Release, Telephone, Visit","Worldwide Distribution-US (nationwide) including the states of AL, AR, AZ, CA, CO, CT, FL, GA, IA, ID, IL, IN, KY, LA, MA, MD, MI, MS, NC, NH, NJ, NV, NY, OH, OK, OR, PA, RI, SC, TN, TX, UT, VA, WA, WI, WV, WY and HI, and the countries of Italy, Japan, Hong Kong, Scotland, Germany, Turkey, Greece, Australia, Singapore, Taiwan, and South Korea.","Z-0224-2016","Class II","Robotic Arm Interactive Orthopedic (RIO) system component PN#205143 (locking pin) and PN# 112220 (connector).   Indicated for use in surgical knee resurfacing and total hip Arthroplasty joint replacement procedures.","1,322 units","The locking pin on the RIO Base Array is damaged during assembly onto the RIO Base Array Connector.","07/16/2015","11/05/2015","12/14/2016","11/11/2015","Model/Catalog Numbers Affected: Mako Rio Robotic Arm  (201000, 203999, 207300 and 209930. Lot/Serial Number:  All RIO's."
"Devices","No","","72236","Terminated","Brainlab AG","Kapellenstr. 12","","Feldkirchen","","	","Germany","Voluntary: Firm initiated","Letter","Worldwide Distribution - US Nationwide and the countries of: Algeria, Argentina, Australia, Austria, Belgium, Brazil, Cambodia, Canada, Chile, China, Colombia, Czech Republic, Denmark, Ecuador, Egypt, Finland, France, Germany, Hong Kong, Hungary, India, Iran, Ireland, Israel, Italy, Japan, Lithuania, Malaysia, Malta, Mexico, Moldova, Morocco, Myanmar, Netherlands, New Zealand, Norway, Philippines, Poland, Portugal, Qatar, Russian Federation, Saudi Arabia, Singapore, South Africa, Spain, Sweden, Switzerland, Taiwan, Thailand, Turkey, United Arab Emirates, United Kingdom and Vietnam.","Z-0218-2016","Class II","Digital Lightbox, BrainLAB system, image processing, radiological    Product Usage:  The Patient Data Manager is a system intended for the display of medical images. The software can transfer images to and from picture archiving and communication systems (PACS), file servers, or removable storage media. It includes functions for image manipulation, basic measurements and 3D visualization (reconstructions and volume rendering). Features for navigation planning include multi-modality image fusion as well as object and trajectory creation. It is not intended for primary image diagnosis or the review of mammographic images.      ","897","Potentially incorrectly displayed objects when actively deselecting a fused reference dataset.","09/21/2015","11/05/2015","04/24/2017","11/11/2015","Potentially affected are Patient Data Manager versions 2.0.0, 2.0.1, 2.0.2, 2.0.3, 2.1.0.  Serial numbers/lot numbers are not applicable for a software version.  Model/catalogue numbers:  Main model/catalogue numbers:  25121-01 PATIENT DATA MANAGER 2.0.0 LICENSE ONLY  25100-05 PATIENT DATA MANAGER 2.0.1 LICENSE ONLY  25100-06 PATIENT DATA MANAGER 2.0.2 LICENSE ONLY  25100-07 PATIENT DATA MANAGER 2.0.3 LICENSE ONLY  25100-08     Further the above listed main-articles are incorporated into the following model/catalogue numbers:  15600 MULTI-TOUCH INFORMATION GATEWAY  15610 IN-WALL MULTI-TOUCH INFORMATION GATEWAY  15700 CURVE CEILING-MOUNTED DUAL DISPLAY  15705 CURVE CEILING-MOUNTED SINGLE DISPLAY  15709-10 CURVE CM COMPUTER UNIT  18070 KICK NAVIGATION STATION  18071 KICK MONITOR CART   18071-19 KICK MONITOR CART BASE (WITH OS)  18073-17 KICK MCU (WITH OS)  18077 KICK UPGRADE NAVIGATION STATION  18078 KICK NAVIGATION STATION (REFURB. CAMERA)  18080 KICK NAVIGATION STATION  18080-01 KICK NAVIGATION STATION BRAZIL  18080-02 KICK NAVIGATION STATION CHINA  18081 KICK DPS MONITOR CART  18081-19 KICK DPS MONITOR CART BASE (WITH OS)  18083-17 KICK DPS MCU (WITH OS)  18090 KICK EM NAVIGATION STATION  19900 CURVE DUAL DISPLAY NAVIGATION STATION  19900-04B MONITOR CART-CURVE DUAL DISPL. SPAREPART  19900-04C MONITOR CART-CURVE DUAL DISPL. SPAREPART  19905 CURVE SINGLE DISPLAY NAVIGATION STATION  19905-04B MONITOR CART-CURVE SINGLE DISP SPAREPART  22216 CRANIAL NAVIGATION SW 3.0  22217 ENT NAVIGATION SW 3.0  22241 NAVIGATION SW ENT EM 1.0  22241-01 NAVIGATION SW ENT EM 1.0 - FOR BENELUX  22244 NAV SW ENT EM 1.0 ADD-ON FOR OPT NAV  22245 NAV SW ENT OPTICAL ADDON FOR ENT EM NAV  22267 SPINE & TRAUMA 3D (VER. 2.1)  25100C PATIENT BROWSER AND CONTENT MANAGER  25100D PATIENT BROWSER AND CONTENT MANAGER  25110 BRAINLAB SESSION SHARING NURSE STATION  25121 PATIENT BROWSER AND CONTENT MANAGER  26201-12A ORIGIN DATA MANAGEMENT SUBSCRIPTION  26201-36A ORIGIN DATA MANAGEMENT SUBSCRIPTION  26201-60A ORIGIN DATA MANAGEMENT SUBSCRIPTION  26201A ORIGIN DATA MANAGEMENT SUBSCRIPTION  26243A UPGRADE TO ORIGIN DATA MANAGEMENT  26269-12A ORIGIN DATA MANAGEMENT SUBSCRIPTION FOC  26269-36A ORIGIN DATA MANAGEMENT SUBSCRIPTION FOC  26269-60A ORIGIN DATA MANAGEMENT SUBSCRIPTION FOC  26269A ORIGIN DATA MANAGEMENT SUBSCRIPTION FOC  26282 UPGRADE TO ORIGIN DATA MANAGEMENT FOC  26290 ELEMENTS PLANNING SUITE FOR NAVIGATION  26291 ELEMENTS PLANNING SUITE FOR BUZZ  27001 NAVIGATION SOFTWARE KNEE 3  27003 NAVIGATION SOFTWARE KNEE 3 BASE SOFTWARE  27004 UPG NAVIGATION SOFTWARE KNEE 3 BASE SW  27006 UPG NAVIGATION SOFTWARE KNEE 3 BASE SW  27007 NAVIGATION SOFTWARE KNEE3  UNIVERSAL  30038A ORIGIN DATA MANAGEMENT  30039 ORIGIN DATA MANAGEMENT ORTHO  70346 UPD PATIENT BROWSER&CONTENT MANAGER 2.X  70349 UPD PACKAGE PDM 1.X TO 2.X INCL ELEMENTS  71201 UPG TO NAV SW CRAN 3.0 FROM CRAN 2.X  71202 UPG TO CRANIAL NAV SW 3.0 FROM ANY PREV  71202 UPG TO CRANIAL NAV SW 3.0 FROM ANY PREV  71203 UPG TO NAV SW ENT 3.0 FROM ENT 2.X  71204 UPG TO ENT NAV SW 3.0 FROM ANY PREV  E15600 MULTI-TOUCH INFORMATION GATEWAY  E15709-10 CURVE CM COMPUTER UNIT  E18073-17 KICK MCU (WITH OS)  E19900 CURVE DUAL DISPLAY NAVIGATION STATION  E19900-04B MONITOR CART-CURVE DUAL DISPL. SPAREPART  E19900-04C MONITOR CART-CURVE DUAL DISPL. SPAREPART  E19900-05 MONITOR CART-CURVE BYPASS 2 DISP SPARE  E19905 CURVE SINGLE DISPLAY NAVIGATION STATION  E19905-04B MONITOR CART-CURVE SINGLE DISP SPAREPART  E19905-05 MONITOR CART-CURVE BYPASS 1 DISP SPARE"
"Food","No","","72253","Terminated","JP Trading and Global Imports LLC","399 Mulberry St","","Newark","NJ","	07102","United States","Voluntary: Firm initiated","Visit","CT, NJ and NY","F-0147-2016","Class II","Tradiciones Andinas Gourmet Foods Peeled Mote Corn, Mote Pelado, Net Wt. 15 oz. (425g), Product of Peru, Distributed By: JP Trading and Global Imports LLC, Newark NJ 07102","80 cases (24 packages per case)","Product contains sulfites that are not listed on products labeling.","09/03/2015","11/04/2015","06/12/2017","11/11/2015","N/A"
"Biologics","No","","72263","Terminated","BPL Plasma, Inc.","3744 Blanding Blvd","","Jacksonville","FL","	32210-5243","United States","Voluntary: Firm initiated","E-Mail","CA","B-0100-16","Class II","Source Plasma","1 unit","Blood product, collected from a donor who had previously tested reactive for Hepatitis C (HCV), was distributed.","07/27/2015","11/04/2015","11/04/2015","11/11/2015","JK0534481"
"Biologics","No","","72264","Terminated","Michigan Blood","1036 Fuller Ave NE","PO Box 1704","Grand Rapids","MI","	49501-1704","United States","Voluntary: Firm initiated","FAX","MI","B-0109-16","Class II","Red Blood Cells Leukocytes Reduced","1 unit","Blood product, collected from a donor who traveled to a malarial endemic area, was distributed.","08/07/2015","11/05/2015","11/05/2015","11/11/2015","W120615007173"
"Biologics","No","","72267","Terminated","BPL Plasma, Inc.","2631 Dunn Ave","","Jacksonville","FL","	32218-4656","United States","Voluntary: Firm initiated","E-Mail","United Kingdom","B-0074-16","Class II","Source Plasma","3 units","Blood products, collected from a donor who was at risk for Creutzfeldt-Jakob Disease (CJD), were distributed.","05/14/2015","11/03/2015","11/03/2015","11/11/2015","JV0178335, JV0178868, JV0180378"
"Biologics","No","","72279","Terminated","LifeSouth Community Blood Centers, Inc.","4891 Ashford Dunwoody Rd","","Dunwoody","GA","	30338-4894","United States","Voluntary: Firm initiated","FAX","AL","B-0099-16","Class II","Platelets Pheresis Leukocytes Reduced","1 unit","Blood product, associated with an unacceptable pH, was distributed.","08/19/2015","11/04/2015","11/04/2015","11/11/2015","W115115170707X"
"Devices","No","","72290","Terminated","Ivoclar A. G.","Fl-9494","","Schaan","","	","Liechtenstein","Voluntary: Firm initiated","Two or more of the following: Email, Fax, Letter, Press Release, Telephone, Visit","Nationwide Distribution including NJ, PA, SC, FL, IN, IA, WI, IL, MO, TX, CA and WA.","Z-0213-2016","Class II","Helioseal F Sealant Refill 1 x 1.25 g, REF 558519AN, and Helioseal F Assortment (kit) 5 x 1.25 g, REF 558518AN.  Dental sealant.  -- ivoclar vivadent clinical --- Helioseal F Refill is provided in a syringe packed sealed foil bag.  Helioseal F is a light-curing, white-shaded fissure sealant featuring fluoride release. Helioseal fissure sealants are suitable for the sealing of pits, fissures and foramina caeca.","Domestic: 337 units","A defect occurred in the production process of Helioseal F Sealant; the particles in the faulty component seem to be larger than the size defined in the formula.  This results in difficulties during extrusion of the material.","10/07/2015","11/04/2015","06/14/2016","11/11/2015","Lot U12511, Kit Lot U19925 (Helioseal F Assortment only), exp. 11.09.2017"
