"Devices","No","","72357","Terminated","Exactech, Inc.","2320 NW 66th Ct","","Gainesville","FL","	32653-1630","United States","Voluntary: Firm initiated","Telephone","US Distribution to states of: AZ, CO, FL, and MD.","Z-0201-2016","Class II","Novation Element Press-Fit, Cementless, HA Coated, Collared, Standard Offset, Size 9, Femoral Hip Implant Stems, Intended for press-fit fixation","8","Eight (8) pieces did not receive the specified Hydroxyapatite (HA) coating.","09/23/2015","11/02/2015","03/01/2017","11/11/2015","Catalog Number 164-13-09  Serial Numbers: 4076815, 4076816, 4076817, 4076818, 4076819, 4076820, 4076821, and 4076822."
"Devices","No","","72362","Terminated","Baxter Healthcare Corp.","1 Baxter Pkwy","","Deerfield","IL","	60015-4625","United States","Voluntary: Firm initiated","Letter","US Distribution and Internationally to Canada.","Z-0194-2016","Class II","Baxter 15L Cycler Drainage Bag Sterile, nonpyrogenic fluid path","19,440 units","Leakage from the inlet port of the 15L Cycler Drainage Bags.","10/06/2015","10/30/2015","06/27/2016","11/11/2015","H15C11095"
"Devices","No","","72363","Terminated","Alcon Research, Ltd.","6201 South Fwy","","Fort Worth","TX","	76134-2099","United States","Voluntary: Firm initiated","Telephone","Distributed in VT.","Z-0195-2016","Class II","Custom Pak 9319-27.  Single-use medical devices and accessories designed by medical professionals for a specific ophthalmic surgical procedure.","5 units","The recalled lot of custom paks are labeled as latex free and contain latex gloves rather than the specified non-latex gloves.","09/21/2015","10/30/2015","03/24/2016","11/11/2015","1792733H, 1783925H, 1785227H, 1786729H"
"Devices","No","","72384","Terminated","CareFusion 303, Inc.","10020 Pacific Mesa Blvd","","San Diego","CA","	92121-4386","United States","Voluntary: Firm initiated","Letter","Distributed US (nationwide) and in Canada.","Z-0221-2016","Class II","SmartSite Extension Set, Model No. 20029E. Used to administer fluid and medications through a needle or catheter inserted into the patient's artery or vein.","21,000 units","CareFusion is recalling the SmartSite Extension Set due to disconnection and leakage issues.","10/09/2015","11/05/2015","03/02/2017","11/11/2015","Lot No. 15015769, 15035412, 15045950."
"Devices","No","","72390","Terminated","Barco Inc.","3059 Premiere Pkwy","","Duluth","GA","	30097-4905","United States","Voluntary: Firm initiated","Letter","US Distribution to the states of : AZ,  CA, FL, GA, IL, MA, NE, NJ, OH, OR and TX., and Internationally to Canada.","Z-0227-2016","Class II","Surgical Display, Model No. MDSC-2224 (24 inch), Model No. MDSC-2226 (26 inch) and Model No. MDSC-2242 (42 inch)","462 devices in US","User settings were no longer on the monitor's memory after these systems were powered off and back on.","05/28/2015","11/05/2015","03/09/2017","11/11/2015","Model MDSC-2224 (24 inch) with part numbers - K9307916 - 991932387121, K9307919 - 991932387131, K9307912 - 991932387071, K9307913 - 991932387081; Model MDSC-2226 (26 inch) with part numbers - K9307906 - 991932387011, K9307907 - 991932387031, K9307908 - 991932387021, 991932387041, 991932387061, 991932387111, 991932387141, 991932389071, 991932389081, 991932389091; Model MDSC-2242 (42 inch) with part numbers - K9307914 - 991932387091, K9307915 - 991932387101"
"Biologics","No","","72439","Terminated","LifeSouth Community Blood Centers, Inc.","1221 NW 13th St","","Gainesville","FL","	32601-4111","United States","Voluntary: Firm initiated","FAX","Florida","B-0015-16","Class II","Apheresis Red Blood Cells, Leukocytes Reduced","4 units","Apheresis Red Blood Cell products, manufactured with lack of assurance of sterility, were distributed.","09/17/2015","11/04/2015","11/04/2015","11/11/2015","W1151151796166 (double collection); W115115179806V (double collection)"
"Biologics","No","","72440","Terminated","LifeSouth Community Blood Centers, Inc.","1221 NW 13th St","","Gainesville","FL","	32601-4111","United States","Voluntary: Firm initiated","FAX","Florida; Georgia","B-0066-16","Class II","Apheresis Platelets, Leukocytes Reduced","2 units","Apheresis products, in which leuko reduced units did not meet WBC count specifications, were distributed.    ","09/01/2015","10/30/2015","10/30/2015","11/11/2015","W1151151233683 (double collection)"
"Biologics","No","","72441","Terminated","LifeSouth Community Blood Centers Inc","8190 Madison Blvd","","Madison","AL","	35758","United States","Voluntary: Firm initiated","FAX","Alabama","B-0083-16","Class II","Apheresis Platelets, Leukocytes Reduced","1 unit","Apheresis product, in which a leuko reduced unit did not meet WBC count specifications, was distributed.    ","09/16/2015","10/30/2015","10/30/2015","11/11/2015","W115115207414X"
"Biologics","No","","72443","Terminated","Walter Reed National Military Medical Center","8901 Wisconsin Ave","","Bethesda","MD","	20889-5600","United States","Voluntary: Firm initiated","Letter","New Jersey","B-0084-16","Class II","Fresh Frozen Plasma","1 unit","Blood product, collected from a donor for whom donor suitability was not adequately determined, was distributed.  ","08/07/2015","11/04/2015","11/04/2015","11/11/2015","W020012106251"
"Devices","No","","72448","Terminated","GE Medical Systems, LLC","3000 N Grandview Blvd","","Waukesha","WI","	53188-1615","United States","Voluntary: Firm initiated","Letter","Worldwide Distribution - US Distribution including the states of : CA, CO, FL, IL, MI, OH, TX and WI., and to the countries of :  AUSTRIA, BRAZIL, FRANCE, GERMANY, JAPAN, POLAND and TURKEY.  UPDATE 11-4-2015:  Additional states:  AZ, MN.  Additional countries:  Canada, China, Czech Republic, South Africa, and United Kingdom","Z-0196-2016","Class II","MR Surgical Suite II Table, Model Number(s): M8074SS, M8053SS, M0074SS.    UPDATE 11-4-2015:  Model M0001SS","23 (11 US; 12 OUS)  Update 11-4-2015:  35 (14 US; 21 OUS)","GE became aware of an issue with the table transfer release mechanism of the MR Surgical Suite Option.  The issue may prevent patient transfer between the MR and surgical tables.","09/23/2015","10/30/2015","03/28/2016","11/11/2015","Mfg Lot or Serial # System ID  00000304124MR1 904202MR8  00000000UA0116 330344MR750W  00000000UA0117 616267IMRI  UA0326 614293MR9  00000307553MR8 415UCBHMR1  00000000UA0296 309655MR750W  00000000UA0396 713792AMR14  00000012228M63 608263MR4IOR  N/A 614RMHTMR1  N/A 720848MR4  N/A 309655IMRI  00000299229MR5 AH5824MR01  00000014131M67 MRHM0323  00000018480M64 MR307144MR6  00000021158M61 MRHM0885  00000013254M68 082445160014  00001309FMM07L T4185506  DUMFMI60876024 M347028301  00000021695M62 M4194477  00000305145MR5 UC2547MR01  00001219FMM0H1 EM0105  00001105XF5047 PL2853MR01  00001251FMM044 34368MRS01      UPDATE 11-4-2015:    Mfg Lot or Serial # System ID  2 602406IMR  3 507284NMRV  N/A 214820ITABLE  N/A 416369MR3T  000000PTST0008 082427040101  000000PTST0007 082427050024  000000PTST0003 CS1020MR01       N/A CS1006MR03  4 YM1733           000000PTST0010 YM3833  000000PTST0006 ZA2169MR01  000000PTST0005 10590MRS01"
"Devices","No","","72459","Terminated","Bard Peripheral Vascular Inc","1625 W 3rd St","","Tempe","AZ","	85281-2438","United States","Voluntary: Firm initiated","Letter","Nationwide in US","Z-0223-2016","Class II","FLAIR Endovascular Stent Graft, Product Code: FAS08070, FAF08070, Implant Size: 8mmx70mm  The FLAIR Endovascular Stent Graft (implant) is a flexible, self-expanding endoprosthesis comprised of expanded polytetrafluoroethylene (ePTFE) encapsulating a Nitinol stent framework. The FLAIR Endovascular Stent Graft is available in both flared and straight configurations. The distal end of the flared configuration devices are approximately 4mm larger in diameter than the body section.","292 units","Bard Peripheral Vascular (BPV) is recalling the Bard Flair Endovascular Stent Graft because of the harm associated with failure to deploy or deployment related issues that could occur during use.","10/19/2015","11/05/2015","04/12/2016","11/11/2015","Product Code: FAF08070,   Lot No.   ANWJ3216   ANXD0762   ANXI2396   ANYG0316   ANWJ3217   ANXD1279   ANXI3475   ANYG0654   ANWK0056   ANXD1280   ANXJ1793   ANYG1630   ANWK0057   ANXD1641   ANXJ2700   ANYG3413  ANWK0058   ANXD1642   ANXK0641   ANYG3414  ANWK0567   ANXD1643   ANXK3033   ANYH0028  ANWK0568   ANXD1644   ANXL0612   ANYH0029  ANWK0569   ANXD2494   ANXL0947   ANYH0982  ANWK0570   ANXD2495   ANXL1451   ANYH0983  ANWK0571   ANXD2496   ANXL1752   ANYH2304  ANWK0572   ANXD2992   ANXL1865   ANYH3647  ANWK2441   ANXD2993   ANYA0042   ANYI2267  ANWK2442   ANXD2994   ANYA0050   ANYI2914  ANWK2443   ANXE0280   ANYA0933   ANYJ0077  ANWK2444   ANXE0281   ANYA1633   ANYJ1318  ANWK2445   ANXE0282   ANYA2052   ANYJ1833  ANWK3391   ANXE0652   ANYA2370   ANYJ2864  ANWK3809   ANXE0653   ANYA2531   ANYK0724  ANWK3810   ANXE0654   ANYB0456   ANYK1157  ANWL0501   ANXE0655   ANYB1022   ANYK2348  ANWL0502   ANXE1453   ANYB2410   ANYK3056  ANWL0507   ANXE2049   ANYB3171   ANZB1342  ANWL0508   ANXE2050   ANYB3172   ANZC0859  ANWL0509   ANXE3161   ANYB3509  ANXA0088   ANXF0165   ANYB3510  ANXA0089   ANXF0166   ANYC0062  ANXA0924   ANXF1325   ANYC2197  ANXA0925   ANXF1326   ANYD0186  ANXA3026   ANXF2393   ANYD0187  ANXB0438   ANXF2394   ANYD0725  ANXB0439   ANXF2395   ANYD1177  ANXB0440   ANXG0227   ANYD1906  ANXB3276   ANXG1407   ANYD2532  ANXB3277   ANXG2477   ANYD3370  ANXB3278   ANXH1052   ANYE0227  ANXB3279   ANXH1586   ANYE1280  ANXB4024   ANXH1587   ANYE2757  ANXB4025   ANXH2842   ANYE3276  ANXB4026   ANXH3098   ANYF0203  ANXC0523   ANXH3100   ANYF0243  ANXD0758   ANXI0375   ANYF2027  ANXD0759   ANXI1296   ANYF2028  ANXD0760   ANXI1298   ANYF2411  ANXD0761   ANXI2395   ANYF3184          Product Code: FAS08070  Lot No. ANWJ3097   ANXC2796   ANYA0036   ANYK2342  ANWJ3098   ANXC2797   ANYA0037   ANYK3044  ANWJ3099   ANXD0029   ANYA0939   ANZB1349  ANWK0580   ANXD0030   ANYA2054   ANZB1350  ANWK0581   ANXD0031   ANYA2678   ANZB1351  ANWK0582   ANXD0032   ANYA3222  ANWK0583   ANXD2812   ANYB0453  ANWK1097   ANXD4188   ANYB1024  ANWK1098   ANXD4189   ANYB2414  ANWK1099   ANXD4607   ANYB3174  ANWK1100   ANXE1146   ANYB3177  ANWK1101   ANXE1147   ANYB3178  ANWK2446   ANXE1465   ANYC0218  ANWK2447   ANXE1466   ANYC1998  ANWK3392   ANXE3173   ANYC2328  ANWK3393   ANXF0156   ANYD2752  ANWK3394   ANXF1333   ANYD3371  ANWK3570   ANXF2407   ANYE0228  ANWK3571   ANXF2408   ANYE1278  ANWK3572   ANXF2866   ANYE2516  ANWK3811   ANXG0229   ANYE3282  ANWK3812   ANXG1416   ANYF0204  ANWK4023   ANXG2513   ANYF0247  ANWK4024   ANXH1078   ANYF2025  ANWL0504   ANXH1589   ANYF2621  ANWL0505   ANXH3102   ANYF3189  ANWL0506   ANXI0389   ANYG1006  ANWL1086   ANXI1336   ANYG1939  ANXA0679   ANXI2405   ANYG2864  ANXB0898   ANXJ1254   ANYG3426  ANXB0899   ANXJ1795  ANYG3427  ANXB1372   ANXJ2068   ANYG3428  ANXB1373   ANXJ2709   ANYH0039  ANXB1374   ANXJ2710   ANYH3655  ANXB1584   ANXK0651   ANYI0669  ANXB1585   ANXK0652   ANYI0677  ANXB1586   ANXK1600   ANYI1452  ANXB3283   ANXK1601   ANYI2270  ANXB3284   ANXK2564   ANYJ0072  ANXB3285   ANXK3027   ANYJ0085  ANXC1568   ANXL0427   ANYJ1334  ANXC1569   ANXL1186   ANYJ1839  ANXC1871   ANXL1450   ANYJ2873  ANXC1872   ANXL1867   ANYK1155"
"Devices","No","","72463","Terminated","Arrow International Inc","2400 Bernville Rd","","Reading","PA","	19605-9607","United States","Voluntary: Firm initiated","Letter","World Wide Distribution - US including AR, AL, TX, MA, CA, IA, MO, NY, AL, VA, RI, IN, TN, FL, KY, NH, SC, MD, WA, OK, IL, ME, OR, OH, PA, MI, KS, LA, TN, WV, NE, NJ, NV, GA, SD, CT, MS, CO, and Internationally to Canada and Belgium.","Z-0207-2016","Class II","ARROW PICC Kit featuring Chlorag+ard Technology  Midline Catheterization Kit  ARROW Advantage5 Pressure Injectable PICC Kit  Arrow¿ Pressure Injectable Arrow¿ PICC powered by Arrow¿ VPS¿ Stylet  ARROW Pressure Injectable JACC with Chlorag+ard Technology  For short-term or long-term peripheral access to the central venous system for intravenous therapy, blood sampling, infusion, pressure injection of contrast media, and allows for central venous pressure monitoring. Permits venous access to the peripheral circulation. Offers an alternative method of intravenous access for select adult and pediatric patients. The ARROW GlideThru Peel-Away Sheath/Dilator is used for the percutaneous introduction of diagnostic or therapeutic devices into the vasculature.","12,157","Possibility that the catheter peel-away  component hub tabs may prematurely detach when the practitioner begins to peel apart the sheath body from the  catheter. Although the issue does not pose a significant risk to the patient, it may cause a delay of treatment  when placing the catheter.","10/16/2015","11/04/2015","11/09/2017","11/11/2015","Product Codes  ASK-45552-RWJ3 CDC-35541-HPK1A EU-00750-45 PL-00750  AU-00420-MAJO CDC-35541-VPS EU-02041-ML PL-00755  CDC-34041-HPK1A CDC-35552-HPK1A EU-24041-HPMSB PR-35552-HPHNM  CDC-34041-VPS CDC-35552-VPS EU-24052-HPMSB PR-45563-HPHNM  CDC-34052-HPK1A CDC-41563-JX1A EU-25041-HPMSB UK-00420-MID  CDC-34052-VPS CDC-44041-HPK1A EU-25052-HPMSB UK-00420-RCHT  CDC-35041-HPK1A CDC-44052-HPK1A EU-25063-HPMSB UK-00420-THT  CDC-35041-VPS CDC-44063-HPK1A EU-25541-HPMSB UK-04041-RDEH  CDC-35052-HPK1A CDC-45063-HPK1A EU-25552-HPMSB UK-05041-MSB  CDC-35052-VPS CDC-45563-HPK1A IB-01652 UK-05041-RDEH  CDC-35063-HPK1A EU-00740-45 PL-00740 UK-05052-RCHT"
"Biologics","No","","72464","Terminated","Gulf Coast Regional Blood Center","1400 La Concha Ln","","Houston","TX","	77054-1802","United States","Voluntary: Firm initiated","FAX","Texas","B-0089-16","Class II","Apheresis Platelets, Leukocytes Reduced","1 unit","Apheresis product, in which quailty control was not performed on a  leukocyte reduced unit, was distributed.    ","09/07/2015","11/04/2015","11/04/2015","11/11/2015","W044615367818"
"Biologics","No","","72465","Terminated","Our Lady Of The Lake Hospital Inc","Attn: Blood Bank","5000 Hennessy Blvd","Baton Rouge","LA","	70808-4375","United States","Voluntary: Firm initiated","FAX","Louisiana","B-0088-16","Class II","Red Blood Cells, Leukocytes Reduced","1 unit","Blood product, for which the deferral screening process was incorrectly performed, was distributed.","10/05/2015","11/04/2015","11/04/2015","11/11/2015","W165714019474O"
"Devices","No","","72472","Terminated","GE Healthcare","540 W Northwest Hwy","","Barrington","IL","	60010-3051","United States","Voluntary: Firm initiated","Letter","Worldwide Distribution-US (nationwide) including the states of  AZ, CA, CO, DE, FL, GA, IA, IL, IN, LA, MA, MI, MN, MO, NJ, NY, OR, PA, SC, SD, TN, TX, VA, WA, WI and WV, and the countries of Australia, Austria, Bangladesh, Belgium, Brazil, Canada, Chile, China, Ecuador, France, Germany, Ghana, Hong Kong, India, Israel, Italy, Japan, Kenya, Korea, Malta, Malaysia, Namibia, Netherlands, Saudi Arabia, Singapore, South Africa, Spain, Sweden, Switzerland, Turkey, Taiwan, United Arab Emirates, United Kingdom and Venezuela.","Z-0225-2016","Class II","The Centricity PACS-IW with Universal Viewer is a device that displays medical images (including mammograms) and data from various imaging sources. Images and data can be viewed, communicated, processed and displayed within the system or across computer networks at distributed locations. Typical users of this system are trained professionals, including but not limited to radiologists, physicians, nurses, medical technicians, and assistants.","Centricity PACS-IW with Universal Viewer Versions 5.0 SP2 and higher 1052 units","Inaccurate distance measurements with magnified projection X-ray images.","09/28/2015","11/05/2015","04/11/2018","11/11/2015","2067131-001DVD UNIVERSAL VIEWER 5.0 - WEB CLIENT"
"Devices","No","","72472","Terminated","GE Healthcare","540 W Northwest Hwy","","Barrington","IL","	60010-3051","United States","Voluntary: Firm initiated","Letter","Worldwide Distribution-US (nationwide) including the states of  AZ, CA, CO, DE, FL, GA, IA, IL, IN, LA, MA, MI, MN, MO, NJ, NY, OR, PA, SC, SD, TN, TX, VA, WA, WI and WV, and the countries of Australia, Austria, Bangladesh, Belgium, Brazil, Canada, Chile, China, Ecuador, France, Germany, Ghana, Hong Kong, India, Israel, Italy, Japan, Kenya, Korea, Malta, Malaysia, Namibia, Netherlands, Saudi Arabia, Singapore, South Africa, Spain, Sweden, Switzerland, Turkey, Taiwan, United Arab Emirates, United Kingdom and Venezuela.","Z-0226-2016","Class II","The Centricity Universal Viewer Version is a device that displays medical images (including mammograms) and data from various imaging sources. Images and data can be viewed, communicated, processed and displayed within the system or across computer networks at distributed locations. Typical users of this system are trained professionals, including but not limited to radiologists, physicians, nurses, medical technicians, and assistants.","Centricity Universal Viewer versions 6.0 and higher 5 units","Inaccurate distance measurements with magnified projection X-ray images.","09/28/2015","11/05/2015","04/11/2018","11/11/2015","2088034-001 DVD UNIVERSAL VIEWER 6.0 - WEB CLIENT"
"Food","No","","72485","Terminated","Krispy Kreme Doughnut Corporation","380 Knollwood St Ste M","","Winston Salem","NC","	27103-1865","United States","Voluntary: Firm initiated","Two or more of the following: Email, Fax, Letter, Press Release, Telephone, Visit","GA","F-0138-2016","Class II","Krispy Kreme Doughnuts, Chocolate Iced Doughnuts with Kreme Filling, 2 count, Net Wt. 4.65oz, and Half Dozen, Net Wt. 16.2 oz., Manufactured under the authority of Krispy Kreme Doughnut Corporation, Winston Salem, NC 27102.","14,966 doughnuts","Finished product may contain foreign matter (glass).","10/15/2015","11/05/2015","02/01/2017","11/11/2015","Lot code: 10/18/15."
"Food","No","","72485","Terminated","Krispy Kreme Doughnut Corporation","380 Knollwood St Ste M","","Winston Salem","NC","	27103-1865","United States","Voluntary: Firm initiated","Two or more of the following: Email, Fax, Letter, Press Release, Telephone, Visit","GA","F-0139-2016","Class II","Krispy Kreme Doughnuts, Glazed Doughnuts with Kreme Filling, Half Dozen Net Wt. 16 oz, Manufactured under the authority of Krispy Kreme Doughnut Corporation, Winston Salem, NC 27102.","","Finished product may contain foreign matter (glass).","10/15/2015","11/05/2015","02/01/2017","11/11/2015","Lot code: 10/18/15."
"Food","No","","72485","Terminated","Krispy Kreme Doughnut Corporation","380 Knollwood St Ste M","","Winston Salem","NC","	27103-1865","United States","Voluntary: Firm initiated","Two or more of the following: Email, Fax, Letter, Press Release, Telephone, Visit","GA","F-0140-2016","Class II","Krispy Kreme Doughnuts, Chocolate Iced Custard Filled Doughnuts, 2 count, Net Wt. 4.65oz, and Half Dozen, Net Wt. 16.2 oz., Manufactured under the authority of Krispy Kreme Doughnut Corporation, Winston Salem, NC 27102.","","Finished product may contain foreign matter (glass).","10/15/2015","11/05/2015","02/01/2017","11/11/2015","Lot code: 10/18/15."
"Food","No","","72485","Terminated","Krispy Kreme Doughnut Corporation","380 Knollwood St Ste M","","Winston Salem","NC","	27103-1865","United States","Voluntary: Firm initiated","Two or more of the following: Email, Fax, Letter, Press Release, Telephone, Visit","GA","F-0141-2016","Class II","Krispy Kreme Doughnuts, Glazed Raspberry Filled Doughnuts, 2 count, Net Wt. 4.65oz, and Half Dozen, Net Wt. 16 oz., Manufactured under the authority of Krispy Kreme Doughnut Corporation, Winston Salem, NC 27102.","","Finished product may contain foreign matter (glass).","10/15/2015","11/05/2015","02/01/2017","11/11/2015","Lot code: 10/18/15."
"Food","No","","72485","Terminated","Krispy Kreme Doughnut Corporation","380 Knollwood St Ste M","","Winston Salem","NC","	27103-1865","United States","Voluntary: Firm initiated","Two or more of the following: Email, Fax, Letter, Press Release, Telephone, Visit","GA","F-0142-2016","Class II","Krispy Kreme Doughnuts, Glazed Lemon Filled Doughnuts, (2 count, Net Wt. 4.65oz and Half Dozen, Net Wt. 16oz), Manufactured under the authority of Krispy Kreme Doughnut Corporation, Winston Salem, NC 27102.","","Finished product may contain foreign matter (glass).","10/15/2015","11/05/2015","02/01/2017","11/11/2015","Lot code: 10/18/15."
"Food","No","","72485","Terminated","Krispy Kreme Doughnut Corporation","380 Knollwood St Ste M","","Winston Salem","NC","	27103-1865","United States","Voluntary: Firm initiated","Two or more of the following: Email, Fax, Letter, Press Release, Telephone, Visit","GA","F-0143-2016","Class II","Krispy Kreme Doughnuts, Signature Doughnuts, Half Dozen, Net Wt. 9.5oz, Manufactured under the authority of Krispy Kreme Doughnut Corporation, Winston Salem, NC 27102.","","Finished product may contain foreign matter (glass).","10/15/2015","11/05/2015","02/01/2017","11/11/2015","Lot code: 10/18/15."
"Food","No","","72485","Terminated","Krispy Kreme Doughnut Corporation","380 Knollwood St Ste M","","Winston Salem","NC","	27103-1865","United States","Voluntary: Firm initiated","Two or more of the following: Email, Fax, Letter, Press Release, Telephone, Visit","GA","F-0144-2016","Class II","Krispy Kreme Doughnuts, Original Glazed Doughnuts, 2 count, Net Wt. 3.5 oz., Half Dozen, Net Wt. 9.4oz and One Dozen, Net Wt. 18.7 oz., Manufactured under the authority of Krispy Kreme Doughnut Corporation, Winston Salem, NC 27102.","","Finished product may contain foreign matter (glass).","10/15/2015","11/05/2015","02/01/2017","11/11/2015","Lot code: 10/18/15."
"Food","No","","72485","Terminated","Krispy Kreme Doughnut Corporation","380 Knollwood St Ste M","","Winston Salem","NC","	27103-1865","United States","Voluntary: Firm initiated","Two or more of the following: Email, Fax, Letter, Press Release, Telephone, Visit","GA","F-0145-2016","Class II","Krispy Kreme Doughnuts, Chocolate Iced Glazed Doughnuts, 2 count, Net Wt. 3.5 oz., and Half Dozen, Net Wt. 12 oz., Manufactured under the authority of Krispy Kreme Doughnut Corporation, Winston Salem, NC 27102.","","Finished product may contain foreign matter (glass).","10/15/2015","11/05/2015","02/01/2017","11/11/2015","Lot code: 10/18/15."
"Food","No","","72485","Terminated","Krispy Kreme Doughnut Corporation","380 Knollwood St Ste M","","Winston Salem","NC","	27103-1865","United States","Voluntary: Firm initiated","Two or more of the following: Email, Fax, Letter, Press Release, Telephone, Visit","GA","F-0146-2016","Class II","Krispy Kreme Doughnuts, Original Glazed Doughnut Holes, 2 count, Net Wt. 6.9 oz., Manufactured under the authority of Krispy Kreme Doughnut Corporation, Winston Salem, NC 27102.","","Finished product may contain foreign matter (glass).","10/15/2015","11/05/2015","02/01/2017","11/11/2015","Lot code: 10/18/15."
