"Devices","No","","66461","Terminated","Invacare Corporation","1200 Taylor St","","Elyria","OH","	44035-6248","United States","Voluntary: Firm initiated","Letter","Worldwide Distribution - USA including PA and Internationally to Canada.","Z-0167-2014","Class II","Aquatec Ocean VIP, Aquatec Ocean Dual-VIP, Aquatec Ocean E-VIP mobile shower and toilet commode with tilting function.     Mobile shower and toilet commode with tilting function","538 (US only) 3317 (Total)","The snap-on fixtures of the backrest cushion on the Mobile Shower and Toilet Commode Aquatec Ocean VIP and Ocean Dual VIP do not withstand a required pull out force of 500 N, when the product is used in a reclined position and or tilted position. This may result in the snap-on fixture coming unlatched.","08/31/2013","11/05/2013","09/15/2014","11/13/2013","The following model and serial numbers were affected by this recall:    Aquatec Ocean VIP Model number: 1470793  Serial numbers: 14541797; 14541800; 14541803; 14541804; 14541805; 14541806; 14541807; 14541808; 14541809; 14541810; 14541812; 14541820; 14541821; 14541822; 14541823; 14541825; 14541836; 14541837; 14541838; 14541839; 14541841; 14541842; 14541886; 14541918; 14541931; 14541937; 14541940; 14541941; 14541942; 14541944; 14541967; 14542408; 14542416; 14542418; 14542424; 14542435; 14542436; 14542437; 14542450; 14542451; 14542460; 14542462; 14542464; 14542468; 14542469; 14542472; 14542613; 14542614; 14542616; 14542652; 14542688; 14542689; 14542692; 14542693; 14542694; 14542695; 14542696; 14542700; 14542705; 14542712; 14542713; 14542714; 14542725; 14542734; 14542737; 14542738; 14542739; 14542750; 14542878; 14542879; 14542880; 14542885; 14542960; 14542967; 14542969; 14542970; 14543048; 14543050; 14543053; 14543055; 14543059; 14543064; 14543068; 14543077; 14543086; 14543087; 14543089; 14543090; 14543091; 14543092; 14543093; 14543094; 14543095; 14543096; 14543097; 14543101; 14543106; 14543107; 14543110; 14543111; 14543112; 14543113; 14543114; 14543115; 14543117; 14543118; 14543122; 14543124; 14543125; 14543126; 14543128; 14543129; 14543130; 14543131; 14543132; 14543133; 14543134; 14543136; 14543138; 14543139; 14543144; 14543147; 14543150; 14543151; 14543155; 14543156; 14543159; 14543160; 14543164; 14543165; 14543168; 14543171; 14543172; 14543173; 14543176; 14543177; 14543178; 14543180; 14543181; 14543182; 14543183; 14543185; 14543187; 14543191; 14543192; 14543193; 14543196; 14543199; 14545700; 14545701; 14545704; 14545706; 14545708; 14545709; 14545710; 14545711; 14545713; 14545715; 14545716; 14545717; 14545718; 14545719; 14545720; 14545721; 14545722; 14545723; 14545724;14545725; 14545727; 14545730; 14545731; 14545732; 14545733; 14545734; 14545735; 14545736; 14545737; 14545738; 14545739; 14545740; 14545741; 14545742; 14545743; 14545744; 14545745; 14545746; 14545747; 14546178; 14546179; 14546180; 14546181; 14546182; 14546183; 14546184; 14546185; 14546186; 14546187; 14546188; 14546189; 14546193; 14546194; 14546195; 14546198; 14546199; 14546200; 14546202; 14546203; 14546204; 14546205; 14546206; 14546207; 14546208; 14546209; 14546210; 14546212; 14546213; 14546216; 14546217; 14546233; 14546234; 14546238; 14546239; 14546240; 14546241; 14546255; 14546261; 14546262; 14546271; 14546314; 14546334; 14546336; 14546339; 14546340; 14546343; 14546345; 14546346; 14546349; 14546356; 14546366; 14546382; 14546383; 14546409; 14546410; 14546411; 14546415; 14546424; 14546431; 14546436; 14546438; 14546448; 14546450; 14546452; 14546453; 14546466; 14546468; 14546469; 14546470; 14546471; 14546472; 14546473; 14546474; 14546475; 14546476; 14546477; 14546478; 14546479; 14546480; 14546481; 14547312; 14546902; 14546903; 14546906; 14546911; 14546914; 14546917; 14546918; 14546920; 14546923; 14546930; 14546931; 14546939; 14546940; 14546942; 14546943; 14546944; 14546950; 14546952; 14546953; 14546954; 14546955; 14546956; 14546962; 14546964; 14546965; 14546968; 14546969; 14546970; 14546971; 14546972; 14546973; 14546974; 14546975; 14546976; 14546977; 14546978; 14546979; 14546980; 14546981; 14546982; 14546983; 14546984; 14546985; 14546986; 14546987; 14546988; 14546989; 14546990; 14546991; 14546992; 14546993; 14546994; 14546995; 14546996; 14547000; 14547003; 14547004; 14547006; 14547007; 14547008; 14547010; 14547012; 14547013; 14547015; 14547016; 14547019; 14547022; 14547027; 14547033; 14547034; 14547035; 14547224; 14547225; 14547227; 14547228; 14547230; 14547232; 14547235; 14547237; 14547239; 14547240; 14547242; 14547247; 14547249; 14547251; 14547253; 14547256; 14547259; 14547260; 14547261; 14547264; 14547266; 14547267; 14547271; 14547272; 14547273; 14547274; 14547283; 14547285; 14547286; 14547289; 14547291; 14547292; 14547293; 14547294; 14547295; 14547296; 14547300; 14547302; 14547309; 14547315; 14547317; 14547318; 14547324; 14547326; 14547332; 14547339; 14547340; 14 547341; 14547345; 14547522; 14547523; 14547527; 14547538; 14547539; 14547540; 14547541; 14547543; 14547544; 14547545; 14547546; 14547553; 14547557; 14547558; 14547559; 14547560; 14547562; 14547563; 14547565; and 14547566.     Aquatec Ocean E-VIP Model number: 1471208  Serial numbers: 13A04000420; 13A04000421; 13A04005696; 13A04005697; 13A04005698; 13A04006199; and 13A04006200.     Aquatec Ocean Dual-VIP Model number: 1525707  Serial numbers: 14543203; 14543207; 14543209; 14543211; 14543213; 14543214; 14543215; 14543216; 14543217; 14543219; 14543225; 14543227; 14543231; 14543232; 14543233; 14543234; 14543235; 14543236; 14543237; 14543239; 14543240; 14543241; 14543242; 14543243; 14543244; 14543245; 14543246; 14543248; 14543249; 14543250; 14543251; 14543252; 14543255; 14543256; 14543266; 14543267; 14543268; 14543345; 14543346; 14543347; 14543348; 14543349; 14543350; 14543351; 14543352; 14543353; 14543354; 14543355; 14543356; 14543357; 14543358; 14543359; 14543360; 14543361; 14543362; 14543363; 14543364; 14543390; 14543392; 14543395; 14543402; 14543405; 14543457; 14543458; 14543459; 14543460; 14543461; 14543462; 14543463; 14543464; 14543465; 14543466; 14543467; 14543468; 14543469; 14543470; 14543471; 14543472; 14543473; 14543474; 14543475; 14543476; 14543523; 14543525; 14543526; 14543527; 14543528; 14543529; 14543530; 14543531; 14543532; 14543533; 14543534; 14543539; 14543540; 14543541; 14543542; 14543543; 14543544; 14543545; 14543547; 14543548; 14543596; 14543597; 14543598; 14543599; 14543600; 14543601; 14543602; 14543566; 14543571; 14543572; 14543573; 14543574; 14543575; 14543577; 14543578; 14543584; 14543585; 14543591; 14543592; and 14543595."
"Devices","No","","66464","Terminated","Sorin Group Deutschland GmbH","Lindberghstrasse 25","","Munchen","","	","Germany","Voluntary: Firm initiated","Letter","Worldwide Distribution - USA including WA, NY, VA, TN, SC, TX, CA, CO, MA, WI, MD, AL, ND, and Puerto Rico and Internationally to Italy, Finland, Germany, Sweden, and Great Britain.","Z-0142-2014","Class II","S5 Heart-lung machine, Stockert S5 System.  Catalogue No: 48-30/40/50-00.    The Stockert S5 System is intended to be used during cardiopulmonary bypass for procedures lasting six(6) hours or less.","84","Sorin Group is recalling certain models of S5 Perfusion Systems due to malfunction of cardioplegia control.","09/24/2013","11/04/2013","07/10/2014","11/13/2013","Serial Numbers: 48E00235,48E00339,48E00342,48E01753,48E02767,48E02753,48E02745,48E02746,48E02748,48E02416,48E01033,480E1038,48E01040,48E01041,48E01043,48E01044,48E01051,48E02631,48E01183,48E02758,48E02764,48E01832,48E01834,48E02278,48E02722,48E02732,48E02326,48E02797,48E02793,48E02791,48E02781,48E02785,48E02786,48E02783,48E02772,48E02802,48E02778,48E02784,48E02788,48E02789,48E02779,48E02792,48E02790,48E02771,48E02773,48E02776,48E02799,48E02801"
"Devices","No","","66465","Terminated","Ethicon Endo-Surgery Inc","4545 Creek Rd","","Cincinnati","OH","	45242-2803","United States","Voluntary: Firm initiated","Letter","Worldwide Distribution: USA (nationwide) including the states of: Alabama, Connecticut, Indiana, Michigan, North Carolina, South Carolina, Alaska, Delaware, Kansas, Minnesota, Ohio, Tennessee, Arizona, Florida, Kentucky, Mississipp,i Oklahoma, Texas, Arkansas, Georgia, Louisiana, Nebraska, Oregon, Virginia, California, Idaho, Maryland, Nevada, Pennsylvania, Washington, Colorado, Illinois, Massachusetts, New Jersey, Rhode Island, and West Virginia; and the countries of: Argentina, France, Malaysia, Spain, Australia, Georgia, Martinique, Sweden, Belgium, Germany, Mexico, Switzerland, Brazil, Greece, Netherland, Taiwan, Chile, Hungary, Panama, Tunisia, China, India, Philippines, United Arab Emirates, Czech Republic, Israel, Poland, United Kingdom, Egypt, Italy, Portugal, Venezuela, Estonia, Kenya, Russia, Finland, Kuwait, and Saudi Arabia.","Z-0149-2014","Class II","Adjustable Gastric Band, packaged alone in transparent PETG inner and outer blisters with Tyvek lids, or in various kit configurations with one band per kit.    Product Usage:  Intended for use in surgical treatment of morbid obesity  ","Product codes: RLZB22 - 2,352 units; RLZB22D1 - 968 units; RLZB22DG1 - 327 units; RLZB22DGT - 20 units; RLZB22DT - 48 units; RLZB22T - 0 units","During aging studies, the firm determined that the gastric belts were unable to pass the test requirements established for Force to Lock.","09/30/2013","11/04/2013","03/26/2014","11/13/2013","The following product code and lot numbers were affected by this recall: Product Codes: RLZB22  Lot Numbers: ZJKBK6, ZJLBBR, ZJLBBT, ZJLBBV, ZJMBB5, ZJMBCG, ZJMBCH, ZJMBCJ, ZJMBCK, ZJMBCL, ZJMBJC, ZJMBJD, ZJMBJF, ZJPBD1, ZJPBD2, ZJPBFT, ZJPBFV, ZKBBCC, ZKBBCD, ZKBBCF, ZKBBCG, ZKBBGC, ZKBBGD, ZKBBGJ, ZKBBJN, ZKBBNV, ZKBBNW, ZKBBNY, ZKCBBK, ZKCBDD, ZKCBJJ, ZKMBK4, ZKMBKP, ZKNBBB, ZKNBCL, ZLBBCH, ZLBBFJ, ZLBBFL, ZLCBCB, ZLCBD8, ZLDBCZ, ZLDBDM, ZLDBDV, ZLFBF7, ZLFBFB, ZLLBCR, ZLLBFT, ZLMBCH, ZLMBWD, ZLNBBF, ZLNBGZ, ZMCBDH, ZMDBCH, ZMFBC4, ZMGBBF, ZMGBC1, ZMHBBW, ZMJBHV, ZMKBBH, ZMLBCJ, ZMNBCK, ZNBBD2, ZNFBCC, ZNHBCM, and ZNLBB4.     Product Codes: RLZB22D1  Lot Numbers: G4TA93, G4TC3R, G4TD5R, G4TF1X, G4TG22, G4TK21, G4TL1D, G4TM3L, G4TM84, G4TP0W, G4TT4D, G4TU2V, G4TV3T, G4TW6D, G4U17U, G4U75W, G4U795, G4UD6T, G4UF6Y, G4UG4E, G4UH49, G4UH4K, H43A3N, H43C8P, H43E9V, H43J2P, H43N12, H43N42, H43P5U, H43P9C, H43T3F, H43U78, H43V8J, H43X4K, H43Z8Y, H4453N, H44623, H4478W, H44965, H44C9G, H44D8W, H44K3G, H44K9M, H44N0X, H44R1Y, H44R4U, H44T9D, H44V39, H44W6H, H44Y24, H44Z0Y, J4A04D, J4A11V, J4A274, J4A668, J4A81X, J4A96M, J4AC6L, J4AE3P, J4AH2Z, J4AK89, J4AN34, J4AU9R, J4AW1Y, J4C35K, J4C76E, J4CE9V, K4C518, K4CE4L, K4CT8W, K4D17T, and K4D45Y.     Product Codes: RLZB22DG1  Lot Numbers: G4TH90, G4TJ61, G4TP6J, G4TR76, G4TV48, G4TX1V, G4U184, G4U734, G4UD77, G4UF9V, G4UH6P, H43A3P, H43C8R, H43G7Y, H43T3K, H43U7E, H43X1G, H43Z5Y, H44645, H44H9M, H44K2T, H44L44, H44V3A, H44W6G, H44Y25, H44Z0X, H44Z3N, J4A48K, J4AA11, J4AL00, J4AR9K, and K4CE6X .    Product Codes: RLZB22DGT  Lot Numbers: G4U323, J4AY55, and K4C663.     Product Codes: RLZB22DT  Lot Numbers: G4UD92, H44D1Y, J4AY72, and K4C666.     Product Codes: RLZB22T  Lot Numbers: G4RE82"
"Devices","No","","66465","Terminated","Ethicon Endo-Surgery Inc","4545 Creek Rd","","Cincinnati","OH","	45242-2803","United States","Voluntary: Firm initiated","Letter","Worldwide Distribution: USA (nationwide) including the states of: Alabama, Connecticut, Indiana, Michigan, North Carolina, South Carolina, Alaska, Delaware, Kansas, Minnesota, Ohio, Tennessee, Arizona, Florida, Kentucky, Mississipp,i Oklahoma, Texas, Arkansas, Georgia, Louisiana, Nebraska, Oregon, Virginia, California, Idaho, Maryland, Nevada, Pennsylvania, Washington, Colorado, Illinois, Massachusetts, New Jersey, Rhode Island, and West Virginia; and the countries of: Argentina, France, Malaysia, Spain, Australia, Georgia, Martinique, Sweden, Belgium, Germany, Mexico, Switzerland, Brazil, Greece, Netherland, Taiwan, Chile, Hungary, Panama, Tunisia, China, India, Philippines, United Arab Emirates, Czech Republic, Israel, Poland, United Kingdom, Egypt, Italy, Portugal, Venezuela, Estonia, Kenya, Russia, Finland, Kuwait, and Saudi Arabia.","Z-0150-2014","Class II","Adjustable Gastric Band, packaged alone in transparent PETG inner and outer blisters with Tyvek lids.    Product Usage:  Intended for use in surgical treatment of morbid obesity  ","Product Code: 2200-X - 2,475 units","During aging studies, the firm determined that the gastric belts were unable to pass the test requirements established for Force to Lock.","09/30/2013","11/04/2013","03/26/2014","11/13/2013","The following product code and lot numbers were affected by this recall: Product Codes: 2200-X  Lot Numbers:  ZLGBC5, ZLNBCW, ZLNBJC, ZLPBB9, ZMBBBB, ZMCBBC, ZMGBCJ, ZMHBBT, ZMHBCV, ZMLBD0, ZMMBCD, ZMPBBC, ZNCBC6, ZNGBB3, and ZNGBBF."
"Devices","No","","66465","Terminated","Ethicon Endo-Surgery Inc","4545 Creek Rd","","Cincinnati","OH","	45242-2803","United States","Voluntary: Firm initiated","Letter","Worldwide Distribution: USA (nationwide) including the states of: Alabama, Connecticut, Indiana, Michigan, North Carolina, South Carolina, Alaska, Delaware, Kansas, Minnesota, Ohio, Tennessee, Arizona, Florida, Kentucky, Mississipp,i Oklahoma, Texas, Arkansas, Georgia, Louisiana, Nebraska, Oregon, Virginia, California, Idaho, Maryland, Nevada, Pennsylvania, Washington, Colorado, Illinois, Massachusetts, New Jersey, Rhode Island, and West Virginia; and the countries of: Argentina, France, Malaysia, Spain, Australia, Georgia, Martinique, Sweden, Belgium, Germany, Mexico, Switzerland, Brazil, Greece, Netherland, Taiwan, Chile, Hungary, Panama, Tunisia, China, India, Philippines, United Arab Emirates, Czech Republic, Israel, Poland, United Kingdom, Egypt, Italy, Portugal, Venezuela, Estonia, Kenya, Russia, Finland, Kuwait, and Saudi Arabia.","Z-0151-2014","Class II","Adjustable Gastric Band, packaged alone in transparent PETG inner and outer blisters with Tyvek lids.    Product Usage:  Intended for use in surgical treatment of morbid obesity  ","Product Code: BD2XV - 1,248 units","During aging studies, the firm determined that the gastric belts were unable to pass the test requirements established for Force to Lock.","09/30/2013","11/04/2013","03/26/2014","11/13/2013","The following product code and lot numbers were affected by this recall: Product Codes: BD2XV  Lot Numbers: ZJMBB4, ZJMBN9, ZJNBBV, ZKDBM6, ZKDBM7, ZKFBDC, ZKGBDY, ZKHBBJ, ZKHBCR, ZKHBFG, ZKNBCK, ZKNBHC, ZLBBFK, ZLDBB8, ZLFBBC, ZLFBGG, ZLGBFV, ZLGBG5 , ZLJBCL, ZLMBBD, ZLMBYF, ZLNBCH, ZMBBGJ, ZMCBDL, ZMFBCT, ZMGBDF, ZMKBCG, ZNBBBB, and ZNCBBB."
"Devices","No","","66475","Terminated","Mesa Laboratories, Inc.","12100 W 6th Ave","","Lakewood","CO","	80228-1252","United States","Voluntary: Firm initiated","Letter","Worldwide Distribution-USA (nationwide) and the country of  Canada.","Z-0175-2014","Class II","pH 7.0 Buffer Solution Pint and Quart Bottles, Part Number 02.0030 for Pints and 02.0031 for Quarts. Packaged in Plastic Bottles.  Can be sold individually or in cartons with 6 bottles per box (for quart bottles only).    Used in the hemodialysis setting to calibrate pH meters.","58,466 bottles","Mesa Laboratories, Inc. is recalling certain lots of pH 7.0 Buffer Solution due to mold growth.","09/13/2013","11/07/2013","08/08/2016","11/13/2013","ML-P7-1110 Exp NOV 11 2013, ML-P7-1118 Exp JAN 12 2014, ML-P7-1122 Exp FEB 23 2014, ML-P7-1128  Exp APR 17 2014, ML-P7-1137 Exp JUN 17 2014, ML-P7-1138 Exp JUL 4 2014, ML-P7-1148 Exp SEP 14 2014, ML-P7-1149 Exp SEP 19 2014, ML-P7-1158 Exp DEC 7 2014, ML-P7-1164 Exp JAN 19 2015"
"Devices","No","","66504","Terminated","EKOS Corporation","11911 N Creek Pkwy S","","Bothell","WA","	98011-8809","United States","Voluntary: Firm initiated","E-Mail","Worldwide Distribution in Germany only.","Z-0133-2014","Class II","The EkoSonic Endovascular System employs high frequency (2-2.5 MHz), low power (0.585 watt average power per transducer) ultrasound to facilitate the delivery of physician-specified fluids in the peripheral vasculature and to deliver solutions into the pulmonary arteries.    The EkoSonic Endovascular System is intended for the controlled and selective infusion of physician-specified fluids, including thrombolytics, into the peripheral vasculature and the infusion of solutions into the pulmonary arteries. The reusable EKOS EkoSonic Control Unit provides power to the system and the user interface for operator control. A reusable, non sterile Connector Interface Cable connects the EKOS EkoSonic Control Unit to the EkoSonic Endovascular Device.","one unit","The EkoSonic Control Unit is recalled because it had the incorrect power entry module installed.  It is missing an AC filter to reduce the noise and electrical interference.","10/02/2013","11/01/2013","11/22/2013","11/13/2013","PT3B-783.     PT3B represents the model number. Adding 783 creates the serial number."
"Devices","No","","66526","Terminated","Intuitive Surgical, Inc.","1266 Kifer Rd Bldg 100","","Sunnyvale","CA","	94086-5304","United States","Voluntary: Firm initiated","Visit","Worldwide Distribution - USA including Puerto Rico and the countries of  Australia, Austria, Argentina, Belgium, Bulgaria, Brazil, Canada, Chile, China, Czech Republic, Denmark, Egypt, Finland, France, Germany, Greece, India, Indonesia, Ireland, Israel, Japan, Kuwait, Mexico, Netherlands, Norway, Pakistan, Panama, Philippines, Poland, Portugal, Qatar, Romania, Russia, Saudi Arabia, Singapore, Slovakia, Slovenia, South Korea, Spain, Sweden, Switzerland, Taiwan, Thailand, Turkey, United Kingdom, Uruguay and Venezuela.","Z-0139-2014","Class II","Patient Cart used in conjunction with the da Vinci S surgical and SI System.    Intuitive Surgical  1266 Kifer Road  Sunnyvale, CA 94086    The Patient Side Cart (PSC) is a robotic platform used for da Vinci Surgery. It is the operative component for both da Vinci systems and its primary function is to support he instrument arms and camera arm. It uses remote center technology. The remote center is a fixed point in space around which the Patient Cart arms move. Remote center technology enables the system to maneuver instruments and endoscopes in the surgical site while exerting minimal force on the patient body wall. The Patient Cart works in the sterile field, assisting the Surgeon Console operator by exchanging instruments and endoscopes, and by performing other patient-side activities. To help ensure patient safety, the action of the Patient Cart operator take precedence over actions of the Surgeon Console operator.","1754 patient carts","Increased number of complaints regarding fluid entering the patient card base of the da Vinci S and SI systems.","12/11/1930","11/04/2013","11/04/2013","11/13/2013","Model IS2000 and IS 3000"
"Devices","No","","66532","Terminated","Medtronic Vascular, Inc.","3576 Unocal Pl","","Santa Rosa","CA","	95403-1774","United States","Voluntary: Firm initiated","Letter","Nationwide Distribution.","Z-0154-2014","Class II","Resolute Integrity Zotarolimus-eluting Coronary Stent:  Stent ID 3.0 mm; Stent length 34 mm; Rx, Sterile.  Mfg in Medtronic Ireland, Galaway, Ireland. Distributed by: Medtronic Inc.  Minneapolis, MN.    Indicated for improving coronary luminal diameters in patients.","201 units","A small number of units in lot number 0006573585 of the Resolute Integrity Zotarolimus-Eluting Coronary Sten System may contain a compliance chart incorrectly referencing a 2.25 mm diameter instead of the correct 3.0mm.","10/07/2013","11/05/2013","02/11/2014","11/13/2013","Model: RSINT30034UX;   Customer Facing Number: RSIST30034UX.  Expiration date: 25 May 2014."
"Devices","No","","66545","Terminated","Smith & Nephew Inc","1450 E. Brooks Rd","","Memphis","TN","	38116","United States","Voluntary: Firm initiated","Two or more of the following: Email, Fax, Letter, Press Release, Telephone, Visit","USA Nationwide Distribution in the states of: AZ, NC, IA, PA, OH, MD, and TN.","Z-0130-2014","Class II","GENESIS(R) II, NON-POROUS TIBIAL BASE, SIZE 5, LEFT, QTY: (1), REF 71420168.    Product Usage:  orthopaedic","4 units","Swapped product.  Non-porous tibial base size 5 L was mis-packaged as size 6 R and vice versa.","10/07/2013","11/01/2013","08/23/2016","11/13/2013","Batch No. 13GM11272"
"Devices","No","","66545","Terminated","Smith & Nephew Inc","1450 E. Brooks Rd","","Memphis","TN","	38116","United States","Voluntary: Firm initiated","Two or more of the following: Email, Fax, Letter, Press Release, Telephone, Visit","USA Nationwide Distribution in the states of: AZ, NC, IA, PA, OH, MD, and TN.","Z-0131-2014","Class II","GENESIS(R) II, NON-POROUS TIBIAL BASE, SIZE 6, RIGHT, QTY: (1), REF 71420188.    Product Usage:  orthopaedic","4 units","Swapped product.  Non-porous tibial base size 5 L was mis-packaged as size 6 R and vice versa.","10/07/2013","11/01/2013","08/23/2016","11/13/2013","Batch No. 13GM09505"
"Food","No","","66564","Terminated","Threshold Enterprises Ltd","23 Janis Way","","Scotts Valley","CA","	95066-3506","United States","Voluntary: Firm initiated","Letter","The product was distributed Nationwide.","F-0100-2014","Class II","Serene Science/Source Naturals brand GABA (Gamma-Aminobutyric Acid), CALM MIND, A dietary supplement,   45 Tablets, Item #: SN0237;  90 Tablets, Item #: SN0240;  180 Tablets, Item #: SN0268;    Product label states, ""manufactured for Source Naturals, Inc., P.O. Box 2118, Santa Cruz, CA 95062""; and distributed by Threshold Enterprises, Ltd, Scotts Valley, CA;     The product is actually manufactured by a Contract Manufacturer:  Abco Laboratories, Inc., 2450 S. Watney Way, Fairfield, CA 94533  ","3976 bottles","The firm found small piece of metal fragment in one tablet during its inspection process.","09/20/2013","11/01/2013","01/27/2014","11/13/2013","Item #: SN0237 - 45 Count, Lot Numbers: FG-40244, FG-40421, FG-40679;    Item #: SN0240 - 90 Count, Lot Numbers: FG-40245, FG-40422, FG-40680;    Item #: SN0268 -180 Count Lot Number: FG-40681;    All packages have BEST BY DATE 3/21/17"
"Biologics","No","","66583","Terminated","International Biologics LLC","16701 N 90th St Ste 200","","Scottsdale","AZ","	85260-1013","United States","Voluntary: Firm initiated","Telephone","California","B-0102-14","Class II","Tendon","1 allograft","Human tissue allograft, not processed in a manner that prevents the introduction, transmission, or spread of communicable disease, was distributed.","09/23/2013","11/05/2013","11/05/2013","11/13/2013","IBM1346174008;"
"Biologics","No","","66584","Terminated","Eye Bank For Sight Restoration","120 Wall St","","New York","NY","	10005-3904","United States","Voluntary: Firm initiated","Telephone","New York","B-0101-14","Class II","Cornea","1 allograft","Human allograft, recovered from a donor who may have participated in high risk behavior, was distributed.","10/10/2013","11/05/2013","11/05/2013","11/13/2013","095113;"
"Devices","No","","66597","Terminated","St. Jude Medical","5050 Nathan Ln N","","Plymouth","MN","	55442-3209","United States","Voluntary: Firm initiated","Letter","US distribution: KS, MA, UT,TX, KY, OH.","Z-0174-2014","Class II","US Safire Duo Ablation Catheter MediGuide Enabled, REF A700240 and Cool Path Duo Ablation Catheter, MediGuide Enabled REF A700244, Rx only, Sterile EO.     The catheters are intended for use with a compatible external irrigation pump and the IBI-15500T9-CP RF Generator at a maximum of 50 Watts. MediGuide Enabled Ablation catheters are used with the MediGuide Technology to enable real-time tip positioning and navigation and in conjunction the the EnSite Velocity System. The MediGuide Technology is indicated for use as an adjunct to fluoroscopy.","59","St. Jude Medical Cardiovascular and Ablation Technologies Division is performing a voluntary notification regarding selected batches of Coolpath Duo Ablation Catheter MediGuide Enabled products and Safire Duo Ablation Catheter MediGuide Enabled.  These units were inadvertently shipped with the incorrect version of the Instructions for Use (IFU).","10/11/2013","11/06/2013","03/10/2016","11/13/2013","Catalog Number A700244 Batch Number 4113241.  Catalog Number A700240 Batch Number 4113242."
"Food","No","","66602","Terminated","Irwin Naturals","5310 Beethoven St","","Los Angeles","CA","	90066-7015","United States","Voluntary: Firm initiated","Letter","Nationwide in US","F-0118-2014","Class II","Dual Action Cleanse by Cellular Research Formulas, 60 ct, Item AN027370, UPC 7 10363 27370 5, Item AN056592HFS, UPC 7 10363 56592 3; Item DR056439, UPC 7 10363 57369 0.","1271 units","Irwin Naturals is recalling Daily Digestive Enzymes and Dual Action Cleanse because they may possibly be contaminated with chloramphenicol.","10/24/2013","11/07/2013","07/02/2014","11/13/2013","Lot # T3F006"
"Food","No","","66602","Terminated","Irwin Naturals","5310 Beethoven St","","Los Angeles","CA","	90066-7015","United States","Voluntary: Firm initiated","Letter","Nationwide in US","F-0119-2014","Class II","Dual Action Cleanse by Cellular Research Formulas with Green Tea Bonus 60 ct, Item AN056906E, UPC Code: 7 10363 56906 8","1686 units","Irwin Naturals is recalling Daily Digestive Enzymes and Dual Action Cleanse because they may possibly be contaminated with chloramphenicol.","10/24/2013","11/07/2013","07/02/2014","11/13/2013","Lot #T3G017"
"Food","No","","66602","Terminated","Irwin Naturals","5310 Beethoven St","","Los Angeles","CA","	90066-7015","United States","Voluntary: Firm initiated","Letter","Nationwide in US","F-0120-2014","Class II","Irwin Naturals Daily Digestive Enzymes 45 ct, Item IN057552, UPC Code: 7 10363 57552 6","5773 units","Irwin Naturals is recalling Daily Digestive Enzymes and Dual Action Cleanse because they may possibly be contaminated with chloramphenicol.","10/24/2013","11/07/2013","07/02/2014","11/13/2013","Lot #S3C013"
