Raw poultry, eggs, raw meat, milk, animals (including pets), insects and sewage;Human body - especially skin, nose, cuts and boils - and raw milk;
Animal and human excreta, soil, dust insects and raw meat;
Soil, raw fish and meat, vegetables, smoked fish, canned fish or corned beef, hazelnut puree;
Soil, raw fish and meat, vegetables, smoked fish, canned fish or corned beef, hazelnut puree;
Raw poultry, raw meat, milk and animals (including pets);
Human and animal gut, sewage, water and raw meat;
Soft cheese, cheese made from unpastuerised milk, salad vegetables and pate;
Water, milk, salad vegetables;
Gut, Sewage - Contaminated Water;
